[
    {
        "id": "576f59d7a0ea3ab96e77096dfa5b523deef291d3f530bb84ce6f75015f91728d",
        "response": "Nu am suficiente informații pentru a răspunde la întrebare.",
        "retrieved_contexts": [
            "Masterat – Admitere 2025 | | Sesiunea Mai Calendar: | Înscriere: | 15 decembrie – 9 mai (ora 16): admitere.pub.ro | | Verificarea dosarelor: | 14 aprilie – 9 mai | | Concurs: | 13-16 mai (planificarea detaliată va fi afișată după finalizarea înscrierilor) | | Rezultate: | 17 mai | | Înmatriculare: | în intervalui 01-31 iulie (după obținerea licenței, conform unui calendar ce va fi afișat ulterior) | În sesiunea Mai vor fi scoase la concurs locuri la toate programele cu excepția EGOV, SCPD și SSA. Numărul orientativ de locuri scoase la concurs va fi afișat în curând. Informații generale pentru candidați Facultatea de Automatică și Calculatoare (ACS) organizează concursul de admitere în învățământul universitar de masterat, în anul 2025, în 3 sesiuni: - admitere anticipată (mai) - sesiunea iulie - sesiunea septembrie Informații generale la nivel UPB privind admiterea la masterat (calendar, regulament admitere, regulament studii etc. – in curs de actualizare): https://upb.ro/admitere/admitere-masterat/ Înscrierea la concurs se face prin intermediul platformei admitere.pub.ro. Toate informațiile specifice ACS privind concursul (modul de desfășurare a probelor, tematica, bibliografia, planificare interviuri, rezultate, înmatricularea candidaților admiși etc.) vor fi afișate pe această pagina. Concursul va consta din cele 2 probe prevăzute de regulamentul de admitere - evaluarea cunoștințelor fundamentale - evaluarea motivației candidatului Modul de desfășurare a probelor, tematica și bibliografia: - domeniul CTI - domeniile IS si IM Mod mixt (fizic + online) Standardele naționale recente de calitate pentru învățământul superior permit desfășurarea de studii în regim mixt. Pentru domeniile de master CTI, IS, IM se pot desfășura în regim online sincron maxim 60% din activitățile de curs și 35% din cele de aplicații și cercetare.",
            "ACS optimizează orarele de master – fizic/online – în funcție de necesități, ținând cont de reglementările naționale și deciziile Senatului UPB. Admiteri anterioare Informativ, rezultatele admiterii din anii anteriori sunt disponibile aici: 2022, 2023, 2024. Programe de studii ACS oferă 25 programe de studii universitare de masterat acreditate ARACIS în domeniile: - CTI (Calculatoare și Tehnologia Informației) – 13 programe - IS (Ingineria Sistemelor) – 11 programe - IM (Inginerie și Management) – 1 program Broșura master (în curs de actualizare cu noile programe) oferă informații sintetice despre masterat și despre fiecare program. În continuarea acestei pagini sunt prezentate programele și descrierile cursurilor. Versiunea preliminară a planurilor de învățământ este disponibilă AICI. Până la începerea anului școlar pot interveni modificări minore ale planurilor de învâțământ. Calculatoare și Tehnologia Informației | Nr. crt. | Nume program master | ||| | 1. | Arhitecturi Avansate de Calculatoare | ||| | 2. | Administrarea Bazelor de Date | ||| | Catedra organizatoare: Calculatoare Responsabil: Prof.Dr.Ing. Florin Radulescu Tip: Aprofundare / Cercetare avansata Informaţii: Scurtă descriere, Plan învăţământ, Cursuri Pentru a putea urma acest program de masterat, sunt necesare studii de licență într-unul din următoarele domenii: Domeniul fundamental Stiinte ingineresti , domeniile: Calculatoare si Tehnologia Informatie (specializarile Calculatoare , Tehnologia Informatiei , Ingineria Informatiei), Inginerie electronica si telecomunicatii, Ingineria sistemelor (specializarile Automatica si informatica aplicata, Ingineria sistemelor multimedia) , Stiinte Ingineresti Aplicate (specializarile Matematica si informatica aplicata in inginerie)",
            "▪ În ziua de 18 iulie 2025, în intervalul 09:00 – 16:00, comisia locală de admitere invită telefonic, în ordinea descrescătoare a mediilor, primii candidați cu barem îndeplinit, în vederea participării la ocuparea parțială sau integrală a acestor locuri. Candidații care acceptă și confirmă prin SMS participarea, își validează dosarul și se înmatriculează în data de 19 iulie 2025, sau dacă este posibil, chiar în data de 18 iulie 2025. ▪ După finalizarea înmatriculării, Comisia centrală și Comisiile locale de admitere generează și publică listele finale cu candidații declarați admiși anticipat și înmatriculați (19 iulie, ora 18:00) Ses. II-5.65. Pentru facultățile și domeniile care organizează Sesiunea II+ și la care candidații au susținut concurs pe baza rezultatelor la activitățile școlare (dosar) (c-rs) (atât în Centrul Universitar București cât și în Centrul Universitar Pitești): ▪ În ziua de 25 iulie 2025, în intervalul 09:00 – 16:00, comisia locală de admitere invită telefonic, în ordinea descrescătoare a mediilor, primii candidați cu barem îndeplinit, în vederea participării la ocuparea parțială sau integrală a acestor locuri. Candidații care acceptă și confirmă prin SMS participarea, își validează dosarul și se înmatriculează în data de 26 iulie 2025, sau dacă este posibil, chiar în data de 25 iulie 2025. ▪ După finalizarea înmatriculării, Comisia centrală și Comisiile locale de admitere generează și publică listele finale cu candidații declarați admiși anticipat și înmatriculați (27 iulie, ora 12:00) Pag. 45 Universitatea Națională de Știință și Tehnologie POLITEHNICA București REGULAMENTUL Concursului de Admitere în Ciclul de Studii Universitare de Licență 2025 VI. SESIUNEA III – ADMITERE-COMPLETARE ȘI ALTE DISPOZIŢII FINALE Ses. III/DF-6.1. După finalizarea înmatriculării din Sesiunea II/II+, Comisia centrală și Comisiile locale de admitere stabilesc eventualele locuri vacante pentru fiecare dintre facultăți."
        ],
        "retrieved_ids": [
            "6ccd6e8cf90ac5e0f62d36ab0c6545bdb0df7714986675e4854d0f00e6cfc934-1",
            "6ccd6e8cf90ac5e0f62d36ab0c6545bdb0df7714986675e4854d0f00e6cfc934-2",
            "85ab8a2001db129d9b28c1a868567dde770e21f5c8ba133a94ef4814a7badfc9-68"
        ],
        "retrieved_scores": [
            0.7817807,
            0.83908737,
            0.7898644
        ],
        "user_input": "Cand are loc admiterea la licenta la ACS?"
    },
    {
        "id": "dca869d781938c902aa3f138164220d0d61f7832be689900d7b15c5161c476c6",
        "response": "Nu am suficiente informații pentru a răspunde la întrebare.",
        "retrieved_contexts": [
            "▪ În ziua de 18 iulie 2025, în intervalul 09:00 – 16:00, comisia locală de admitere invită telefonic, în ordinea descrescătoare a mediilor, primii candidați cu barem îndeplinit, în vederea participării la ocuparea parțială sau integrală a acestor locuri. Candidații care acceptă și confirmă prin SMS participarea, își validează dosarul și se înmatriculează în data de 19 iulie 2025, sau dacă este posibil, chiar în data de 18 iulie 2025. ▪ După finalizarea înmatriculării, Comisia centrală și Comisiile locale de admitere generează și publică listele finale cu candidații declarați admiși anticipat și înmatriculați (19 iulie, ora 18:00) Ses. II-5.65. Pentru facultățile și domeniile care organizează Sesiunea II+ și la care candidații au susținut concurs pe baza rezultatelor la activitățile școlare (dosar) (c-rs) (atât în Centrul Universitar București cât și în Centrul Universitar Pitești): ▪ În ziua de 25 iulie 2025, în intervalul 09:00 – 16:00, comisia locală de admitere invită telefonic, în ordinea descrescătoare a mediilor, primii candidați cu barem îndeplinit, în vederea participării la ocuparea parțială sau integrală a acestor locuri. Candidații care acceptă și confirmă prin SMS participarea, își validează dosarul și se înmatriculează în data de 26 iulie 2025, sau dacă este posibil, chiar în data de 25 iulie 2025. ▪ După finalizarea înmatriculării, Comisia centrală și Comisiile locale de admitere generează și publică listele finale cu candidații declarați admiși anticipat și înmatriculați (27 iulie, ora 12:00) Pag. 45 Universitatea Națională de Știință și Tehnologie POLITEHNICA București REGULAMENTUL Concursului de Admitere în Ciclul de Studii Universitare de Licență 2025 VI. SESIUNEA III – ADMITERE-COMPLETARE ȘI ALTE DISPOZIŢII FINALE Ses. III/DF-6.1. După finalizarea înmatriculării din Sesiunea II/II+, Comisia centrală și Comisiile locale de admitere stabilesc eventualele locuri vacante pentru fiecare dintre facultăți.",
            "Masterat – Admitere 2025 | | Sesiunea Mai Calendar: | Înscriere: | 15 decembrie – 9 mai (ora 16): admitere.pub.ro | | Verificarea dosarelor: | 14 aprilie – 9 mai | | Concurs: | 13-16 mai (planificarea detaliată va fi afișată după finalizarea înscrierilor) | | Rezultate: | 17 mai | | Înmatriculare: | în intervalui 01-31 iulie (după obținerea licenței, conform unui calendar ce va fi afișat ulterior) | În sesiunea Mai vor fi scoase la concurs locuri la toate programele cu excepția EGOV, SCPD și SSA. Numărul orientativ de locuri scoase la concurs va fi afișat în curând. Informații generale pentru candidați Facultatea de Automatică și Calculatoare (ACS) organizează concursul de admitere în învățământul universitar de masterat, în anul 2025, în 3 sesiuni: - admitere anticipată (mai) - sesiunea iulie - sesiunea septembrie Informații generale la nivel UPB privind admiterea la masterat (calendar, regulament admitere, regulament studii etc. – in curs de actualizare): https://upb.ro/admitere/admitere-masterat/ Înscrierea la concurs se face prin intermediul platformei admitere.pub.ro. Toate informațiile specifice ACS privind concursul (modul de desfășurare a probelor, tematica, bibliografia, planificare interviuri, rezultate, înmatricularea candidaților admiși etc.) vor fi afișate pe această pagina. Concursul va consta din cele 2 probe prevăzute de regulamentul de admitere - evaluarea cunoștințelor fundamentale - evaluarea motivației candidatului Modul de desfășurare a probelor, tematica și bibliografia: - domeniul CTI - domeniile IS si IM Mod mixt (fizic + online) Standardele naționale recente de calitate pentru învățământul superior permit desfășurarea de studii în regim mixt. Pentru domeniile de master CTI, IS, IM se pot desfășura în regim online sincron maxim 60% din activitățile de curs și 35% din cele de aplicații și cercetare.",
            "Acestea vor fi trimise pe mail la adresa admitere.energetica@upb.ro, iar rezultatul acestora se anunță în cel mult 24 de ore de la încheierea termenului de depunere a contestațiilor. - Faza 4 - Înmatricularea candidaților 01.07.2025 - 07.07.2025Înmatricularea candidaților - 01.07.2025-07.07.2025 Înmatricularea candidaților admiși în sesiunea de admitere anticipată se va face la secretariatul facultății, în perioada 01/07/2025-07/07/2025, în intervalul orar 9:00-16:00. Pentru înmatriculare, candidații admiși în admiterea anticipată trebuie să depună la secretariatul facultății unde au fost admiși următoarele documente: • forma fizică a fișei de înscriere; • 2 fotografii, realizată recent, color, format 3x4 cm; • diploma de bacalaureat (în original); • diploma de licență/inginer sau echivalentă acesteia; candidații care au promovat examenul de licență în sesiunea iunie-iulie 2025 pot depune la înscriere, pentru sesiunile imediat următoare, în locul diplomei de licență, adeverința de absolvire eliberată de facultate, în care se menționează atât media generală de la examenul de diplomă/licență cât și mediile generale obținute în fiecare an de studiu (în original); • foaia matricolă/suplimentul la diplomă, numai în cazul în care se depune diploma de licență/inginer (în original); • certificatul de naștere (copie conform cu originalul); • certificatul de căsătorie (dacă este cazul, copie conform cu originalul); • buletin/carte de identitate/pașaport (copie conform cu originalul); • dovada de plată a taxei de înscriere la admitere (contul în care se face plata va fi afișat pe site-ul de admitere al Universității); • dovada de plată a taxei de înmatriculare la admitere (contul în care se face plata va fi afișat pe site-ul de admitere al Universității); În caz contrar aceștia vor pierde statutul de masterand."
        ],
        "retrieved_ids": [
            "85ab8a2001db129d9b28c1a868567dde770e21f5c8ba133a94ef4814a7badfc9-68",
            "6ccd6e8cf90ac5e0f62d36ab0c6545bdb0df7714986675e4854d0f00e6cfc934-1",
            "95433f95bf4f9e5fef2fb7938a0ae137f2588497cb46ca97e61fd05660532466-6"
        ],
        "retrieved_scores": [
            0.8468199,
            0.84836996,
            0.8367392
        ],
        "user_input": "Cand are loc admiterea la licenta?"
    },
    {
        "id": "8b2ae32f62f6082666797da74ab1dc55476ce1485845a5cfbf552cff51ca3c33",
        "response": "Admiterea la studiile universitare de masterat va avea loc în sesiunea de admitere din luna septembrie 2024, conform următorului calendar:\n\n- **Înscrierea candidaților**: 02.09 - 13.09.2024\n- **Concursul de admitere**: 16.09 – 17.09.2024\n- **Comunicarea rezultatelor**: 16.09 – 18.09.2024\n- **Înmatricularea candidaților**: 16.09 – 20.09.2024\n\nÎnscrierea se va face online pe site-ul universității, conform regulamentului specificat.\n\nSurse:\n- URL: https://chimie.upb.ro/admitere/programe-de-studii-de-masterat/",
        "retrieved_contexts": [
            "Admitere master - informații Regulamentul privind organizarea și desfășurarea concursului de admitere în învățământul universitar de masterat anul universitar 2025-2026 poate fi consultat aici https://admitere.pub.ro/. Admitere anticipată Numarul de locuri - In curand. La sesiunea de admitere anticipată pot candida studenți într-un an terminal al studiilor de licență sau absolvenți ai unui program de studii de licență din anii anteriori, care doresc garantarea anticipată (prin pre-admitere) a unui loc pentru studii de masterat în POLITEHNICA București. Pentru validarea și înmatricularea candidaților astfel pre-admiși, promovarea examenului de Licență/Diplomă până la data prevăzută pentru înmatriculare este, conform legii, o condiție necesară. Pot candida la admiterea la studii universitare de masterat cetățenii statelor membre ale Uniunii Europene, ai statelor aparținând Spațiului Economic European și Confederației Elvețiene, în aceleași condiții prevăzute de lege pentru cetățenii români, inclusiv în ceea ce privește taxele de școlarizare. - Faza 1 - Înscriere 15.12.2024 - 09.05.2025Înscriere - 15.12.2024-9.05.2025 Pentru înscrierea la concursul de admitere în învățământul universitar de masterat în sesiunea de admitere anticipată, candidații depun online pe site-ul de admitere al universității dosarul de înscriere, care trebuie să conțină următoarele documente: a) fișa de înscriere tip, conform Anexei 2, în care vor menționa, sub semnătură electronică sau scanată și răspundere proprie, toate datele solicitate de formularul respectiv; b) certificatul de naștere; c) certificatul de căsătorie (dacă este cazul); d) situația școlară a anilor de licență anteriori anului curent în care se află sau foaia matricolă/suplimentul la diplomă în cazul în care au absolvit un program de licență într-un an anterior: e) buletin/carte de identitate/pașaport; f) dovada de plată a taxei de înscriere la admitere anticipată (contul în care se face plata va fi afișat pe site-ul de admitere al universității);",
            "Procesul de Admitere în sesiunea Septembrie la studiile universitare de masterat va începe pe data de 02.09.2024. Calendarul pentru Sesiunea III de Admitere 2024 este următorul: înscrierea candidaților: 02.09 - 13.09.2024, Concursul de admitere: 16.09 – 17.09.2024, Comunicarea rezultatelor: 16.09 – 18.09.2024, Înmatricularea candidaților: 16.09 – 20.09.2024. Admiterea se face conform Regulamentului privind organizarea și desfășurarea concursului de admitere în ciclul de studii universitare de masterat. Înscrierea la concursul de admitere pentru studiile de masterat in Sesiunea III de Admitere, sesiunea septembrie, se face online pe site-ul https://admitere.pub.ro conform regulamentului amintit. Programarea examenelor este disponibila aici.",
            "Modificare date admitere masterat sesiunea august-septembrie 2020 Inscriere | 17.08.2020 – 11.09.2020 | Concurs admitere | 14.09.2020 – 15.09.2020 | Comunicare rezultate, depunere contestatii si inmatriculare | 16.09.2020 – 17.09.2020 | Depunere documente pentru candidatii admisi si inmatriculati in ambele sesiuni (programare – site facultate) | 10 – 18 septembrie 2020 | Continutul dosarului (documente care se depun) Comisii admitere Masterat - Sesiunea septembrie 2020 ( Cu link-uri canale Microsoft Teams) Inscriere online Masterat 2020 - https://admitere.pub.ro/ REGULAMENT PRIVIND ORGANIZAREA ȘI DESFĂȘURAREA CONCURSULUI DE ADMITERE ÎN ÎNVĂŢĂMÂNTUL UNIVERSITAR DE MASTERAT Sesiunea Iunie 2020 Candidati declarati admisi - sesiunea iulie 2020 Inscriere online Masterat 2020 - https://admitere.pub.ro/ Comisii admitere Masterat - sesiunea iulie 2020 ( Cu link-uri canale Microsoft Teams) REGULAMENT PRIVIND ORGANIZAREA ȘI DESFĂȘURAREA CONCURSULUI DE ADMITERE ÎN ÎNVĂŢĂMÂNTUL UNIVERSITAR DE MASTERAT Admitere masterat 2019 Facultatea de Inginerie Industrială și Robotică Concursul de admitere în învățământul universitar de masterat se organizează în două sesiuni, în iulie și septembrie 2019: Sesiunea a II a Sesiunea I: Examen de admitere: 11-12 iulie Program înscriere (Sala CB 017): Luni, miercuri și vineri / 9.00 – 16.00 Marți și joi / 12.00 – 18.00 Sâmbătă și duminică / 10.00 – 14.00 Taxa de înscriere este de 50 lei. Pentru alegerea unei specializări consultați următoarele informații: Conţinutul dosarului de înscriere: Pentru înscrierea la concursul de admitere în învăţământul universitar de masterat, candidaţii vor prezenta la înscriere un dosar plic, care trebuie să conţină următoarele documente:"
        ],
        "retrieved_ids": [
            "95433f95bf4f9e5fef2fb7938a0ae137f2588497cb46ca97e61fd05660532466-1",
            "1b1ea7137bcac57a08ed409352d4dafea078d3672aaa23e9e88a89e6ba380ff4-1",
            "a6d9cdea7b06db11d13e1fd4b50c30fbca9db6da2616cd019773eb4baee44a2e-5"
        ],
        "retrieved_scores": [
            0.85973275,
            0.8095051,
            0.79031384
        ],
        "user_input": "Cand are loc admiterea la master?"
    },
    {
        "id": "ead4d26ec37d3dab98f5a1d29d6881c4162cb6db1ef61a04db840f1a7c389457",
        "response": "Admiterea la doctorat se va desfășura în perioada 1 aprilie – 20 septembrie 2024. În această perioadă, se va realiza înscrierea, validarea dosarului și admiterea candidaților. Detaliile specifice ale calendarului includ:\n\n- **Validarea dosarelor**: 26 aprilie 2024 - 20 septembrie 2024\n- **Evaluarea dosarelor**: 30 aprilie 2024 - 23 septembrie 2024\n- **Rezultate evaluare**: 30 aprilie 2024 - 30 august 2024\n- **Evaluarea candidaților admiși (interviu oral)**: 25-26 septembrie 2024\n- **Înmatricularea candidaților admiși**: 30 septembrie 2024\n- **Începerea stagiului doctoral**: 1 octombrie 2024.\n\nSurse:\n- URL: https://acs.pub.ro/admitere/doctorat/",
        "retrieved_contexts": [
            "Doctorat Admitere doctorat Calendar admitere doctorat | 1 aprilie – 20 septembrie 2024 | Înscrierea, validarea dosarului și admiterea candidaților. Platformă înscriere candidați: https://admitere.pub.ro. | | 26 aprilie 2024 29 mai 2024 26 iunie 2024 24 iulie 2024 28 august 2024 20 septembrie 2024, 16:00 | Validarea dosarelor de către secretariatul SD-AC. Evaluarea dosarelor de către conducătorii de doctorat. | | 30 aprilie 2024 31 mai 2024 28 iunie 2024 26 iulie 2024 30 august 2024 23 septembrie 2024 | Rezultate evaluare și acordarea calificativului Admis/Respins. [Rezultate aprilie 2024] [Rezultate mai 2024] [Rezultate iunie 2024] [Rezultate iulie 2024] [Rezultate august 2024] [Rezultate septembrie 2024] | | 25-26 septembrie 2024 | Evaluarea candidaților declarați admiși (interviu oral) de către Comisia de admitere și alocarea burselor MEN în baza ierarhiei stabilite. [Listă finală admitere și burse] | | 30 septembrie 2024 | Înmatricularea candidaților declarați admiși. [Rezultate finale] | | 1 octombrie 2024 | Începerea stagiului doctoral. | Legislație și regulament admitere SD-AC organizează ocuparea locurilor disponibile pe bază de concurs conform următoarelor reglementări: - Metodologia privind organizarea și desfășurarea concursului de admitere la doctorat a Instituției Organizatoare de Studii Universitare de Doctorat IOSUD – UPB [link]. - Regulamentul de funcționare al Școlii Doctorale de Automatică și Calculatoare [link]. Admiterea la doctorat se face în limita locurilor alocate anual de: - Ministerul Educației pentru doctoratul în regim de finanțare de la bugetul de stat sub formă de granturi doctorale. - UPB, în calitate de Instituție Organizatoare de Studii Universitare de Doctorat, pentru doctoratul în regim cu taxă, care este suportată de către doctorand. Cuantumul taxelor este publicat aici [link].",
            "Admitere doctorat Admiterea la studiile universitare de doctorat se organizează continuu în perioada Aprilie-Septembrie 2022, conform Metodologiei privind organizarea şi desfăşurarea concursului de admitere la doctorat în anul universitar 2022- 2023 Admiterea la doctorat se organizează la nivelul Şcolii doctorale de Inginerie Energetică (SDIEn) pentru domeniul de Inginerie energetică. Informațiile despre admiterea la studii universitare de doctorat se găsesc la adresa http://doctorat.energetica.upb.ro/admitere.html",
            "- 3 - 5 iulie 2017: susținerea probei de concurs, afișarea rezultatelor, încheierea contractelor de studii doctorale. Această sesiune de admitere la studii universitare de doctorat se adresează, cu precădere, absolvenților UPB de masterat care își prezintă DISERTAȚIA în perioada 26 iunie - 30 iunie 2017. Candidatii completeaza numai Anexa 2, Anexa 3 si Anexa 5 Program Admitere Doctorat sesiunea IULIE 2017 Procedura de Admitere la Doctorat 2017 Comisie Admitere Doctorat 2017 Repartiție locuri pe Școli Doctorale Metodologia de admitere, dar și alte date sunt prezentate la: http://www.upb.ro/admitere-doctorat.html Admitere Doctorat 2016 Rezultate colocviu admitere doctorat 2016 - Candidații admiși la studii universitare de doctorat – cu bursa - Candidații admiși la studii universitare de doctorat – fara bursa - Candidații admiși la studii universitare de doctorat – cu taxa Planificare examen concurs de admitere la studii universitare de doctorat - septembrie 2016 Sesiunea a II-a: 5 - 30 septembrie 2016 - 5 - 27 septembrie 2016: înscrierea candidaților (taxa de înscriere este de 200 lei). - 28 - 30 septembrie 2016: susținerea probei de concurs, afișarea rezultatelor, încheierea contractelor de studii doctorale. Sesiunea I. - Candidații admiși la studii universitare de doctorat, cu subvenționare de la buget Sesiunea I. 27 iunie - 8 iulie 2016 - Programarea probei de concurs Admiterea la studii universitare de doctorat pentru anul univ. 2016 - 2017 se va desfășura în două sesiuni: Sesiunea I 27 iunie - 8 iulie 2016 și, respectiv, Sesiunea a II-a 5 - 28 septembrie 2016, astfel: Sesiunea I 27 iunie - 8 iulie 2016 - 27 iunie - 6 iulie 2016: înscrierea candidaților (taxa de înscriere este de 150 lei). - 7 - 8 iulie 2016: susținerea probei de concurs, afișarea rezultatelor, încheierea contractelor de studii doctorale."
        ],
        "retrieved_ids": [
            "0a7047bd9ee00f3d76a3f6e330d97e214cbc6a81ed25ef001a0d2834d408455f-1",
            "2857876d53734150ffb44fc71e4dbc6585d2bc1415ee25bfcea3633c54158da3-1",
            "d43f4eaa3d93bf485a402f19f967f21b14b8011a675d9a5e0301629717d64291-6"
        ],
        "retrieved_scores": [
            0.83613193,
            0.86037505,
            0.8224288
        ],
        "user_input": "Cand are loc admiterea la doctorat?"
    },
    {
        "id": "65b91ccc2e7aeeb4e0e0e10eccc099655873d2cc499bf8c462216e27dbe88fe5",
        "response": "# Documente necesare pentru înmatriculare\n\nPentru a finaliza procesul de înmatriculare, candidații trebuie să prezinte următoarele documente:\n\n1. **Diploma de Bacalaureat** însoțită de foaia matricolă (în original).\n2. **Certificatul de naștere** (în original și copie).\n3. **Act de identitate** (Carte de identitate sau Pașaport) (în original și copie) aflat în perioada de valabilitate la data înscrierii.\n4. **3 fotografii color** (dimensiune 3x4 cm, recente, identice).\n5. **Documente care să ateste rezultatele obținute** la activitățile suplimentare desfășurate în anii de liceu, dacă este cazul.\n6. **Dovada achitării taxei de înscriere** sau dovada scutirii de plata taxei.\n7. **Cererea de înscriere** semnată de candidat.\n8. **Declarație pe proprie răspundere** semnată de candidat privind veridicitatea documentelor.\n9. **Adeverință medicală** din care să rezulte că este apt medical.\n10. **Dovada achitării taxei de înmatriculare** (50 lei).\n\nTaxa de înmatriculare se poate achita online sau direct la sediul facultății.\n\nSurse:\n- URL: https://energ.upb.ro/admitere/licenta/informatii-admitere\n- Sursa: http://fsa.pub.ro/wp-content/uploads/2025/02/Admitere-ses1-olimpici-2025.pdf, URL: http://fsa.pub.ro/wp-content/uploads/2025/02/Admitere-ses1-olimpici-2025.pdf, pagina: 9",
        "retrieved_contexts": [
            "1. Diploma de Bacalaureat însoțită de foaia matricolă (în original – rămâne la dosar); PP 2. Certificat de naștere (în original – copie la dosar); 3. Carte de identitate sau pașaport (în original – copie la dosar); 4. 3 fotografii color – dimensiune 3x4 cm (rămân la dosar); 5. Documente care să ateste rezultatele obținute la concursurile considerate la înscriere (în original – copie la dosar) ; 6. Dovada achitării taxei de înscriere sau dovada scutirii de plata taxei (în original – rămâne la dosar); 7. Cerere de înscriere semnată (în original – rămâne la dosar); 8. Declarație pe proprie răspundere semnată privind veridicitatea documentelor (în original – rămâne la dosar); 9. Adeverință medicală (în original – rămâne la dosar); 10. Dovada achitării taxei de înmatriculare (în original – rămâne la dosar). Taxa de înmatriculare este 50 lei și se poate plăti în aceleași modalități ca și taxa de înscriere",
            "Validarea dosarului de concurs, Confirmarea locului obținut preliminar, Participarea opțională la glisare și depunerea documentelor pentru înmatriculare se realizează personal sau prin împuternicire notarială la sediul facultății la care candidatul a fost declarat pre-admis. Sunt necesare următoarele documente: Pentru toți candidații",
            "- Certificatul de naștere al candidatului (original și copie). - Act de identitate candidat (Carte de identitate sau Pașaport) (original și copie) aflat în perioada de valabilitate la data înscrierii, iar dacă acesta a expirat, o copie după vechiul act de identitate și originalul noului act. - 3 fotografii color, pe hârtie fotografică (tip pașaport/CI, recente, identice, dimensiune 3x4 cm). Pe spatele fiecărei fotografii se scrie numele, inițiala tatălui și prenumele. - Situație școlară, adeverință, foaie matricolă sau alt document/documente emis/emise de liceul de la care provine candidatul, în care sunt specificate mediile obținute de candidat, în timpul liceului, la disciplinele selectate pentru proba P1 și, respectiv, P2, cât și mediile generale obținute de către acesta în clasele a IX-a, a X-a și a XI-a pentru proba P3. - Dacă este cazul, documente care să ateste rezultatele obținute de candidat la o serie de activități suplimentare pe care acesta le-a desfășurat în anii de liceu. - Dovada achitării taxei de înscriere la concurs sau dovadă prin care să reiasă faptul că poate fi scutit de această taxă. - Cererea de înscriere la concurs semnată de candidat. - Declarație pe proprie răspundere, semnată de candidat, privind veridicitatea datelor și a documentelor furnizate de acesta în cadrul procesului de înscriere. - Adeverința medicală din care să rezulte că este apt medical. - Dovada achitării taxei de înmatriculare. Taxa de înmatriculare este de 50 lei și se poate achita având menționate la explicațiile plății: numele și prenumele complet al candidatului precum și „Facultatea de Energetică”, astfel: - direct, prin platforma on-line https://admitere.pub.ro/, cu card bancar;"
        ],
        "retrieved_ids": [
            "a192eeb16b38c512b52907612a334423de5ea7a64b05047d05038e52e01dcad9-8",
            "85ab8a2001db129d9b28c1a868567dde770e21f5c8ba133a94ef4814a7badfc9-146",
            "57fffc9ae7f67be9c637b16ae3a994af2cbec240e5ea61a02f4d25fea85f1d10-6"
        ],
        "retrieved_scores": [
            0.8304925,
            0.79077137,
            0.7752259
        ],
        "user_input": "Ce documente sunt necesare pentru inmatriculare?"
    },
    {
        "id": "d87d3954d8ccbc3764aec55afa8deb55cdece192b96fd9439a70f80b38bd58a6",
        "response": "Pentru înscrierea la examenul de admitere, candidații trebuie să prezinte următoarele documente:\n\n1. **Diploma de Bacalaureat** (sau diploma echivalentă) însoțită de foaia matricolă, în original.\n2. **Certificatul de naștere** al candidatului, original.\n3. **Act de identitate** (Carte de identitate sau Pașaport) aflat în perioada de valabilitate, original.\n4. **3 fotografii color** recente, pe hârtie fotografică (tip pașaport, dimensiune 3x4 cm).\n5. **Situație școlară** (adeverință, foaie matricolă) emisă de liceul de proveniență, în original.\n6. **Documente care atestă rezultatele** obținute la activități suplimentare, dacă este cazul, în original.\n7. **Dovada achitării taxei de înscriere** la concurs, în original.\n8. **Cererea de înscriere** la concurs, semnată de candidat, în original.\n9. **Declarație pe proprie răspundere** privind veridicitatea datelor și documentelor furnizate, semnată de candidat, în original.\n10. **Adeverința medicală** care să ateste că este apt medical, în original.\n11. **Documente care fac dovada cunoașterii limbii** respective, pentru candidații care optează pentru programe în limbi străine, în original.\n12. **Eseul motivațional** pentru candidații care optează la domeniul Științe ale educației, în original, dacă este cazul.\n\nAceste documente sunt necesare pentru validarea dosarului de concurs și ulterior pentru înmatricularea candidaților admiși.\n\nSurse:\n- Regulament admitere licență 2025, URL: https://upb.ro/wp-content/uploads/2024/12/Regulament_admitere_licenta_2025.pdf, pagina: 75",
        "retrieved_contexts": [
            "Candidați vor pregăti pentru examenul de admitere o prezentare bazată pe propunerea de tematica pentru studiile doctorale (PhD proposal) în limba română sau în limba engleză după modelul acesta [prezentare]. Pasul 5: Înmatriculare Rezultatele concursului de admitere sunt validate și afișate pe pagina de admitere a SD-AC (vezi calendarul admiterii). Toți candidații declarați admiși se vor înmatricula online în termen de 48 de ore de la data afișării rezultatelor (condiționată de prezentarea dovezii privind absolvirea unui program de masterat (diplomă de masterat sau adeverință de absolvire, foaie matricolă)). Înmatricularea constă în încărcarea pe platforma de admitere a dovezii de plată a taxei de înmatriculare în valoare de 50 RON. Aceasta se achită online, toate informațiile necesare fiind disponibile în platformă. Toți candidații declarați admiși vor completa și semna olograf contractul de studii universitare de doctorat până la începutul anului universitar. Pentru candidații străini din țări UE și non-UE Pentru candidații cetățeni ai statelor UE înscrierile se fac în conformitate cu: https://international.upb.ro/international-students/applying/students-from-eu-countries Pentru candidații cetățeni ai statelor non-UE înscrierile se fac în conformitate cu: https://international.upb.ro/international-students/applying/students-from-non-eu-countries Candidații străini vor urma aceleași proceduri și același flux de validare a dosarelor și admitere ca cetățenii români. Aceștia se pot prezenta la concursul de admitere începând cu luna iulie după validarea actelor de înscriere.",
            "10 11 12 Dovada achitării taxei de înmatriculare (vezi Anx. VIII-5). 13 Anx. VIII-2. Pentru candidații care sunt deja absolvenți (cu sau fără diplomă) ai unei instituții de învățământ superior, care s-au înscris la concursul de admitere în 2025 pentru a se școlariza într-un alt domeniu și care au fost declarați admiși, sunt necesare documentele specificate în tabelul Anx. VIII-1 la care se mai adaugă și documentele din tabelul de mai jos.",
            "| Pachet de documente necesar validării dosarului de concurs şi ulterior înmatriculării candidaților admişi anticipat | Rămâne în dosarul candidatului înmatriculat |\n|:--|:--|\n| Diploma de Bacalaureat (sau diploma echivalentă cu aceasta) însoțită de foaia matricolă Original ***Notă | Da pt. candidații: - pre-admişi; - admişi în etapa de completare |\n| Pentru candidații care au promovat examenul de Bacalaureat în 2025, dacă liceul nu a eliberat diploma până la data înmatriculării, în locul diplomei de Bacalaureat se admite, în original, adeverința eliberată de liceu în care se menționează atât media generală, cât și notele obținute la probele susținute. Foaia matricolă în original este, şi în acest caz, necesară. | (Sesiunea I+) |\n| Certificatul de naștere al candidatului. Originalul documentului din Tabelul Anx.IV-2 — Punctul 01 | |\n| Act de identitate candidat (Carte de identitate sau Pașaport) aflat în perioada de valabilitate la data înscrierii, iar dacă acesta a expirat, o copie după vechiul act de identitate și originalul noului act. Originalul documentului din Tabelul Anx.IV-2 — Punctul 02. | |\n| 3 fotografii color, pe hârtie fotografică (tip pașaport/Cl, recente, identice, dimensiune 3x4 cm). | |\n| Situație şcolară, adeverință, foaie matricolă sau alt document/documente emis/emise de liceul de la care provine candidatul, în care sunt specificate mediile obținute de candidat, în timpul liceului, la disciplinele selectate pentru proba PI și, respectiv, P2, cât și mediile generale obținute de către acesta în clasele a IX-a, a X-a și a XI-a pentru proba P3. Originalul documentelor din Tabelul Anx.IV-2 — Punctul 04. | |\n| Dacă este cazul, documente care să ateste rezultatele obținute de candidat la o serie de activități suplimentare pe care acesta le-a desfăşurat în anii de liceu. Originalul documentelor din Tabelul Anx.IV-2— Punctul 05. și/sau, acolo unde este cazul, Originalul documentelor corespunzătoare prevăzute în Anexa VI. — Admiterea olimpicilor și a candidaților cu rezultate deosebite. | |\n| Dovada achitării taxei de înscriere la concurs sau dovadă prin care să reiasă faptul că poate fi scutit de această taxă. Originalul documentelor din Tabelul Anx.IV-2— Punctul 06. | |\n| Cererea de înscriere la concurs semnată de candidat. Originalul documentelor din Tabelul Anx.IV-2— Punctul 07. | |\n| Declarație pe proprie răspundere, semnată de candidat, privind veridicitatea datelor și a documentelor furnizate de acesta în cadrul procesului de înscriere. Originalul documentelor din Tabelul Anx.IV-2 — Punctul 08. | |\n| Adeverința medicală din care să rezulte că este apt medical sau, dacă este cazul, carnetul de legitimare. Notă: Pentru sportivi, adeverința medicală poate fi suplinită de carnetul de legitimare cu viza medicală în termen de valabilitate pe perioada examenului de admitere Originalul documentului din Tabelul Anx.IV-2— Punctul 09. | Da - adeverința medicală NU -carnetul de legitimare |\n| Pentru candidații care au optat la programe de studii şcolarizate în limbi străine (engleză, franceză, germană), dacă este cazul, documentul/documentele care fac dovada cunoaşterii limbii respective. Originalul documentelor din Tabelul Anx.IV-2— Punctul 10. | |\n| Pentru candidații care au optat la domeniul Ştiințe ale educației, eseul motivațional al candidatului relativ la capacitatea, dorința și determinarea acestuia de a urma studiile în cadrul domeniului Ştiințe ale educației. Pentru candidații care optează la domeniul Teologie, Binecuvântarea Înaltpreasfințitului Părinte Arhiepiscop sau, după caz, Episcop, ierarhul eparhiei din care provine candidatul (de unde are domiciliul), în vederea înscrierii la Facultatea de Teologie, Litere, Istorie și Arte. Originalul documentului din Tabelul Anx.IV-2— Punctul 11. | |\n| Dovada achitării taxei de înmatriculare (vezi Anx.V-5). Original | |"
        ],
        "retrieved_ids": [
            "0a7047bd9ee00f3d76a3f6e330d97e214cbc6a81ed25ef001a0d2834d408455f-4",
            "85ab8a2001db129d9b28c1a868567dde770e21f5c8ba133a94ef4814a7badfc9-219",
            "85ab8a2001db129d9b28c1a868567dde770e21f5c8ba133a94ef4814a7badfc9-147"
        ],
        "retrieved_scores": [
            0.8170434,
            0.8112715,
            0.8036431
        ],
        "user_input": "Ce documente sunt necesare pentru inscrierea la examenul de admitere?"
    },
    {
        "id": "32906d1f4fea504415c37f1223e507adac5c45e91d160fdf23b0e7869e56bf4c",
        "response": "Nu am suficiente informații pentru a răspunde la întrebare.",
        "retrieved_contexts": [
            "ACS optimizează orarele de master – fizic/online – în funcție de necesități, ținând cont de reglementările naționale și deciziile Senatului UPB. Admiteri anterioare Informativ, rezultatele admiterii din anii anteriori sunt disponibile aici: 2022, 2023, 2024. Programe de studii ACS oferă 25 programe de studii universitare de masterat acreditate ARACIS în domeniile: - CTI (Calculatoare și Tehnologia Informației) – 13 programe - IS (Ingineria Sistemelor) – 11 programe - IM (Inginerie și Management) – 1 program Broșura master (în curs de actualizare cu noile programe) oferă informații sintetice despre masterat și despre fiecare program. În continuarea acestei pagini sunt prezentate programele și descrierile cursurilor. Versiunea preliminară a planurilor de învățământ este disponibilă AICI. Până la începerea anului școlar pot interveni modificări minore ale planurilor de învâțământ. Calculatoare și Tehnologia Informației | Nr. crt. | Nume program master | ||| | 1. | Arhitecturi Avansate de Calculatoare | ||| | 2. | Administrarea Bazelor de Date | ||| | Catedra organizatoare: Calculatoare Responsabil: Prof.Dr.Ing. Florin Radulescu Tip: Aprofundare / Cercetare avansata Informaţii: Scurtă descriere, Plan învăţământ, Cursuri Pentru a putea urma acest program de masterat, sunt necesare studii de licență într-unul din următoarele domenii: Domeniul fundamental Stiinte ingineresti , domeniile: Calculatoare si Tehnologia Informatie (specializarile Calculatoare , Tehnologia Informatiei , Ingineria Informatiei), Inginerie electronica si telecomunicatii, Ingineria sistemelor (specializarile Automatica si informatica aplicata, Ingineria sistemelor multimedia) , Stiinte Ingineresti Aplicate (specializarile Matematica si informatica aplicata in inginerie)",
            "Din cei 40 candidați admiși la taxă s-au înmatriculat 31, rămânând disponibile pentru următoarea sesiune de admitere 9 locuri la taxă (IA.X). Pentru candidații din licee rurale 1 loc a fost ocupat prin înmatriculare și mai sunt 5 locuri disponibile (4 la IA și 1 la IAen). La românii de pretutindeni există 17 candidați admiși în principiu, dosarele lor fiind în lucru la Biroul de Studenți Internaționali. Îi vom afișa când procedura lor va fi completă. Rezultate Admitere iulie 2019 Etapa I După etapa I de admitere s-au ocupat 220 locuri din 220 la IA buget, 40 locuri din 40 la IA taxă, 1 loc la IA liceu rural. Au rămas disponibile 5 locuri rezervate pentru absolvenții liceelor rurale. Important pentru concursul din 22-23 iulie 2019 Rezultatele concursului sunt vizibile online pe admitere.pub.ro cu CNP-ul candidatului. Listele se vor afișa la avizier pe 24 iulie 2019 dimineața și de asemenea sunt afișate mai sus. Candidații declarați admiși sunt rugați să se înmatriculeze la Secretariat miercuri 24 sau joi 25 iulie 2019, orele 8-18, altfel locurile respective devin vacante. Pe ele vor avansa candidații admiși la taxă care au optat pentru buget, dar care n-au obținut în primă instanță media necesară. Pentru locurile vacante la taxă se va organiza o a doua etapă de admitere dacă va fi cazul. Candidații respinși de asemenea sunt rugați să-și retragă dosarul în aceeași perioadă. Candidații respinși cu barem se pot înmatricula la facultățile unde au fost redistribuiți. Candidații respinși cu barem care nu au optat pentru alte facultăți se pot înscrie cu această medie obținută în sesiunea a II-a la orice facultate din UPB care mai are locuri disponibile. *** Concursul va avea loc în Campus Polizu în sălile afișate pe site-ul Admitere UPB și la avizier.",
            "Regulament [Link] Către platforma de inscriere Programele de master ale FSA (domeniul: Ştiințe Inginerești Aplicate) Număr de locuri disponibile: - 100 Buget - 20 Taxă Calendarul sesiunilor de admitere: Sesiunea I Admitere anticipată - Înscrierea candidaților: 15.12.2024 – 10.05.2025 (Taxa înscriere: 50 RON) - Concurs de admitere: 13.05 – 16.05.2025 - Comunicarea rezultatelor: 13.05 – 17.05.2025 - Înmatricularea candidaților: 01.07 – 31.07.2025 Sesiunea II Iulie 2025 - Înscrierea candidaților: 1.07 – 8.07.2025 - Concurs de admitere: 10.07 – 12.07.2025 - Comunicarea rezultatelor: 10.07 – 12.07.2025 - Înmatricularea candidaților: 10.07 – 31.07.2025 Sesiunea III Septembrie 2025 - Înscrierea candidaților: 2.09 – 13.09.2025 - Concurs de admitere: 16.09 – 17.09.2025 - Comunicarea rezultatelor: 16.09 – 18.09.2025 - Înmatricularea candidaților: 16.09 – 20.09.2025"
        ],
        "retrieved_ids": [
            "6ccd6e8cf90ac5e0f62d36ab0c6545bdb0df7714986675e4854d0f00e6cfc934-2",
            "7261d53c1bc03b86e5609b82811972b54096ba162fef6abf2a9fc84018d179b4-4",
            "5ed022490c4bb6b106bfb96e9f513a2f775f895e59731b26cd505937a92b04e3-1"
        ],
        "retrieved_scores": [
            0.8419134,
            0.7521354,
            0.7760371
        ],
        "user_input": "Cate locuri sunt disponibile pentru admiterea la ACS?"
    },
    {
        "id": "351b9edc51d5fc910e562c8898208083d2741100710ffbcd9c7abd68ca38085d",
        "response": "Testul online de limbă de la Politehnica București are loc în două date: 21 martie 2025 și 23 mai 2025. Prima dată este valabilă pentru toți candidații, iar a doua dată este specifică pentru candidații înscriși la facultățile unde admiterea anticipată se bazează pe rezultatele activităților școlare (dosar). Detalii suplimentare pot fi găsite pe pagina oficială a universității.\n\nSurse:\n- Regulament admitere licență 2025, URL: https://upb.ro/wp-content/uploads/2024/12/Regulament_admitere_licenta_2025.pdf, pagina: 26\n- Regulament admitere licență 2025, URL: https://upb.ro/wp-content/uploads/2024/12/Regulament_admitere_licenta_2025.pdf, pagina: 36",
        "retrieved_contexts": [
            "Candidații care la înscriere optează pentru un domeniu cu limbă de predare engleză, franceză sau germană și care aleg să probeze cunoașterea respectivei limbi prin promovarea testului POLITEHNICA București, vor susține acest test on-line, la data de 21 martie 2025 (dată valabilă pentru toți candidații) sau 23 mai 2025 (această a doua dată este valabilă doar pentru candidații înscriși la facultățile la care admiterea anticipată este pe baza rezultatelor la activitățile școlare (dosar)). Detalii privind organizarea sa pot fi găsite la https://admitere.pub.ro. Ses. I-4.9. La înscriere, în formularul tipizat menționat anterior, în ordinea preferințelor sale, candidatul poate face opțiuni privind domeniile (numai de la facultatea la care s-a înscris) la care acesta dorește să fie pre-admis. În Sesiunea I sunt disponibile numai locuri cu finanțare de la buget. Ses. I-4.10. Fiecărui candidat cu dosar de înscriere validat de comisia locală i se întocmește o legitimație de concurs, cu fotografie. Candidații descarcă legitimația de concurs din aplicația de admitere (din contul propriu). Pe întreaga perioadă de desfășurare a concursului de admitere cu probe scrise sau vocaționale (c-s, c-v, c-m) și pe durata interacțiunii directe cu comisiile locale de admitere, candidații vor avea asupra lor cartea de identitate și legitimația de concurs. Ses. I-4.11.",
            "Candidații care la înscriere optează și pentru un domeniu cu limbă de predare engleză, franceză sau germană și care aleg să probeze cunoașterea respectivei limbi prin promovarea testului POLITEHNICA București, vor susține acest test on-line, la data de 10 iulie 2025 (dată valabilă pentru toți candidații) sau 18 iulie 2025 (această a doua dată este valabilă doar pentru candidații înscriși la facultățile la care admiterea anticipată este pe baza rezultatelor la activitățile școlare (dosar)(c-rs)) . Detalii privind organizarea sa pot fi găsite la https://admitere.pub.ro. Ses. II-5.11. Candidații care la înscriere optează pentru (și pentru) triade FaDoFi pentru care școlarizarea se realizează în beneficiul SRI trebuie să fi parcurs cu succes etapa suplimentară de înscriere și evaluare specifică la beneficiar. Ses. II-5.12. Fiecărui candidat cu dosar de înscriere validat de comisia locală i se întocmește o legitimație de concurs, cu fotografie. Candidații descărcată legitimația de concurs din aplicația de admitere (din contul propriu). Pe întreaga perioadă de desfășurare a concursului de admitere cu probe scrise, cu probe vocaționale sau cu probe mixte precum și pe durata interacțiunii directe cu comisiile locale de admitere, candidații vor avea asupra lor cartea de identitate și legitimația de concurs. Ses. II-5.13. După încheierea perioadei de înscriere la concursul de admitere, Comisiile locale de admitere vor publica on-line, cel mai târziu în preziua desfășurării probelor scrise sau vocaționale, listele nominale ale candidaților înscriși, ordonați alfabetic și repartizați pe săli, denumirea, data și ora începerii probelor scrise/vocaționale, precum și durata de desfășurare a acestora. Pag. 36 Universitatea Națională de Știință și Tehnologie POLITEHNICA București REGULAMENTUL Concursului de Admitere în Ciclul de Studii Universitare de Licență 2025 Ses. II-5.14.",
            "româna II. Am ales să susțin testul, ce trebuie să fac? 1. Mă înscriu (anunț cine sunt și pentru ce limbă susțin testul). 2. Obțin accesul la platforma on-line de test. 3. Susțin testul. 4. Primesc rezultatul. III.Etapele testului on-line POLITEHNICA București A – Înscriere Candidații trebuie să se înscrie pentru a putea susține testul on-line POLITEHNICA București din data de 23 mai 2025 prin completarea formularului de la adresa https://forms.office.com/e/2AWesNbYr9 Adresa de e-mail completată in formular trebuie să fie aceeași adresa de e-mail pe care candidatul a utilizat-o sau o va utiliza în cadrul procesului de înscriere la concurs de pe pagina http://admitere.pub.ro/. Formularul trebuie completat până cel târziu pe 21 mai 2025 ora 12:00. Toate câmpurile din formular sunt obligatorii! Candidații care nu au completat la timp si în integralitate formularul nu vor putea susține testul on-line POLITEHNICA București. B – Obținere date acces În urma completării formularului, candidatul va primi pe adresa de e-mail pe care a utilizat- o un e-mail care va conține următoarele informații necesare pentru susținerea testului on-line: 1. Link accesare platformă test de limbă on-line; 2. User și parolă necesare pentru accesarea testului propriu-zis. E- mailul se va trimite pe data de 21 mai 2025, după ora 14:00 C – Susținerea testului de limbă Candidatul accesează platforma în care va susține testul on-line POLITEHNICA București folosind datele de la punctul anterior. Testul pentru limba engleză începe la ora 10:00. Testul pentru limba germană începe la ora 12:00. Testul pentru limba franceză începe la ora 14:00. Testul devine disponibil pentru dvs. la ora programată mai sus. Pentru pornirea testului, formularea răspunsurilor, precum și pentru încărcarea acestora, aveți la dispoziție cel mult 100 min (contorizate din momentul în care dvs. ați pornit testul). Testul se va închide automat după 120 min de la ora de început programată, chiar daca nu l-ați finalizat între timp. D – Primire rezultate"
        ],
        "retrieved_ids": [
            "85ab8a2001db129d9b28c1a868567dde770e21f5c8ba133a94ef4814a7badfc9-36",
            "85ab8a2001db129d9b28c1a868567dde770e21f5c8ba133a94ef4814a7badfc9-53",
            "4a8af42a6c47f11b1d13d802bee4da49f7d449950fa3f74b338baa449e1e595b-3"
        ],
        "retrieved_scores": [
            0.8376472,
            0.841563,
            0.81430894
        ],
        "user_input": "Cand are loc testul online de limba de la Politehnica?"
    },
    {
        "id": "8124a958077450cc5ef9ac39c9d9468cfc7f3645ac143fef44d48ea7b42b8a63",
        "response": "Pentru a demonstra cunoștințele lingvistice la înscrierea la un program de studii în limba engleză, candidații trebuie să prezinte unul dintre următoarele documente:\n\n1. **Liceu absolvit în limba engleză**: Dacă acest lucru nu este evident din celelalte documente furnizate, este necesar să se încarce o copie a unui document eliberat de liceu care să ateste că s-a urmat un program de studii în limba engleză.\n2. **Certificat de competențe lingvistice**: Un certificat care atestă competențe lingvistice în limba engleză, cu un nivel minim B2.\n3. **Disciplina de tip limbă străină**: O disciplină de tip limbă străină promovată în liceu cu media cel puțin 8,00 (pentru clasele a IX-a, a X-a, a XI-a).\n4. **Proba de la examenul de Bacalaureat**: Proba A, B sau C de la examenul de Bacalaureat, însoțită de o copie completă a diplomei de Bacalaureat.\n5. **Testul de limbă POLITEHNICA București**: Candidații pot alege să susțină testul de limbă POLITEHNICA București, fără a fi necesar să încarce documente suplimentare la înscriere.\n\nEste important de menționat că, dacă candidatul optează pentru domenii în care școlarizarea se desfășoară în limba română, nu este necesară prezentarea acestor documente.\n\nSurse:\n- Testul de limbă on-line POLITEHNICA București, URL: https://fils.upb.ro/wp-content/uploads/2025/02/Test-limba-straina-23-05-detalii-S1-2025.pdf, pagina: 1\n- Regulament admitere licență 2025, URL: https://upb.ro/wp-content/uploads/2024/12/Regulament_admitere_licenta_2025.pdf, pagina: 99",
        "retrieved_contexts": [
            "| Pentru candidații care au optat la programe de studii școlarizate în limbi străine (engleză, franceză, germană), dacă este cazul, documentul/documentele care fac dovada cunoașterii limbii respective. Originalul documentelor din Tabelul Anx.VII-2— Punctul 10. |\n|:--|\n| Pentru candidații care au optat la domeniul Ştiințe ale educației, eseul motivațional al candidatului relativ la capacitatea, dorința și determinarea acestuia de a urma studiile în cadrul domeniului Ştiințe ale educației. Pentru candidații care optează la domeniul Teologie, Binecuvântarea Înaltpreasfințitului Părinte Arhiepiscop sau, după caz, Episcop, ierarhul eparhiei din care provine candidatul (de unde are domiciliul), în vederea înscrierii la Facultatea de Teologie, Litere, Istorie și Arte. Pentru candidații care au optat la domeniul Inginerie industrială — învățământ dual eseul motivațional al candidatului relativ la capacitatea, dorința și determinarea acestuia de a urma studiile universitare în forma de organizare dual, având în vedere particularitățile învățării prin muncă Originalul documentului din Tabelul Anx.IV-2— Punctul 11. |\n| Dovada achitării taxei de înmatriculare (vezi Anx.VIII-3). Original |\n| Pentru candidații care au fost admiși pe un loc cu taxă sau care participă la glisare având activate opțiuni cu taxă, dovada achitării parțiale a taxei de şcolarizare în anul I (vezi Anx.VIII-6). Original ***Notă Pentru candidații care în urma procesului de glisare sunt înmatriculați pe un loc la buget, sau în cazul în care candidatul solicită retragerea de la studiile universitare de licență, din motive personale, acest avans nu se restituie. |",
            "Despre testul de limbă on-line POLITEHNICA București din data de 23 mai 2025 L Ce este cu acest test? Am nevoie de el? Dacă doresc să beneficiez de avantajele studiului într-una din limbile de largă circulație (engleză, franceză, germană) și în lista mea de opțiuni includ domenii la care școlarizarea se desfășoară într-una din acest limbi, trebuie, conform legii, să fac dovada că am cunoștințele lingvistice necesare. Dovada se face folosind oricare dintre variantele de mai jos:",
            "| Varianta | Cum dovedesc la înscriere | Este necesar să susțin testul de limbă POLITEHNICA Bucureşti? |\n|:--|:--|:--|\n| Liceu absolvit în respectiva limbă de predare | Dacă acest lucru nu apare evident din celelalte documente furnizate la înscriere, am grijă să încarc o copie a unui document eliberat de liceu şi din care să reiasă că am urmat un program de studii în respectiva limbă | NU |\n| Certificat de competențe lingvistice pentru respectiva limbă de predare (minim B2); | Încarc o copie a certificatului | NU |\n| Disciplină de tip limbă străină promovată în liceu cu media cel puțin 8,00 (pentru clasele a IX- a,a X-a, a XI-a). | Încarc o copie a unui document eliberat de liceul urmat din care reiese acest lucru | NU |\n| Proba A, B sau C de la examenul de Bacalaureat; | Încare o copie completă a diplomei de Bacalaureat (inclusiv situația la examen) | NU |\n| Aleg să susțin testul de limbă POLITEHNICA Bucureşti; | Nu încarc nimic la înscriere | DA |\n| L La înscriere optez numai pentru domenii pentru care şcolarizarea se desfăşoară în româna | Nu încarc nimic la înscriere | NU |"
        ],
        "retrieved_ids": [
            "85ab8a2001db129d9b28c1a868567dde770e21f5c8ba133a94ef4814a7badfc9-218",
            "4a8af42a6c47f11b1d13d802bee4da49f7d449950fa3f74b338baa449e1e595b-1",
            "4a8af42a6c47f11b1d13d802bee4da49f7d449950fa3f74b338baa449e1e595b-2"
        ],
        "retrieved_scores": [
            0.839536,
            0.829654,
            0.87440145
        ],
        "user_input": "Ce documente sunt necesare pentru a demonstra cunostintele lingvistice la inscrierea la un program de studii in limba engleza?"
    },
    {
        "id": "2b48bbd9773ad15e6d6896fe9aba7282c8965d537e7a3df5c02b60b27c2817de",
        "response": "Pentru a te înscrie la testul online de limbă străină, trebuie să urmezi următorii pași:\n\n1. **Înscriere**: Completează formularul de înscriere disponibil la adresa [https://forms.office.com/e/2AWesNbYr9](https://forms.office.com/e/2AWesNbYr9). Este important ca adresa de e-mail completată în formular să fie aceeași cu cea utilizată în procesul de înscriere la concurs pe pagina [http://admitere.pub.ro/](http://admitere.pub.ro/).\n2. **Termen limită**: Asigură-te că formularul este completat până cel târziu pe 21 mai 2025, ora 12:00. Toate câmpurile din formular sunt obligatorii, iar candidații care nu respectă acest termen nu vor putea susține testul.\n3. **Obținerea datelor de acces**: După completarea formularului, vei primi un e-mail pe adresa ta de e-mail, care va conține linkul pentru accesarea platformei de testare, precum și user și parolă necesare pentru a accesa testul. Acest e-mail va fi trimis pe 21 mai 2025, după ora 14:00.\n4. **Susținerea testului**: Accesează platforma de testare folosind datele primite și susține testul la ora programată pentru limba aleasă (engleză, germană sau franceză). Testul va fi disponibil timp de 100 de minute, iar închiderea automată va avea loc după 120 de minute de la ora de început programată.\n\nSurse:\n- Testul online de limbă străină - POLITEHNICA București, URL: https://fils.upb.ro/wp-content/uploads/2025/02/Test-limba-straina-23-05-detalii-S1-2025.pdf, pagina: 1",
        "retrieved_contexts": [
            "româna II. Am ales să susțin testul, ce trebuie să fac? 1. Mă înscriu (anunț cine sunt și pentru ce limbă susțin testul). 2. Obțin accesul la platforma on-line de test. 3. Susțin testul. 4. Primesc rezultatul. III.Etapele testului on-line POLITEHNICA București A – Înscriere Candidații trebuie să se înscrie pentru a putea susține testul on-line POLITEHNICA București din data de 23 mai 2025 prin completarea formularului de la adresa https://forms.office.com/e/2AWesNbYr9 Adresa de e-mail completată in formular trebuie să fie aceeași adresa de e-mail pe care candidatul a utilizat-o sau o va utiliza în cadrul procesului de înscriere la concurs de pe pagina http://admitere.pub.ro/. Formularul trebuie completat până cel târziu pe 21 mai 2025 ora 12:00. Toate câmpurile din formular sunt obligatorii! Candidații care nu au completat la timp si în integralitate formularul nu vor putea susține testul on-line POLITEHNICA București. B – Obținere date acces În urma completării formularului, candidatul va primi pe adresa de e-mail pe care a utilizat- o un e-mail care va conține următoarele informații necesare pentru susținerea testului on-line: 1. Link accesare platformă test de limbă on-line; 2. User și parolă necesare pentru accesarea testului propriu-zis. E- mailul se va trimite pe data de 21 mai 2025, după ora 14:00 C – Susținerea testului de limbă Candidatul accesează platforma în care va susține testul on-line POLITEHNICA București folosind datele de la punctul anterior. Testul pentru limba engleză începe la ora 10:00. Testul pentru limba germană începe la ora 12:00. Testul pentru limba franceză începe la ora 14:00. Testul devine disponibil pentru dvs. la ora programată mai sus. Pentru pornirea testului, formularea răspunsurilor, precum și pentru încărcarea acestora, aveți la dispoziție cel mult 100 min (contorizate din momentul în care dvs. ați pornit testul). Testul se va închide automat după 120 min de la ora de început programată, chiar daca nu l-ați finalizat între timp. D – Primire rezultate",
            "Candidații care la înscriere optează pentru un domeniu cu limbă de predare engleză, franceză sau germană și care aleg să probeze cunoașterea respectivei limbi prin promovarea testului POLITEHNICA București, vor susține acest test on-line, la data de 21 martie 2025 (dată valabilă pentru toți candidații) sau 23 mai 2025 (această a doua dată este valabilă doar pentru candidații înscriși la facultățile la care admiterea anticipată este pe baza rezultatelor la activitățile școlare (dosar)). Detalii privind organizarea sa pot fi găsite la https://admitere.pub.ro. Ses. I-4.9. La înscriere, în formularul tipizat menționat anterior, în ordinea preferințelor sale, candidatul poate face opțiuni privind domeniile (numai de la facultatea la care s-a înscris) la care acesta dorește să fie pre-admis. În Sesiunea I sunt disponibile numai locuri cu finanțare de la buget. Ses. I-4.10. Fiecărui candidat cu dosar de înscriere validat de comisia locală i se întocmește o legitimație de concurs, cu fotografie. Candidații descarcă legitimația de concurs din aplicația de admitere (din contul propriu). Pe întreaga perioadă de desfășurare a concursului de admitere cu probe scrise sau vocaționale (c-s, c-v, c-m) și pe durata interacțiunii directe cu comisiile locale de admitere, candidații vor avea asupra lor cartea de identitate și legitimația de concurs. Ses. I-4.11.",
            "Candidații care la înscriere optează și pentru un domeniu cu limbă de predare engleză, franceză sau germană și care aleg să probeze cunoașterea respectivei limbi prin promovarea testului POLITEHNICA București, vor susține acest test on-line, la data de 10 iulie 2025 (dată valabilă pentru toți candidații) sau 18 iulie 2025 (această a doua dată este valabilă doar pentru candidații înscriși la facultățile la care admiterea anticipată este pe baza rezultatelor la activitățile școlare (dosar)(c-rs)) . Detalii privind organizarea sa pot fi găsite la https://admitere.pub.ro. Ses. II-5.11. Candidații care la înscriere optează pentru (și pentru) triade FaDoFi pentru care școlarizarea se realizează în beneficiul SRI trebuie să fi parcurs cu succes etapa suplimentară de înscriere și evaluare specifică la beneficiar. Ses. II-5.12. Fiecărui candidat cu dosar de înscriere validat de comisia locală i se întocmește o legitimație de concurs, cu fotografie. Candidații descărcată legitimația de concurs din aplicația de admitere (din contul propriu). Pe întreaga perioadă de desfășurare a concursului de admitere cu probe scrise, cu probe vocaționale sau cu probe mixte precum și pe durata interacțiunii directe cu comisiile locale de admitere, candidații vor avea asupra lor cartea de identitate și legitimația de concurs. Ses. II-5.13. După încheierea perioadei de înscriere la concursul de admitere, Comisiile locale de admitere vor publica on-line, cel mai târziu în preziua desfășurării probelor scrise sau vocaționale, listele nominale ale candidaților înscriși, ordonați alfabetic și repartizați pe săli, denumirea, data și ora începerii probelor scrise/vocaționale, precum și durata de desfășurare a acestora. Pag. 36 Universitatea Națională de Știință și Tehnologie POLITEHNICA București REGULAMENTUL Concursului de Admitere în Ciclul de Studii Universitare de Licență 2025 Ses. II-5.14."
        ],
        "retrieved_ids": [
            "4a8af42a6c47f11b1d13d802bee4da49f7d449950fa3f74b338baa449e1e595b-3",
            "85ab8a2001db129d9b28c1a868567dde770e21f5c8ba133a94ef4814a7badfc9-36",
            "85ab8a2001db129d9b28c1a868567dde770e21f5c8ba133a94ef4814a7badfc9-53"
        ],
        "retrieved_scores": [
            0.8216795,
            0.8269264,
            0.8261335
        ],
        "user_input": "Cum pot sa ma inscriu la testul online de limba straina?"
    },
    {
        "id": "1d7d1f8e960b45844dfd40ced16d06233ee311f4135b37aabaa3ff0e79196e78",
        "response": "# Tipuri de burse disponibile la Politehnica\n\nLa Universitatea Națională de Știință și Tehnologie POLITEHNICA București, studenții pot beneficia de următoarele tipuri de burse:\n\n1. **Burse sociale** - Acordate pe baza veniturilor nete pe membru de familie, în ordine crescătoare.\n2. **Burse de performanță** - Acordate studenților cu rezultate academice deosebite, cuantumul acestora fiind aprobat prin hotărârea Senatului.\n3. **Burse pentru învățământ dual** - Acordate studenților care urmează un program de învățământ dual, cuantumul fiind de asemenea aprobat prin hotărârea Senatului.\n4. **Burse speciale** - Acordate pe baza unei metodologii aprobate de senatul universitar.\n5. **Granturi de studii** - Acordate românilor de pretutindeni și cetățenilor străini, conform metodologiilor proprii.\n6. **Burse pentru stagii de studii universitare și postuniversitare** - Acordate pentru susținerea mobilităților temporare în universități și instituții din țară și străinătate.\n7. **Premii și stimulente financiare** - Acordate studenților cu performanțe remarcabile în activități extrașcolare, culturale și sportive, precum și celor în situație de risc.\n\nAceste burse sunt disponibile în funcție de criteriile stabilite de universitate și pot fi solicitate de studenți, cu excepția burselor speciale și burselor de performanță II și III, care sunt acordate fără cerere prealabilă.\n\nSurse:\n- Metodologie burse, URL: https://upb.ro/wp-content/uploads/2024/12/Metodologie-burse_rectificata.pdf, pagina: 2\n- Metodologie burse, URL: https://upb.ro/wp-content/uploads/2024/12/Metodologie-burse_rectificata.pdf, pagina: 13",
        "retrieved_contexts": [
            "Toate categoriile de burse se acordă la cererea studenților cu excepția burselor speciale, burselor de performanță II și III. Art. 4. (1) Informațiile privind modalitatea de accesare și acordare a burselor de la bugetul de stat se fac publice prin afișarea pe pagina web şi la facultățile din cadrul POLITEHNICII București, la începutul anului universitar. (2) Anunțurile pentru depunerea cererilor şi documentelor justificative în vederea obținerii unor categorii de burse vor fi publicate pe site-ul și la avizierul POLITEHNICII București/ fiecărei facultăți cu minimum 15 zile lucrătoare înainte de data-limită pentru depunerea acestora. Art. 5. Studentul POLITEHNICII București va depune la Secretariatul facultății, respectând data limită, dosarul în vederea obținerii bursei, ce trebuie să conțină următoarele documente,: a) cererea, însoțită de acordul de prelucrare a datelor cu caracter personal; b) copia cărții de identitate; c) documentele justificative specifice tipului de bursă solicitat. Art. 6. Se constituite, la nivelul Universității Naționale de Știință și Tehnologie POLITEHNICA București comisia centrală de atribuire a burselor, iar la nivelul fiecărei facultăți comisia de atribuire a burselor. Art.7. Comisia centrală de atribuire a burselor, prevăzută la art. 6, este formată din: a) Președinte: Prorectorul responsabil cu gestionarea resurselor; b) Directorul Direcției Generale Administrativ-Economice; c) Directorul Direcției Financiar-Contabile; d) Secretarul șef al universității/ Responsabil Probleme Sociale Studențești; e) Șeful Serviciului Social; Page 3 of 16 f) Un consilier juridic; g) Reprezentantul studenților în Consiliul de Administrație al POLITEHNICII București. Art. 8. Comisia centrală de atribuire a burselor are următoarele responsabilități:",
            "b. burse şi alte forme de sprijin studenților prin proiecte instituționale, fonduri nerambursabile sau din alte surse legal constituite, în conformitate cu metodologiile proprii. c. burse speciale, în baza unei metodologii aprobate de senatul universitar; d. premii, burse şi alte stimulente financiare studenților cu performanțe, respectiv, cu rezultate remarcabile în activitățile extrașcolare sau în activităţi culturale şi sportive, precum şi studenților în situație de risc. (6) POLITEHNICA București poate acorda granturi de studii şi burse românilor de pretutindeni și cetățenilor străini, în conformitate cu metodologiile proprii. Cuantumul bursei este stabilit prin hotărâre a senatului instituției de învățământ superior de stat, la propunerea consiliului de administrație. (7) Studenții pot beneficia și de alte burse, finanțate din bugetul POLITEHNICII București și din alte forme legal constituite, cuantumul acestora fiind stabilit prin hotărârea Senatului Universității, la propunerea Consiliului de Administrație; Page 2 of 16 (8) Studenții români și străini pot beneficia de burse, mobilități și alte drepturi, finanțate din contracte de finanțare externă nerambursabilă, câștigate de către POLITEHNICA București în competiții naționale și internaționale, în cuantumul prevăzut de aceste contracte. Art. 2. Perioada de acordare (1) Bursele, indiferent de categorie, se acordă pe toată durata anului universitar (12 luni), cu excepția burselor sociale ocazionale. Acordarea burselor încetează la data pierderii calității de student sau a neîndeplinirii criteriilor de promovabilitate, după caz. (2) Studenților înmatriculați în ultimul an de studiu al ciclurilor de studii de licență sau de masterat, care beneficiază de orice tip de bursă în ultimul semestru de studii al respectivului ciclu, li se acordă același tip de bursă/burse până la susținerea examenului de finalizare a studiilor în prima sesiune din anul universitar curent. (3) Prin excepție de la prevederile alin. (2), studenții înmatriculați în ultimul an de studiu pot beneficia de orice tip de bursă până la sfârșitul anului universitar curent, în situații temeinic justificate. CAPITOLUL II Atribuirea burselor Art. 3.",
            "(6) În cazul în care fondul pentru acordarea burselor sociale nu este utilizat în întregime, acesta se redistribuie pentru acordarea burselor de performanță. (7) Distribuirea burselor sociale se face în ordine crescătoare a venitului net pe membru de familie. (8) Sumele rămase în sold pentru facilități de transport pentru studenți, subvenții pentru cămine-cantine și sumele pentru bursele studenților neridicate în termen pot fi utilizate în anii următori pentru acordarea de burse pentru studenți, precum și pentru alte cheltuieli de natura investițiilor pentru infrastructura de cămine, cantine și pentru susținerea activităților centrelor pentru consiliere și orientare în carieră. Art. 35. Universitatea Națională de Știință și Tehnologie POLITEHNICA București poate suplimenta fondul pentru burse provenit de la bugetul de stat, pentru fiecare categorie de burse, cu fonduri provenite din venituri proprii. Art. 36. (1) Cuantumul burselor de performanță și al burselor pentru învățământ dual se aprobă prin hotărârea Senatului, la propunerea Consiliului de Administrație, ca urmare a consultării cu reprezentanții studenților, inclusiv a organizațiilor studențești reprezentative din POLITEHNICA București. (2) Universitatea Națională de Știință și Tehnologie POLITEHNICA București poate acorda sprijin financiar studenților cu rezultate deosebite, pentru participarea la conferințe sau publicarea de articole științifice, cu aprobarea Consiliului de Administrație. (3) Universitatea Națională de Știință și Tehnologie POLITEHNICA București poate acorda burse pentru stagii de studii universitare și postuniversitare, în vederea susținerii mobilităților temporare efectuate în universități și instituții din țară și străinătate. Decizia cu privire la acordarea burselor pentru stagii de studii universitare și postuniversitare, precum și stabilirea cuantumului acestora se ia de către Biroul Consiliului de Administrație al POLITEHNICII București. Page 13 of 16 CAPITOLUL IV Dispoziții finale Art. 37. În cazul în care există suspiciuni de falsificare a documentelor depuse pentru obținerea unei burse pentru ajutor social, POLITEHNICA București va sesiza organele de anchetă competente și va proceda la sancționarea studentului, în funcție de gravitatea faptei. Art. 38."
        ],
        "retrieved_ids": [
            "d9aaa3233afc85c50c8869a9a97f45c2e80bd9dcea6b434aec2d66ca2234b796-3",
            "d9aaa3233afc85c50c8869a9a97f45c2e80bd9dcea6b434aec2d66ca2234b796-2",
            "d9aaa3233afc85c50c8869a9a97f45c2e80bd9dcea6b434aec2d66ca2234b796-18"
        ],
        "retrieved_scores": [
            0.8222842,
            0.8055164,
            0.7683557
        ],
        "user_input": "Ce tipuri de burse sunt disponibile la Politehnica?"
    },
    {
        "id": "9f3c444f377d6eb885f91cd5dfb31daa34c69bed9db80b2926a182b7244a05e8",
        "response": "Pentru a obține o bursă la Universitatea Națională de Știință și Tehnologie POLITEHNICA București, studenții trebuie să demonstreze rezultate deosebite în activitatea profesională, științifică și de cercetare, precum și implicarea în activitățile comunității. Universitatea poate acorda următoarele tipuri de burse: burse de performanță, burse de voluntariat, diplome de merit, diplome și burse speciale pentru șefii de promoție, diplome de excelență pentru studenții cu rezultate remarcabile la nivel național și/sau internațional, burse de mobilități în programe internaționale, și alte diplome sau premii. Detaliile specifice privind criteriile de eligibilitate și procedura de aplicare pot fi consultate în regulamentul universității.\n\nSurse:\n- Regulament organizare studii universitare de licență, URL: https://upb.ro/wp-content/uploads/2022/11/Regulament-org-studii-univ-licenta_2024.pdf, pagina: 20",
        "retrieved_contexts": [
            "MINISTERUL EDUCAȚIEI Universitatea Naţională de Ştiinţă şi Tehnologie POLITEHNICA Bucureşti (2) Înscrierea la Examenul de Diplomă/Examenul de Licenţăeste condiționată de acumularea ECTS aferente disciplinelor obligatorii şi opționale din planul de învățământ al programului formativ al studentului. (3) Media minimă de promovarea Examenului de Diplomă/Examenul de Licenţăeste 6. (4) Departamentele sunt obligate să stabilească titlurile temelor de Proiect de Diplomă/Lucrare de Licenţă şi conducătorii ştiințifici şi să facă repartizarea acestora conform opţiunilor studenţilor, cel mai tărziu în săptămâna a patra a penultimului semestru, conform criteriilor stabilite la nivelul facultăţii. (5) Modul de desfăşurare a Examenului de Diplomă/Examenul de Licenţă se face în conformitate cu regulamentul de organizare şi desfãşurare a examenelor de finalizare a studiilor, aprobat de către Senatul POLITEHNICA Bucureşti. (6) Absolvenţii care au promovat examenul de Diplomă/Licenţă primesc Diploma de Inginer/Diploma de Licenţă. VII. RECOMPENSE ŞI SANCŢIUNI ART. 30. RECOMPENSE Pentru rezultate deosebite în activitatea profesională, știinţifică și de cercetare şi pentru implicarea în activităţile comunităţii, universitatea poate acorda studentului următoarele recompense: a) burse de performanță; b) burse de voluntariat c) diplome de merit; d) diplome și burse speciale pentru șefii de promoţie; e) diplome de excelență pentru studenţii care au obținut rezultate profesionale științifice remarcabile la nivel național și/sau international; f) burse de mobilităţi în programe internaţionale; g) alte diplome sau premii. ART. 31. SANCȚIUNI Pentru încălcarea normelor de conduită universitară, studentului i se pot aplica următoarele sancţiuni: a) avertisment scris; b) avertisment scris cu atenționare: c) sistarea bursei pe o perioadă de 10-30 zile; d) suspendarea sau retragerea dreptului la unele facilităţi de care beneficiază studentul (cazare în cămin, legitimaţie de student etc); e) exmatricularea. VIII.",
            "Persoanele care dispun de resursele financiare corespunzătoare, fie din surse proprii, fie din burse acordate de persoane fizice sau juridice, pot fi admise ca studenţi-doctoranzi în regim cu taxă, în condiţiile prevăzute în regulamentul studiilor doctorale. Doctoratul ştiinţific este o condiţie pentru cariera profesională în învăţământul superior şi cercetare; b) doctorat profesional, în domeniile artelor, sportului, ale ştiinţelor militare, respectiv pentru învăţământul universitar dual, care are ca finalitate producerea de cunoaştere originală pe baza aplicării metodei ştiinţifice, a reflecţiei sistematice sau a cercetării aplicative asupra unor creaţii artistice, asupra unor performanţe sportive de înalt nivel naţional şi internaţional sau asupra unor teme de importanţă practică şi care constituie o bază pentru cariera profesională în învăţământul superior şi în cercetare, în domeniile vizate. (11) Programele de studii universitare de doctorat profesional se pot organiza, de regulă, la forma de învățământ cu frecvență. (12) Prin excepție de la prevederile aliniatului de mai sus programele de studii universitare de doctorat se pot organiza și la forma de învățământ cu frecvență redusă. (13) Au dreptul să participe la concursul de admitere la studii universitare de doctorat numai absolvenţii cu diplomă de masterat sau echivalentă acesteia, iar numărul cumulat de credite de studii transferabile dobândite, pentru ciclul de studii universitare de licenţă şi de masterat, să fie de cel puţin 300. Potrivit prevederilor Legii învăţământului superior nr. 199/2023, cu modificările şi completările ulterioare, diploma de licenţă a absolvenţilor învăţământului superior de lungă durată din perioada anterioară aplicării celor trei cicluri tip Bologna este echivalentă cu diploma de studii universitare de masterat în specialitate. În consecinţă, titularii diplomelor de studii superioare de lungă durată au dreptul să se înscrie la studii universitare de doctorat fără obligativitatea de a mai parcurge ciclul II de studii universitare de masterat. (14) Înscrierea la concursul de admitere la studii universitare de doctorat, într-un domeniu de doctorat nu este condiționată de domeniul în care a fost dobândită diploma de licență sau masterat.",
            "B14 B15 * Locuri subvenționate de la buget, pentru școlarizarea în beneficiul SRI (Serviciul Român de Informații) *** Locuri cu taxă, dar subvenționate (fără efort bugetar din partea candidaților admiși) Anx. II-2. În anul 2025, disciplinele luate în considerare la concursul de admitere pe baza rezultatelor la activitățile școlare (dosar) în Centrul Universitar București sunt: Pentru proba P1: Matematică, Chimie anorganică • Pentru proba P2: Fizică, Informatică, Chimie anorganică, Chimie organică, Biologie, Economie, Procesarea computerizată a imaginii, Geografie Anx. II-3. În anul 2025, disciplinele luate în considerare la concursul de admitere pe baza rezultatelor la activitățile școlare (dosar) în Centrul Universitar Pitești sunt: Pentru proba P1: Matematică, Chimie anorganică, respectiv Limba și literatura română. • Pentru proba P2: Fizică, Informatică, Chimie organică, Chimie anorganică, Biologie, Matematică, Psihologie, Procesarea computerizată a imaginii, Sociologie, Istorie, Economie, Geografie, Logică argumentare și comunicare, Cultură de specialitate, Religie, Discipline teologice, Limbă modernă 1, Limbă modernă 2, respectiv Latină Anx. II-4. La înscriere, candidatul optează pentru disciplina care va fi utilizată (una dintre variantele permise la facultatea / domeniul la care se înscrie) pentru fiecare dintre cele două probe și furnizează mediile necesare în conformitate cu situația sa școlară. Anx. II-5. Determinarea notelor, pentru disciplinele de concurs pe baza rezultatelor la activitățile școlare, se face pe baza mediilor anuale la discipline corespondente din foaia matricolă/situația școlară a candidatului pentru clasele a IX-a, a X-a și a XI-a. P01 Universitatea Națională de Știință și Tehnologie POLITEHNICA București Anexa II Discipline pentru probele de concurs P1 și P2. Calculul notelor la disciplinele de concurs Matematică M M M cA Chimie anorganică CA Limba și literature română R A Fizică F Informatică I Chimie organică CO"
        ],
        "retrieved_ids": [
            "3b29b0516a0b7af978077a8daaa189c3b82dad4559940a8acebc9017b6e97310-33",
            "36527b3da039b452b387028c350e8e537c8c6b5176f91649e53bf33924e493bb-3",
            "85ab8a2001db129d9b28c1a868567dde770e21f5c8ba133a94ef4814a7badfc9-97"
        ],
        "retrieved_scores": [
            0.7303266,
            0.72205377,
            0.7273195
        ],
        "user_input": "Cum pot obtine bursa la Politehnica?"
    },
    {
        "id": "78746274d7d7929857796fa56b1983a2cc969529daeb1627224bb7abab335ac6",
        "response": "Nu am suficiente informații pentru a răspunde la întrebare.",
        "retrieved_contexts": [
            "punct de vedere socio-economic, a căror familie nu a realizat în cele 12 luni dinaintea depunerii cererii pentru acordarea acestui tip de bursă un venit lunar net mediu pe membru de familie mai mare de 50% din salariul minim net la nivel național. Această categorie de bursă se poate acorda aceluiași student de două ori în cursul unui an universitar; b) bursa pentru ajutor social ocazional de maternitate, care se acordă studentei sau studentului a cărui soție nu realizează deloc venituri sau venituri mai mari decât salariul de bază minim net la nivel național, constă într-o bursă pentru naștere și lăuzie și o bursă pentru procurarea îmbrăcămintei copilului nou-născut și care se acordă o singură dată în cursul anului universitar pentru fiecare copil născut; c) bursa pentru ajutor social ocazional în caz de deces se poate acorda pentru decesul unui membru al familiei studentului(ei). Prin membru de familie se înțelege soț, soție, copil. În cazul decesului studentului(ei) necăsătorit(e)/căsătorit(e) cu soție/soț care nu realizează venituri, bursa se acordă rudelor de gradul I/succesorului legal o singură dată în cursul anului universitar. (2) Cuantumul acestor burse este stabilit de Senatul universității, la propunerea Consiliului de administrație, cu condiția ca acesta să fie cel puțin egal cu cuantumul lunar al bursei sociale. (3) POLITEHNICA București poate acorda alte stimulente financiare studenților în situație de risc, stabilite de Biroul Consiliului de Administrație. Art. 28. Calculul venitului lunar mediu net (1) Determinarea venitului lunar mediu net al familiei studentului se realizează până la împlinirea vârstei de 26 de ani. La stabilirea venitului mediu net lunar pe membru de familie se iau în calcul toate veniturile nete cu caracter permanent realizate de membrii familiei, supuse impozitului pe venit. Prin venituri nete se înțelege totalitatea sumelor primite/realizate de persoana singură, respectiv de fiecare membru al familiei, reprezentând valoarea obținută după aplicarea cotei de impozitare asupra venitului impozabil stabilit conform prevederilor legale.",
            "(2) Pentru studenții cu vârsta între 26 și 35 de ani, venitul lunar mediu net se va calcula ținând cont doar de veniturile personale ale acestora și ale persoanelor pe care le au în grijă, precum copii, soție etc., în conformitate cu prevederile legale în vigoare. (3) În situația în care personalul instituției de învățământ are suspiciuni privind îndeplinirea condițiilor de acordare a bursei sociale, rectorul POLITEHNICII București sesizează situația autorităților publice locale, în vederea efectuării unei anchete sociale. Personalul instituției de învățământ nu efectuează anchete sociale în vederea acordării burselor sociale. (4) După caz, bursa socială poate fi acordată sau retrasă, ca urmare a unei solicitări în acest sens din partea serviciilor publice de asistență socială și pe baza unui raport de anchetă socială. Art. 29. Depunerea documentelor în vederea acordării burselor sociale (1) Conform art. 69 alin. (4) din Legea nr. 207/2015 privind Codul de procedură fiscală, cu modificările și completările ulterioare, verificarea veniturilor declarate de solicitanți se face de către reprezentanții instituției de învățământ superior, respectiv, Comisia de atribuire a burselor la nivel de facultate, cu ajutorul platformei PatrimVen sau prin solicitarea organului central fiscal, în a cărui rază teritorială se află situația beneficiarii, de eliberare a unui document care să ateste situația veniturilor declarate de către aceștia. (2) În vederea acordării burselor sociale, studenții trebuie să depună următoarele documente justificative pe baza cărora se realizează încadrarea în unul dintre tipurile de burse oferite: a) cererea solicitantului, însoțită de o declarație pe propria răspundere privind veniturile nete, cu caracter permanent, obținute pe ultimele 12 luni anterioare cererii, realizate de Page 10 of 16 membrii familiei, supuse impozitului pe venit, și acordul privind prelucrarea datelor cu caracter personal pentru verificarea respectării criteriilor de acordare a bursei; b) pentru situațiile în care există suspiciuni rezonabile, comisia de atribuire a burselor poate solicita studentului să prezinte raportul de anchetă socială, realizat cu respectarea prevederilor legale, din care să reiasă situația exactă a familiei acestuia.",
            "(3) Cuantumul minim al bursei sociale se propune anual, până la data de 1 septembrie, de către Comisia Națională pentru Finanțarea Învățământului Superior (CNFIS), se adoptă prin ordin al ministrului educației și trebuie să acopere cheltuielile minime de masă şi cazare. (4) Cuantumul burselor sociale se stabilește prin hotărâre a senatului universității POLITEHNICA București, la propunerea Consiliului de administrație, în limita fondurilor disponibile și în funcție de nevoile identificate la nivelul comunității studențești, prin consultarea reprezentanților studenților, inclusiv cu organizațiile studențești din POLITEHNICA București. (5) Pentru acordarea burselor sociale, singurul criteriu academic ce se ia în considerare este promovabilitatea. (6) Bursele sociale se cumulează cu alte tipuri de burse, dacă studentul îndeplinește criteriile specifice pentru ambele categorii de burse. (7) Bursele sociale se acordă pe durata legală a programului de studii, până la împlinirea vârstei de 35 de ani. (8) Beneficiarii burselor sociale pot fi: a) studenții orfani de unul sau ambii părinți, studenții care provin din familii monoparentale sau studenții proveniți din centre de plasament și care nu realizează venituri peste plafonul pentru acordarea bursei sociale; b) studenții bolnavi de tuberculoză, care se află în evidența unităților medicale, pe perioada tratamentului tuberculostatic, diabet insulinonecesitant, boli maligne, sindroame de malabsorbție severe, boală cronică de rinichi în program de dializă, astm bronșic persistent moderat sau sever, epilepsie grand mal, cardiopatii congenitale, hepatită cronică cu fibroză avansată (stadiul F3 sau F4), glaucom, miopie gravă, boli imunologice autoimune forme severe, boli rare, tulburări din spectrul autist, boli hematologice severe care necesită tratament continuu sau spitalizări frecvente, surditate bilaterală, fibroză chistică, cei infectați cu virusul HIV sau bolnavi de SIDA, cei cu handicap locomotor și încadrați într-un grad de invaliditate, fără a se lua în considerare nivelul venitului mediu pe membru de familie;"
        ],
        "retrieved_ids": [
            "d9aaa3233afc85c50c8869a9a97f45c2e80bd9dcea6b434aec2d66ca2234b796-13",
            "d9aaa3233afc85c50c8869a9a97f45c2e80bd9dcea6b434aec2d66ca2234b796-14",
            "d9aaa3233afc85c50c8869a9a97f45c2e80bd9dcea6b434aec2d66ca2234b796-10"
        ],
        "retrieved_scores": [
            0.7617272,
            0.7486427,
            0.7758374
        ],
        "user_input": "Care este media minima necesara pentru a obtine o bursa?"
    },
    {
        "id": "b9874c243e8aa40ae9e79f15c70cb1a95667f036e3d6933c9333ee33147f89e5",
        "response": "Condițiile de promovare a unui an universitar la Politehnica București includ:\n\n1. **Acumularea ECTS**: Studentul trebuie să acumuleze ECTS aferente disciplinelor obligatorii și opționale din planul de învățământ al programului său de studii.\n2. **Media minimă**: Este necesar ca media generală de promovare a examenelor să fie de cel puțin 6.\n3. **Respectarea normelor de conduită**: Studentul trebuie să respecte normele de etică și conduită academică, precum și regulamentele instituției.\n\nAceste condiții sunt esențiale pentru a putea continua studiile și a promova la anul următor.\n\nSurse:\n- Regulament organizare studii universitare de licență, URL: https://upb.ro/wp-content/uploads/2022/11/Regulament-org-studii-univ-licenta_2024.pdf, pagina: 20\n- Codul drepturilor și obligațiilor studenților, URL: https://upb.ro/wp-content/uploads/2025/03/Codul-drepturilor-si-obligatiilor-studentilor.pdf, pagina: 16",
        "retrieved_contexts": [
            "(7) Bursele, indiferent de categorie, se acordă pe toată durata anului universitar (12 luni), cu excepţia burselor sociale ocazionale. Acordarea burselor încetează la data pierderii calităţii de student sau a neîndeplinirii criteriilor de promovabilitate, după caz, în conformitate cu regulamentele de organizare şi funcţionare ale instituţiilor de învăţământ superior. Capitolul III: OBLIGAȚIILE STUDENȚILOR Art. 15 (1) În mod corelativ, pe durata cât are contract de studii cu POLITEHNICA Bucureşti, studentul, studentul-doctorand sau cursantul, după caz, au următoarele îndatoriri: a) de a învăță în mod sistematic la toate disciplinele din planul de învățământ şi de a-şi însuşi pe deplin cunoştințele predate potrivit programelor universitare sau postuniversitare, după caz, în scopul unei temeinice pregătiri teoretice şi practice; b) de a respecta normele de etică şi de conduită academică în mediul universitar şi de a avea un comportament demn şi conform cu regulile de conviețuire socială în afara acestuia; c) de a respecta Carta, regulamentele și deciziile impuse de POLITEHNICA București; d) de a participa la ședințele structurilor de conducere din cadrul POLITEHNICII București în calitate de reprezentanți aleși ai studenților; e) de a respecta standardele de calitate impuse de către POLITEHNICA București; f) de a respecta drepturile de autor ale altor persoane și de a recunoaște paternitatea informațiilor prezentate în lucrările elaborate g) de a elabora și susține lucrări de evaluare la nivel de disciplină și lucrări de finalizare originale; h) de a sesiza autorităților competente orice nereguli în procesul de învățământ și în cadrul activităților conexe acestuia; i) de a participa la activități academice fără a fi sub influența băuturilor alcoolice sau a altor substanțe interzise; j) de a nu folosi un limbaj și comportament neadecvate mediului universitar; k) de a utiliza în mod corespunzător, conform destinației stabilite, toate facilitățile și subvențiile primite; l) de a semna contractul de studii la începerea fiecărui ciclu de studii. m)",
            "(7) Rezultatele aşteptate ale învăţării sunt corelate cu competenţele solicitate de ocupaţiile corespunzătoare, conform standardelor ocupaţionale şi/sau Clasificării Europene a Ocupaţiilor (ESCO). Art. 4. Structura anului universitar (1) Structura anului universitar este aprobată de către Senatul Universității, în conformitate cu dispozițiile art. 27 din Legea 199/2023. (2) La începutul fiecărui an universitar, facultățile au obligația afișării pe pagina web structura anului universitar și planurile de învățământ, pentru fiecare program de studii. Fișa disciplinei se aduce la cunoștința studentului de către cadrul didactic titular al disciplinei în cadrul primului curs/seminar al semestrului și se publică pe platforma Moodle. MINISTERUL EDUCAȚIEI Universitatea Naţională de Ştiinţă şi Tehnologie POLITEHNICA Bucureşti Art. 5. Calitatea de Student (1) Calitatea de student în cadrul POLITEHNICII Bucureşti se poate dobândi/redobândi prin unul din următoarele moduri: a) prin concurs de admitere; b) prin mobilitate academică definitivă de la o altă instituție de învățământ superior autorizată să funcționeze provizoriu sau acreditată din țară sau străinătate, conform prevederilor legale; c) prin reînmatriculare la aceeași facultate/domeniu/specializare pentru persoanele care au fost exmatriculate din POLITEHNICA București (în maxim 5 ani de la exmatriculare); d) prin reluarea studiilor, la aceeași facultate/domeniu/specializare unde a făcut întreruperea, pentru studenții care au fost în întrerupere de studii (1 sau 2 ani universitari); e) conform procedurilor legale pentru studenții străini. (2) Înscrierea la studii a unui student se face în baza existenţei unui contract de studii semnat de către părți (student și universitate). (3) Calitatea de student al universităţii se pierde: a) la absolvirea ciclului de studii; b) prin retragere de la studii; c) prin exmatriculare; d) pe perioada întreruperii studiilor . Art. 6. Planurile de învățământ Planurile de învățământ conțin discipline care sunt clasificate, în raport de criterii, astfel: a) după tipul disciplinei: obligatorii, opționale și facultative; b) după categoria formativă: disciplină de sinteză, disciplină de aprofundare, disciplină complementară.",
            "MINISTERUL EDUCAȚIEI Universitatea Naţională de Ştiinţă şi Tehnologie POLITEHNICA Bucureşti (2) Înscrierea la Examenul de Diplomă/Examenul de Licenţăeste condiționată de acumularea ECTS aferente disciplinelor obligatorii şi opționale din planul de învățământ al programului formativ al studentului. (3) Media minimă de promovarea Examenului de Diplomă/Examenul de Licenţăeste 6. (4) Departamentele sunt obligate să stabilească titlurile temelor de Proiect de Diplomă/Lucrare de Licenţă şi conducătorii ştiințifici şi să facă repartizarea acestora conform opţiunilor studenţilor, cel mai tărziu în săptămâna a patra a penultimului semestru, conform criteriilor stabilite la nivelul facultăţii. (5) Modul de desfăşurare a Examenului de Diplomă/Examenul de Licenţă se face în conformitate cu regulamentul de organizare şi desfãşurare a examenelor de finalizare a studiilor, aprobat de către Senatul POLITEHNICA Bucureşti. (6) Absolvenţii care au promovat examenul de Diplomă/Licenţă primesc Diploma de Inginer/Diploma de Licenţă. VII. RECOMPENSE ŞI SANCŢIUNI ART. 30. RECOMPENSE Pentru rezultate deosebite în activitatea profesională, știinţifică și de cercetare şi pentru implicarea în activităţile comunităţii, universitatea poate acorda studentului următoarele recompense: a) burse de performanță; b) burse de voluntariat c) diplome de merit; d) diplome și burse speciale pentru șefii de promoţie; e) diplome de excelență pentru studenţii care au obținut rezultate profesionale științifice remarcabile la nivel național și/sau international; f) burse de mobilităţi în programe internaţionale; g) alte diplome sau premii. ART. 31. SANCȚIUNI Pentru încălcarea normelor de conduită universitară, studentului i se pot aplica următoarele sancţiuni: a) avertisment scris; b) avertisment scris cu atenționare: c) sistarea bursei pe o perioadă de 10-30 zile; d) suspendarea sau retragerea dreptului la unele facilităţi de care beneficiază studentul (cazare în cămin, legitimaţie de student etc); e) exmatricularea. VIII."
        ],
        "retrieved_ids": [
            "bcba579c444019f0d3049720ae28075e7e2d3834011a96d548acb8c751e8d95b-22",
            "71788602578701b9e9b11da963eee9859a06e0dc3d482036b87e7c9c12f5fab5-15",
            "3b29b0516a0b7af978077a8daaa189c3b82dad4559940a8acebc9017b6e97310-33"
        ],
        "retrieved_scores": [
            0.840991,
            0.83559686,
            0.8156805
        ],
        "user_input": "Care sunt conditiile de promovare a unui an universitar la Politehnica?"
    },
    {
        "id": "cec39a122a07131e47318e6eebfee172401c137d9d7e5c3b48c7c3011ae1cee1",
        "response": "Nu am suficiente informații pentru a răspunde la întrebare.",
        "retrieved_contexts": [
            "Statutul de masterand cu taxă se păstrează, de regulă, pe întreaga durată de școlarizare. Pentru Centrul Universitar Pitești, forma de finanțare pentru studentul masterand se va stabili în fiecare an, conform ierarhizării studenților după medii, fără a fi menținut locul la buget sau taxă, obținut la admitere, toată perioada școlarizării. Cuantumul taxei, pentru fiecare an de studiu, se aprobă de Senatul Universității, în funcție de costurile specifice școlarizării. Art. 35. În organizarea formațiilor de studiu nu se face distincție între cele două categorii de admiși, cu sau fără taxă. Art. 36. Candidații declarați admiși vor completa și semna olograf contractul de studii universitare de masterat, respectiv un contract individual de studii şi pregătire practică la învăţământul dual, după înmatriculare și nu mai târziu de începutul anului universitar 2025-2026. În caz contrar aceștia vor pierde statutul de masterand. Anexa 1 Universitatea Națională de Știință și Tehnologie POLITEHNICA București FIŞA DE ÎNSCRIERE PENTRU ABSOLVENŢII CU DIPLOMĂ DE LICENŢĂ/INGINER CARE DORESC SĂ URMEZE ÎNVĂŢĂMÂNTUL UNIVERSITAR DE MASTERAT ANUL UNIVERSITAR 2025 – 2026 Sesiunea iulie și septembrie 1. Numele, iniţiala prenumelui tatălui şi prenumele candidatului:",
            "CONTINUAREA STUDIILOR IX. DISPOZIŢII FINALE I. PREVEDERI LEGALE Organizarea și desfășurarea concursului de admitere și scolarizare a românilor de pretutindeni la Universitatea Naţională de Ştiinţă şi Tehnologie POLITEHNICA Bucureşti (1) Pe locuri de studii fără plata taxelor de școlarizare, dar cu bursă, respectiv, fără plata taxelor de școlarizare, dar fără bursă, se face în conformitate cu: - Legea învățământului superior nr. 199/2023 cu modificările şi completările ulterioare; - Legea nr. 299/2007 privind sprijinul acordat românilor de pretutindeni, republicată, cu modificările şi completările ulterioare; - Ordinul MEN nr. 3900 din 16 mai 2017 privind aprobarea Metodologiei de școlarizare a românilor de pretutindeni, în învățământul preuniversitar de stat din România, pe locuri de studii fără plata taxelor de școlarizare, dar cu bursă, respectiv, fără plata taxelor de școlarizare, dar fără bursă începând cu anul şcolar 2017-2018 şi a Metodologiei de şcolarizare a românilor de pretutindeni în învăţământul superior de stat în România, pe locuri de studii fără plata taxelor de şcolarizare, dar cu bursă, respectiv fără plata taxelor de şcolarizare, dar fără bursă începând cu anul 2017 – 2018; - Ordinul Ministrului Educaţiei nr. 5552/16.04.2024, publicat în Monitorul Oficial nr. 742/30.07.2024, pentru aprobarea Metodologiei privind condiţiile de şcolarizare a românilor de pretutindeni şi a cetăţenilor străini în cadrul instituţiilor de învăţământ superior de stat, particulare şi confesionale particulare acreditate din România; - Ordinul Ministrului Educaţiei nr. 5553/16.06.2024 privind aprobarea Procedurii de emitere a scrisorilor de acceptare la studii a românilor de pretutindeni pentru învăţământul superior de stat şi particular acreditat, pe locuri cu taxă în lei; - Ordinul Ministrului Educației nr. 4262/2024 pentru aprobarea Metodologiei privind mobilitatea academică a studenților. (2) în categoria românilor de pretutindeni fac parte, în conformitate cu prevederile Legii nr. 299/2007 privind sprijinul acordat românilor de pretutindeni, republicată, cu modificările şi completările ulterioare:",
            "Sistemul de taxe școlarizare În Universitatea Națională de Știință și Tehnologie POLITEHNICA București, pentru anul universitar 2024-2025 2024 Cuantumul Nr. taxei Taxa Crt. [RON]"
        ],
        "retrieved_ids": [
            "79426a1571b68492454210a4455253ad1c6ca02f95283000457c0e0eb426d81d-13",
            "672577271c2e708d1597a074314ae1c6e2c501a0ea55477ba9124d256f0d763d-3",
            "305ffba5f7d4c89b1b0d23204ead08d29eea1ec1098c7799ba545633bab3c3c2-1"
        ],
        "retrieved_scores": [
            0.8001759,
            0.7898233,
            0.82518846
        ],
        "user_input": "Care este cuantumul taxei de scolarizare la ACS?"
    },
    {
        "id": "d161b0bade5998a8c2b2536c561a218bacb08d7e78aa6df4bac5f45e763528c6",
        "response": "Taxa de școlarizare poate fi plătită în următoarele moduri:\n\n1. **Direct în platforma on-line**: Utilizând un card bancar pe site-ul [https://admitere.pub.ro/](https://admitere.pub.ro/).\n2. **Prin transfer bancar**: Aceasta se poate realiza fie printr-o aplicație de e-banking, fie la ghișeul unei bănci. Este important ca la explicațiile plății să fie menționate numele și prenumele complet al candidatului, precum și Facultatea de bază la care acesta se înscrie pentru concursul de admitere.\n\nSurse:\n- Taxa de înscriere, URL: https://fils.upb.ro/wp-content/uploads/2025/01/Taxa-de-inscriere-LICENTA-2025-2.pdf, pagina: 1",
        "retrieved_contexts": [
            "(4) Studenţilor români de pretutindeni care finalizează un an de studii în cadrul unei instituţii româneşti de învăţământ superior de stat li se poate modifica regimul financiar de la \"fără plata taxelor de şcolarizare, fără bursă\" la \"fără plata taxelor de şcolarizare, cu bursă\" şi viceversa, în baza regulamentelor proprii ale universităţilor, în limita numărului de locuri alocat pentru anul I. Orice modificare a regimului financiar al bursierilor români de pretutindeni se va comunica Ministerului Educaţiei, în vederea emiterii unei noi scrisori de acceptare la studii. (5) Studenţii români de pretutindeni şcolarizaţi în cadrul instituţiilor de învăţământ superior din România trebuie să respecte prevederile regulamentelor în vigoare la nivelul instituţiilor de învăţământ superior şi legile în vigoare în România. (6) Cuantumul taxelor de şcolarizare este stabilit de instituţiile de învăţământ superior, cu respectarea prevederilor legale în vigoare. (7) Candidaţii nu pot fi repartizaţi fără acordul scris al acestora la programe de studii pentru care nu au optat în prealabil. (8) Scrisoarea de acceptare este valabilă doar pentru instituţia de învăţământ superior pentru care a fost emisă, începând cu anul universitar pentru care a fost emisă şi pentru ciclul universitar respectiv. Orice schimbare în parcursul universitar, care contravine înscrisurilor din scrisoarea de acceptare iniţială (universitate, domeniu, subdomeniu de studiu, prelungire/întrerupere de doctorat, regim financiar la românii de pretutindeni etc.), va fi reglementată, la solicitarea POLITEHNICA Bucureşti, prin emiterea de către Ministerul Educației a unei noi scrisori de acceptare. (9) Înmatricularea la studii, mobilitatea academică, schimbarea domeniului de studii şi reînmatricularea se realizează exclusiv cu aprobarea Ministerul Educației. (10) Prezenta Metodologie a fost aprobată în şedinţa Consiliului de Administrație din data de 12.09.2024 și în ședința Senatului din data de 20.09.2024. (11) Direcția Relații Internaționale prin Serviciul Gestionare Studenți Străini şi Facultăţile din cadrul POLITEHNICA Bucureşti vor duce la îndeplinire prevederile prezentei metodologii. Mihnea COSTOIU Rector Președintele Consiliului de Administrație",
            "CONTINUAREA STUDIILOR IX. DISPOZIŢII FINALE I. PREVEDERI LEGALE Organizarea și desfășurarea concursului de admitere și scolarizare a românilor de pretutindeni la Universitatea Naţională de Ştiinţă şi Tehnologie POLITEHNICA Bucureşti (1) Pe locuri de studii fără plata taxelor de școlarizare, dar cu bursă, respectiv, fără plata taxelor de școlarizare, dar fără bursă, se face în conformitate cu: - Legea învățământului superior nr. 199/2023 cu modificările şi completările ulterioare; - Legea nr. 299/2007 privind sprijinul acordat românilor de pretutindeni, republicată, cu modificările şi completările ulterioare; - Ordinul MEN nr. 3900 din 16 mai 2017 privind aprobarea Metodologiei de școlarizare a românilor de pretutindeni, în învățământul preuniversitar de stat din România, pe locuri de studii fără plata taxelor de școlarizare, dar cu bursă, respectiv, fără plata taxelor de școlarizare, dar fără bursă începând cu anul şcolar 2017-2018 şi a Metodologiei de şcolarizare a românilor de pretutindeni în învăţământul superior de stat în România, pe locuri de studii fără plata taxelor de şcolarizare, dar cu bursă, respectiv fără plata taxelor de şcolarizare, dar fără bursă începând cu anul 2017 – 2018; - Ordinul Ministrului Educaţiei nr. 5552/16.04.2024, publicat în Monitorul Oficial nr. 742/30.07.2024, pentru aprobarea Metodologiei privind condiţiile de şcolarizare a românilor de pretutindeni şi a cetăţenilor străini în cadrul instituţiilor de învăţământ superior de stat, particulare şi confesionale particulare acreditate din România; - Ordinul Ministrului Educaţiei nr. 5553/16.06.2024 privind aprobarea Procedurii de emitere a scrisorilor de acceptare la studii a românilor de pretutindeni pentru învăţământul superior de stat şi particular acreditat, pe locuri cu taxă în lei; - Ordinul Ministrului Educației nr. 4262/2024 pentru aprobarea Metodologiei privind mobilitatea academică a studenților. (2) în categoria românilor de pretutindeni fac parte, în conformitate cu prevederile Legii nr. 299/2007 privind sprijinul acordat românilor de pretutindeni, republicată, cu modificările şi completările ulterioare:",
            "Taxa de înscriere este 125 lei și se poate achita având menționate la explicațiile plății: numele și prenumele complet al candidatului, precum și Facultatea de bază la care acesta se înscrie pentru concursul de admitere, astfel: • direct în platforma on-line https://admitere.pub.ro/, cu card bancar. • prin transfer bancar (realizat într-o aplicate de e-banking sau la ghișeul unei bănci), într-unul dintre următoarele conturi:"
        ],
        "retrieved_ids": [
            "672577271c2e708d1597a074314ae1c6e2c501a0ea55477ba9124d256f0d763d-14",
            "672577271c2e708d1597a074314ae1c6e2c501a0ea55477ba9124d256f0d763d-3",
            "020962287c1797917927df2a9e9c5f1c0d701b8180527b701504210f7f4b3927-1"
        ],
        "retrieved_scores": [
            0.73604494,
            0.74453974,
            0.7435118
        ],
        "user_input": "Cum pot plati taxa de scolarizare?"
    },
    {
        "id": "6ed38f96e14bb9c7c01bcb02f3b89029db5f9fc554d6d93fa97d7b11dfe6fca5",
        "response": "Nu am suficiente informații pentru a răspunde la întrebare.",
        "retrieved_contexts": [
            "(2) Pentru studenții cu vârsta între 26 și 35 de ani, venitul lunar mediu net se va calcula ținând cont doar de veniturile personale ale acestora și ale persoanelor pe care le au în grijă, precum copii, soție etc., în conformitate cu prevederile legale în vigoare. (3) În situația în care personalul instituției de învățământ are suspiciuni privind îndeplinirea condițiilor de acordare a bursei sociale, rectorul POLITEHNICII București sesizează situația autorităților publice locale, în vederea efectuării unei anchete sociale. Personalul instituției de învățământ nu efectuează anchete sociale în vederea acordării burselor sociale. (4) După caz, bursa socială poate fi acordată sau retrasă, ca urmare a unei solicitări în acest sens din partea serviciilor publice de asistență socială și pe baza unui raport de anchetă socială. Art. 29. Depunerea documentelor în vederea acordării burselor sociale (1) Conform art. 69 alin. (4) din Legea nr. 207/2015 privind Codul de procedură fiscală, cu modificările și completările ulterioare, verificarea veniturilor declarate de solicitanți se face de către reprezentanții instituției de învățământ superior, respectiv, Comisia de atribuire a burselor la nivel de facultate, cu ajutorul platformei PatrimVen sau prin solicitarea organului central fiscal, în a cărui rază teritorială se află situația beneficiarii, de eliberare a unui document care să ateste situația veniturilor declarate de către aceștia. (2) În vederea acordării burselor sociale, studenții trebuie să depună următoarele documente justificative pe baza cărora se realizează încadrarea în unul dintre tipurile de burse oferite: a) cererea solicitantului, însoțită de o declarație pe propria răspundere privind veniturile nete, cu caracter permanent, obținute pe ultimele 12 luni anterioare cererii, realizate de Page 10 of 16 membrii familiei, supuse impozitului pe venit, și acordul privind prelucrarea datelor cu caracter personal pentru verificarea respectării criteriilor de acordare a bursei; b) pentru situațiile în care există suspiciuni rezonabile, comisia de atribuire a burselor poate solicita studentului să prezinte raportul de anchetă socială, realizat cu respectarea prevederilor legale, din care să reiasă situația exactă a familiei acestuia.",
            "(3) Cuantumul minim al bursei sociale se propune anual, până la data de 1 septembrie, de către Comisia Națională pentru Finanțarea Învățământului Superior (CNFIS), se adoptă prin ordin al ministrului educației și trebuie să acopere cheltuielile minime de masă şi cazare. (4) Cuantumul burselor sociale se stabilește prin hotărâre a senatului universității POLITEHNICA București, la propunerea Consiliului de administrație, în limita fondurilor disponibile și în funcție de nevoile identificate la nivelul comunității studențești, prin consultarea reprezentanților studenților, inclusiv cu organizațiile studențești din POLITEHNICA București. (5) Pentru acordarea burselor sociale, singurul criteriu academic ce se ia în considerare este promovabilitatea. (6) Bursele sociale se cumulează cu alte tipuri de burse, dacă studentul îndeplinește criteriile specifice pentru ambele categorii de burse. (7) Bursele sociale se acordă pe durata legală a programului de studii, până la împlinirea vârstei de 35 de ani. (8) Beneficiarii burselor sociale pot fi: a) studenții orfani de unul sau ambii părinți, studenții care provin din familii monoparentale sau studenții proveniți din centre de plasament și care nu realizează venituri peste plafonul pentru acordarea bursei sociale; b) studenții bolnavi de tuberculoză, care se află în evidența unităților medicale, pe perioada tratamentului tuberculostatic, diabet insulinonecesitant, boli maligne, sindroame de malabsorbție severe, boală cronică de rinichi în program de dializă, astm bronșic persistent moderat sau sever, epilepsie grand mal, cardiopatii congenitale, hepatită cronică cu fibroză avansată (stadiul F3 sau F4), glaucom, miopie gravă, boli imunologice autoimune forme severe, boli rare, tulburări din spectrul autist, boli hematologice severe care necesită tratament continuu sau spitalizări frecvente, surditate bilaterală, fibroză chistică, cei infectați cu virusul HIV sau bolnavi de SIDA, cei cu handicap locomotor și încadrați într-un grad de invaliditate, fără a se lua în considerare nivelul venitului mediu pe membru de familie;",
            "(6) În cazul în care fondul pentru acordarea burselor sociale nu este utilizat în întregime, acesta se redistribuie pentru acordarea burselor de performanță. (7) Distribuirea burselor sociale se face în ordine crescătoare a venitului net pe membru de familie. (8) Sumele rămase în sold pentru facilități de transport pentru studenți, subvenții pentru cămine-cantine și sumele pentru bursele studenților neridicate în termen pot fi utilizate în anii următori pentru acordarea de burse pentru studenți, precum și pentru alte cheltuieli de natura investițiilor pentru infrastructura de cămine, cantine și pentru susținerea activităților centrelor pentru consiliere și orientare în carieră. Art. 35. Universitatea Națională de Știință și Tehnologie POLITEHNICA București poate suplimenta fondul pentru burse provenit de la bugetul de stat, pentru fiecare categorie de burse, cu fonduri provenite din venituri proprii. Art. 36. (1) Cuantumul burselor de performanță și al burselor pentru învățământ dual se aprobă prin hotărârea Senatului, la propunerea Consiliului de Administrație, ca urmare a consultării cu reprezentanții studenților, inclusiv a organizațiilor studențești reprezentative din POLITEHNICA București. (2) Universitatea Națională de Știință și Tehnologie POLITEHNICA București poate acorda sprijin financiar studenților cu rezultate deosebite, pentru participarea la conferințe sau publicarea de articole științifice, cu aprobarea Consiliului de Administrație. (3) Universitatea Națională de Știință și Tehnologie POLITEHNICA București poate acorda burse pentru stagii de studii universitare și postuniversitare, în vederea susținerii mobilităților temporare efectuate în universități și instituții din țară și străinătate. Decizia cu privire la acordarea burselor pentru stagii de studii universitare și postuniversitare, precum și stabilirea cuantumului acestora se ia de către Biroul Consiliului de Administrație al POLITEHNICII București. Page 13 of 16 CAPITOLUL IV Dispoziții finale Art. 37. În cazul în care există suspiciuni de falsificare a documentelor depuse pentru obținerea unei burse pentru ajutor social, POLITEHNICA București va sesiza organele de anchetă competente și va proceda la sancționarea studentului, în funcție de gravitatea faptei. Art. 38."
        ],
        "retrieved_ids": [
            "d9aaa3233afc85c50c8869a9a97f45c2e80bd9dcea6b434aec2d66ca2234b796-14",
            "d9aaa3233afc85c50c8869a9a97f45c2e80bd9dcea6b434aec2d66ca2234b796-10",
            "d9aaa3233afc85c50c8869a9a97f45c2e80bd9dcea6b434aec2d66ca2234b796-18"
        ],
        "retrieved_scores": [
            0.76101804,
            0.77583843,
            0.79315424
        ],
        "user_input": "Cum se calculeaza media de bursa la Politehnica?"
    },
    {
        "id": "3e5df26269a3930fdec22fc89b19dfa9710ccf6c4e018967b5ebbb1c3ae4475f",
        "response": "Nu am suficiente informații pentru a răspunde la întrebare.",
        "retrieved_contexts": [
            "(4) Studenţilor români de pretutindeni care finalizează un an de studii în cadrul unei instituţii româneşti de învăţământ superior de stat li se poate modifica regimul financiar de la \"fără plata taxelor de şcolarizare, fără bursă\" la \"fără plata taxelor de şcolarizare, cu bursă\" şi viceversa, în baza regulamentelor proprii ale universităţilor, în limita numărului de locuri alocat pentru anul I. Orice modificare a regimului financiar al bursierilor români de pretutindeni se va comunica Ministerului Educaţiei, în vederea emiterii unei noi scrisori de acceptare la studii. (5) Studenţii români de pretutindeni şcolarizaţi în cadrul instituţiilor de învăţământ superior din România trebuie să respecte prevederile regulamentelor în vigoare la nivelul instituţiilor de învăţământ superior şi legile în vigoare în România. (6) Cuantumul taxelor de şcolarizare este stabilit de instituţiile de învăţământ superior, cu respectarea prevederilor legale în vigoare. (7) Candidaţii nu pot fi repartizaţi fără acordul scris al acestora la programe de studii pentru care nu au optat în prealabil. (8) Scrisoarea de acceptare este valabilă doar pentru instituţia de învăţământ superior pentru care a fost emisă, începând cu anul universitar pentru care a fost emisă şi pentru ciclul universitar respectiv. Orice schimbare în parcursul universitar, care contravine înscrisurilor din scrisoarea de acceptare iniţială (universitate, domeniu, subdomeniu de studiu, prelungire/întrerupere de doctorat, regim financiar la românii de pretutindeni etc.), va fi reglementată, la solicitarea POLITEHNICA Bucureşti, prin emiterea de către Ministerul Educației a unei noi scrisori de acceptare. (9) Înmatricularea la studii, mobilitatea academică, schimbarea domeniului de studii şi reînmatricularea se realizează exclusiv cu aprobarea Ministerul Educației. (10) Prezenta Metodologie a fost aprobată în şedinţa Consiliului de Administrație din data de 12.09.2024 și în ședința Senatului din data de 20.09.2024. (11) Direcția Relații Internaționale prin Serviciul Gestionare Studenți Străini şi Facultăţile din cadrul POLITEHNICA Bucureşti vor duce la îndeplinire prevederile prezentei metodologii. Mihnea COSTOIU Rector Președintele Consiliului de Administrație",
            "(7) Persoana care a beneficiat de școlarizare în cadrul unui program de studii universitare pe loc finanțat de la bugetul de stat are, în condițiile legii, dreptul de a urma un alt program de studii universitare în cadrul aceluiași ciclu de studii universitare: (a) în regim cu taxă , dacă instituția de învățământ superior de stat organizează programul și în acest mod; (b) în regim gratuit, cu finanțare de la bugetul de stat, în condițiile în care persoana achită contravaloarea serviciilor de școlarizare de care a beneficiat anterior cu finanțare de la bugetul de stat, integral sau parțial, în cazurile în care programul de studii la care a fost admisă este organizat doar cu finanțare integrală de la buget. Studenții pot achita contravaloarea serviciilor de școlarizare de care au beneficiat anterior Ministerului Educației, conform unei metodologii aprobate prin ordin al ministrului educației; (c) în regim gratuit, doar în cazul programelor universitare de masterat profesional de conducere interarme, care sunt obligatorii pentru evoluția ofițerilor în cariera militară, precum și în cazul programelor universitare de masterat profesional pentru formarea ofițerilor de informații și pentru formarea inițială a ofițerilor/ofițerilor de poliție din Ministerul Afacerilor Interne. (8) În conformitate cu autonomia universitară instituțiile de învățământ superior pot oferi scutiri parțiale sau totale de la plata taxelor de școlarizare, în baza unor criterii sociale, în conformitate cu reglementările proprii. Art. 9 (1) Studenţii au dreptul de a cunoaşte mecanismele prin care se stabilesc taxele de studiu, precum şi alte taxe percepute de instituția de învățământ superior, în conformitate cu Carta Universității. (2) Studenţii au dreptul să fie informaţi cu privire la numărul, tipul şi cuantumul fiecărei taxe practicate de instituțiile de învățământ superior. Cuantumul taxelor este aprobat de Senatul universitar și publicat pe site-ul instituțiilor de învățământ superior cu cel puțin 3 luni înainte de începutul fiecărui an universitar. Taxa de studiu nu se poate modifica în cursul unui ciclu de studii, decât prin indexarea cu rata inflației. (3) Statutul de student cu taxă se modifică în condițiile stabilite de senatul universitar, la începutul fiecărui an universitar.",
            "CONTINUAREA STUDIILOR IX. DISPOZIŢII FINALE I. PREVEDERI LEGALE Organizarea și desfășurarea concursului de admitere și scolarizare a românilor de pretutindeni la Universitatea Naţională de Ştiinţă şi Tehnologie POLITEHNICA Bucureşti (1) Pe locuri de studii fără plata taxelor de școlarizare, dar cu bursă, respectiv, fără plata taxelor de școlarizare, dar fără bursă, se face în conformitate cu: - Legea învățământului superior nr. 199/2023 cu modificările şi completările ulterioare; - Legea nr. 299/2007 privind sprijinul acordat românilor de pretutindeni, republicată, cu modificările şi completările ulterioare; - Ordinul MEN nr. 3900 din 16 mai 2017 privind aprobarea Metodologiei de școlarizare a românilor de pretutindeni, în învățământul preuniversitar de stat din România, pe locuri de studii fără plata taxelor de școlarizare, dar cu bursă, respectiv, fără plata taxelor de școlarizare, dar fără bursă începând cu anul şcolar 2017-2018 şi a Metodologiei de şcolarizare a românilor de pretutindeni în învăţământul superior de stat în România, pe locuri de studii fără plata taxelor de şcolarizare, dar cu bursă, respectiv fără plata taxelor de şcolarizare, dar fără bursă începând cu anul 2017 – 2018; - Ordinul Ministrului Educaţiei nr. 5552/16.04.2024, publicat în Monitorul Oficial nr. 742/30.07.2024, pentru aprobarea Metodologiei privind condiţiile de şcolarizare a românilor de pretutindeni şi a cetăţenilor străini în cadrul instituţiilor de învăţământ superior de stat, particulare şi confesionale particulare acreditate din România; - Ordinul Ministrului Educaţiei nr. 5553/16.06.2024 privind aprobarea Procedurii de emitere a scrisorilor de acceptare la studii a românilor de pretutindeni pentru învăţământul superior de stat şi particular acreditat, pe locuri cu taxă în lei; - Ordinul Ministrului Educației nr. 4262/2024 pentru aprobarea Metodologiei privind mobilitatea academică a studenților. (2) în categoria românilor de pretutindeni fac parte, în conformitate cu prevederile Legii nr. 299/2007 privind sprijinul acordat românilor de pretutindeni, republicată, cu modificările şi completările ulterioare:"
        ],
        "retrieved_ids": [
            "672577271c2e708d1597a074314ae1c6e2c501a0ea55477ba9124d256f0d763d-14",
            "bcba579c444019f0d3049720ae28075e7e2d3834011a96d548acb8c751e8d95b-15",
            "672577271c2e708d1597a074314ae1c6e2c501a0ea55477ba9124d256f0d763d-3"
        ],
        "retrieved_scores": [
            0.78162813,
            0.78452563,
            0.7750455
        ],
        "user_input": "Exista posibilitatea de a plati taxa de scolarizare in rate?"
    },
    {
        "id": "c80161863263f81c4779491346f7765365ea92e937c8d3c222292467dd2a51cd",
        "response": "# Calendarul de admitere la doctorat pentru anul 2024\n\n- **Înscrierea, validarea dosarului și admiterea candidaților:** 1 aprilie – 20 septembrie 2024  \n- **Validarea dosarelor de către secretariatul SD-AC:** 26 aprilie 2024, 29 mai 2024, 26 iunie 2024, 24 iulie 2024, 28 august 2024, 20 septembrie 2024, 16:00  \n- **Evaluarea dosarelor de către conducătorii de doctorat:** 30 aprilie 2024, 31 mai 2024, 28 iunie 2024, 26 iulie 2024, 30 august 2024, 23 septembrie 2024  \n- **Rezultate evaluare și acordarea calificativului Admis/Respins:** 25-26 septembrie 2024  \n- **Evaluarea candidaților declarați admiși (interviu oral):** 25-26 septembrie 2024  \n- **Înmatricularea candidaților declarați admiși:** 30 septembrie 2024  \n- **Începerea stagiului doctoral:** 1 octombrie 2024  \n\nAcest calendar este conform informațiilor disponibile pe site-ul oficial al Universității Politehnica din București.\n\nSurse:\n- URL: https://acs.pub.ro/admitere/doctorat/",
        "retrieved_contexts": [
            "Anunt important - sesiune suplimentara Program depunere documente sesiune suplimentara Comisii de admitere Septembrie 2022 Program depunere documente septembrie 2022 Rezultate concurs admitere masterat-iulie 2022 Comisii de admitere Iulie 2022 Program depunere documente Iulie 2022 Sesiuni admitere și calendar desfășurare Concursul de admitere în învățământul universitar de masterat, în anul universitar 2022-2023, se organizează în trei sesiuni: sesiunea de admitere anticipată 2022, sesiunea din iulie 2022 și sesiunea din septembrie 2022, conform calendarului din tabel. Sesiune Etape | Anticipată 2022 | Iulie 2022 | Septembrie 2022 | Înscrierea candidaților | 04.04 – 09.05.2022 | 01.07 – 11.07.2022 | 05.09 – 15.09.2022 | Concurs de admitere | 11.05 – 12.05.2022 | 13.07 – 15.07.2022 | 16.09 – 19.09.2022 | Comunicarea rezultatelor | 12.05 – 13.05.2022 | 15.07 – 16.07.2022 | 17.09 – 19.09.2022 | Înmatricularea candidaților | 04.07-24.07.2022 | 16.07-24.07.2022 | 19.09 – 21.09.2022 | Probe examen admitere Concursul de admitere la studii universitare de masterat constă din două probe: Proba 1 – o probă orală de evaluare a cunoștințelor fundamentale ale candidatului, desfășurată cu prezență fizică sau susținută online, cu subiecte dintr-o bibliografie anunțată sau de tip interviu Proba 2 – o probă orală de evaluare a motivației candidatului pentru urmarea programului de studiu, desfășurată cu prezență fizică sau susținută online Pentru fiecare probă, se obține o medie a notelor membrilor comisiei de admitere. Media generală de admitere se obține ca medie a celor două medii de la probele de examen. Rezultate concurs admitere masterat-mai 2022 Înmatricularea candidaților admiși Admitere Masterat 2021 Facultatea de Inginerie Industrială și Robotică Sesiunea Septembrie 2021 Sesiunea de admitere masterat III se organizează în perioada 18 – 26 septembrie 2021 (ora 16:00).",
            "Procesul de Admitere în sesiunea Septembrie la studiile universitare de masterat va începe pe data de 02.09.2024. Calendarul pentru Sesiunea III de Admitere 2024 este următorul: înscrierea candidaților: 02.09 - 13.09.2024, Concursul de admitere: 16.09 – 17.09.2024, Comunicarea rezultatelor: 16.09 – 18.09.2024, Înmatricularea candidaților: 16.09 – 20.09.2024. Admiterea se face conform Regulamentului privind organizarea și desfășurarea concursului de admitere în ciclul de studii universitare de masterat. Înscrierea la concursul de admitere pentru studiile de masterat in Sesiunea III de Admitere, sesiunea septembrie, se face online pe site-ul https://admitere.pub.ro conform regulamentului amintit. Programarea examenelor este disponibila aici.",
            "Doctorat Admitere doctorat Calendar admitere doctorat | 1 aprilie – 20 septembrie 2024 | Înscrierea, validarea dosarului și admiterea candidaților. Platformă înscriere candidați: https://admitere.pub.ro. | | 26 aprilie 2024 29 mai 2024 26 iunie 2024 24 iulie 2024 28 august 2024 20 septembrie 2024, 16:00 | Validarea dosarelor de către secretariatul SD-AC. Evaluarea dosarelor de către conducătorii de doctorat. | | 30 aprilie 2024 31 mai 2024 28 iunie 2024 26 iulie 2024 30 august 2024 23 septembrie 2024 | Rezultate evaluare și acordarea calificativului Admis/Respins. [Rezultate aprilie 2024] [Rezultate mai 2024] [Rezultate iunie 2024] [Rezultate iulie 2024] [Rezultate august 2024] [Rezultate septembrie 2024] | | 25-26 septembrie 2024 | Evaluarea candidaților declarați admiși (interviu oral) de către Comisia de admitere și alocarea burselor MEN în baza ierarhiei stabilite. [Listă finală admitere și burse] | | 30 septembrie 2024 | Înmatricularea candidaților declarați admiși. [Rezultate finale] | | 1 octombrie 2024 | Începerea stagiului doctoral. | Legislație și regulament admitere SD-AC organizează ocuparea locurilor disponibile pe bază de concurs conform următoarelor reglementări: - Metodologia privind organizarea și desfășurarea concursului de admitere la doctorat a Instituției Organizatoare de Studii Universitare de Doctorat IOSUD – UPB [link]. - Regulamentul de funcționare al Școlii Doctorale de Automatică și Calculatoare [link]. Admiterea la doctorat se face în limita locurilor alocate anual de: - Ministerul Educației pentru doctoratul în regim de finanțare de la bugetul de stat sub formă de granturi doctorale. - UPB, în calitate de Instituție Organizatoare de Studii Universitare de Doctorat, pentru doctoratul în regim cu taxă, care este suportată de către doctorand. Cuantumul taxelor este publicat aici [link]."
        ],
        "retrieved_ids": [
            "a6d9cdea7b06db11d13e1fd4b50c30fbca9db6da2616cd019773eb4baee44a2e-2",
            "1b1ea7137bcac57a08ed409352d4dafea078d3672aaa23e9e88a89e6ba380ff4-1",
            "0a7047bd9ee00f3d76a3f6e330d97e214cbc6a81ed25ef001a0d2834d408455f-1"
        ],
        "retrieved_scores": [
            0.79446805,
            0.8133649,
            0.7842419
        ],
        "user_input": "Care este calendarul de admitere?"
    },
    {
        "id": "53e67b1e657959392e91fa74a68c2a93e31e23b478a462a73be770b52be5f14e",
        "response": "Pentru a intra pe locurile destinate olimpicilor la admiterea la licență la Universitatea Națională de Știință și Tehnologie POLITEHNICA București, trebuie să îndeplinești următoarele condiții:\n\n1. **Distincții la olimpiade**: Trebuie să fi obținut distincții (premiile I, II, III, mențiune) la olimpiadele școlare internaționale recunoscute de Ministerul Educației în perioada studiilor liceale. Aceste distincții îți oferă dreptul de a te înscrie, la cerere, fără susținerea concursului de admitere, în cadrul numărului de locuri/granturi alocate.\n\n2. **Înscrierea**: Poți urma, fără taxe de școlarizare, cursurile a două facultăți în instituții de învățământ superior de stat, inclusiv la ACS, în funcție de domeniile de studiu corespunzătoare disciplinelor la care ai fost distins.\n\n3. **Perioada de valabilitate**: Aceste facilități sunt valabile pe o perioadă de cel mult trei ani de la absolvirea liceului.\n\n4. **Condiții suplimentare**: În anul 2025, pentru obținerea statutului de pre-admis fără concurs, vor fi luate în considerare diverse olimpiade și concursuri, precum și categoriile de rezultate obținute (premii, mențiuni, participări, calificări), în funcție de specificul facultății la care te înscrii.\n\nTe încurajez să consulți site-ul oficial al universității pentru informații suplimentare și detalii specifice despre admitere.\n\nSurse:\n- Anexa VI Admiterea olimpicilor și a candidaților cu rezultate deosebite, URL: https://admitere.pub.ro/docs/Anexa_VI_Regulament_2025.pdf, pagina: 1",
        "retrieved_contexts": [
            "Universitatea Națională de Știință și Tehnologie POLITEHNICA București Anexa VI Admiterea olimpicilor și a candidaților cu rezultate deosebite Anexa VI. Admiterea olimpicilor și a candidaților cu rezultate deosebite Anx. VI-1. În conformitate cu prevederii legii, absolvenții de liceu cu diplomă de bacalaureat, care au obținut în perioada studiilor liceale distincții (premiile I, II, III, mențiune) la olimpiadele școlare internaționale, recunoscute de Ministerul Educației, beneficiază de dreptul de a se înscrie, la cerere, fără susținerea concursului de admitere, în cadrul numărului de locuri/granturi alocate, în învățământul superior de stat în domenii de studiu corespunzătoare disciplinelor la care au fost distinși, putând urma, fără taxe de școlarizare, cursurile a două facultăți în instituții de învățământ superior de stat. Anx. VI-2. Candidații care au obținut performanțele respective pe timpul studiilor liceale beneficiază de facilitățile de mai sus, pe o perioadă de cel mult trei ani de la absolvirea liceului. Anx. VI-3. În plus, față de prevederile Anx. VI-1, în anul 2025, pentru obținerea statutului de pre-admis fără concurs, în condițiile legii și cu respectarea cadrului definit prin hotărârile Senatului universității, în funcție de specificul facultății la care candidatul s-a înscris pentru susținerea concursului de admitere, vor fi luate în considerare următoarele olimpiade și concursuri împreună cu diferitele categorii de rezultate obținute (premii, mențiuni, participări, calificări), după cum urmează: Olimpiade, concursuri și categorii de rezultate ce permit pre-admiterea/admiterea fără concurs la diverse facultăți din Universitatea Națională de Știință și Tehnologie POLITEHNICA București (UNSTPB) CENTRUL UNIVERSITAR BUCUREȘTI Olimpiada/Concursul Rezultat",
            "Admiterea olimpicilor și a candidaților cu rezultate deosebite Universitatea Națională de Știință și Tehnologie POLITEHNICA Bucuresti Centrul Universitar PITESTI FACULTATEA DE MECANICA SI TEHNOLOGIE LINK platforma de admitere https://admitere.pub.ro/Admitere/site/alegeCentru LINK informatii admitere https://www.upit.ro/ro/academia-reorganizata/facultatea-de-mecanica-si-tehnologie-2 https://www.facebook.com/FMT.UPIT https://www.instagram.com/fmt.upit/ Telefon informatii admitere 0348 453 150 si 0348 453 155 Universitatea Națională de Știință și Tehnologie POLITEHNICA Bucuresti Centrul Universitar PITESTI FACULTATEA DE MECANICA SI TEHNOLOGIE Apasa Universitatea Națională de Știință și Tehnologie POLITEHNICA Bucuresti Centrul Universitar PITESTI FACULTATEA DE MECANICA SI TEHNOLOGIE Apasa Universitatea Națională de Știință și Tehnologie POLITEHNICA Bucuresti Centrul Universitar PITESTI FACULTATEA DE MECANICA SI TEHNOLOGIE Apasa 10-Dec-24 Universitatea Națională de Știință și Tehnologie POLITEHNICA Bucuresti Centrul Universitar PITESTI FACULTATEA DE MECANICA SI TEHNOLOGIE Se introduc datele Universitatea Națională de Știință și Tehnologie POLITEHNICA Bucuresti Centrul Universitar PITESTI FACULTATEA DE MECANICA SI TEHNOLOGIE Componența dosarului de concurs la înscrierea on-line în Sesiunea I 01. Certificatul de naștere al candidatului (copie scanată/fotografie, format *.jpg sau *.pdf) încărcată on-line în platforma https://admitere.pub.ro 02. Act de identitate candidat aflat în perioada de valabilitate la data înscrierii – copie scanată/fotografie, format *.jpg sau *.pdf, încărcată on-line în platforma https://admitere.pub.ro 03. 1 fotografie (tip pașaport/CI, color, minim 2MP, format *.jpg) încărcată on-line în platforma https://admitere.pub.ro 04.",
            "(1) Bursele de excelență olimpică I/internațională se acordă studenților din cadrul POLITEHNICII București înmatriculați în anul I care au obținut premiul I, II sau III la olimpiadele școlare internaționale recunoscute de Ministerul Educației. (2) Bursele de excelență olimpică I/internațională se păstrează pe toată durata studiilor universitare de licență, dacă se menține performanța academică, stabilită în conformitate cu hotărârea Consiliului de Administrație. (3) Cuantumul minim al bursei de excelență olimpică I/internațională este cel stabilit prin ordin al ministrului educației și va fi avut în vedere de Consiliul de Administrație la începutul fiecărui an universitar, cu ocazia stabilirii cuantumului burselor. Art.21. Bursele de performanță (1) Bursele pentru performanță se acordă studenților din POLITEHNICA București, înmatriculați la programe de studii universitare cu frecvență, indiferent de forma de finanțare. Page 5 of 16 (2) Bursele atribuite pentru stimularea performanței prevăzute la alin. (1) se pot acorda studenților care se încadrează în cel puțin unul dintre următoarele cazuri: a) au obținut rezultate deosebite la învățătură, respectiv au cele mai mari medii din același an de studiu al unui program de studii; b) au obținut performanțe științifice, inovație și brevete. (3) Cuantumul bursei de performanță este mai mare decât cuantumul bursei sociale. (4) Bursele de performanță se distribuie în ordinea descrescătoare a mediilor, în limita bugetului fiecărei facultăți. (5) Media pentru bursă se calculează având în vedere și restanțele anterioare, astfel: a) pentru semestrul I, în cazul studenților anului I de la studiile universitare de licență, media după care sunt ordonați este media de la admitere la ciclu de licență; b) pentru semestrul I, în cazul studenților anului I de la studiile universitare de masterat, media după care sunt ordonați este media de la admitere la ciclu de masterat; c)"
        ],
        "retrieved_ids": [
            "90d452286979bc3ba13df942fe481c229bca45f701e35a41aac700dcf99479f4-1",
            "d30921449a2b0b31d12ccc546028a7e3af51f9dc6a39bcbd675f7003c2029704-7",
            "d9aaa3233afc85c50c8869a9a97f45c2e80bd9dcea6b434aec2d66ca2234b796-6"
        ],
        "retrieved_scores": [
            0.78697526,
            0.8000637,
            0.79492474
        ],
        "user_input": "Cum pot intra pe locurile pentru olimpici la admiterea la licenta la ACS?"
    },
    {
        "id": "8777dca76087c3bfaac84301b52faa967dde34d7c970352f681a4af1ef0422e7",
        "response": "Admiterea candidaților la Politehnica București se desfășoară în mai multe etape, conform regulamentului de admitere. Iată ordinea acestora:\n\n1. **Înscrierea candidaților**: Aceasta se face în perioada specificată în calendarul de admitere, prin completarea dosarului de înscriere pe portalul dedicat (admitere.pub.ro). Candidații trebuie să respecte instrucțiunile de înscriere.\n\n2. **Analiza dosarelor**: La sfârșitul perioadei de înscriere, Comisia Locală de admitere analizează dosarele candidaților conform criteriilor stabilite în regulamentul de admitere. Candidații care îndeplinesc aceste criterii vor fi declarați pre-admiși.\n\n3. **Concursul de admitere**: Candidații cu dosarul validat se prezintă la examenul scris, care se desfășoară într-o zi specificată. Este important ca aceștia să aibă legitimația de concurs.\n\n4. **Validare, confirmare, înscriere în anul I și înmatriculare**: După finalizarea concursului, în perioada stabilită, candidații declarați admiși se vor prezenta fizic la sediul facultății pentru a finaliza procesul de înmatriculare.\n\nAceste etape sunt esențiale pentru a asigura o admitere corectă și transparentă la programele de studii universitare integrate sau acreditate.\n\nSurse:\n- Regulament admitere licență 2025, URL: https://upb.ro/wp-content/uploads/2024/12/Regulament_admitere_licenta_2025.pdf, pagina: 106\n- Regulament programe de studii universitare integrate, URL: https://upb.ro/wp-content/uploads/2025/03/Regulament-programe-de-studii-universitare-integrate-sau-deja-acreditate.pdf, pagina: 9\n- URL: https://acs.pub.ro/admitere/licenta/",
        "retrieved_contexts": [
            "Sesiunea 2 - FAZA I - Înscrierea candidaților Înscrierea se face, în perioada indicată în calendarul de mai jos, completând dosarul de înscriere, conform instrucțiunilor, prin portalul admitere.pub.ro. A – Fără concurs - olimpiade și concursuri La sfârșitul perioadei de înscriere dosarele candidaților sunt analizate de către Comisia Locală de admitere în conformitate cu criteriile prezentate în regulamentul de admitere - Anexa VI. Candidații care îndeplinesc aceste criterii vor fi declarați pre-admiși și se vor prezenta la Faza III – Validare, confirmare, înscriere în anul I și înmatriculare admiși anticipat. B – Prin concurs - examen scris După finalizarea dosarului, acesta va fi validat de către comisia locala. Fiecărui candidat cu dosar de înscriere validat de comisia locală i se întocmește o legitimație de concurs (pe care candidatul o descarcă de pe platforma de admitere) cu care se va prezenta în ziua concursului. Sesiunea 2 – FAZA II – Concursul de admitere B – Prin concurs - examen scris - Informații despre desfășurarea examenului scris Candidații care au finalizat procedura de înscriere și au dosarul validat de către comisia locala vor imprima legitimația de concurs (disponibila după validarea înscrierii) și se vor prezenta la Examenul scris din data de 14 iulie 2025 – începând cu ora 09:00. Ambele probe de examen se desfășoară în aceeași zi. Sălile de examen vor fi afișate în contul candidatului de pe portalul admitere.pub.ro. Intrarea în sălile de examen se va face la ora 9.00, examenul va începe la ora 10.00. Accesul candidaților in campusul POLITEHNICII București se va face pietonal pe baza legitimației de concurs. Accesul aparținătorilor va fi permis în campus după ora 10.00. Sesiunea 2 – FAZA III – Validare, confirmare, înscriere în anul I și înmatriculare 16 iulie – 17 iulie, fizic, la sediul facultății pentru candidatii declarați admiși conform unei programări prealabile.",
            "(2) Criteriile de selecţie şi de evaluare ale candidaţilor, precum şi documentele din dosarul de admitere se vor stabili prin acordul de parteneriat interinstituţional. (3) Admiterea la studii universitare de scurtă durată/licenţă/master/doctorat în cadrul unui program de studii integrate, acreditat conform prevederilor acestui regulament, se desfăşoară cu respectarea metodologiei de admitere adoptate în cadrul POLITEHNICII București şi a legislaţiei naţionale în vigoare, după cum urmează: a. la concursul de admitere la studii universitare de scurtă durată au dreptul să participe absolvenţii cu diplomă de bacalaureat sau echivalentă, cu respectarea condiţiilor specifice stabilite de acordul interinstituţional; b. la concursul de admitere la studii universitare de licenţă au dreptul să participe absolvenţii cu diplomă de bacalaureat sau echivalentă, cu respectarea condiţiilor specifice stabilite de acordul interinstituţional; c. la concursul de admitere la studii universitare de master au dreptul să participe absolvenţii cu diplomă de licenţă sau echivalentă, cu respectarea condiţiilor specifice stabilite de acordul interinstituţional; (4) la concursul de admitere la studii universitare de doctorat au dreptul să participe absolvenţii cu diplomă de masterat sau echivalentă acesteia, cu respectarea condiţiilor specifice stabilite de acordul interinstituţional şi care au parcurs programe de studii universitare de licenţă/masterat cumulând minimum 300 ECTS. (5) Înmatricularea candidaţilor declaraţi admişi în urma concursului de admitere se face prin decizia rectorului POLITEHNICA București și ținând seama de clauzele stabilite în acordul de parteneriat interinstituţional. (6) Înscrierea în Registrul matricol unic a studenţilor admişi la programele de studii universitare integrate se realizează cu respectarea prevederilor legale în vigoare. (7) Candidatul declarat admis la un program de studii universitare integrate are calitatea de student/student-doctorand pe întreaga perioadă a prezenţei sale în cadrul programului respectiv, de la înmatriculare şi până la susţinerea examenelor sau a examenului de finalizare a studiilor sau exmatriculare, cu excepţia perioadelor de întrerupere a studiilor.",
            "listele candidaților cu barem (pre-admitere) îndeplinit; ▪ listele candidaților declarați admiși anticipat și înmatriculați Ses I; ▪ listele finale ale candidaților declarați admiși anticipat și înmatriculați Ses I+; Anx X - 3 Universitatea Națională de Știință și Tehnologie POLITEHNICA București Anexa X Competențele comisiilor de admitere ▪ listele candidaților declarați admiși preliminar, în ordinea descrescătoare a mediilor generale obținute, ținându-se seama de opțiunile din fișa de înscriere; ▪ listele candidaților cu barem îndeplinit (dar nu au avut media necesară admiterii la nicio facultate precizată în fișa de înscriere); lista candidaților declarați respinși; lista cu locuri vacante pentru fiecare domeniu, dacă este cazul. • predau Comisiei centrale de admitere câte un exemplar din cataloage și din fiecare listă. Anx.X-10. Publicarea rezultatelor: • publică la facultate informațiile locale privind rezultatele și etapele următoare ale concursului; • publică informații pentru candidații declarați pre-admiși/admiși preliminar (perioada și condițiile de validare dosar, confirmare, participare la glisare, înscriere în anul I și înmatriculare); • publică informații pentru candidații declarați admiși preliminar (facultatea, domeniul și forma de finanțare la care au fost admiși pe baza opțiunilor din fișa de înscriere); • publică, dacă este cazul, informații privind modalitatea de ocupare a locurilor vacante. Anx. X-11. Rezolvarea contestațiilor: • analizează contestațiile împreună cu Comisia centrală de admitere • formulează răspunsuri la contestații și publică rezultatele. Anx. X-12. Validarea dosarelor, confirmarea, participarea la glisare, înscrierea în anul I și înmatricularea: • Planifică, organizează și asigură integral activitatea de verificare a dosarelor, confirmarea locului, înscrierea pentru participarea opțională la glisare, completarea documentelor necesare înscrierii în anul I și înmatricularea candidaților preliminar admiși."
        ],
        "retrieved_ids": [
            "491f908948d53e5b16fb1e16d5db1345049605301c9e3d3f7116532b523b9d98-5",
            "2350258c519b2dda96612268851c0f3932f97cd1681d19df7eec652511e653db-12",
            "85ab8a2001db129d9b28c1a868567dde770e21f5c8ba133a94ef4814a7badfc9-234"
        ],
        "retrieved_scores": [
            0.85250396,
            0.85972303,
            0.85346353
        ],
        "user_input": "In ce ordine se face admiterea candidatilor la Politehnica?"
    },
    {
        "id": "7cdd24fcc18210506783a2df4eb8e535e3c794d0fdddd162a6cf2e12aaa3eb34",
        "response": "Conform regulamentului de admitere, un candidat se poate înscrie la o singură facultate din Universitatea Națională de Știință și Tehnologie POLITEHNICA București (UNSTPB) în cadrul sesiunii de admitere anticipată. Aceasta înseamnă că nu este permisă înscrierea la examenul de admitere la mai multe facultăți simultan. Candidatul va plăti o singură taxă de înscriere și va trebui să finalizeze procesul de înscriere pe platforma specificată. \n\nDe asemenea, este important de menționat că, pentru a fi admiși, candidații trebuie să dețină diploma de Bacalaureat sau o diplomă echivalentă, iar admiterea și înmatricularea sunt accesibile doar celor care îndeplinesc această condiție.\n\nSurse:\n- URL: https://energ.upb.ro/admitere/licenta/informatii-admitere\n- Sursa: https://upb.ro/wp-content/uploads/2024/12/Regulament_admitere_licenta_2025.pdf, URL: https://upb.ro/wp-content/uploads/2024/12/Regulament_admitere_licenta_2025.pdf, pagina: 11",
        "retrieved_contexts": [
            "În ceea ce privește necesitatea de a fi promovat examenul de Bacalaureat în momentul participării la concursul de admitere la Universitatea Națională de Știință și Tehnologie POLITEHNICA București (UNSTPB), în anul 2025, sunt valabile următoarele: • Pot fi admiși și înmatriculați prin Concursul de admitere în UNSTPB numai absolvenți de liceu cu diplomă de bacalaureat (sau diplomă echivalentă acesteia). • La înscriere pot participa și elevi din clasa a XII-a sau absolvenți de liceu care încă nu au promovat examenul de Bacalaureat, dar admiterea și înmatricularea sunt accesibile numai candidaților ce dețin diplomă de Bacalaureat (sau diplomă echivalentă acesteia). CP-2.2. Un candidat declarat admis poate beneficia de finanțare de la bugetul de stat pentru un singur program de licență. Costurile aferente depășirii duratei învățământului gratuit, prevăzute de lege (durata normală pentru respectivul program de studii), se suportă de către student. Candidatul admis la mai multe universități/domenii de studiu pe locurile fără taxă este obligat să opteze pentru domeniul de studii la care dorește să fie finanțat de la bugetul de stat, la o singură facultate dintr-o instituție de învățământ superior. Opțiunea sa este confirmată prin depunerea diplomei de Bacalaureat în original la dosarul de concurs. CP-2.3. Se pot înscrie la concurs și studenți ai UNSTPB sau ai altor instituții de învățământ superior de stat sau particular acreditate sau autorizate, înmatriculați în anii precedenți pe locuri finanțate de la bugetul de stat sau în regim cu taxă, care renunță sau au renunțat la continuarea studiilor în domeniul respectiv și doresc să studieze un alt domeniu în Universitatea Națională de Știință și Tehnologie POLITEHNICA București (UNSTPB). Pentru candidații admiși și înmatriculați într-un nou program de studii universitare, din finanțarea de la buget alocată pentru durata normală a noului program se scade cea corespunzătoare anilor de studiu finanțați de la buget pentru programul/programele anterioare. CP-2.4.",
            "Doar daca este cazul (a doua facultate, întreruperi, …): - adeverinţă din care să rezulte calitatea de student şi regimul de studiu (cu sau fără taxă), pentru cei care renunţă la continuarea studiilor sau se înscriu la concurs ca să urmeze un alt domeniu de studiu. Pot participa la concursul de admitere pentru a urma concomitent două domenii de studiu numai studenţii care la finele sesiunii de examene din vara anului universitar 2018/2019 sunt integralişti, acest lucru fiind precizat în adeverinţă. În acest caz, diploma de bacalaureat sau diploma echivalentă acesteia se va prezenta în copie legalizată (originalul rămânând la prima facultate); - adeverinţă(e) din care să rezulte perioada(ele) în care au fost studenţi şi regimul de studiu (cu sau fără taxă) pentru candidaţii care au renunţat la continuarea studiilor în instituţii de învăţământ superior de stat; - adeverinţă din care să rezulte calitatea de student al unei instituţii de învăţământ superior particular cu precizarea domeniului de studiu urmat, care trebuie să fie acreditat sau autorizat, pentru studenţii care se înscriu la concurs la un acelaşi domeniu. În acest caz se va prezenta diploma de bacalaureat sau diploma echivalentă acesteia în copie legalizată (originalul rămânând la prima facultate); - adeverinţă din care să rezulte calitatea de absolvent fără diplomă de licenţă sau diplomă de absolvire al unei instituţii de învăţământ superior de stat sau particular, precizându-se regimul în care au fost efectuate studiile (cu sau fără taxă), pentru absolvenţii care doresc să urmeze un alt domeniu de studiu; Pentru înscrierea la concurs, candidaţii vor depune personal dosarul la secretariatul facultăţii. Când? Preînscrieri (2 aprilie – 20 iulie 2019) În această etapă, candidații se preînscriu online – își înregistrează datele personale și opțiunile privind înscrierea la concursul de admitere. Astfel, înscrierea candidaților la secretariatele facultăților va dura mai puțin, pentru că datele înregistrate vor fi doar verificate pe baza actelor în original. Înscrieri (15 – 20 iulie 2019) În această etapă candidații se prezintă personal cu actele necesare la secretariatele facultăților la care doresc să se înscrie, între orele 0900-1600.",
            "Admitere licență - informații Regulamentul privind organizarea și desfășurarea concursului de admitere în ciclul de studii universitare de licență anul universitar 2025-2026 poate fi consultat prin accesarea https://admitere.pub.ro/. Admitere anticipată CalendarBuget: 320 locuri Numărul de locuri disponibile în Sesiunea I pentru candidații care participă la admiterea anticipată prin concurs este limitat. Candidații eligibili vor fi declarați admiși anticipat (prin concurs), în limita locurilor menționate anterior și li se va garanta locul dacă promovează examenul de Bacalaureat și parcurg cu succes Faza III - Validare, confirmare, înscriere în anul I și înmatriculare. **DOMENIUL: Inginerie Energetică ** PROGRAME DE STUDIU: - Energetică şi Ingineria Fluidelor - Energetică şi Tehnologii Informatice - Energetică şi Tehnologii de Mediu - Energetică şi Tehnologii Nucleare - Ingineria Sistemelor Electroenergetice - Managementul Energiei - Termoenergetică (*) Studenţii vor fi repartizaţi pe specializările domeniului Inginerie Energetică la sfârşitul anului II de studii. - Faza 1 - Înscriere online la sesiunea curentă 15.12.2024 - 02.06.2025În Sesiunea I – Admitere anticipată un candidat se poate înscrie la o singură facultate din UNSTPB (facultatea de bază) și va plăti on-line o singură taxă de înscriere*. Înscrierea se face pe platforma https://admitere.pub.ro/. Pachetul de documente necesar înscrierii candidaților: - Certificatul de naștere al candidatului (copie scanată/fotografie, format *.jpg sau *.pdf) încărcată on-line în platforma https://admitere.pub.ro. - Act de identitate candidat (Carte de identitate sau Pașaport) aflat în perioada de valabilitate la data înscrierii – copie scanată/fotografie, format *.jpg sau *.pdf, încărcată on-line în platforma https://admitere.pub.ro - 1 fotografie (tip pașaport/CI, color, minim 2MP, format *.jpg) încărcată on-line în platforma https://admitere.pub.ro."
        ],
        "retrieved_ids": [
            "85ab8a2001db129d9b28c1a868567dde770e21f5c8ba133a94ef4814a7badfc9-13",
            "7261d53c1bc03b86e5609b82811972b54096ba162fef6abf2a9fc84018d179b4-10",
            "57fffc9ae7f67be9c637b16ae3a994af2cbec240e5ea61a02f4d25fea85f1d10-1"
        ],
        "retrieved_scores": [
            0.8166776,
            0.82856,
            0.8016096
        ],
        "user_input": "Ma pot inscrie la examenul de admitere la licenta la mai multe facultati?"
    },
    {
        "id": "3b8ff476d217d7c8bb55b8a884b878403bbc34996170681ddf736ee60396435c",
        "response": "Nu am suficiente informații pentru a răspunde la întrebare.",
        "retrieved_contexts": [
            "În ceea ce privește probele de concurs, în Sesiunea I, două dintre acestea (P1 și respectiv P2) se bazează, după caz, fie pe mediile obținute de candidat, în timpul liceului, la disciplinele selectate (vezi Anexa II-1.1) dacă acesta s-a înscris la o facultate la care admiterea anticipată este prin concurs pe baza rezultatelor la activitățile școlare (dosar) (c-rs), fie pe baza notelor obținute la examenul scris din data de 05 aprilie 2025 la disciplinele selectate (vezi Anexa II-1.2) dacă acesta s-a înscris la o facultate la care admiterea anticipată este prin concurs cu probe scrise (c-s) sau, după caz, la probele vocaționale din data de 10 mai 2025, la disciplinele selectate (vezi Anexa II-1.3), dacă acesta s-a înscris la o facultate la care admiterea anticipată este prin concurs cu probe vocaționale (c-v). În cazul candidaților care s-au înscris la o facultate cu concurs mixt (c-m) proba P1 se bazează pe mediile obținute de candidat în timpul liceului iar P2, pe baza notei obținute la proba scrisă sau vocațională susținută în data de 10 mai 2025, la disciplina selectată (vezi Anexa II-1.4). În Sesiunea I, Proba P3 se bazează pe mediile generale obținute de candidat în clasele a IX-a, a X-a și a XI- a, precum și pe o serie de activități suplimentare pe care acesta le-a desfășurat în anii de liceu (vezi Anexa III). Pag. 26 Universitatea Națională de Știință și Tehnologie POLITEHNICA București REGULAMENTUL Concursului de Admitere în Ciclul de Studii Universitare de Licență 2025 l IV.2. Despre Faza II – Admitere preliminară IV.2.1 Desfășurarea probelor scrise ***2F Ses. I-4.12. La intrarea în sala de concurs candidații prezintă comisiei de supraveghere legitimația de concurs și cartea de identitate, pentru confruntarea cu datele înscrise în tabelul nominal al sălii respective.",
            "Evaluarea performanțelor acestor candidați și ierarhizarea lor în vederea admiterii anticipate se face pe baza rezultatelor obținute înaintea susținerii examenului de Bacalaureat. SC-3.3. Evaluarea performanțelor candidaților înscriși la această sesiune și ierarhizarea lor în vederea admiterii prin concurs, se face pe baza rezultatelor obținute pentru probele P1, P2 și P3. Probele P1 și P2 cumulează 80% din punctajul total iar proba P3 contribuie cu 20% din punctajul total. SC-3.4. În funcție de modul în care se susțin probele P1 și P2, în Sesiunea I există facultăți și domenii pentru care admiterea prin concurs are loc: • Printr-un concurs pe baza rezultatelor la activitățile școlare (dosar) („c-rs” – P1 și P2 - medii din clasele a IX-a, a X-a și a XI-a la disciplinele selectate) (vezi Anexa II-1.1). În această categorie intră: Centrul Universitar București cu facultățile: Inginerie Electrică – toate domeniile ▪ Energetică – toate domeniile ***1 Opțional, la latitudinea fiecărui candidat care la sfârșitul Fazei II din Sesiunea I, a fost declarat pre-admis Pag. 14 Universitatea Națională de Știință și Tehnologie POLITEHNICA București REGULAMENTUL Concursului de Admitere în Ciclul de Studii Universitare de Licență 2025 ▪ Inginerie Mecanică și Mecatronică – toate domeniile Inginerie Industrială și Robotică – toate domeniile ▪ Ingineria Sistemelor Biotehnice – toate domeniile ▪ Transporturi – toate domeniile Inginerie Aerospațială – toate domeniile ▪ Știința și Ingineria Materialelor – toate domeniile ▪ Inginerie Chimică și Biotehnologii – toate domeniile Inginerie în Limbi Străine – toate domeniile ▪ Științe Aplicate – toate domeniile Inginerie Medicală – toate domeniile ▪ Antreprenoriat, Ingineria și Managementul Afacerilor – toate domeniile o Centrul Universitar Pitești cu facultățile ▪ Științe, Educație fizică, și Informatică – toate domeniile cu excepția domeniilor Educație fizică și sport și respectiv Sănătate",
            "DESFĂȘURAREA CONCURSULUI DE ADMITERE Concursul de admitere la studii universitare de masterat constă din două probe: a) Proba 1 – o probă orală sau scrisă de evaluare a cunoștințelor fundamentale ale candidatului, desfășurată cu prezență fizică sau susținută on-line, cu subiecte dintr-o bibliografie anunțată sau de tip interviu, și corespunde mediei MA a notelor date de membrii comisiei de admitere a programului de masterat la care este înscris candidatul. Media MA se va obține ca medie aritmetică a notelor obținute la fiecare din cele 4 criterii de mai jos. Criteriul 1 – Susținerea unei scurte prelegeri, pe o temă aleasă de candidat, în domeniul masterului ales ca primă opțiune; Criteriul 2 – participarea la un stagiu Erasmus în anii de licență/participarea la un concurs internațional; Criteriul 3 – câștigarea unui premiu la concursurile studențești la nivel național/local; Criteriul 4 - Rezultate profesionale în studiile de licență absolvite în domeniul programului de master - se apreciază gradul de apropiere între programul de master ales ca primă opțiune și domeniul studiilor de licență absolvite. b) Proba 2 - o probă orală sau scrisă de evaluare a motivației candidatului pentru urmarea programului de studiu, desfășurată cu prezență fizică sau susținută on-line, care corespunde mediei MB a notelor date de membrii comisiei de admitere a programului de masterat la care este înscris candidatul. Media MB se obține cu ajutorul relației: MB = 𝑚𝑖𝑛 (𝑠𝑢𝑚𝑎(𝑛𝑖), 10), 𝑖 = 1,2,3, ... , 7 unde ni reprezintă numărul de puncte obținut la evaluarea bazată pe fiecare din cele șapte criterii utilizate de către Facultatea de Mecanică și Tehnologie. Criteriul 1 = SRS – Existența unei scrisori de recomandare pentru „domeniu”, din partea conducerii societății unde acesta este angajat sau a societății unde își desfășoară/şi-a desfășurat stagiul de practică în perioada licenței. Se va lua în considerare max. 1 recomandare punctată cu n = 1 punct."
        ],
        "retrieved_ids": [
            "85ab8a2001db129d9b28c1a868567dde770e21f5c8ba133a94ef4814a7badfc9-37",
            "85ab8a2001db129d9b28c1a868567dde770e21f5c8ba133a94ef4814a7badfc9-18",
            "a860fecfb47c89e5a6bc295c7fcaf02446c872f33f681a42931f51aacf7e106e-1"
        ],
        "retrieved_scores": [
            0.8604292,
            0.834566,
            0.857045
        ],
        "user_input": "Care sunt disciplinele de concurs de la examenul de admitere la licenta?"
    },
    {
        "id": "156ea4d270db4a8d5256e8118d7929e344e8f0c43c0631cf0ecc2f0a02fea03d",
        "response": "Cuantumul taxei de înscriere la examenul de admitere la Universitatea Națională de Știință și Tehnologie POLITEHNICA București este de 125 lei. Aceasta se poate achita fie direct în platforma on-line https://admitere.pub.ro/ cu card bancar, fie prin transfer bancar. Detalii suplimentare privind plata pot fi găsite în documentele oficiale ale universității.\n\nSurse:\n- Brosura de admitere, URL: https://chimie.upb.ro/administrare/content/doc/admitere/brosura/doc.pdf, pagina: 4\n- Regulament admitere licență 2025, URL: https://upb.ro/wp-content/uploads/2024/12/Regulament_admitere_licenta_2025.pdf, pagina: 96\n- URL: https://www.sim.upb.ro/index.php/admitere-licenta/",
        "retrieved_contexts": [
            "1..11 Anx VII - 5 Universitatea Națională de Știință și Tehnologie POLITEHNICA București Anexa VII Componența dosarului de concurs la înscriere în Sesiunea II Anexa VII - 3. Taxa de înscriere. Cuantum/Plată/Scutire de plată Anx. VII-11. Pentru Sesiunile II și III taxa de înscriere este 125 lei. Candidații care au participat la Sesiunea I și care la sfârșitul acesteia au fost declarați candidați cu barem îndeplinit beneficiază, pentru Sesiunile II și III, de reducerea taxei de înscriere de la 125 lei la 50 lei. Ea se poate achita având menționate la explicațiile plății: numele și prenumele complet al candidatului, precum și Facultatea de bază, la care acesta se înscrie pentru concursul de admitere, astfel: • direct în platforma on-line https://admitere.pub.ro/, cu card bancar; • prin transfer bancar (detalii privind acest mod de plată urmează a fi oferite după data de 15 decembrie 2024) Anx. VII-12. Documentele solicitate pentru scutirea plății taxei de înscriere sunt, după caz: - adeverință de angajat în sistemul de învățământ a unuia dintre părinți eliberată de unitatea de învățământ la care acesta este angajat; - adeverințe de la centrele de plasament sau casele de copii, în cazul candidaților care provin de la un centru de plasament sau de la o casă de copii; - certificatul de deces al unui părinte, în cazul candidaților orfani de un părinte; - certificatele de deces ale părinților, în cazul candidaților orfani de ambii părinți; - dovada că este copil al eroilor martiri sau al răniților din timpul Revoluției din decembrie 1989; - dovada că este copil al unui salariat din UNSTPB; - cerere",
            "| TAXA DE ÎNSCRIERE Taxa de înscriere este 125 lei și se poate achita având menționate la explicațiile plății: numele și prenumele complet al candidatului, precum și Facultatea de bază la care acesta se înscrie pentru concursul de admitere (Facultatea de Știința și Ingineria Materialelor), astfel: - direct în platforma on-line https://admitere.pub.ro/, cu card bancar; - prin transfer bancar (detalii privind acest mod de plată urmează a fi oferite după data de 15 decembrie 2024) Documentele solicitate pentru scutirea plății taxei de înscriere sunt, după caz: – adeverință de angajat în sistemul de învățământ a unuia dintre părinți, eliberată de unitatea de învățământ la care acesta este angajat; – adeverințe de la centrele de plasament sau casele de copii, în cazul candidaților care provin de la un centru de plasament sau de la o casă de copii; – certificatul de deces al unui părinte, în cazul candidaților orfani de un părinte; – certificatele de deces ale părinților, în cazul candidaților orfani de ambii părinți; – dovada că este copil al eroilor martiri sau al răniților din timpul Revoluției din decembrie 1989; – dovada că este copil al unui salariat din Universitatea Națională de Știință și Tehnologie POLITEHNICA București; – cerere către Decanul facultății la care candidatul se înscrie la concurs (facultatea de bază), pentru scutirea de plată a taxei de înscriere însoțită de acte doveditoare care să ateste o situație materială precară, în special pentru candidații proveniți din mediul rural (cupoane de pensii din ultima lună ale părinților; adeverințe care să ateste statutul de șomer al părinților; adeverințe de venit eliberate de primăria comunei în care locuiesc părinții etc.). Companii partenere – ANGAJATORI În loc de concluzie… ..5 PAȘI SIMPLI PENTRU A DEVENI STUDENT LA FACULTATEA DE ȘTIINȚA ȘI INGINERIA MATERIALELOR PASUL 1 În perioada 15 decembrie 2024 – 02 iunie 2025 te înscrii on-line pe platforma https://admitere.pub.ro.",
            "• Taxa de înscriere este 125 lei și se poate achita având menționate la explicațiile plății: numele și prenumele complet al candidatului și facultatea la care acesta se înscrie pentru concursul de admitere (Facultatea de Inginerie Chimică și Biotehnologii), fie direct în platforma on-line https://admitere.pub.ro/, cu card bancar, fie prin transfer bancar (realizat într-o aplicate de e-banking sau la ghișeul unei bănci), într-unul dintre următoarele conturi: Universitatea Națională de Știință și Tehnologie POLITEHNICA București IBAN RO42RNCB 0723 0005 0625 0270, CUI 48467613, deschis la Banca Comercială Română (BCR) sau Universitatea Națională de Știință și Tehnologie POLITEHNICA București IBAN RO97BRDE 410S V980 6875 4100, CUI 48467613, deschis la Banca Română de Dezvoltare (BRD). SESIUNEA I. ADMITERE ANTICIPATĂ FAZA 1. Înscrieri 15.12.2024-2.06.2025 CONTINUT DOSAR DE ÎNSCRIERE • Dosarul on-line va conține documente în format electronic, scanate/fotografiate, lizibile, în format *.jpg sau *.pdf, ale documentelor originale • Certificatul de naștere al candidatului • Act de identitate candidat (Carte de identitate sau Pașaport) aflat în perioada de valabilitate la data înscrierii • 1 fotografie (tip pașaport/CI, color, minim 2MP, format *.jpg) • Situație școlară, adeverință, foaie matricolă sau alt document/documente emis/emise de liceul de la care provine candidatul, în care sunt specificate mediile obținute de candidat în timpul liceului, pentru a se calcula mediile probelor P1, P2 și P3. • Documente care să ateste rezultatele obținute de candidat la o serie de activități suplimentare pe care acesta le-a desfășurat în anii de liceu. • Dovada achitării taxei de înscriere la concurs sau dovadă prin care să reiasă faptul că poate fi scutit de această taxă. SESIUNEA I. ADMITERE ANTICIPATĂ FAZA 1."
        ],
        "retrieved_ids": [
            "85ab8a2001db129d9b28c1a868567dde770e21f5c8ba133a94ef4814a7badfc9-213",
            "96e70f4bda047167435c1c790d1eed7085397707930e9d47fee17c191c260855-6",
            "81eecb583745caf19cfcc51fd6934ec333208f8b5736456e051aa42e11c6104e-2"
        ],
        "retrieved_scores": [
            0.82548296,
            0.833289,
            0.82997394
        ],
        "user_input": "Care este cuantumul taxei de inscriere la examenul de admitere la licenta la Politehnica?"
    },
    {
        "id": "87aba796cad31fb736033c93a5b1350e53beabc9c6277adac1cce696ec8d7e26",
        "response": "Cuantumul taxei de înscriere la examenul de admitere la masterat la Politehnica București este de 100 RON, conform informațiilor disponibile pentru sesiunea iulie 2025 și sesiunea septembrie 2025.\n\nSurse:\n- ADMITERE_MASTERAT_FIIR-2025-Informatii_generale, URL: https://www.fiir.upb.ro/Upload/Master/Admitere/2025/admitere_anticipata/ADMITERE_MASTERAT_FIIR-2025-Informatii_generale.pdf, pagina: 2\n- ADMITERE_MASTERAT_FIIR-2025-Informatii_generale, URL: https://www.fiir.upb.ro/Upload/Master/Admitere/2025/admitere_anticipata/ADMITERE_MASTERAT_FIIR-2025-Informatii_generale.pdf, pagina: 3",
        "retrieved_contexts": [
            "Valoarea taxei de înscriere la concursul de admitere la doctorat este de 200 RON, cu excepția candidaților care au absolvit un program de masterat în POLITEHNICA București pentru care taxa de înscriere este de 100 RON. Pasul 3: Evaluarea dosarului și a candidatului SD-AC asigură permanent transparenţa procedurilor de selecţie şi admitere la doctorat, a criteriilor de evaluare şi a standardelor impuse candidaţilor, egalitatea de șanse și nediscriminarea de orice tip. Conducătorul de doctorat evaluează individual dosarul de concurs al candidatului, validând sau invalidând aplicația acestuia. Pentru avizului pozitiv al conducătorului de doctorat se poate organiza un interviu online. În cadrul interviului, candidatul este așteptat să prezinte pe scurt parcursul său academic și profesional și, după caz, rezultatele de cercetare cele mai relevante. De asemenea, candidatul va expune tematica și preocupările de cercetare ştiinţifică vizate în cadrul tezei de doctorat, cu accent pe contribuțiile și soluțiile noi ce vor fi investigate. În urma evaluării, candidatul primește calificativul Admis sau Respins din partea coordonatorului de doctorat. În cazul în care este Admis, candidatul va participa la concursul de admitere la nivelul Școlii Doctorale, în vederea alocării un loc la programul doctoral din cadrul SD-AC (buget sau taxă), inclusiv a burselor doctorale acordate de către minister. Pasul 4: Alocarea locurilor (admiterea finală) și a burselor de doctorat Conform calendarului, comisia de admitere realizează evaluarea candidaților declarați Admiși de către coordonatorul de doctorat în vederea alocării locurilor la programul doctoral din cadrul SD-AC (buget sau taxă) și acordării burselor de doctorat. Candidaţii vor fi apreciaţi în raport cu nivelul de pregătire şi informare în domeniu, cu capacitatea de a evidenția orientările majore ale cercetării, cu capacitatea de a formula soluţii şi căi de rezolvare (teoretice şi experimentale) pentru tema de cercetare vizată, cât și cu privire la capacitatea de a urma programul doctoral. Criteriile cantitative de evaluare sunt prezentate în Metodologia de admitere, articolul 5 (Anexa 3) [link].",
            "III. SESIUNEA SEPTEMBRIE 2025 Pentru înscrierea la concursul de admitere în învățământul universitar de masterat, candidații depun online, pe site-ul https://admitere.pub.ro sau fizic, la secretariatul facultății, dosarul de înscriere. Cuantumul taxei de înscriere este de 100 RON.",
            "II. SESIUNEA IULIE 2025 Pentru înscrierea la concursul de admitere în învățământul universitar de masterat, candidații depun online, pe site-ul https://admitere.pub.ro sau fizic, la secretariatul facultății, dosarul de înscriere. Cuantumul taxei de înscriere este de 100 RON."
        ],
        "retrieved_ids": [
            "0a7047bd9ee00f3d76a3f6e330d97e214cbc6a81ed25ef001a0d2834d408455f-3",
            "6b808561f11405e18487fc62e100ff4fa8a350384fb5f9ec6723131d690d862f-6",
            "6b808561f11405e18487fc62e100ff4fa8a350384fb5f9ec6723131d690d862f-4"
        ],
        "retrieved_scores": [
            0.85412186,
            0.8241198,
            0.81622404
        ],
        "user_input": "Care este cuantumul taxei de inscriere la examenul de admitere la master la Politehnica?"
    },
    {
        "id": "014a0168e80b28b954848f59f25c34d96d68b84a189c3e7d1db6d6ab2bfaddef",
        "response": "Cuantumul taxei de înscriere la examenul de admitere la doctorat la ACS este de 200 RON. Totuși, pentru candidații care au absolvit un program de masterat în POLITEHNICA București, taxa de înscriere este redusă la 100 RON.\n\nSurse:\n- URL: https://acs.pub.ro/admitere/doctorat/",
        "retrieved_contexts": [
            "Valoarea taxei de înscriere la concursul de admitere la doctorat este de 200 RON, cu excepția candidaților care au absolvit un program de masterat în POLITEHNICA București pentru care taxa de înscriere este de 100 RON. Pasul 3: Evaluarea dosarului și a candidatului SD-AC asigură permanent transparenţa procedurilor de selecţie şi admitere la doctorat, a criteriilor de evaluare şi a standardelor impuse candidaţilor, egalitatea de șanse și nediscriminarea de orice tip. Conducătorul de doctorat evaluează individual dosarul de concurs al candidatului, validând sau invalidând aplicația acestuia. Pentru avizului pozitiv al conducătorului de doctorat se poate organiza un interviu online. În cadrul interviului, candidatul este așteptat să prezinte pe scurt parcursul său academic și profesional și, după caz, rezultatele de cercetare cele mai relevante. De asemenea, candidatul va expune tematica și preocupările de cercetare ştiinţifică vizate în cadrul tezei de doctorat, cu accent pe contribuțiile și soluțiile noi ce vor fi investigate. În urma evaluării, candidatul primește calificativul Admis sau Respins din partea coordonatorului de doctorat. În cazul în care este Admis, candidatul va participa la concursul de admitere la nivelul Școlii Doctorale, în vederea alocării un loc la programul doctoral din cadrul SD-AC (buget sau taxă), inclusiv a burselor doctorale acordate de către minister. Pasul 4: Alocarea locurilor (admiterea finală) și a burselor de doctorat Conform calendarului, comisia de admitere realizează evaluarea candidaților declarați Admiși de către coordonatorul de doctorat în vederea alocării locurilor la programul doctoral din cadrul SD-AC (buget sau taxă) și acordării burselor de doctorat. Candidaţii vor fi apreciaţi în raport cu nivelul de pregătire şi informare în domeniu, cu capacitatea de a evidenția orientările majore ale cercetării, cu capacitatea de a formula soluţii şi căi de rezolvare (teoretice şi experimentale) pentru tema de cercetare vizată, cât și cu privire la capacitatea de a urma programul doctoral. Criteriile cantitative de evaluare sunt prezentate în Metodologia de admitere, articolul 5 (Anexa 3) [link].",
            "TAXA de înscriere Cuantumul taxei de înscriere este de 100 RON pentru înscrierea la sesiunile din iulie și septembrie și de 50 RON pentru înscrierea la sesiunea de admitere anticipată. Taxa de înscriere pentru înscrierea la sesiunea de admitere anticipată este 50 lei și se poate achita având menționate la explicațiile plății: - numele și prenumele complet al candidatului, - Facultatea de bază la care acesta se înscrie pentru concursul de admitere, direct în platforma on-line https://admitere.pub.ro/, cu card bancar.",
            "III. SESIUNEA SEPTEMBRIE 2025 Pentru înscrierea la concursul de admitere în învățământul universitar de masterat, candidații depun online, pe site-ul https://admitere.pub.ro sau fizic, la secretariatul facultății, dosarul de înscriere. Cuantumul taxei de înscriere este de 100 RON."
        ],
        "retrieved_ids": [
            "0a7047bd9ee00f3d76a3f6e330d97e214cbc6a81ed25ef001a0d2834d408455f-3",
            "c642c14d935f4cf36dcf3277811b920052336016da4e5f53e7161b29d9d179a3-1",
            "6b808561f11405e18487fc62e100ff4fa8a350384fb5f9ec6723131d690d862f-6"
        ],
        "retrieved_scores": [
            0.8767729,
            0.7939571,
            0.8231462
        ],
        "user_input": "Care este cuantumul taxei de inscriere la examenul de admitere la doctorat la ACS?"
    },
    {
        "id": "8ee1d5c3b7452e14ea28d7beb1b8ced4c222f24564f220e839394625ba1413b6",
        "response": "Rezultatele preliminare la admiterea la licență la ACS vor fi afișate pe data de **15 iulie**. Rezultatele finale ale concursului vor fi disponibile pe **16 iulie**.\n\nSurse:\n- URL: https://acs.pub.ro/admitere/licenta/",
        "retrieved_contexts": [
            "ACS optimizează orarele de master – fizic/online – în funcție de necesități, ținând cont de reglementările naționale și deciziile Senatului UPB. Admiteri anterioare Informativ, rezultatele admiterii din anii anteriori sunt disponibile aici: 2022, 2023, 2024. Programe de studii ACS oferă 25 programe de studii universitare de masterat acreditate ARACIS în domeniile: - CTI (Calculatoare și Tehnologia Informației) – 13 programe - IS (Ingineria Sistemelor) – 11 programe - IM (Inginerie și Management) – 1 program Broșura master (în curs de actualizare cu noile programe) oferă informații sintetice despre masterat și despre fiecare program. În continuarea acestei pagini sunt prezentate programele și descrierile cursurilor. Versiunea preliminară a planurilor de învățământ este disponibilă AICI. Până la începerea anului școlar pot interveni modificări minore ale planurilor de învâțământ. Calculatoare și Tehnologia Informației | Nr. crt. | Nume program master | ||| | 1. | Arhitecturi Avansate de Calculatoare | ||| | 2. | Administrarea Bazelor de Date | ||| | Catedra organizatoare: Calculatoare Responsabil: Prof.Dr.Ing. Florin Radulescu Tip: Aprofundare / Cercetare avansata Informaţii: Scurtă descriere, Plan învăţământ, Cursuri Pentru a putea urma acest program de masterat, sunt necesare studii de licență într-unul din următoarele domenii: Domeniul fundamental Stiinte ingineresti , domeniile: Calculatoare si Tehnologia Informatie (specializarile Calculatoare , Tehnologia Informatiei , Ingineria Informatiei), Inginerie electronica si telecomunicatii, Ingineria sistemelor (specializarile Automatica si informatica aplicata, Ingineria sistemelor multimedia) , Stiinte Ingineresti Aplicate (specializarile Matematica si informatica aplicata in inginerie)",
            "o Rezultatele finale privind admiterea preliminară din Sesiunea I vor fi publicate la data de: ▪ 12 aprilie, ora 12:00 pentru facultățile și domeniile la care candidații au susținut probe scrise (c-s) (în Centrul Universitar București); ▪ 14 mai, ora 12:00 pentru facultățile și domeniile la care candidații au susținut concurs cu probe vocaționale (c-v) sau concurs mixt (c-m) (în Centrul Universitar Pitești); Pag. 17 Universitatea Națională de Știință și Tehnologie POLITEHNICA București REGULAMENTUL Concursului de Admitere în Ciclul de Studii Universitare de Licență 2025 ▪ 16 iunie, ora 12:00 pentru restul facultăților și domeniilor la care candidații au susținut concurs pe baza rezultatelor la activitățile școlare (dosar) (c-rs) (atât în Centrul Universitar București cât și în Centrul Universitar Pitești) . • Faza III – Admitere Etapa II – Validare, confirmare, participare la glisare (opțional) înscriere în anul I și înmatriculare începe la data de 02 iulie, ora 08:00 și se încheie după trei zile (04 iulie, ora 16:00). o Validarea implică, pentru fiecare candidat, completarea dosarului de concurs cu documentele originale solicitate (vezi Anexa V), verificarea promovării examenului de Bacalaureat și verificarea conformității datelor introduse în Faza I cu cele din documentele originale furnizate. Pentru a fi admis și înmatriculat candidatul trebuie să fi promovat examenul de Bacalaureat, să fi fost declarat pre-admis în Faza II, să aibă dosarul de admitere complet (cu toate documentele solicitate), iar datele furnizate la înscriere în Faza I să fie conforme cu documentele originale aduse în Faza III. o Validarea, confirmarea locului obținut, solicitarea pentru participare la glisare (opțional), înscrierea în anul I și ulterior înmatricularea se face la sediul facultăților la care aceștia au fost declarați pre-admiși, zilnic, între orele 08:00-16:00, începând cu ziua de 02 iulie, ora 8:00 și terminând cu ziua de 04 iulie, ora 16:00).",
            "- Examen scris (ambele probe): 14 Iulie începând cu ora 09:00 - Afișare rezultate preliminare: 15 iulie - Afișare rezultate finale concurs: 16 iulie - Validare, confirmare, înscriere în anul I și înmatriculare: 16 Iulie ora 9.00 – 17 Iulie ora 16.00, conform programării, fizic, la sediul facultății - Daca se va organiza Sesiunea 2+ (in funcție de situația locurilor vacante): Validare, confirmare, înscriere în anul I și înmatriculare candidati Sesiunea 2+: 18 Iulie ora 9.00 – 19 Iulie ora 16.00, fizic, la sediul facultății - Rezultate finale admiși și înscriși în anul I: 19 Iulie Înscrierea se face prin portalul https://admitere.pub.ro Detalii despre condițiile de admitere si întreg Calendarul Sesiunii 2 – Admitere sunt disponibile aici. Date de contact: telefon 021 402 91 79"
        ],
        "retrieved_ids": [
            "6ccd6e8cf90ac5e0f62d36ab0c6545bdb0df7714986675e4854d0f00e6cfc934-2",
            "85ab8a2001db129d9b28c1a868567dde770e21f5c8ba133a94ef4814a7badfc9-23",
            "491f908948d53e5b16fb1e16d5db1345049605301c9e3d3f7116532b523b9d98-7"
        ],
        "retrieved_scores": [
            0.8367428,
            0.7903651,
            0.78329813
        ],
        "user_input": "Cand se afiseaza rezultatele la admiterea la licenta la ACS?"
    },
    {
        "id": "c28f4ccf40feaaa24575d6393fa98c91f26bf68414084e053c1019d06ed3351c",
        "response": "Rezultatele preliminare la admiterea la licență la FAIMA vor fi afișate pe data de 15 iulie, iar rezultatele finale vor fi disponibile pe 16 iulie. Aceste date sunt conform calendarului de admitere publicat pe site-ul oficial al facultății.\n\nSurse:\n- URL: https://acs.pub.ro/admitere/licenta/",
        "retrieved_contexts": [
            "- Examen scris (ambele probe): 14 Iulie începând cu ora 09:00 - Afișare rezultate preliminare: 15 iulie - Afișare rezultate finale concurs: 16 iulie - Validare, confirmare, înscriere în anul I și înmatriculare: 16 Iulie ora 9.00 – 17 Iulie ora 16.00, conform programării, fizic, la sediul facultății - Daca se va organiza Sesiunea 2+ (in funcție de situația locurilor vacante): Validare, confirmare, înscriere în anul I și înmatriculare candidati Sesiunea 2+: 18 Iulie ora 9.00 – 19 Iulie ora 16.00, fizic, la sediul facultății - Rezultate finale admiși și înscriși în anul I: 19 Iulie Înscrierea se face prin portalul https://admitere.pub.ro Detalii despre condițiile de admitere si întreg Calendarul Sesiunii 2 – Admitere sunt disponibile aici. Date de contact: telefon 021 402 91 79",
            "o Rezultatele finale privind admiterea preliminară din Sesiunea I vor fi publicate la data de: ▪ 12 aprilie, ora 12:00 pentru facultățile și domeniile la care candidații au susținut probe scrise (c-s) (în Centrul Universitar București); ▪ 14 mai, ora 12:00 pentru facultățile și domeniile la care candidații au susținut concurs cu probe vocaționale (c-v) sau concurs mixt (c-m) (în Centrul Universitar Pitești); Pag. 17 Universitatea Națională de Știință și Tehnologie POLITEHNICA București REGULAMENTUL Concursului de Admitere în Ciclul de Studii Universitare de Licență 2025 ▪ 16 iunie, ora 12:00 pentru restul facultăților și domeniilor la care candidații au susținut concurs pe baza rezultatelor la activitățile școlare (dosar) (c-rs) (atât în Centrul Universitar București cât și în Centrul Universitar Pitești) . • Faza III – Admitere Etapa II – Validare, confirmare, participare la glisare (opțional) înscriere în anul I și înmatriculare începe la data de 02 iulie, ora 08:00 și se încheie după trei zile (04 iulie, ora 16:00). o Validarea implică, pentru fiecare candidat, completarea dosarului de concurs cu documentele originale solicitate (vezi Anexa V), verificarea promovării examenului de Bacalaureat și verificarea conformității datelor introduse în Faza I cu cele din documentele originale furnizate. Pentru a fi admis și înmatriculat candidatul trebuie să fi promovat examenul de Bacalaureat, să fi fost declarat pre-admis în Faza II, să aibă dosarul de admitere complet (cu toate documentele solicitate), iar datele furnizate la înscriere în Faza I să fie conforme cu documentele originale aduse în Faza III. o Validarea, confirmarea locului obținut, solicitarea pentru participare la glisare (opțional), înscrierea în anul I și ulterior înmatricularea se face la sediul facultăților la care aceștia au fost declarați pre-admiși, zilnic, între orele 08:00-16:00, începând cu ziua de 02 iulie, ora 8:00 și terminând cu ziua de 04 iulie, ora 16:00).",
            "CU ACTIVITATE REMARCABILĂ LA OLIMPIADE ȘI CONCURSURI PENTRU ABSOLVENȚI Sesiunea 1 Admitere anticipată prin concurs de dosare Desfășurarea sesiunii Înscrierea candidaților: • 15 decembrie 2024 – 2 iunie 2025, ora 16:00 • Afișarea rezultatelor preliminare • 11 iunie 2025, ora 12:00 • Depunerea contestațiilor (online) • 11-12 iunie 2025, ora 12:00 Afișarea rezultatelor finale • 16 iunie 2025, ora 12:00 Validarea, confirmarea si înmatricularea studenților • 2 iulie, ora 8:00 - 4 iulie, ora 16:00 • Are loc la Secretariatul Facultății De Științe Aplicate, CORP BN camera BN 105 • Afișarea liste cu candidații admiși și înmatriculați (Ses. 1) • 5 iulie 2025 ora 12.00 Sesiunea 1+: • Validare, înmatriculare 5 - 6 iulie 2025 ora 8:00 - 16.00 Sesiunea 1 -Admitere anticipată fără concurs Candidații eligibili: Absolvenții cu rezultate remarcabile la olimpiade și concursuri: • aceștia sunt admiși fără limită de locuri. Sesiunea 1 -Admitere anticipată fără concurs 1. Condiții de participare: Obținerea, în timpul liceului, de rezultate remarcabile la cel puțin unul din următoarele concursuri:"
        ],
        "retrieved_ids": [
            "491f908948d53e5b16fb1e16d5db1345049605301c9e3d3f7116532b523b9d98-7",
            "85ab8a2001db129d9b28c1a868567dde770e21f5c8ba133a94ef4814a7badfc9-23",
            "a192eeb16b38c512b52907612a334423de5ea7a64b05047d05038e52e01dcad9-1"
        ],
        "retrieved_scores": [
            0.796821,
            0.7871814,
            0.78654003
        ],
        "user_input": "Cand se afiseaza rezultatele la admiterea la licenta la FAIMA?"
    },
    {
        "id": "fbba491096f6bf6f760dd5cc3a7d726852bf0b4fa4d1eecc681f27e03eb4a2b8",
        "response": "# Facultățile din cadrul Universității Naționale de Știință și Tehnologie POLITEHNICA București\n\n1. **Facultatea de Științe Economice și Drept**\n2. **Facultatea de Antreprenoriat, Ingineria și Managementul Afacerilor**\n3. **Facultatea de Științe, Educație Fizică și Informatică**\n4. **Facultatea de Teologie, Litere, Istorie și Arte**\n5. **Facultatea de Transporturi**\n6. **Facultatea de Mecanică și Tehnologie**\n7. **Facultatea de Știința și Ingineria Materialelor**\n8. **Facultatea de Inginerie Medicală**\n9. **Facultatea de Ingineria Sistemelor Biotehnice**\n10. **Facultatea de Inginerie Chimică și Biotehnologii**\n11. **Facultatea de Energetică**\n\nAceste informații sunt extrase din documentul de regulament privind raportarea instituțională în vederea obținerii finanțării publice a universității.\n\nSurse:\n- Regulament privind raportarea instituțională în vederea obținerii finanțării publice a universității, URL: https://upb.ro/wp-content/uploads/2022/11/Regulament-privind-raportarea-institutionala-in-vederea-obtinerii-finantarii-publice-a-universitatii.pdf, pagina: 30",
        "retrieved_contexts": [
            "Admiterea în învățământul universitar se organizează pe facultăți și în cadrul lor, pe domenii de studii. Denumirea domeniilor și programelor de studii, numărul de locuri (bugetate sau cu taxă) care fac obiectul concursului de admitere pentru fiecare domeniu, Pag. 8 Universitatea Națională de Știință și Tehnologie POLITEHNICA București REGULAMENTUL Concursului de Admitere în Ciclul de Studii Universitare de Licență 2025 precum și disciplinele probelor de concurs se publică centralizat pe platforma on-line https://admitere.pub.ro și local, la fiecare facultate. Studenții admiși cu taxă în anul universitar 2025-2026 vor putea beneficia de granturi de școlarizare din bugetul propriu al POLITEHNICII București, în limita locurilor stabilite de universitate. Acordarea de granturi de școlarizare se va face din bugetul propriu al POLITEHNICII București, în conformitate cu prevederile art. 148 alin.(2) din Legea 199/2023. Statutul de student cu taxă, care beneficiază de finanțare prin grant de școlarizare din bugetul propriu al POLITEHNICII București, în baza mediilor generale obținute la concursul de admitere, se poate modifica la începutul anului universitar următor, pe locurile finanțate de la bugetul de stat care devin disponibile. PG-1.6. Pot participa la concursul de admitere absolvenții de liceu cu diplomă de bacalaureat sau cu diplomă echivalentă. PG-1.7. Pot participa și cetățeni români și cetățeni ai statelor membre ale Uniunii Europene, ai statelor aparținând Spațiului Economic European și ai Confederației Elvețiene precum și cetățenii britanici și membrii familiilor acestora, ca beneficiari ai Acordului privind retragerea Regatului Unit al Marii Britanii și Irlandei de Nord din Uniunea Europeană și din Comunitatea Europeană a Energiei Atomice 2019/C 384 I/01, cu diplome de bacalaureat obținute în statele menționate, recunoscute de instituțiile de învățământ superior, conform unei liste și metodologii aprobate prin ordin al ministrului. Aceștia din urmă pot participa în aceleași condiții prevăzute de lege pentru cetățenii români, inclusiv în ceea ce privește taxele de școlarizare.",
            "| 9 | Drept P | 21. Facultatea de Ştiințe Economice şi Drept | 21. Facultatea de Ştiințe Economice şi Drept.1 |\n|:--|:--|:--|:--|\n| 0 | . Economie | - | 15. Facultatea de Antreprenoriat, MIRRERIE - Ingineria şi Managementul Afacerilor |\n| l | | 18. Facultatea de Ştiințe, Educație Fizică și Informatică | |\n| 2 | - . Filologie | - | 23. Facultatea de Teologie, Litere, Istorie , & şi Arte |\n| 3 | , Finanțe ” | 21. Facultatea de Ştiințe Economice şi M Drept | 21. Facultatea de Ştiințe Economice şi , ” Drept |\n| 4 | , - Horticultură | 18. Facultatea de Ştiințe, Educație Fizică . - 7 , și Informatică | - |\n| 53 | . Informatică | 18. Facultatea de Ştiințe, Educație Fizică , g și Informatică | 18. Facultatea de Ştiințe, Educație Fizică - — ' ' şi Informatică |\n| 6 | Ingineria Autovehiculelor | 08. Facultatea de Transporturi | 08. Facultatea de Transporturi |\n| 6 | Ingineria Autovehiculelor | UNIN 19. Facultatea de Mecanică şi Tehnologie | UUR 19. Facultatea de Mecanică şi Tehnologie |\n| 17 | NIIE . Ingineria Materialelor | 10. Facultatea de Ştiința şi Ingineria - VIIR SI IE Materialelor | 10. Facultatea de Ştiința şi Ingineria Materialelor |\n| 17 | NIIE . Ingineria Materialelor | 10. Facultatea de Ştiința şi Ingineria - VIIR SI IE Materialelor | 14. Facultatea de Inginerie Medicală |\n| 18 | NII NEN Ingineria Mediului | 07. Facultatea de Ingineria Sistemelor , , Biotehnice | — . 02. Facultatea de Energetică |\n| 18 | NII NEN Ingineria Mediului | 10. Facultatea de Ştiința şi Ingineria Materialelor | 07. Facultatea de Ingineria Sistemelor Biotehnice |\n| 18 | NII NEN Ingineria Mediului | 11. Facultatea de Inginerie Chimică şi & ' Biotehnologii | — , 08. Facultatea de Transporturi |\n| 18 | NII NEN Ingineria Mediului | 18. Facultatea de Ştiințe, Educație Fizică și Informatică | 10. Facultatea de Ştiința şi Ingineria Materialelor |\n| 18 | NII NEN Ingineria Mediului | | 11. Facultatea De Inginerie Chimica Si Biotehnologii |\n| 18 | NII NEN Ingineria Mediului | 07. Facultatea de Ingineria Sistemelor Biotehnice | 07. Facultatea de Ingineria Sistemelor Biotehnice |",
            "(1) Admiterea la studiile universitare de masterat se organizează în cadrul facultăților care au programe de studiu aprobate de Senatul Universității Naționale de Știință și Tehnologie POLITEHNICA București și Ministerul Educației, acreditate de ARACIS și publicate în hotărâre de guvern; programele de studii sunt afișate pe site-ul universității și, pentru fiecare facultate în parte, pe site-ul facultății. (2) Admiterea la studiile universitare de masterat se face prin concurs, iar numărul de locuri este aprobat de: • Ministerul Educației, pentru cele finanțate de la bugetul de stat; • Senatul universității, pentru cele în regim cu taxă de studii. (3) Facultățile hotărăsc distribuirea locurilor acordate pentru cele trei sesiuni de admitere (în funcție de necesități specifice) și informează Consiliul de Administrație al Universității Naționale de Știință și Tehnologie POLITEHNICA București cu privire la această distribuire. (4) Formațiile de studii se stabilesc de către Senat. Pentru anul universitar 2025– 2026, formațiile de studiu la masterat trebuie să fie de minimum 20 masteranzi, respectând o medie de minimum 25 masteranzi pe facultate. Facultățile care vor alcătui formații de studiu pentru programele de masterat cu un număr mai mic de studenți decât cel specificat vor norma orele aferente activităților didactice la acele formații de studiu cu o reducere proporțională cu raportul dintre numărul de studenți din formații și numărul minim impus. Art. 6. (1) Un candidat declarat admis pentru un program de studii universitare de masterat poate beneficia de finanțare de la bugetul de stat o singură dată. (2) Un candidat admis în sesiunea de admitere anticipată Mai sau Iulie de admitere nu va putea candida pentru alt program în sesiunea septembrie decât daca renunța, în prealabil, la locul ocupat. Retragerea se face printr-o cerere scrisă către Decan, semnată, trimisă pe email sau depusă la secretariat. Art. 7. La înscriere, candidații vor declara, pe proprie răspundere, dacă au mai urmat alte programe de masterat cu finanțare de la bugetul de stat."
        ],
        "retrieved_ids": [
            "85ab8a2001db129d9b28c1a868567dde770e21f5c8ba133a94ef4814a7badfc9-9",
            "0939dd251ffa3b90ecb8af564934dc6ba1b92e780dfdf58548d6652a993628eb-52",
            "79426a1571b68492454210a4455253ad1c6ca02f95283000457c0e0eb426d81d-3"
        ],
        "retrieved_scores": [
            0.8190241,
            0.8476229,
            0.8543563
        ],
        "user_input": "Ce facultati sunt in cadrul Politehnicii?"
    },
    {
        "id": "0a43fb9041068319c5a0a3d0fe706687b42fa7bd14145033e7448fd319598d71",
        "response": "Facultatea de Automatică și Calculatoare (ACS) oferă un total de 25 de programe de studii universitare de masterat acreditate ARACIS. Acestea sunt împărțite în următoarele domenii: 13 programe în domeniul Calculatoare și Tehnologia Informației, 11 programe în domeniul Ingineria Sistemelor și 1 program în domeniul Inginerie și Management.\n\nSurse:\n- URL: https://acs.pub.ro/admitere/masterat/\n- URL: https://acs.pub.ro/educatie/masterat/",
        "retrieved_contexts": [
            "ACS optimizează orarele de master – fizic/online – în funcție de necesități, ținând cont de reglementările naționale și deciziile Senatului UPB. Admiteri anterioare Informativ, rezultatele admiterii din anii anteriori sunt disponibile aici: 2022, 2023, 2024. Programe de studii ACS oferă 25 programe de studii universitare de masterat acreditate ARACIS în domeniile: - CTI (Calculatoare și Tehnologia Informației) – 13 programe - IS (Ingineria Sistemelor) – 11 programe - IM (Inginerie și Management) – 1 program Broșura master (în curs de actualizare cu noile programe) oferă informații sintetice despre masterat și despre fiecare program. În continuarea acestei pagini sunt prezentate programele și descrierile cursurilor. Versiunea preliminară a planurilor de învățământ este disponibilă AICI. Până la începerea anului școlar pot interveni modificări minore ale planurilor de învâțământ. Calculatoare și Tehnologia Informației | Nr. crt. | Nume program master | ||| | 1. | Arhitecturi Avansate de Calculatoare | ||| | 2. | Administrarea Bazelor de Date | ||| | Catedra organizatoare: Calculatoare Responsabil: Prof.Dr.Ing. Florin Radulescu Tip: Aprofundare / Cercetare avansata Informaţii: Scurtă descriere, Plan învăţământ, Cursuri Pentru a putea urma acest program de masterat, sunt necesare studii de licență într-unul din următoarele domenii: Domeniul fundamental Stiinte ingineresti , domeniile: Calculatoare si Tehnologia Informatie (specializarile Calculatoare , Tehnologia Informatiei , Ingineria Informatiei), Inginerie electronica si telecomunicatii, Ingineria sistemelor (specializarile Automatica si informatica aplicata, Ingineria sistemelor multimedia) , Stiinte Ingineresti Aplicate (specializarile Matematica si informatica aplicata in inginerie)",
            "Masterat Detalii despre admiterea la masterat se găsesc aici >A fost activată, în platforma de opționale, posibilitatea de a aplica pentru disciplinele opționale și schimbări de discipline. Solicitările se pot introduce până MARȚI 08 oct 2024 ora 14. Mai multe instructiuni au fost postate pe canalul de Informare master de pe Teams. Programe de studii Facultatea de Automatică și Calculatoare oferă 24 programe de studii universitare de masterat acreditate de către ARACIS în domeniile: - Calculatoare și Tehnologia Informației – 12 programe - Ingineria Sistemelor – 11 programe - Inginerie și Management – 1 program BROŞURA MASTER oferă informații sintetice despre masterat și despre fiecare program, iar în continuarea acestei pagini sunt prezentate planurile de învăţământ şi descrierile cursurilor. *planurile de invatamant 2023-2025 sunt in curs de avizare de catre CF si Senat. Calculatoare și Tehnologia Informației | Nr. crt. | Nume program master | ||| | 1. | Arhitecturi Avansate de Calculatoare | ||| | 2. | Administrarea Bazelor de Date | ||| | Catedra organizatoare: Calculatoare Responsabil: Prof.Dr.Ing. Florin Radulescu Tip: Aprofundare / Cercetare avansata Informaţii: Scurtă descriere, Plan învăţământ, Cursuri Pentru a putea urma acest program de masterat, sunt necesare studii de licență într-unul din următoarele domenii: Domeniul fundamental Stiinte ingineresti , domeniile: Calculatoare si Tehnologia Informatie (specializarile Calculatoare , Tehnologia Informatiei , Ingineria Informatiei), Inginerie electronica si telecomunicatii, Ingineria sistemelor (specializarile Automatica si informatica aplicata, Ingineria sistemelor multimedia) , Stiinte Ingineresti Aplicate (specializarile Matematica si informatica aplicata in inginerie) Domeniul fundamental Stiinte Exacte , domeniile : Matematica (specializarea Matematica informatica) , Informatica (specializarile Informatica , informatica aplicata) Domeniul fundamental Stiinte Economice, domeniile: Economie, Administrarea Afacerilor, Economie si Afaceri Internationale, Management , Marketing | |||| | 3.",
            "Programe de master Pentru continuarea studiilor de licență și obținerea diplomei de master, Facultatea de Inginerie Aerospațială oferă 7 programe de studii de masterat în ingineria aerospațială și unul în ingineria industrială (GID), învățământ la zi, 2 ani, 120 puncte credit transferabile prin sistemul european ECTS: *Directorul departamentului (DD) / Responsabilul programului de studii (RPS) – daca este un cadru didactic distinct"
        ],
        "retrieved_ids": [
            "6ccd6e8cf90ac5e0f62d36ab0c6545bdb0df7714986675e4854d0f00e6cfc934-2",
            "b0cbeb3807d8d4381a6714716c6b975a969f6f161745575e700833bee09cd1c7-1",
            "be5ae40f334f68882d68d7d4400977cb93057a69e326335fee6a238e0cf042f4-1"
        ],
        "retrieved_scores": [
            0.89165616,
            0.80671096,
            0.80172145
        ],
        "user_input": "Cate programe de studii de masterat sunt la ACS?"
    },
    {
        "id": "77a2e1725e3daa08df670f4e3e7391d9106474f234027ca6390680e487ad0ca5",
        "response": "La Facultatea de Automatică și Calculatoare, pregătirea fundamentală și de specialitate a studenților se realizează în cadrul programelor de studii Calculatoare și Tehnologia Informației și Automatică și Informatică Aplicată. În primii doi ani de studiu, disciplinele sunt comune în proporție de peste 80% și includ cursuri de:\n- Matematică\n- Fizică\n- Metode numerice de calcul\n- Mecanică\n- Electronică\n- Teoria sistemelor\n\nDe asemenea, studenții își însușesc cunoștințe generale despre:\n- Știința sistemelor\n- Știința și ingineria calculatoarelor\n- Tehnici și limbaje de programare (C, C++, Java, limbaje de asamblare)\n- Cunoștințe de limbi străine.\n\nÎncepând cu anul 3, programele de studiu includ mai multe direcții ce grupează discipline de specialitate, unde studenții urmează cursuri obligatorii și opționale care oferă posibilitatea individualizării pregătirii.\n\nSurse:\n- URL: https://acs.pub.ro/educatie/licenta/",
        "retrieved_contexts": [
            "Licenţă Detalii despre admiterea la licenţă se găsesc aici Pregatirea fundamentală şi de specialitate a studenţilor din facultate se realizează in cadrul programelor de studii Calculatoare si Tehnologia Informatiei si Autoatica si Informatică Aplicată. În cadrul primilor doi ani de studiu, discipliele studiale la cele programe de studii sunt comune în proporţie de peste 80% şi urmăresc asigurarea unei pregătiri de bază, specifică învăţământului superior tehnic în profilul facultăţii. Se urmează cursuri de matematică, fizică, metode numerice de calcul, mecanică, electronică, teoria sistemelor. De asemenea, studenţii îşi însuşesc cunoştinţe generale despre ştiinţa sistemelor, ştiinţa şi ingineria calculatoarelor, tehnici şi limbaje de programare (C, C++, Java, limbaje de asamblare) şi cunoştinţe de limbi străine. Incepand cu anul 3, programele de studiu cuprind mai multe directii ce grupează discipline de specialitate, în cadrul cărora studenţii urmează cursuri obligatorii ce definesc profilul de bază al specializării cât şi cursuri opţionale care oferă posibilitatea individualizării pregătirii. Specializările oferite de facultatea de Automatică şi Calculatoare sunt: Automatică şi Ingineria Sistemelor, Automatică şi Informatică Aplicată, Arhitectura sistemelor de calcul, Sisteme incorporate, Sisteme de programe de bază, Sisteme de programe de aplicaţii, Tehnologia informaţiei. Domeniul: Calculatoare şi Tehnologia Informaţiei Programe de studii (specializări) Calculatoare și Tehnologia informaţiei Direcţii de studiu (anul IV): Arhitectura sistemelor de calcul, Sisteme incorporate, Sisteme de programe de bază, Sisteme de programe de aplicaţii, Tehnologia informaţiei * Admiterea se face pe Domeniu de studiu iar specializarea se alege în anul IV. Domeniul: Ingineria Sistemelor Program de studii (specializare): Automatică şi informatică aplicată Direcții de studiu (anul III, IV): Informatică aplicată, Sisteme de conducere * Admiterea se face pe Domeniu de studiu iar specializarea se alege în anul III și IV.",
            "Masterat Detalii despre admiterea la masterat se găsesc aici >A fost activată, în platforma de opționale, posibilitatea de a aplica pentru disciplinele opționale și schimbări de discipline. Solicitările se pot introduce până MARȚI 08 oct 2024 ora 14. Mai multe instructiuni au fost postate pe canalul de Informare master de pe Teams. Programe de studii Facultatea de Automatică și Calculatoare oferă 24 programe de studii universitare de masterat acreditate de către ARACIS în domeniile: - Calculatoare și Tehnologia Informației – 12 programe - Ingineria Sistemelor – 11 programe - Inginerie și Management – 1 program BROŞURA MASTER oferă informații sintetice despre masterat și despre fiecare program, iar în continuarea acestei pagini sunt prezentate planurile de învăţământ şi descrierile cursurilor. *planurile de invatamant 2023-2025 sunt in curs de avizare de catre CF si Senat. Calculatoare și Tehnologia Informației | Nr. crt. | Nume program master | ||| | 1. | Arhitecturi Avansate de Calculatoare | ||| | 2. | Administrarea Bazelor de Date | ||| | Catedra organizatoare: Calculatoare Responsabil: Prof.Dr.Ing. Florin Radulescu Tip: Aprofundare / Cercetare avansata Informaţii: Scurtă descriere, Plan învăţământ, Cursuri Pentru a putea urma acest program de masterat, sunt necesare studii de licență într-unul din următoarele domenii: Domeniul fundamental Stiinte ingineresti , domeniile: Calculatoare si Tehnologia Informatie (specializarile Calculatoare , Tehnologia Informatiei , Ingineria Informatiei), Inginerie electronica si telecomunicatii, Ingineria sistemelor (specializarile Automatica si informatica aplicata, Ingineria sistemelor multimedia) , Stiinte Ingineresti Aplicate (specializarile Matematica si informatica aplicata in inginerie) Domeniul fundamental Stiinte Exacte , domeniile : Matematica (specializarea Matematica informatica) , Informatica (specializarile Informatica , informatica aplicata) Domeniul fundamental Stiinte Economice, domeniile: Economie, Administrarea Afacerilor, Economie si Afaceri Internationale, Management , Marketing | |||| | 3.",
            "Licenţă Admitere Licență 2025 Facultatea de Automatică şi Calculatoare organizează concurs de admitere pentru anul universitar 2025-2026 pentru : - Domeniul Calculatoare și Tehnologia Informației - Specializarea: Calculatoare și Tehnologia Informației – buget (AC-CTI-B) - Specializarea: Calculatoare și Tehnologia Informației – taxă (AC-CTI-Tx) - Domeniul Ingineria Sistemelor - Specializarea: Automatica și Informatică Aplicată – buget (AC-IS-B) - Specializarea: Automatica și Informatică Aplicată – taxă (AC-IS-Tx) Facultatea de Automatică şi Calculatoare organizează două sesiuni de admitere : - Sesiunea de admitere anticipată – S1 (aprilie 2025) - Sesiunea de admitere – S2 (iulie 2025) Cifra de școlarizare pentru anul universitar 2025 – 2026 este: - Locuri subvenționate de la buget: - Domeniul Calculatoare și Tehnologia Informației – 330 - Domeniul Ingineria Sistemelor – 250 - Locuri cu taxă: - Domeniul Calculatoare și Tehnologia Informației (AC-CTI-Tx) – 155 - Domeniul Ingineria Sistemelor (AC-IS-Tx) – 70 Detalii despre regulamentul concursului de admitere, se găsesc în “REGULAMENT privind organizarea şi desfăşurarea Concursului de admitere în ciclul de studii universitare de licență la Universitatea Națională de Știință și Tehnologie POLITEHNICA Bucureşti pentru anul universitar 2025-2026“. Ocuparea locurilor se face prin concurs, în funcție de opțiunile individuale, pe domenii, în ordinea mediei finale de admitere. Studenții admiși în anul I 2025 – 2026 vor primi cazare în căminele studențești alocate Facultății de Automatică și Calculatoare. Sesiunea 1 – Admitere anticipată – Informații A – Fără concurs – olimpiade și concursuri Pot participa elevii și absolvenții cu rezultate remarcabile la olimpiade și concursuri. Pentru a fi eligibili, candidații trebuie să fi obținut premii, medalii sau mențiuni la cel puțin unul dintre concursurile din lista acceptată de Facultatea de Automatică şi Calculatoare (Anexa VI din regulamentul de admitere)."
        ],
        "retrieved_ids": [
            "699b8dd450c1d79a46377ef809f95fb7a405af6c53b96aba0945dd16837ac73c-1",
            "b0cbeb3807d8d4381a6714716c6b975a969f6f161745575e700833bee09cd1c7-1",
            "491f908948d53e5b16fb1e16d5db1345049605301c9e3d3f7116532b523b9d98-1"
        ],
        "retrieved_scores": [
            0.84859014,
            0.8219502,
            0.80258894
        ],
        "user_input": "Ce materii sunt la facultatea de Automatica si Calculatoare?"
    },
    {
        "id": "7c34f77662f49370f81fbfa82fe9c70c38ab09019ea3f8b957a208d5b949427f",
        "response": "Nu am suficiente informații pentru a răspunde la întrebare.",
        "retrieved_contexts": [
            "Durata totală cumulată a ciclului de studii universitare de licență și masterat trebuie să fie de cel puțin 300 de credite transferabile (ECTS). (15) În vederea înscrierii la concursul de admitere la doctorat, la nivelul IOSUD se realizează recunoașterea creditelor (ECTS) sau a punctelor de credit alocate pentru studiile universitare de licență și masterat obținute în străinătate, cu condiția cumulării celor 300 de credite transferabile (ECTS). (16) Cetățenii statelor membre ale Uniunii Europene, ai statelor aparținând Spațiului Economic European și ai Confederației Elvețiene, precum și cetățenii britanici și membrii familiilor acestora, ca beneficiari ai Acordului privind retragerea Regatului Unit al Marii Britanii și Irlandei de Nord din Uniunea Europeană și din Comunitatea Europeană a Energiei Atomice 2019/C 384 I/01 pot participa la admiterea în toate ciclurile de studii universitare, în aceleași condiții prevăzute de lege pentru cetățenii români, inclusiv în ceea ce privește taxele de școlarizare. (17) La admiterea la studii universitare de doctorat se pot înscrie și cetățeni care nu fac parte din Uniunea Europeană, Spațiul Economic European și Confederația Elvețiană (extracomunitari), absolvenți ai studiilor universitare de masterat sau absolvenți cu diplomă de licență sau echivalentă ai studiilor universitare de lungă durată (5, 6 ani). Recunoașterea studiilor efectuate de către aceștia Metodologie admitere la doctorat 2025 în afara României se va realiza de către Direcția de specialitate din cadrul Ministerului Educației. (18) Un candidat admis beneficiază o singură dată de finanţare de la bugetul de stat pentru ciclul de studii universitare de doctorat; candidaţii vor completa la înscriere o declaraţie pe propria răspundere prin care vor confirma că nu au mai beneficiat/nu beneficiază de o altă finanţare de la bugetul de stat pentru ciclul de studii doctorale. (19) Programul de doctorat se desfășoară în limba română sau într-o limbă de circulație internațională. (20) Selecția candidatului pentru o poziție vacantă de student-doctorand este realizată de o comisie de concurs aprobată de Consiliul Școlii doctorale.",
            "minim 95 ECTS pentru trecerea în anul III; minim 155 ECTS pentru trecerea în anul IV. (3) În situaţii bine justificate Consiliile Facultăților, la propunerea BExF, pot modifica aceste praguri. (4) Pragurile de trecere modificate de fiecare facultate vor fi avizate anual de Birourile Executive Reunite ale Senatului și ale Consiliului de Administrație. (5) Studenții care nu au acumulat numărul de ECTS pentru trecerea în anul de studii superior, pot reface anul de studii cu plata taxei pentru fiecare disciplină nepromovată. ART. 17. EXAMENUL DE DIPLOMĂ/LICENŢĂ (1) Accesul la susținerea Examenului de Diplomă/Licenţă este condiționat de obținerea, la disciplinele impuse și opționale, a minim 180 ECTS, respectiv 240 ECTS, în funcţie de durata programului de studii. MINISTERUL EDUCAȚIEI Universitatea Naţională de Ştiinţă şi Tehnologie POLITEHNICA Bucureşti (2) În cazul în care studenţii nu acumulează numărul minim de ECTS pentru accederea la susţinerea examenului de diplomă/licenţă, aceştia pot urma, la cerere, doar în regim cu taxă, anul III/IV suplimentar. (3) Înscrierea în anul III/IV suplimentar cu plata taxei pe disciplină este posibilă o singură dată, ulterior studentul va achita taxa de școlarizare anuală. (4) Studenţii care nu se înscriu sau care nu promovează anul suplimentar vor fi exmatriculaţi. (5) Pe parcursul anului III/IV suplimentar studenţii nu pot beneficia de întrerupere de studii. II.3. REGULI DE ÎNTRERUPERE/REÎNMATRICULARE/RETRAGERE ART. 18. ÎNTRERUPEREA STUDIILOR (1) Întreruperea studiilor se poate face, la cerere, numai la începutul anului universitar, în perioada în care se încheie Contractele de studii/Actele adiționale, și este permisă pentru o durată de cel mult 2 ani universitari. (2) În cazuri bine justificate, BExF poate aproba întreruperea studiilor începând cu semestrul II. Reînscrierea se va face în aceleaşi condiţii. (3) Întreruperea studiilor presupune:",
            "(2) Media generală de admitere se constituie ca medie aritmetică dintre nota acordată de comisia/comisiile constituite de Şcoala doctorală privind evaluarea dosarelor electronice ale candidaţilor declaraţi admişi de către conducătorii de doctorat şi media generală a anilor de studii, calculată prin luarea în considerare a anilor de studii de licenţă şi masterat sau de lunga Metodologie admitere la doctorat 2025 durata (Anexa 3). Media generală de admitere trebuie sa fie minim 7,00. (3) Înmatricularea candidaților admiși se face online în termen de 7 2 ore de la data afișării electronice a rezultatelor finale, fiind condiționată de prezentarea dovezii privind absolvirea unui program de masterat (diploma de masterat sau adeverință de absolvire). (4) Candidaţii admişi vor completa şi semna olograf contractul de studii universitare de doctorat până la începutul anului universitar 2025-2026. Contractul se oficializează prin semnaturile olografe ale conducătorului de doctorat și Directorului Şcolii doctorale. Metodologie admitere la doctorat 2025 Anexa 1 Lista domeniilor doctorale organizate de POLITEHNICA București"
        ],
        "retrieved_ids": [
            "36527b3da039b452b387028c350e8e537c8c6b5176f91649e53bf33924e493bb-4",
            "3b29b0516a0b7af978077a8daaa189c3b82dad4559940a8acebc9017b6e97310-21",
            "36527b3da039b452b387028c350e8e537c8c6b5176f91649e53bf33924e493bb-9"
        ],
        "retrieved_scores": [
            0.7999606,
            0.7870128,
            0.794731
        ],
        "user_input": "Care sunt conditiile de admitere la licenta la ETTI?"
    },
    {
        "id": "4ee2e6eba5c541739d1b145a6023e677ccaea11fc5b8f50b7730898e2427df9b",
        "response": "Cuantumul burselor sociale se stabilește anual de către Comisia Națională pentru Finanțarea Învățământului Superior (CNFIS) și trebuie să acopere cheltuielile minime de masă și cazare. Acesta este adoptat prin ordin al ministrului educației. De asemenea, cuantumul burselor sociale la Universitatea POLITEHNICA București se stabilește prin hotărârea senatului universității, la propunerea Consiliului de administrație, în limita fondurilor disponibile și în funcție de nevoile identificate la nivelul comunității studențești, prin consultarea reprezentanților studenților. Cuantumul acestor burse trebuie să fie cel puțin egal cu cuantumul lunar al bursei sociale. În cazul în care fondul pentru acordarea burselor sociale nu este utilizat în întregime, acesta se redistribuie pentru acordarea burselor de performanță. Detalii suplimentare despre cuantumul exact al burselor nu sunt specificate în documentele disponibile.\n\nSurse:\n- Metodologie burse, URL: https://upb.ro/wp-content/uploads/2024/12/Metodologie-burse_rectificata.pdf, pagina: 8\n- Metodologie burse, URL: https://upb.ro/wp-content/uploads/2024/12/Metodologie-burse_rectificata.pdf, pagina: 10\n- Metodologie burse, URL: https://upb.ro/wp-content/uploads/2024/12/Metodologie-burse_rectificata.pdf, pagina: 13",
        "retrieved_contexts": [
            "(3) Cuantumul minim al bursei sociale se propune anual, până la data de 1 septembrie, de către Comisia Națională pentru Finanțarea Învățământului Superior (CNFIS), se adoptă prin ordin al ministrului educației și trebuie să acopere cheltuielile minime de masă şi cazare. (4) Cuantumul burselor sociale se stabilește prin hotărâre a senatului universității POLITEHNICA București, la propunerea Consiliului de administrație, în limita fondurilor disponibile și în funcție de nevoile identificate la nivelul comunității studențești, prin consultarea reprezentanților studenților, inclusiv cu organizațiile studențești din POLITEHNICA București. (5) Pentru acordarea burselor sociale, singurul criteriu academic ce se ia în considerare este promovabilitatea. (6) Bursele sociale se cumulează cu alte tipuri de burse, dacă studentul îndeplinește criteriile specifice pentru ambele categorii de burse. (7) Bursele sociale se acordă pe durata legală a programului de studii, până la împlinirea vârstei de 35 de ani. (8) Beneficiarii burselor sociale pot fi: a) studenții orfani de unul sau ambii părinți, studenții care provin din familii monoparentale sau studenții proveniți din centre de plasament și care nu realizează venituri peste plafonul pentru acordarea bursei sociale; b) studenții bolnavi de tuberculoză, care se află în evidența unităților medicale, pe perioada tratamentului tuberculostatic, diabet insulinonecesitant, boli maligne, sindroame de malabsorbție severe, boală cronică de rinichi în program de dializă, astm bronșic persistent moderat sau sever, epilepsie grand mal, cardiopatii congenitale, hepatită cronică cu fibroză avansată (stadiul F3 sau F4), glaucom, miopie gravă, boli imunologice autoimune forme severe, boli rare, tulburări din spectrul autist, boli hematologice severe care necesită tratament continuu sau spitalizări frecvente, surditate bilaterală, fibroză chistică, cei infectați cu virusul HIV sau bolnavi de SIDA, cei cu handicap locomotor și încadrați într-un grad de invaliditate, fără a se lua în considerare nivelul venitului mediu pe membru de familie;",
            "punct de vedere socio-economic, a căror familie nu a realizat în cele 12 luni dinaintea depunerii cererii pentru acordarea acestui tip de bursă un venit lunar net mediu pe membru de familie mai mare de 50% din salariul minim net la nivel național. Această categorie de bursă se poate acorda aceluiași student de două ori în cursul unui an universitar; b) bursa pentru ajutor social ocazional de maternitate, care se acordă studentei sau studentului a cărui soție nu realizează deloc venituri sau venituri mai mari decât salariul de bază minim net la nivel național, constă într-o bursă pentru naștere și lăuzie și o bursă pentru procurarea îmbrăcămintei copilului nou-născut și care se acordă o singură dată în cursul anului universitar pentru fiecare copil născut; c) bursa pentru ajutor social ocazional în caz de deces se poate acorda pentru decesul unui membru al familiei studentului(ei). Prin membru de familie se înțelege soț, soție, copil. În cazul decesului studentului(ei) necăsătorit(e)/căsătorit(e) cu soție/soț care nu realizează venituri, bursa se acordă rudelor de gradul I/succesorului legal o singură dată în cursul anului universitar. (2) Cuantumul acestor burse este stabilit de Senatul universității, la propunerea Consiliului de administrație, cu condiția ca acesta să fie cel puțin egal cu cuantumul lunar al bursei sociale. (3) POLITEHNICA București poate acorda alte stimulente financiare studenților în situație de risc, stabilite de Biroul Consiliului de Administrație. Art. 28. Calculul venitului lunar mediu net (1) Determinarea venitului lunar mediu net al familiei studentului se realizează până la împlinirea vârstei de 26 de ani. La stabilirea venitului mediu net lunar pe membru de familie se iau în calcul toate veniturile nete cu caracter permanent realizate de membrii familiei, supuse impozitului pe venit. Prin venituri nete se înțelege totalitatea sumelor primite/realizate de persoana singură, respectiv de fiecare membru al familiei, reprezentând valoarea obținută după aplicarea cotei de impozitare asupra venitului impozabil stabilit conform prevederilor legale.",
            "(6) În cazul în care fondul pentru acordarea burselor sociale nu este utilizat în întregime, acesta se redistribuie pentru acordarea burselor de performanță. (7) Distribuirea burselor sociale se face în ordine crescătoare a venitului net pe membru de familie. (8) Sumele rămase în sold pentru facilități de transport pentru studenți, subvenții pentru cămine-cantine și sumele pentru bursele studenților neridicate în termen pot fi utilizate în anii următori pentru acordarea de burse pentru studenți, precum și pentru alte cheltuieli de natura investițiilor pentru infrastructura de cămine, cantine și pentru susținerea activităților centrelor pentru consiliere și orientare în carieră. Art. 35. Universitatea Națională de Știință și Tehnologie POLITEHNICA București poate suplimenta fondul pentru burse provenit de la bugetul de stat, pentru fiecare categorie de burse, cu fonduri provenite din venituri proprii. Art. 36. (1) Cuantumul burselor de performanță și al burselor pentru învățământ dual se aprobă prin hotărârea Senatului, la propunerea Consiliului de Administrație, ca urmare a consultării cu reprezentanții studenților, inclusiv a organizațiilor studențești reprezentative din POLITEHNICA București. (2) Universitatea Națională de Știință și Tehnologie POLITEHNICA București poate acorda sprijin financiar studenților cu rezultate deosebite, pentru participarea la conferințe sau publicarea de articole științifice, cu aprobarea Consiliului de Administrație. (3) Universitatea Națională de Știință și Tehnologie POLITEHNICA București poate acorda burse pentru stagii de studii universitare și postuniversitare, în vederea susținerii mobilităților temporare efectuate în universități și instituții din țară și străinătate. Decizia cu privire la acordarea burselor pentru stagii de studii universitare și postuniversitare, precum și stabilirea cuantumului acestora se ia de către Biroul Consiliului de Administrație al POLITEHNICII București. Page 13 of 16 CAPITOLUL IV Dispoziții finale Art. 37. În cazul în care există suspiciuni de falsificare a documentelor depuse pentru obținerea unei burse pentru ajutor social, POLITEHNICA București va sesiza organele de anchetă competente și va proceda la sancționarea studentului, în funcție de gravitatea faptei. Art. 38."
        ],
        "retrieved_ids": [
            "d9aaa3233afc85c50c8869a9a97f45c2e80bd9dcea6b434aec2d66ca2234b796-10",
            "d9aaa3233afc85c50c8869a9a97f45c2e80bd9dcea6b434aec2d66ca2234b796-13",
            "d9aaa3233afc85c50c8869a9a97f45c2e80bd9dcea6b434aec2d66ca2234b796-18"
        ],
        "retrieved_scores": [
            0.72410965,
            0.7028302,
            0.76271075
        ],
        "user_input": "Care este cuantumul burselor?"
    },
    {
        "id": "9d9e9455b52e49993069f174e2514cd661584e1bf5a69be4d8fdc9b920580a06",
        "response": "Cuantumul minim al bursei sociale se propune anual, până la data de 1 septembrie, de către Comisia Națională pentru Finanțarea Învățământului Superior (CNFIS) și se adoptă prin ordin al ministrului educației. Acesta trebuie să acopere cheltuielile minime de masă și cazare. Cuantumul burselor sociale se stabilește prin hotărâre a senatului universității POLITEHNICA București, la propunerea Consiliului de administrație, în limita fondurilor disponibile și în funcție de nevoile identificate la nivelul comunității studențești, prin consultarea reprezentanților studenților, inclusiv cu organizațiile studențești din POLITEHNICA București.\n\nSurse:\n- Metodologie burse, URL: https://upb.ro/wp-content/uploads/2024/12/Metodologie-burse_rectificata.pdf, pagina: 8",
        "retrieved_contexts": [
            "(3) Cuantumul minim al bursei sociale se propune anual, până la data de 1 septembrie, de către Comisia Națională pentru Finanțarea Învățământului Superior (CNFIS), se adoptă prin ordin al ministrului educației și trebuie să acopere cheltuielile minime de masă şi cazare. (4) Cuantumul burselor sociale se stabilește prin hotărâre a senatului universității POLITEHNICA București, la propunerea Consiliului de administrație, în limita fondurilor disponibile și în funcție de nevoile identificate la nivelul comunității studențești, prin consultarea reprezentanților studenților, inclusiv cu organizațiile studențești din POLITEHNICA București. (5) Pentru acordarea burselor sociale, singurul criteriu academic ce se ia în considerare este promovabilitatea. (6) Bursele sociale se cumulează cu alte tipuri de burse, dacă studentul îndeplinește criteriile specifice pentru ambele categorii de burse. (7) Bursele sociale se acordă pe durata legală a programului de studii, până la împlinirea vârstei de 35 de ani. (8) Beneficiarii burselor sociale pot fi: a) studenții orfani de unul sau ambii părinți, studenții care provin din familii monoparentale sau studenții proveniți din centre de plasament și care nu realizează venituri peste plafonul pentru acordarea bursei sociale; b) studenții bolnavi de tuberculoză, care se află în evidența unităților medicale, pe perioada tratamentului tuberculostatic, diabet insulinonecesitant, boli maligne, sindroame de malabsorbție severe, boală cronică de rinichi în program de dializă, astm bronșic persistent moderat sau sever, epilepsie grand mal, cardiopatii congenitale, hepatită cronică cu fibroză avansată (stadiul F3 sau F4), glaucom, miopie gravă, boli imunologice autoimune forme severe, boli rare, tulburări din spectrul autist, boli hematologice severe care necesită tratament continuu sau spitalizări frecvente, surditate bilaterală, fibroză chistică, cei infectați cu virusul HIV sau bolnavi de SIDA, cei cu handicap locomotor și încadrați într-un grad de invaliditate, fără a se lua în considerare nivelul venitului mediu pe membru de familie;",
            "punct de vedere socio-economic, a căror familie nu a realizat în cele 12 luni dinaintea depunerii cererii pentru acordarea acestui tip de bursă un venit lunar net mediu pe membru de familie mai mare de 50% din salariul minim net la nivel național. Această categorie de bursă se poate acorda aceluiași student de două ori în cursul unui an universitar; b) bursa pentru ajutor social ocazional de maternitate, care se acordă studentei sau studentului a cărui soție nu realizează deloc venituri sau venituri mai mari decât salariul de bază minim net la nivel național, constă într-o bursă pentru naștere și lăuzie și o bursă pentru procurarea îmbrăcămintei copilului nou-născut și care se acordă o singură dată în cursul anului universitar pentru fiecare copil născut; c) bursa pentru ajutor social ocazional în caz de deces se poate acorda pentru decesul unui membru al familiei studentului(ei). Prin membru de familie se înțelege soț, soție, copil. În cazul decesului studentului(ei) necăsătorit(e)/căsătorit(e) cu soție/soț care nu realizează venituri, bursa se acordă rudelor de gradul I/succesorului legal o singură dată în cursul anului universitar. (2) Cuantumul acestor burse este stabilit de Senatul universității, la propunerea Consiliului de administrație, cu condiția ca acesta să fie cel puțin egal cu cuantumul lunar al bursei sociale. (3) POLITEHNICA București poate acorda alte stimulente financiare studenților în situație de risc, stabilite de Biroul Consiliului de Administrație. Art. 28. Calculul venitului lunar mediu net (1) Determinarea venitului lunar mediu net al familiei studentului se realizează până la împlinirea vârstei de 26 de ani. La stabilirea venitului mediu net lunar pe membru de familie se iau în calcul toate veniturile nete cu caracter permanent realizate de membrii familiei, supuse impozitului pe venit. Prin venituri nete se înțelege totalitatea sumelor primite/realizate de persoana singură, respectiv de fiecare membru al familiei, reprezentând valoarea obținută după aplicarea cotei de impozitare asupra venitului impozabil stabilit conform prevederilor legale.",
            "(6) În cazul în care fondul pentru acordarea burselor sociale nu este utilizat în întregime, acesta se redistribuie pentru acordarea burselor de performanță. (7) Distribuirea burselor sociale se face în ordine crescătoare a venitului net pe membru de familie. (8) Sumele rămase în sold pentru facilități de transport pentru studenți, subvenții pentru cămine-cantine și sumele pentru bursele studenților neridicate în termen pot fi utilizate în anii următori pentru acordarea de burse pentru studenți, precum și pentru alte cheltuieli de natura investițiilor pentru infrastructura de cămine, cantine și pentru susținerea activităților centrelor pentru consiliere și orientare în carieră. Art. 35. Universitatea Națională de Știință și Tehnologie POLITEHNICA București poate suplimenta fondul pentru burse provenit de la bugetul de stat, pentru fiecare categorie de burse, cu fonduri provenite din venituri proprii. Art. 36. (1) Cuantumul burselor de performanță și al burselor pentru învățământ dual se aprobă prin hotărârea Senatului, la propunerea Consiliului de Administrație, ca urmare a consultării cu reprezentanții studenților, inclusiv a organizațiilor studențești reprezentative din POLITEHNICA București. (2) Universitatea Națională de Știință și Tehnologie POLITEHNICA București poate acorda sprijin financiar studenților cu rezultate deosebite, pentru participarea la conferințe sau publicarea de articole științifice, cu aprobarea Consiliului de Administrație. (3) Universitatea Națională de Știință și Tehnologie POLITEHNICA București poate acorda burse pentru stagii de studii universitare și postuniversitare, în vederea susținerii mobilităților temporare efectuate în universități și instituții din țară și străinătate. Decizia cu privire la acordarea burselor pentru stagii de studii universitare și postuniversitare, precum și stabilirea cuantumului acestora se ia de către Biroul Consiliului de Administrație al POLITEHNICII București. Page 13 of 16 CAPITOLUL IV Dispoziții finale Art. 37. În cazul în care există suspiciuni de falsificare a documentelor depuse pentru obținerea unei burse pentru ajutor social, POLITEHNICA București va sesiza organele de anchetă competente și va proceda la sancționarea studentului, în funcție de gravitatea faptei. Art. 38."
        ],
        "retrieved_ids": [
            "d9aaa3233afc85c50c8869a9a97f45c2e80bd9dcea6b434aec2d66ca2234b796-10",
            "d9aaa3233afc85c50c8869a9a97f45c2e80bd9dcea6b434aec2d66ca2234b796-13",
            "d9aaa3233afc85c50c8869a9a97f45c2e80bd9dcea6b434aec2d66ca2234b796-18"
        ],
        "retrieved_scores": [
            0.80945444,
            0.795082,
            0.8570097
        ],
        "user_input": "Care este cuantumul bursei sociale?"
    },
    {
        "id": "240129e465aab8ef6bc60b3c18f5fc39c17ba754f4170c60c72d809e8076d02a",
        "response": "Nu am suficiente informații pentru a răspunde la întrebare.",
        "retrieved_contexts": [
            "ORGANIZAREA ȘI DESFĂȘURAREA CONCURSULUI DE ADMITERE 2025 Pentru anul universitar 2025-2026, admiterea la Facultatea de Inginerie Chimică și Biotehnologii se face printr-un concurs de dosare bazat pe 3 probe (P1, P2 și P3) și desfășurat în trei sesiuni: Sesiunea I – Admitere anticipată, Sesiunea II – Admitere și, dacă este cazul, Sesiunea III – Admitere-completare. Fiecare dintre sesiunile de admitere are trei faze: Faza I – Înscriere la sesiunea curentă, Faza II – Admitere preliminară (Etapa I), Faza III – Admitere – Etapa II – Validare, confirmare loc, participare la glisare (opțional), înscriere în anul I și înmatriculare. Regulamentul de admitere valabil pentru sesiunea 2025 este disponibil aici. SESIUNEA I. ADMITERE ANTICIPATĂ LA STUDII DE LICENŢĂ",
            "• Faza II – Admitere preliminară, • Faza III – Admitere – Etapa II – Validare, confirmare loc, participare la glisare internă***4F 5, înscriere în anul I și înmatriculare. Pentru obținerea statutului de candidat admis, înscris în anul I și înmatriculat, parcurgerea tuturor fazelor din această sesiune este obligatorie. l V.1. Despre Faza I – Înscriere la concurs Ses. II-5.6. Candidații care intenționează să participe la concursul de admitere în UNSTPB trebuie să-și aleagă mai întâi facultatea la care își doresc să urmeze unul dintre programele de studii. Înscrierea la concursul de admitere se va face la această facultate (care va fi denumită, pe scurt, facultate de bază). Ses. II-5.7. În Sesiunea II – Admitere un candidat se poate înscrie la o singură facultate din UNSTPB (facultatea de bază) și va plăti on-line o singură taxă de înscriere⁂ Ses. II-5.8. În ceea ce privește opțiunile: • Candidatul alege, în prima fază, disciplinele pentru probele P1 și P2 dintre cele valabile la facultatea la care se înscrie (vezi Anexa II-1.1 pentru concurs pe baza rezultatelor la activitățile școlare (dosar) (c-rs), Anexa II-1.2 pentru ⁂ Prin excepție, candidații de la facultățile cu concurs cu probe scrise sau vocaționale (c-s, c-v, c-m) care nu au fost declarați admiși preliminar la sfârșitul Fazei II din Sesiunea II, dacă doresc, se mai pot înscrie la concursul de admitere încă deschis în Sesiunea II, la una dintre celelalte facultăți (cu concurs pe baza rezultatelor la activitățile școlare). Atenție însă, că în această ultimă situație există posibilitatea de a nu putea participa la Sesiunea II+ de la facultățile cu concurs cu probe scrise sau vocaționale. Universitatea Națională de Știință și Tehnologie POLITEHNICA București REGULAMENTUL Concursului de Admitere în Ciclul de Studii Universitare de Licență 2025 concurs cu probe scrise (c-s),",
            "• Faza I – Înscriere la sesiunea curentă. • Faza II – Admitere preliminară (Etapa I) • Faza III – Admitere – Etapa II – Validare, confirmare, participare la glisare (opțional), înscriere în anul I și înmatriculare Pentru obținerea statutului de candidat admis, înscris și înmatriculat în anul I, parcurgerea tuturor fazelor din respectiva sesiune este obligatorie. PG-1.13. Pentru Sesiunea I – Admitere anticipată, notarea candidaților la fiecare probă de concurs se stabilește în conformitate cu metodologia prezentată în capitolul IV împreună cu anexele aferente. Pentru Sesiunea II – Admitere notarea candidaților la fiecare probă de concurs se stabilește în conformitate cu metodologia prezentată în capitolul V împreună cu anexele aferente. PG-1.14. Pentru candidații admiși/pre-admiși prin concurs media generală minimă de admitere este 5,00 (cinci), aceasta reprezentând Baremul minim de admitere. PG-1.15. Pentru fiecare sesiune admiterea candidaților în UNSTPB se face în ordinea descrescătoare a mediei generale obținută de candidați în concurs, în limita numărului de locuri, pentru fiecare domeniu de studii. Candidații care vor avea aceeași medie generală vor fi ordonați conform criteriilor de departajare precizate în capitolele IV și V din prezentul regulament. PG-1.16. Pentru asigurarea bunei organizări și desfășurări a concursului de admitere, în UNSTPB se formează Comisia centrală de admitere și, la fiecare facultate, câte o Comisie Pag. 10 Universitatea Națională de Știință și Tehnologie POLITEHNICA București REGULAMENTUL Concursului de Admitere în Ciclul de Studii Universitare de Licență 2025 locală de admitere . Componența acestor comisii se stabilește prin decizia Rectorului universității. Competențele comisiilor de admitere sunt prezentate în Anexa X. II. CONDIȚIILE PARTICIPĂRII LA CONCURS CP-2.1."
        ],
        "retrieved_ids": [
            "f73ea1d90056ccb3e9135467f94bef99f2294b8ec52d73cc838a697a36565ea8-1",
            "85ab8a2001db129d9b28c1a868567dde770e21f5c8ba133a94ef4814a7badfc9-51",
            "85ab8a2001db129d9b28c1a868567dde770e21f5c8ba133a94ef4814a7badfc9-12"
        ],
        "retrieved_scores": [
            0.7746958,
            0.792293,
            0.7838586
        ],
        "user_input": "Ce presupune sesiunea 3 de admitere la licenta?"
    },
    {
        "id": "dccdcb1acd47623462d5aa48f3e38f5dcae2a215123f9f2502aba37cfb890432",
        "response": "Nu am suficiente informații pentru a răspunde la întrebare.",
        "retrieved_contexts": [
            "ACS optimizează orarele de master – fizic/online – în funcție de necesități, ținând cont de reglementările naționale și deciziile Senatului UPB. Admiteri anterioare Informativ, rezultatele admiterii din anii anteriori sunt disponibile aici: 2022, 2023, 2024. Programe de studii ACS oferă 25 programe de studii universitare de masterat acreditate ARACIS în domeniile: - CTI (Calculatoare și Tehnologia Informației) – 13 programe - IS (Ingineria Sistemelor) – 11 programe - IM (Inginerie și Management) – 1 program Broșura master (în curs de actualizare cu noile programe) oferă informații sintetice despre masterat și despre fiecare program. În continuarea acestei pagini sunt prezentate programele și descrierile cursurilor. Versiunea preliminară a planurilor de învățământ este disponibilă AICI. Până la începerea anului școlar pot interveni modificări minore ale planurilor de învâțământ. Calculatoare și Tehnologia Informației | Nr. crt. | Nume program master | ||| | 1. | Arhitecturi Avansate de Calculatoare | ||| | 2. | Administrarea Bazelor de Date | ||| | Catedra organizatoare: Calculatoare Responsabil: Prof.Dr.Ing. Florin Radulescu Tip: Aprofundare / Cercetare avansata Informaţii: Scurtă descriere, Plan învăţământ, Cursuri Pentru a putea urma acest program de masterat, sunt necesare studii de licență într-unul din următoarele domenii: Domeniul fundamental Stiinte ingineresti , domeniile: Calculatoare si Tehnologia Informatie (specializarile Calculatoare , Tehnologia Informatiei , Ingineria Informatiei), Inginerie electronica si telecomunicatii, Ingineria sistemelor (specializarile Automatica si informatica aplicata, Ingineria sistemelor multimedia) , Stiinte Ingineresti Aplicate (specializarile Matematica si informatica aplicata in inginerie)",
            "- Examen scris (ambele probe): 14 Iulie începând cu ora 09:00 - Afișare rezultate preliminare: 15 iulie - Afișare rezultate finale concurs: 16 iulie - Validare, confirmare, înscriere în anul I și înmatriculare: 16 Iulie ora 9.00 – 17 Iulie ora 16.00, conform programării, fizic, la sediul facultății - Daca se va organiza Sesiunea 2+ (in funcție de situația locurilor vacante): Validare, confirmare, înscriere în anul I și înmatriculare candidati Sesiunea 2+: 18 Iulie ora 9.00 – 19 Iulie ora 16.00, fizic, la sediul facultății - Rezultate finale admiși și înscriși în anul I: 19 Iulie Înscrierea se face prin portalul https://admitere.pub.ro Detalii despre condițiile de admitere si întreg Calendarul Sesiunii 2 – Admitere sunt disponibile aici. Date de contact: telefon 021 402 91 79",
            "o Rezultatele finale privind admiterea preliminară din Sesiunea I vor fi publicate la data de: ▪ 12 aprilie, ora 12:00 pentru facultățile și domeniile la care candidații au susținut probe scrise (c-s) (în Centrul Universitar București); ▪ 14 mai, ora 12:00 pentru facultățile și domeniile la care candidații au susținut concurs cu probe vocaționale (c-v) sau concurs mixt (c-m) (în Centrul Universitar Pitești); Pag. 17 Universitatea Națională de Știință și Tehnologie POLITEHNICA București REGULAMENTUL Concursului de Admitere în Ciclul de Studii Universitare de Licență 2025 ▪ 16 iunie, ora 12:00 pentru restul facultăților și domeniilor la care candidații au susținut concurs pe baza rezultatelor la activitățile școlare (dosar) (c-rs) (atât în Centrul Universitar București cât și în Centrul Universitar Pitești) . • Faza III – Admitere Etapa II – Validare, confirmare, participare la glisare (opțional) înscriere în anul I și înmatriculare începe la data de 02 iulie, ora 08:00 și se încheie după trei zile (04 iulie, ora 16:00). o Validarea implică, pentru fiecare candidat, completarea dosarului de concurs cu documentele originale solicitate (vezi Anexa V), verificarea promovării examenului de Bacalaureat și verificarea conformității datelor introduse în Faza I cu cele din documentele originale furnizate. Pentru a fi admis și înmatriculat candidatul trebuie să fi promovat examenul de Bacalaureat, să fi fost declarat pre-admis în Faza II, să aibă dosarul de admitere complet (cu toate documentele solicitate), iar datele furnizate la înscriere în Faza I să fie conforme cu documentele originale aduse în Faza III. o Validarea, confirmarea locului obținut, solicitarea pentru participare la glisare (opțional), înscrierea în anul I și ulterior înmatricularea se face la sediul facultăților la care aceștia au fost declarați pre-admiși, zilnic, între orele 08:00-16:00, începând cu ziua de 02 iulie, ora 8:00 și terminând cu ziua de 04 iulie, ora 16:00)."
        ],
        "retrieved_ids": [
            "6ccd6e8cf90ac5e0f62d36ab0c6545bdb0df7714986675e4854d0f00e6cfc934-2",
            "491f908948d53e5b16fb1e16d5db1345049605301c9e3d3f7116532b523b9d98-7",
            "85ab8a2001db129d9b28c1a868567dde770e21f5c8ba133a94ef4814a7badfc9-23"
        ],
        "retrieved_scores": [
            0.82057834,
            0.80299246,
            0.79788595
        ],
        "user_input": "Cand are loc simularea examenului de admitere la licenta la ACS?"
    },
    {
        "id": "914c2e63192ab7ae448836150b6ac332d7b7d24ee100a1c5464f6b5c81e1a4b3",
        "response": "Nu am suficiente informații pentru a răspunde la întrebare.",
        "retrieved_contexts": [
            "Criteriul 4 = NPN - Număr premii obținute la concursuri naționale/internaționale la care candidatul a participat. Fiecare concurs este punctat cu 3 puncte. Se pot aduna din acest criteriu maxim n = 10 pct. Se poate face dovada prin diploma de premiere. Criteriul 5 = NAV - Număr activități de voluntariat la care a participat. Fiecare activitate este punctată cu 0,5 puncte. Se pot aduna din acest criteriu maxim n =2 pct. Se poate face dovada prin poze, link-uri, adeverințe etc. Criteriul 6 = NRP - Număr „recomandări pentru domeniu” în favoarea candidatului, din partea profesorilor titulari la disciplinele luate în considerare de UNSTPB la admitere (matematică, fizică, chimie, economie, informatică), indiferent de materiile selectate de facultate pentru probele P1 și P2. Se va lua în considerare cel mult 1 recomandare / disciplină. Fiecare recomandare este punctată cu 2 puncte. Se pot aduna din acest criteriu maxim n = 4 puncte. Criteriul 7 = NCLS - Număr certificate de competență pentru cunoașterea unor limbi străine (engleză, germană, franceză) la nivel cel puțin B2, eliberate de autorități recunoscute (Cambridge, Toefl, IELTS, DELF, DALF, DL, TestDaF etc.). Fiecare certificat este punctat cu 1 punct. Se pot aduna din acest criteriu maxim n = 3 puncte. Cu ajutorul valorilor NC1 (pentru proba P1), NC2 (pentru proba P2) şi NB (pentru proba P3), se va calcula media generală de admitere cu ajutorul formulei: M = NC1*0.4+NC2*0.4+NB*0.2",
            "(2) Media generală de admitere se constituie ca medie aritmetică dintre nota acordată de comisia/comisiile constituite de Şcoala doctorală privind evaluarea dosarelor electronice ale candidaţilor declaraţi admişi de către conducătorii de doctorat şi media generală a anilor de studii, calculată prin luarea în considerare a anilor de studii de licenţă şi masterat sau de lunga Metodologie admitere la doctorat 2025 durata (Anexa 3). Media generală de admitere trebuie sa fie minim 7,00. (3) Înmatricularea candidaților admiși se face online în termen de 7 2 ore de la data afișării electronice a rezultatelor finale, fiind condiționată de prezentarea dovezii privind absolvirea unui program de masterat (diploma de masterat sau adeverință de absolvire). (4) Candidaţii admişi vor completa şi semna olograf contractul de studii universitare de doctorat până la începutul anului universitar 2025-2026. Contractul se oficializează prin semnaturile olografe ale conducătorului de doctorat și Directorului Şcolii doctorale. Metodologie admitere la doctorat 2025 Anexa 1 Lista domeniilor doctorale organizate de POLITEHNICA București",
            "(b) Media de promovare a examenului de disertaţiei trebuie să fie cel puțin 6,00 și este media aritmetică (cu două zecimale, fără rotunjire) a notelor numere întregi de la 1 la 10 acordate de membrii comisiei de examen de disertaţie (exclusiv secretarul). Deliberarea comisiilor cu privire la stabilirea rezultatelor examenului de disertaţie nu este publică, dar se acceptă participarea conducătorului ştiinţific al lucrării de disertaţie. (c) În cazul nepromovării examenului de disertaţie, absolventul se poate prezenta la o a doua sesiune după ce a integrat modificările recomandate de comisie. (5) Media unei probe de examen de licență/diplomă/absolvire/disertaţie nu se calculează dacă există o diferenţă mai mare de două puncte între notările membrilor comisiei de examen. În cazul în care apare o diferenţă mai mare de două puncte decizia se ia prin consens. (6) Probele examenului de licență/diplomă/disertaţie/absolvire se vor susţine scris și oral sau numai oral, după caz. (7) La aprecierea corectă a lucrărilor de licență/proiectelor de diplomă/lucrărilor de disertaţie şi acordarea notelor probelor de examen, se propun următoarele criterii orientative: • tema abordată, conţinutul şi organizarea lucrării de licență/proiectului de diplomă/lucrării de disertaţie: actualitatea şi/sau noutatea temei, respectarea structurii impuse de conducerea departamentului/facultăţii, concordanţa dintre conţinut şi obiectivele asumate prin temă, corectitudinea şi calitatea proiectului/lucrării, abilităţile de exprimare în scris, nivelul ştiinţific, originalitatea datelor etc. ; • documentarea și contribuțiile absolventului: extinderea, actualitatea şi corectitudinea utilizării bibliografiei, utilizarea corectă a referinţelor bibliografice, originalitatea abordării problemelor propuse prin temă, ponderea contribuţiilor personale a absolventului în ansamblul proiectului/lucrării, conţinutul şi valoarea concluziilor şi propunerilor, capacitatea de evidenţiere a contribuţiilor personale, corectitudinea soluţiilor inginereşti etc. ;"
        ],
        "retrieved_ids": [
            "85fcf9d8684602276ff1fc4ac04e10d3fb6a6c2732942ac846889086a23d3e5d-5",
            "36527b3da039b452b387028c350e8e537c8c6b5176f91649e53bf33924e493bb-9",
            "70316c29c4e024cfb07239b8cb041fe2e61b063ecc31311c2a24497c18e0195a-13"
        ],
        "retrieved_scores": [
            0.7560772,
            0.8314681,
            0.7615931
        ],
        "user_input": "Cum se calculeaza media de admitere la licenta?"
    },
    {
        "id": "b112eeda8562cb3d34135d7a1a0edd7355c867f8412132589a9a2c5f570f4be8",
        "response": "Nu am suficiente informații pentru a răspunde la întrebare. Documentele disponibile nu specifică dacă taxa de înscriere poate fi plătită o singură dată pentru mai multe facultăți. Este recomandat să verificați direct cu instituția de învățământ superior la care doriți să vă înscrieți pentru clarificări suplimentare.",
        "retrieved_contexts": [
            "Taxa de înscriere este 125 lei și se poate achita având menționate la explicațiile plății: numele și prenumele complet al candidatului, precum și Facultatea de bază la care acesta se înscrie pentru concursul de admitere, astfel: • direct în platforma on-line https://admitere.pub.ro/, cu card bancar. • prin transfer bancar (realizat într-o aplicate de e-banking sau la ghișeul unei bănci), într-unul dintre următoarele conturi:",
            "TAXA de înscriere Cuantumul taxei de înscriere este de 100 RON pentru înscrierea la sesiunile din iulie și septembrie și de 50 RON pentru înscrierea la sesiunea de admitere anticipată. Taxa de înscriere pentru înscrierea la sesiunea de admitere anticipată este 50 lei și se poate achita având menționate la explicațiile plății: - numele și prenumele complet al candidatului, - Facultatea de bază la care acesta se înscrie pentru concursul de admitere, direct în platforma on-line https://admitere.pub.ro/, cu card bancar.",
            "Anx.IV-6. Taxa de înscriere este 125 lei și se poate achita având menționate la explicațiile plății: numele și prenumele complet al candidatului, precum și Facultatea de bază la care acesta se înscrie pentru concursul de admitere, astfel: • direct în platforma on-line https://admitere.pub.ro/, cu card bancar; • prin transfer bancar (detalii privind acest mod de plată urmează a fi oferite după data de 15 decembrie 2024) Anx. IV-7. Documentele solicitate pentru scutirea plății taxei de înscriere sunt, după caz: - adeverință de angajat în sistemul de învățământ a unuia dintre părinți, eliberată de unitatea de învățământ la care acesta este angajat; - adeverințe de la centrele de plasament sau casele de copii, în cazul candidaților care provin de la un centru de plasament sau de la o casă de copii; - certificatul de deces al unui părinte, în cazul candidaților orfani de un părinte; - certificatele de deces ale părinților, în cazul candidaților orfani de ambii părinți; - dovada că este copil al eroilor martiri sau al răniților din timpul Revoluției din decembrie 1989; - dovada că este copil al unui salariat din UNSTPB; - cerere către Decanul facultății la care candidatul se înscrie la concurs (facultatea de bază), pentru scutirea de plată a taxei de înscriere însoțită de acte doveditoare care să ateste o situație materială precară, în special pentru candidații proveniți din mediul rural (cupoane de pensii din ultima lună ale părinților; adeverințe care să ateste statutul de șomer al părinților; adeverințe de venit eliberate de primăria comunei în care locuiesc părinții etc.). Anx IV - 3 Universitatea Națională de Știință și Tehnologie POLITEHNICA București Anexa V Componența dosarului de concurs la înmatriculare în Sesiunea I Anexa V. Componența dosarului de concurs la înmatriculare în Sesiunea I Anx. V-1."
        ],
        "retrieved_ids": [
            "020962287c1797917927df2a9e9c5f1c0d701b8180527b701504210f7f4b3927-1",
            "c642c14d935f4cf36dcf3277811b920052336016da4e5f53e7161b29d9d179a3-1",
            "85ab8a2001db129d9b28c1a868567dde770e21f5c8ba133a94ef4814a7badfc9-145"
        ],
        "retrieved_scores": [
            0.78082716,
            0.7823835,
            0.7809789
        ],
        "user_input": "Daca ma inscriu la mai multe facultati pot plati o singura taxa de inscriere?"
    },
    {
        "id": "b458dcc13926734d4b6e086f04c4c320024ed6549b2d0f7c78a1d355763a056f",
        "response": "Pentru a opta pentru cazare la cămin, studenții trebuie să se prezinte cu legitimația de cămin eliberată și vizată la zi de administratorul căminului. Aceasta este o condiție necesară pentru accesul în spațiile de cazare. De asemenea, este important ca studenții să se asigure că toate documentele necesare sunt actualizate și conforme cu reglementările universității.\n\nSurse:\n- Regulament acces UPB actualizat noiembrie 2022, URL: https://upb.ro/wp-content/uploads/2025/04/Regulament-acces-UPB_actualizat-noiembrie-2022-01.pdf, pagina: 4",
        "retrieved_contexts": [
            "Acces la serviciile unui interpret de limbaj mimico-gestual, dacă asistenţa sa este necesară şi solicitată de către acestea; b) cu privire la accesibilitate: Acces adaptat în în spaţiile campusului universitar (amfiteatre, săli de curs, săli de laborator/activităţi practice/seminare, biblioteci, săli de sport, spaţii de cazare, cantine etc.), conform prevederilor legale în vigoare; Acces gratuit cu autoturismul personal în campusul universitar şi loc de parcare a acestuia, după caz; Spații de cazare și grupuri sanitare adaptate nevoilor acestora, precum şi prioritate la ocuparea locurilor de cazare în căminele studenţeşti, în special a locurilor de cazare situate la parter, în clădiri adaptate accesului persoanelor cu dizabilităţi; Acces gratuit la dispozitivele/echipamentele/software-urile asistive existente în universitate pentru facilitarea desfăşurării procesului de predare-învăţare; c) privind servicii de suport: Servicii specializate gratuite de consiliere și asistență psihopedagogică/vocațională/pentru carieră, prin Centrul de Consiliere şi Orientare în Carieră al universității Servicii de asistenţă medicală, stomatologică şi psihologică gratuite în cabinetele medicale, cabinetele stomatologice din universitate, în policlinici şi unităţi spitaliceşti, conform prevederilor legale în vigoare, în limita disponibilității; Servicii de asistență în desfășurarea activităților didactice, adaptate nevoilor individuale; Însoțitor în timpul activităților didactice sau în timpul susţinerii examenelor de evaluare a cunoştinţelor, la solicitarea acestora, după caz; d) de natura financiară: Dreptul la toate categoriile de burse, inclusiv burse sociale, conform prevederilor legale în vigoare; Reducere, la cerere, cu 50% a tarifelor pentru cazare şi masă la cantinele studenţeşti ale universității; Reducere sau gratuitate, după caz, a costurilor de transport, cu respectarea prevederilor legale în vigoare; e) de natură socială: Acces la oportunităţi de învăţare, oferite de programe de mobilitate naţionale şi internaţionale, conform prevederilor legale în vigoare; Acces la activitățile nonformale/extracurriculare organizate de universitate;",
            "studenților - în spațiile de cazare/cantine, pe baza legitimației de cămin eliberată şi vizată la zi de administratorul căminului, iar în spațiile de învățământ – pe baza carnetului de student eliberat şi vizat la zi de secretariatele facultăților U.P.B; (3) personalului societăților comerciale ce dețin spații închiriate în incinta universităţii - pe baza unei legitimații/card eliberat/eliberată de către Serviciului Valorificare Resurse, în baza aprobării Directorului Direcției Dezvoltare Patrimoniu; (4) reprezentanților mass-media (redactori, reporteri, fotoreporteri, operatori, tehnicieni radio-tv etc.) - cu aprobarea conducerii universităţii - în baza documentelor de identitate și a legitimației de presă, vizată la zi; aceștia vor fi preluați de către un reprezentant al Serviciului de Relatii Publice, care îi va însoți pe toata durata șederii în incinta universității; (5) terțe persoane – numai prin zonele de acces (conf. anexei II), în baza actului de identitate și după înregistrarea în Registrul de evidență a persoanelor, constituit la fiecare punct de acces în locațiile universității. Art. 7. (1) Programul de acces pietonal în incinta universității (spațile de învațământ și administrative) este:",
            "m) asigurarea pentru întregul personal din universitate a dreptului efectuării concediului de odihnă în fiecare an calendaristic, în conformitate cu prevederilor legale; n) întocmirea evaluărilor, privind activitatea profesională a salariaţilor, conform legislaţiei în vigoare şi a reglementărilor proprii; Conducerea Universităţii, prin conducătorii structurilor organizatorice de specialitate, răspunde de funcţionarea, utilizarea şi exploatarea sigură şi fără întrerupere a instalaţiilor, utilajelor şi maşinilor cu regim de funcţionare continuu sau cu grad ridicat de pericol în exploatare, de respectarea riguroasă a disciplinei tehnologice şi aplicarea tuturor normelor privind buna desfăşurare a procesului de muncă, având obligaţia să: Regulament Intern UNIVERSITATEA POLITEHNICA DIN BUCUREȘTI a) asigure recepţionarea, punerea în funcţiune a instalaţiilor, utilajelor şi maşinilor, cu respectarea strictă a prevederilor din documentaţia tehnică de execuţie; b) asigure respectarea riguroasă a normativelor tehnice privind exploatarea instalaţiilor, utilajelor şi a maşinilor, precum şi a echipamentelor acestora, cu aparatura de măsură, control şi automatizare, verificarea şi menţinerea aparaturii în stare de perfectă funcţionare; c) asigure efectuarea operaţiunilor de întreţinere, revizii şi reparaţii, cu respectarea riguroasă a normelor şi normativelor tehnice; d) asigurare desfăşurarea procesului de muncă în condiţii de siguranţă; e) asigurare asistenţă tehnică prin personal calificat; f) asigure luarea de măsuri pentru respectarea regulilor de protecţia muncii, de prevenire şi stingere a incendiilor, dotarea locurilor de muncă cu mijloace specifice de protecţie; g) asigure personalul cu echipament de protecţie şi de lucru; h) asigure efectuarea serviciului de pază şi ordine, stabilirea de reguli stricte privind intrarea şi ieşirea din Universitate, interzicerea accesului în unitate a persoanelor care se prezintă la programul de lucru sub influenţa băuturilor alcoolice. IV. Drepturile salariaților 1. Salariatii Universitatii beneficiază de toate drepturile prevăzute în favoarea lor de legile în vigoare"
        ],
        "retrieved_ids": [
            "bcba579c444019f0d3049720ae28075e7e2d3834011a96d548acb8c751e8d95b-9",
            "5fe6fc7e457fe49fc645ddd2f88550ce3d5a2c0f3f63fa795b3a120b53c2e748-5",
            "a98a700ef6b47f46f4820a8597f1e9f15e10b6ff2acf9ea891b73ec6c83fabb0-30"
        ],
        "retrieved_scores": [
            0.6416687,
            0.6715479,
            0.6264994
        ],
        "user_input": "Cum pot opta pentru cazare la camin?"
    },
    {
        "id": "1250c48f08e08b4b9b6f1801eba454e5916be78c9f79758e4ab691dee96d4cbf",
        "response": "Structura anului universitar este aprobată de către Senatul Universității, conform dispozițiilor legale. La începutul fiecărui an universitar, facultățile au obligația de a afișa pe pagina web structura anului universitar și planurile de învățământ pentru fiecare program de studii. De asemenea, fișa disciplinei se aduce la cunoștința studentului de către cadrul didactic titular al disciplinei în cadrul primului curs/seminar al semestrului și se publică pe platforma Moodle.\n\nSurse:\n- Regulament privind organizarea și funcționarea studiilor universitare de masterat, URL: https://upb.ro/wp-content/uploads/2022/11/Regulament-privind-organizarea-si-functionarea-studiilor-universitare-de-masterat.pdf, pagina: 6",
        "retrieved_contexts": [
            "(7) Rezultatele aşteptate ale învăţării sunt corelate cu competenţele solicitate de ocupaţiile corespunzătoare, conform standardelor ocupaţionale şi/sau Clasificării Europene a Ocupaţiilor (ESCO). Art. 4. Structura anului universitar (1) Structura anului universitar este aprobată de către Senatul Universității, în conformitate cu dispozițiile art. 27 din Legea 199/2023. (2) La începutul fiecărui an universitar, facultățile au obligația afișării pe pagina web structura anului universitar și planurile de învățământ, pentru fiecare program de studii. Fișa disciplinei se aduce la cunoștința studentului de către cadrul didactic titular al disciplinei în cadrul primului curs/seminar al semestrului și se publică pe platforma Moodle. MINISTERUL EDUCAȚIEI Universitatea Naţională de Ştiinţă şi Tehnologie POLITEHNICA Bucureşti Art. 5. Calitatea de Student (1) Calitatea de student în cadrul POLITEHNICII Bucureşti se poate dobândi/redobândi prin unul din următoarele moduri: a) prin concurs de admitere; b) prin mobilitate academică definitivă de la o altă instituție de învățământ superior autorizată să funcționeze provizoriu sau acreditată din țară sau străinătate, conform prevederilor legale; c) prin reînmatriculare la aceeași facultate/domeniu/specializare pentru persoanele care au fost exmatriculate din POLITEHNICA București (în maxim 5 ani de la exmatriculare); d) prin reluarea studiilor, la aceeași facultate/domeniu/specializare unde a făcut întreruperea, pentru studenții care au fost în întrerupere de studii (1 sau 2 ani universitari); e) conform procedurilor legale pentru studenții străini. (2) Înscrierea la studii a unui student se face în baza existenţei unui contract de studii semnat de către părți (student și universitate). (3) Calitatea de student al universităţii se pierde: a) la absolvirea ciclului de studii; b) prin retragere de la studii; c) prin exmatriculare; d) pe perioada întreruperii studiilor . Art. 6. Planurile de învățământ Planurile de învățământ conțin discipline care sunt clasificate, în raport de criterii, astfel: a) după tipul disciplinei: obligatorii, opționale și facultative; b) după categoria formativă: disciplină de sinteză, disciplină de aprofundare, disciplină complementară.",
            "1. La începutul anului universitar (în primele 15 zile), studentul este obligat să completeze și să semneze Contractul anual de studii/Actul Adiţional(indiferent de regimul de studii cu sau fără taxă), document care certifică încadrarea sa în procesul de învățământ și includerea într-o formaţie de studii. 2. Prin Contractul anual de studii studentul se obligă să frecventeze și să promoveze disciplinele asumate. 3. Contractul anual de studii nu se poate modifica în timpul anului universitar în sensul modificării disciplinelor asumate din planul de învățământ. 4. Studentul care nu semnează Contractul anual de studii în perioada programată nu este înmatriculat în anul universitar respectiv. 5. În Contractul anual de studii se vor înscrie și toate disciplinele nepromovate. 6. Pentru disciplinele opționale și facultative studentul optează cel mai târziu în prima săptămână a anului universitar. 7. Disciplinele facultative se organizează în regim „cu taxă”, la cererea studenţilor, cu excepţia disciplinelor prevăzute în programul de pregătire psiho-pedagogică. 8. Nu există o limită superioară a numărului total de ECTS din Contractul anual de studii. 23 MINISTERUL EDUCAȚIEI Universitatea Naţională de Ştiinţă şi Tehnologie POLITEHNICA Bucureşti Anexa 2 Dosarul personal al studentului 1. Înscrierea studentului în registrul matricol se face pe baza dosarului personal care va cuprinde următoarele documente: fişa de înscriere de la concursul de admitere; lucrările de la concursul de admitere (dacă este cazul); • diploma de bacalaureat și foaie matricolă, în original; • diploma de licență şi și suplimentul la aceasta, în original; • diplomă echivalentă (diploma de licență emisă de un alt stat și atestatul de echivalare emis de CNRED/scrisorii de acceptare la studii) pentru studenții străini; • copie conform cu originalul după certificatul de naştere; • 2 fotografii; • adeverinţă medicală; • copie după cartea de identitate sau paşaport; • acte care atestă schimbarea numelui, în copie legalizată sau în copie conform cu originalul (dacă este cazul). 2. În perioada şcolarizării dosarul personal se completează cu următoarele documente:",
            "(1) Studentul poate accede, pe durata studiilor universitare de licenţă (începând cu anul II de studii), la începutul fiecărui an universitar, conform prevederilor legale şi reglementărilor interne, pe loc finanţat de la bugetul de stat, în limita locurilor disponibile pentru fiecare an de studii în parte la nivelul fiecărui centru universitar. (2) La începutul fiecărui an universitar, locurile disponibile finanţate de la bugetul de stat sunt redistribuite în ordinea descrescătoare a mediilor obţinute de studenţi în anul anterior. Studenții care nu au ocupat, în urma redistribuirii locurilor, un loc finanțat de la bugetul de stat vor continua studiile în regim cu taxă. (3) În cazul în care, pentru ultimul loc bugetat ce intră în procedura de redistribuire, sunt eligibili mai mulţi studenţi cu aceeaşi medie se va proceda la redistribuirea acestora pe baza unor criterii subsidiare în următoarea ordine: numărul de ECTS acumulate, media generală a anilor de studii până la momentul realizării repartizării sau media de la admitere (pentru studenţii promovaţi din anul I). În cazul în care egalitatea persistă, BExF va stabili şi alte criterii specifice de departajare. (4) Locul finanţat de la bugetul de stat de pe care titularul, din motive personale, solicită să se retragă după începerea anului universitar, până la finalizarea anului calendaristic, este redistribuit următorului student din clasamentul anului respectiv de studii, începând cu semestrul al II-lea al anului universitar. (5) Repartizarea studenţilor pe locurile finanţate de la bugetul de stat se efectuează la nivelul ramurilor de ştiinţă din fiecare facultate, fiind posibilă redistribuirea internă la nivelul fiecărei facultăţi, fără afectarea negativă a finanţării. În situaţia în care numărul locurilor finanţate de la bugetul de stat depăşeste numărul studenţilor înmatriculaţi la un anumit an de studiu (II, III sau IV) şi nu pot fi redistribuite în cadrul facultăţii respective, atunci Consiliul de Administraţie al Universităţii poate decide redistribuirea locurilor bugetate între facultăţi, la nivelul fiecărui an universitar. VI. FINALIZAREA STUDIILOR ART. 29. FINALIZAREA STUDIILOR (1) Finalizarea studiilor de licenţă în POLITEHNICA Bucureştise face prin Examen de Diplomă/Examen de Licenţă."
        ],
        "retrieved_ids": [
            "71788602578701b9e9b11da963eee9859a06e0dc3d482036b87e7c9c12f5fab5-15",
            "71788602578701b9e9b11da963eee9859a06e0dc3d482036b87e7c9c12f5fab5-36",
            "3b29b0516a0b7af978077a8daaa189c3b82dad4559940a8acebc9017b6e97310-32"
        ],
        "retrieved_scores": [
            0.8365278,
            0.8168331,
            0.81008625
        ],
        "user_input": "Care este structura unui an universitar?"
    }
]