[
    {
        "id": "38101e8f735361698b029876a423802ea797d4718c5bfaa86deafa7887b22d03",
        "user_input": "Cand are loc admiterea la licenta la ACS?",
        "retrieved_contexts": [
            "ACS optimizează orarele de master – fizic/online – în funcție de necesități, ținând cont de reglementările naționale și deciziile Senatului UPB. Admiteri anterioare Informativ, rezultatele admiterii din anii anteriori sunt disponibile aici: 2022, 2023, 2024. Programe de studii ACS oferă 25 programe de studii universitare de masterat acreditate ARACIS în domeniile: - CTI (Calculatoare și Tehnologia Informației) – 13 programe - IS (Ingineria Sistemelor) – 11 programe - IM (Inginerie și Management) – 1 program Broșura master (în curs de actualizare cu noile programe) oferă informații sintetice despre masterat și despre fiecare program. În continuarea acestei pagini sunt prezentate programele și descrierile cursurilor. Versiunea preliminară a planurilor de învățământ este disponibilă AICI. Până la începerea anului școlar pot interveni modificări minore ale planurilor de învâțământ. Calculatoare și Tehnologia Informației | Nr. crt. | Nume program master | ||| | 1. | Arhitecturi Avansate de Calculatoare | ||| | 2. | Administrarea Bazelor de Date | ||| | Catedra organizatoare: Calculatoare Responsabil: Prof.Dr.Ing. Florin Radulescu Tip: Aprofundare / Cercetare avansata Informaţii: Scurtă descriere, Plan învăţământ, Cursuri Pentru a putea urma acest program de masterat, sunt necesare studii de licență într-unul din următoarele domenii: Domeniul fundamental Stiinte ingineresti , domeniile: Calculatoare si Tehnologia Informatie (specializarile Calculatoare , Tehnologia Informatiei , Ingineria Informatiei), Inginerie electronica si telecomunicatii, Ingineria sistemelor (specializarile Automatica si informatica aplicata, Ingineria sistemelor multimedia) , Stiinte Ingineresti Aplicate (specializarile Matematica si informatica aplicata in inginerie)",
            "Acestea vor fi trimise pe mail la adresa admitere.energetica@upb.ro, iar rezultatul acestora se anunță în cel mult 24 de ore de la încheierea termenului de depunere a contestațiilor. - Faza 4 - Înmatricularea candidaților 01.07.2025 - 07.07.2025Înmatricularea candidaților - 01.07.2025-07.07.2025 Înmatricularea candidaților admiși în sesiunea de admitere anticipată se va face la secretariatul facultății, în perioada 01/07/2025-07/07/2025, în intervalul orar 9:00-16:00. Pentru înmatriculare, candidații admiși în admiterea anticipată trebuie să depună la secretariatul facultății unde au fost admiși următoarele documente: • forma fizică a fișei de înscriere; • 2 fotografii, realizată recent, color, format 3x4 cm; • diploma de bacalaureat (în original); • diploma de licență/inginer sau echivalentă acesteia; candidații care au promovat examenul de licență în sesiunea iunie-iulie 2025 pot depune la înscriere, pentru sesiunile imediat următoare, în locul diplomei de licență, adeverința de absolvire eliberată de facultate, în care se menționează atât media generală de la examenul de diplomă/licență cât și mediile generale obținute în fiecare an de studiu (în original); • foaia matricolă/suplimentul la diplomă, numai în cazul în care se depune diploma de licență/inginer (în original); • certificatul de naștere (copie conform cu originalul); • certificatul de căsătorie (dacă este cazul, copie conform cu originalul); • buletin/carte de identitate/pașaport (copie conform cu originalul); • dovada de plată a taxei de înscriere la admitere (contul în care se face plata va fi afișat pe site-ul de admitere al Universității); • dovada de plată a taxei de înmatriculare la admitere (contul în care se face plata va fi afișat pe site-ul de admitere al Universității); În caz contrar aceștia vor pierde statutul de masterand.",
            "În cadrul Sesiunii I – Admitere anticipată există 3 faze cu desfășurare succesivă – Înscriere, Admitere preliminară, Validare, confirmare, înscriere în anul I și înmatriculare admiși anticipat, după cum urmează: - Faza I – Înscriere (pe platforma on-line https://admitere.pub.ro) Începe la 15 decembrie 2024, odată cu deschiderea aplicației on-line pentru înscriere și se va termina în data de 02 iunie 2025, ora 16:00. - Faza II – Admitere preliminară Rezultatele intermediare obținute în urma evaluării dosarelor de concurs și ordonării candidaților în funcție de media generală de concurs vor fi afișate în data de 11 iunie 2025, ora 12:00. Fiecare candidat poate vizualiza rezultatul obținut în contul său din platforma on-line https://admitere.pub.ro . Eventualele contestații vor putea fi depuse on-line până la data de 12 iunie 2025, ora 12:00. Rezultatele finale privind pre-admiterea vor fi publicate la data de 16 iunie 2025, ora 12:00. - Faza III – Validare, confirmare, înscriere în anul I și înmatriculare admiși anticipat Începe în data de 02 iulie 2025, ora 08:00 și se încheie în data de 04 iulie 2025, ora 16:00. Validarea și înmatricularea implică, pentru fiecare candidat, completarea dosarului de concurs cu documentele originale solicitate și depunerea acestora la secretariatul facultății (060042 Splaiul Independenţei 313, corp J, sector 6, Bucureşti, România, Tel: 021 4029624, 0214029566, Fax: 0213181017). ATENȚIE! Pentru a deveni studenți, candidații care au fost declarați pre-admiși trebuie să obțină diploma de Bacalaureat și să se înmatriculeze între 02 și 04 iulie 2025, orele 8:00 – 16:00 la secretariatul facultății (060042 Splaiul Independenţei 313, corp J, sector 6, Bucureşti, România, Tel: 021 4029624, 0214029566, Fax: 0213181017)!",
            "Procesul de Admitere în sesiunea Septembrie la studiile universitare de masterat va începe pe data de 02.09.2024. Calendarul pentru Sesiunea III de Admitere 2024 este următorul: înscrierea candidaților: 02.09 - 13.09.2024, Concursul de admitere: 16.09 – 17.09.2024, Comunicarea rezultatelor: 16.09 – 18.09.2024, Înmatricularea candidaților: 16.09 – 20.09.2024. Admiterea se face conform Regulamentului privind organizarea și desfășurarea concursului de admitere în ciclul de studii universitare de masterat. Înscrierea la concursul de admitere pentru studiile de masterat in Sesiunea III de Admitere, sesiunea septembrie, se face online pe site-ul https://admitere.pub.ro conform regulamentului amintit. Programarea examenelor este disponibila aici.",
            "Admitere Masterat 2025 Cifra de scolarizare solicitata pentru anul universitar 2025 – 2026: – 160 locuri – Buget + granturi acordate de universitate – 20 locuri – Taxă Concursul de admitere se organizează în trei sesiuni: - înscrierea candidaṭilor: 15 decembrie 2024 – 9 mai 2025, ora 16.00; - concurs de admitere: 13 – 16 mai 2025 - comunicarea rezultatelor: 13 – 17 mai 2025 - înmatricularea candidaṭilor: 1 – 9 iulie 2025 (luni-vineri) - înscrierea candidaṭilor: 30 iunie – 7 iulie 2025, ora 16.00; - concurs de admitere: 9 – 11 iulie 2025 - comunicarea rezultatelor: 9 – 13 iulie 2025 - înmatricularea candidaṭilor: 15 – 18 iulie 2025 - înscrierea candidaṭilor: 1 – 13 septembrie 2025, ora 16.00; - concurs de admitere: 15 – 17 septembrie 2025 - comunicarea rezultatelor: 16 – 17 septembrie 2025; - înmatricularea candidaṭilor: 17 – 19 septembrie 2025. Taxa de inscriere: Cuantumul taxei de înscriere este de 100 lei pentru înscrierea la sesiunile din iulie și septembrie și de 50 lei pentru înscrierea la sesiunea anticipată şi a fost stabilit de către Senatul Universității. Taxa de inmatriculare: 50 lei Programele de studii universitare de masterat acreditate din domeniul INGINERIE ELECTRICA sunt: - ELECTRONICĂ DE PUTERE ŞI ACŢIONĂRI ELECTRICE INTELIGENTE (EPA) - INGINERIE ELECTRICĂ ŞI INFORMATICĂ APLICATĂ (IEIA) - INGINERIA PRODUSELOR ŞI SERVICIILOR ÎN ELECTROTEHNICĂ (IPSE) - SISTEME ELECTRICE AVANSATE (SEA) - SISTEME INTELIGENTE DE INSTRUMENTAŢIE ŞI MĂSURARE (SIIM) - INGINERIA SISTEMELOR ELECTRICE INTEGRATE ȊN AUTOVEHICULE (ISEIA) / INTEGRATED ELECTRICAL SYSTEMS ENGINEERING IN VEHICLES (cu predare în limba engleză) Mai multe informatii despre programele de masterat: – planuri de invatamant – ghidul masterandului – broșura programelor de masterat."
        ],
        "response": "Nu am suficiente informații pentru a răspunde la întrebare.",
        "faithfulness": "1.0"
    },
    {
        "id": "2e1c9f9b49f2bbd79f472b309feadefefae4ea7d77b4e1e2df994bb6dcdb8807",
        "user_input": "Cand are loc admiterea la licenta?",
        "retrieved_contexts": [
            "Masterat – Admitere 2025 | | Sesiunea Mai Calendar: | Înscriere: | 15 decembrie – 9 mai (ora 16): admitere.pub.ro | | Verificarea dosarelor: | 14 aprilie – 9 mai | | Concurs: | 13-16 mai (planificarea detaliată va fi afișată după finalizarea înscrierilor) | | Rezultate: | 17 mai | | Înmatriculare: | în intervalui 01-31 iulie (după obținerea licenței, conform unui calendar ce va fi afișat ulterior) | În sesiunea Mai vor fi scoase la concurs locuri la toate programele cu excepția EGOV, SCPD și SSA. Numărul orientativ de locuri scoase la concurs va fi afișat în curând. Informații generale pentru candidați Facultatea de Automatică și Calculatoare (ACS) organizează concursul de admitere în învățământul universitar de masterat, în anul 2025, în 3 sesiuni: - admitere anticipată (mai) - sesiunea iulie - sesiunea septembrie Informații generale la nivel UPB privind admiterea la masterat (calendar, regulament admitere, regulament studii etc. – in curs de actualizare): https://upb.ro/admitere/admitere-masterat/ Înscrierea la concurs se face prin intermediul platformei admitere.pub.ro. Toate informațiile specifice ACS privind concursul (modul de desfășurare a probelor, tematica, bibliografia, planificare interviuri, rezultate, înmatricularea candidaților admiși etc.) vor fi afișate pe această pagina. Concursul va consta din cele 2 probe prevăzute de regulamentul de admitere - evaluarea cunoștințelor fundamentale - evaluarea motivației candidatului Modul de desfășurare a probelor, tematica și bibliografia: - domeniul CTI - domeniile IS si IM Mod mixt (fizic + online) Standardele naționale recente de calitate pentru învățământul superior permit desfășurarea de studii în regim mixt. Pentru domeniile de master CTI, IS, IM se pot desfășura în regim online sincron maxim 60% din activitățile de curs și 35% din cele de aplicații și cercetare.",
            "** - Rezultate preliminare: 11 iunie 2025, ora 12:00 - Contestații: pot fi depuse online până la date de 12 iunie 2025, ora 12:00 - Rezultatele finale privind admiterea preliminară: 16 iunie 2025, ora 12:00 Admiterea anticipată fără concurs - Absolvenții de liceu cu diplomă de bacalaureat, care au obținut în perioada studiilor liceale distincții la olimpiadele școlare internaționale, recunoscute de Ministerul Educației și Cercetării, beneficiază de dreptul de a se înscrie, la cerere, fără susținerea concursului de admitere, în cadrul numărului de locuri/granturi alocate, în învățământul superior de stat în domenii de studiu corespunzătoare disciplinelor la care au fost distinși, putând urma, fără taxe de școlarizare, cursurile a două facultăți în instituții de învățământ superior de stat. - În plus, față de prevederile anterioare, în anul 2023, pentru obținerea statutului de pre-admis fără concurs în cadrul Facultății de Energetică, în condițiile legii și cu respectarea cadrului definit prin hotărârile Senatului UPB, vor fi luate în considerare următoarele olimpiade și concursuri (vezi Anexa VI - REGULAMENT PRIVIND ORGANIZAREA ȘI DESFĂȘURAREA CONCURSULUI DE ADMITERE ÎN CICLUL DE STUDII UNIVERSITARE DE LICENȚĂ ANUL UNIVERSITAR 2025-2026). Admiterea anticipată prin concurs Media generală de admitere (MG) se determină cu relația: - MG = (4*MC + NB)/5 (unde MC este media notelor de concurs, iar NB reprezintă nota pentru proba P3. Media notelor de concurs (MC) se calculează cu formula: - MC = (NC1 + NC2)/2 (unde notele NC1 și respectiv NC2 sunt obținute la probele de concurs P1 și respectiv P2. La proba de concurs P1 se evaluează rezultatele obținute de candidat la Matematică (M) în clasele a IX-a, a X-a și a XI-a, iar nota obținută se calculează astfel: - M = Ma = (M9 + M10 + M11)/3 sau M = Mb = (M9 + M10)/2 (în funcție de specialitatea absolvită la liceu.",
            "▪ În ziua de 18 iulie 2025, în intervalul 09:00 – 16:00, comisia locală de admitere invită telefonic, în ordinea descrescătoare a mediilor, primii candidați cu barem îndeplinit, în vederea participării la ocuparea parțială sau integrală a acestor locuri. Candidații care acceptă și confirmă prin SMS participarea, își validează dosarul și se înmatriculează în data de 19 iulie 2025, sau dacă este posibil, chiar în data de 18 iulie 2025. ▪ După finalizarea înmatriculării, Comisia centrală și Comisiile locale de admitere generează și publică listele finale cu candidații declarați admiși anticipat și înmatriculați (19 iulie, ora 18:00) Ses. II-5.65. Pentru facultățile și domeniile care organizează Sesiunea II+ și la care candidații au susținut concurs pe baza rezultatelor la activitățile școlare (dosar) (c-rs) (atât în Centrul Universitar București cât și în Centrul Universitar Pitești): ▪ În ziua de 25 iulie 2025, în intervalul 09:00 – 16:00, comisia locală de admitere invită telefonic, în ordinea descrescătoare a mediilor, primii candidați cu barem îndeplinit, în vederea participării la ocuparea parțială sau integrală a acestor locuri. Candidații care acceptă și confirmă prin SMS participarea, își validează dosarul și se înmatriculează în data de 26 iulie 2025, sau dacă este posibil, chiar în data de 25 iulie 2025. ▪ După finalizarea înmatriculării, Comisia centrală și Comisiile locale de admitere generează și publică listele finale cu candidații declarați admiși anticipat și înmatriculați (27 iulie, ora 12:00) Pag. 45 Universitatea Națională de Știință și Tehnologie POLITEHNICA București REGULAMENTUL Concursului de Admitere în Ciclul de Studii Universitare de Licență 2025 VI. SESIUNEA III – ADMITERE-COMPLETARE ȘI ALTE DISPOZIŢII FINALE Ses. III/DF-6.1. După finalizarea înmatriculării din Sesiunea II/II+, Comisia centrală și Comisiile locale de admitere stabilesc eventualele locuri vacante pentru fiecare dintre facultăți.",
            "Procesul de Admitere în sesiunea Septembrie la studiile universitare de masterat va începe pe data de 02.09.2024. Calendarul pentru Sesiunea III de Admitere 2024 este următorul: înscrierea candidaților: 02.09 - 13.09.2024, Concursul de admitere: 16.09 – 17.09.2024, Comunicarea rezultatelor: 16.09 – 18.09.2024, Înmatricularea candidaților: 16.09 – 20.09.2024. Admiterea se face conform Regulamentului privind organizarea și desfășurarea concursului de admitere în ciclul de studii universitare de masterat. Înscrierea la concursul de admitere pentru studiile de masterat in Sesiunea III de Admitere, sesiunea septembrie, se face online pe site-ul https://admitere.pub.ro conform regulamentului amintit. Programarea examenelor este disponibila aici.",
            "Acestea vor fi trimise pe mail la adresa admitere.energetica@upb.ro, iar rezultatul acestora se anunță în cel mult 24 de ore de la încheierea termenului de depunere a contestațiilor. - Faza 4 - Înmatricularea candidaților 01.07.2025 - 07.07.2025Înmatricularea candidaților - 01.07.2025-07.07.2025 Înmatricularea candidaților admiși în sesiunea de admitere anticipată se va face la secretariatul facultății, în perioada 01/07/2025-07/07/2025, în intervalul orar 9:00-16:00. Pentru înmatriculare, candidații admiși în admiterea anticipată trebuie să depună la secretariatul facultății unde au fost admiși următoarele documente: • forma fizică a fișei de înscriere; • 2 fotografii, realizată recent, color, format 3x4 cm; • diploma de bacalaureat (în original); • diploma de licență/inginer sau echivalentă acesteia; candidații care au promovat examenul de licență în sesiunea iunie-iulie 2025 pot depune la înscriere, pentru sesiunile imediat următoare, în locul diplomei de licență, adeverința de absolvire eliberată de facultate, în care se menționează atât media generală de la examenul de diplomă/licență cât și mediile generale obținute în fiecare an de studiu (în original); • foaia matricolă/suplimentul la diplomă, numai în cazul în care se depune diploma de licență/inginer (în original); • certificatul de naștere (copie conform cu originalul); • certificatul de căsătorie (dacă este cazul, copie conform cu originalul); • buletin/carte de identitate/pașaport (copie conform cu originalul); • dovada de plată a taxei de înscriere la admitere (contul în care se face plata va fi afișat pe site-ul de admitere al Universității); • dovada de plată a taxei de înmatriculare la admitere (contul în care se face plata va fi afișat pe site-ul de admitere al Universității); În caz contrar aceștia vor pierde statutul de masterand."
        ],
        "response": "Admiterea la studiile universitare de licență va avea loc conform următorului calendar: Rezultatele preliminare vor fi anunțate pe 11 iunie 2025, iar contestațiile pot fi depuse online până pe 12 iunie 2025. Rezultatele finale privind admiterea preliminară vor fi comunicate pe 16 iunie 2025. De asemenea, pentru absolvenții de liceu cu distincții la olimpiadele școlare internaționale, există posibilitatea de admitere anticipată fără concurs, în funcție de numărul de locuri disponibile. Detalii suplimentare pot fi găsite în regulamentul de admitere.\n\nSurse:\n- URL: https://energ.upb.ro/admitere/licenta/informatii-admitere",
        "faithfulness": "1.0"
    },
    {
        "id": "3ca8747b7e9c46f99f7219350c139555118397befd882e080146a60dcab44b61",
        "user_input": "Cand are loc admiterea la master?",
        "retrieved_contexts": [
            "Admitere master - informații Regulamentul privind organizarea și desfășurarea concursului de admitere în învățământul universitar de masterat anul universitar 2025-2026 poate fi consultat aici https://admitere.pub.ro/. Admitere anticipată Numarul de locuri - In curand. La sesiunea de admitere anticipată pot candida studenți într-un an terminal al studiilor de licență sau absolvenți ai unui program de studii de licență din anii anteriori, care doresc garantarea anticipată (prin pre-admitere) a unui loc pentru studii de masterat în POLITEHNICA București. Pentru validarea și înmatricularea candidaților astfel pre-admiși, promovarea examenului de Licență/Diplomă până la data prevăzută pentru înmatriculare este, conform legii, o condiție necesară. Pot candida la admiterea la studii universitare de masterat cetățenii statelor membre ale Uniunii Europene, ai statelor aparținând Spațiului Economic European și Confederației Elvețiene, în aceleași condiții prevăzute de lege pentru cetățenii români, inclusiv în ceea ce privește taxele de școlarizare. - Faza 1 - Înscriere 15.12.2024 - 09.05.2025Înscriere - 15.12.2024-9.05.2025 Pentru înscrierea la concursul de admitere în învățământul universitar de masterat în sesiunea de admitere anticipată, candidații depun online pe site-ul de admitere al universității dosarul de înscriere, care trebuie să conțină următoarele documente: a) fișa de înscriere tip, conform Anexei 2, în care vor menționa, sub semnătură electronică sau scanată și răspundere proprie, toate datele solicitate de formularul respectiv; b) certificatul de naștere; c) certificatul de căsătorie (dacă este cazul); d) situația școlară a anilor de licență anteriori anului curent în care se află sau foaia matricolă/suplimentul la diplomă în cazul în care au absolvit un program de licență într-un an anterior: e) buletin/carte de identitate/pașaport; f) dovada de plată a taxei de înscriere la admitere anticipată (contul în care se face plata va fi afișat pe site-ul de admitere al universității);",
            "Masterat – Admitere 2025 | | Sesiunea Mai Calendar: | Înscriere: | 15 decembrie – 9 mai (ora 16): admitere.pub.ro | | Verificarea dosarelor: | 14 aprilie – 9 mai | | Concurs: | 13-16 mai (planificarea detaliată va fi afișată după finalizarea înscrierilor) | | Rezultate: | 17 mai | | Înmatriculare: | în intervalui 01-31 iulie (după obținerea licenței, conform unui calendar ce va fi afișat ulterior) | În sesiunea Mai vor fi scoase la concurs locuri la toate programele cu excepția EGOV, SCPD și SSA. Numărul orientativ de locuri scoase la concurs va fi afișat în curând. Informații generale pentru candidați Facultatea de Automatică și Calculatoare (ACS) organizează concursul de admitere în învățământul universitar de masterat, în anul 2025, în 3 sesiuni: - admitere anticipată (mai) - sesiunea iulie - sesiunea septembrie Informații generale la nivel UPB privind admiterea la masterat (calendar, regulament admitere, regulament studii etc. – in curs de actualizare): https://upb.ro/admitere/admitere-masterat/ Înscrierea la concurs se face prin intermediul platformei admitere.pub.ro. Toate informațiile specifice ACS privind concursul (modul de desfășurare a probelor, tematica, bibliografia, planificare interviuri, rezultate, înmatricularea candidaților admiși etc.) vor fi afișate pe această pagina. Concursul va consta din cele 2 probe prevăzute de regulamentul de admitere - evaluarea cunoștințelor fundamentale - evaluarea motivației candidatului Modul de desfășurare a probelor, tematica și bibliografia: - domeniul CTI - domeniile IS si IM Mod mixt (fizic + online) Standardele naționale recente de calitate pentru învățământul superior permit desfășurarea de studii în regim mixt. Pentru domeniile de master CTI, IS, IM se pot desfășura în regim online sincron maxim 60% din activitățile de curs și 35% din cele de aplicații și cercetare.",
            "Admitere master Admitere Master 2025 << Regulament admitere master 2025 >> Concursul de admitere în învățământul universitar de masterat în anul universitar 2025 – 2026 se desfășoară conform Regulamentului privind organizarea și desfășurarea concursului de admitere în învățământul de masterat în POLITEHNICA București. Concursul de admitere se organizează în trei sesiuni:",
            "** - Rezultate preliminare: 11 iunie 2025, ora 12:00 - Contestații: pot fi depuse online până la date de 12 iunie 2025, ora 12:00 - Rezultatele finale privind admiterea preliminară: 16 iunie 2025, ora 12:00 Admiterea anticipată fără concurs - Absolvenții de liceu cu diplomă de bacalaureat, care au obținut în perioada studiilor liceale distincții la olimpiadele școlare internaționale, recunoscute de Ministerul Educației și Cercetării, beneficiază de dreptul de a se înscrie, la cerere, fără susținerea concursului de admitere, în cadrul numărului de locuri/granturi alocate, în învățământul superior de stat în domenii de studiu corespunzătoare disciplinelor la care au fost distinși, putând urma, fără taxe de școlarizare, cursurile a două facultăți în instituții de învățământ superior de stat. - În plus, față de prevederile anterioare, în anul 2023, pentru obținerea statutului de pre-admis fără concurs în cadrul Facultății de Energetică, în condițiile legii și cu respectarea cadrului definit prin hotărârile Senatului UPB, vor fi luate în considerare următoarele olimpiade și concursuri (vezi Anexa VI - REGULAMENT PRIVIND ORGANIZAREA ȘI DESFĂȘURAREA CONCURSULUI DE ADMITERE ÎN CICLUL DE STUDII UNIVERSITARE DE LICENȚĂ ANUL UNIVERSITAR 2025-2026). Admiterea anticipată prin concurs Media generală de admitere (MG) se determină cu relația: - MG = (4*MC + NB)/5 (unde MC este media notelor de concurs, iar NB reprezintă nota pentru proba P3. Media notelor de concurs (MC) se calculează cu formula: - MC = (NC1 + NC2)/2 (unde notele NC1 și respectiv NC2 sunt obținute la probele de concurs P1 și respectiv P2. La proba de concurs P1 se evaluează rezultatele obținute de candidat la Matematică (M) în clasele a IX-a, a X-a și a XI-a, iar nota obținută se calculează astfel: - M = Ma = (M9 + M10 + M11)/3 sau M = Mb = (M9 + M10)/2 (în funcție de specialitatea absolvită la liceu.",
            "Procesul de Admitere în sesiunea Septembrie la studiile universitare de masterat va începe pe data de 02.09.2024. Calendarul pentru Sesiunea III de Admitere 2024 este următorul: înscrierea candidaților: 02.09 - 13.09.2024, Concursul de admitere: 16.09 – 17.09.2024, Comunicarea rezultatelor: 16.09 – 18.09.2024, Înmatricularea candidaților: 16.09 – 20.09.2024. Admiterea se face conform Regulamentului privind organizarea și desfășurarea concursului de admitere în ciclul de studii universitare de masterat. Înscrierea la concursul de admitere pentru studiile de masterat in Sesiunea III de Admitere, sesiunea septembrie, se face online pe site-ul https://admitere.pub.ro conform regulamentului amintit. Programarea examenelor este disponibila aici."
        ],
        "response": "Admiterea la studiile universitare de masterat se desfășoară în anul universitar 2025-2026 în trei sesiuni: \n\n1. **Sesiunea de admitere anticipată**: \n   - Înscriere: 15 decembrie 2024 - 9 mai 2025 \n   - Concurs: 13-16 mai 2025 \n   - Rezultate: 17 mai 2025 \n   - Înmatriculare: 01-31 iulie 2025 \n\n2. **Sesiunea iulie**: Detalii specifice nu sunt menționate, dar se va desfășura conform regulamentului. \n\n3. **Sesiunea de admitere în septembrie**: \n   - Înscriere: 02 septembrie - 13 septembrie 2024 \n   - Concurs: 16 septembrie - 17 septembrie 2024 \n   - Comunicarea rezultatelor: 16 septembrie - 18 septembrie 2024 \n   - Înmatricularea candidaților: 16 septembrie - 20 septembrie 2024. \n\nToate informațiile specifice privind admiterea pot fi consultate pe site-ul oficial al universității.\n\nSurse:\n- URL: https://chimie.upb.ro/admitere/programe-de-studii-de-masterat/\n- URL: https://acs.pub.ro/admitere/masterat/",
        "faithfulness": "0.8823529411764706"
    },
    {
        "id": "6c72d75e4f0f1cc503f821c82ff91eb588c8feddb36ae6289c925f87219410b0",
        "user_input": "Cand are loc admiterea la doctorat?",
        "retrieved_contexts": [
            "Admitere doctorat Admiterea la studiile universitare de doctorat se organizează continuu în perioada Aprilie-Septembrie 2022, conform Metodologiei privind organizarea şi desfăşurarea concursului de admitere la doctorat în anul universitar 2022- 2023 Admiterea la doctorat se organizează la nivelul Şcolii doctorale de Inginerie Energetică (SDIEn) pentru domeniul de Inginerie energetică. Informațiile despre admiterea la studii universitare de doctorat se găsesc la adresa http://doctorat.energetica.upb.ro/admitere.html",
            "Această sesiune de admitere la studii universitare de doctorat se adresează, cu precădere, absolvenților UPB de masterat care își prezintă DISERTAȚIA în perioada 27 iunie - 3 iulie 2016. Sesiunea a II-a 5 - 30 septembrie 2016 - 5 - 27 septembrie 2016: înscrierea candidaților (taxa de înscriere este de 200 lei). - 28 - 30 septembrie 2016: susținerea probei de concurs, afișarea rezultatelor, încheierea contractelor de studii doctorale. Comisiile pentru Admiterea la Studii universitare de doctorat 2016 Formularele completate și celelalte documente necesare la înscriere se depun la Biroul Doctorate/ Secretariatul Școlii Doctorale IMST, Rectorat UPB, camera R 308. Metodologia de admitere, formularele de înscriere (anexele 2, 3) și alte date sunt prezentate mai jos, precum și la: http://www.upb.ro/admitere-doctorat.html | FORMULARE | | | Cerere | Metodologia de admitere | | Fișă de înscriere | Conducători științifici de doctorat | | Locuri repartizate pe școli doctorale | Admitere Doctorat 2015 Rezultate colocviu admitere doctorat 2015 - Candidații admiși la studii universitare de doctorat – cu bursa - Candidații admiși la studii universitare de doctorat – fara bursa - Candidații admiși la studii universitare de doctorat – cu taxa Admiterea la studii universitare de doctorat se organizează in sesiunea septembrie-octombrie, în conformitate cu următorul program: Susţinerea probei de specialitate, validarea rezultatelor concursului, semnarea contractelor de studii doctorale şi înscrierea doctoranzilor - conform planificarii (vezi mai jos). Susţinerea probei de specialitate, validarea rezultatelor concursului, semnarea contractelor de studii doctorale şi înscrierea doctoranzilor - 12 octombrie 2015. COLOCVIUL DE ADMITERE LA DOCTORAT Etapa a II a | | Departamentul de Masini si Sisteme de Productie | |",
            "(3) La sfârşitul fiecărei luni se afişează în platforma de admitere a universității cât și pe website-ul şcolii doctorale rezultatul evaluării de către conducătorul de doctorat prin ADMIS/RESPINS (cu protejarea datelor cu caracter personal, conform GDPR). (4) Admiterea la studiile universitare de doctorat se organizează continuu în perioada Decembrie 2024 - Septembrie 2025. (5) Comisia/comisiile de evaluare, constituită/constituite la nivelul fiecărei şcoli doctorale, stabileşte/stabilesc ordinea finală a candidaţilor pe locuri bugetate/cu taxă cât şi candidaţii care au obţinut bursă, la finalul perioadei de admitere, în luna septembrie. Art. 5. CONTESTAȚII (1) Eventualele contestaţii privind rezultatul evaluării pentru admiterea la doctorat se depun electronic, în termen de 24 de ore de la afişarea rezultatelor, la secretariatul Şcolii doctorale unde s-a realizat înscrierea. (2) Directorul Şcolii doctorale numește, în termen de 24 de ore de la înregistrarea contestaţiei, o comisie de contestație pentru rezolvarea acesteia, alcătuită din 3 conducatori de doctorat din care nu face parte conducatorul de doctorat care a realizat inițial evaluarea. (3) Comisia trebuie să rezolve contestaţia în termen de 24 de ore de la numire, să opereze eventualele modificări în listele cu rezultatele concursului de admitere la doctorat şi să comunice candidatului rezultatul, electronic. (4) După expirarea termenului de rezolvare și de răspuns la contestații, decizia comisiei responsabilă cu analiza şi soluţionarea contestaţiilor este definitivă și nu mai poate fi modificată. Art. 6. DISPOZIŢII FINALE (1) Listele cu rezultatele finale ale concursului de admitere la doctorat inclusiv listele cu bursierii sunt întocmite în luna Septembrie 2025, fiind validate prin semnare de către Directorul Şcolii doctorale şi Directorul CSUD POLITEHNICA Bucureşti şi afişate apoi pe site- ul sau pagina web a Şcolii doctorale.",
            "Doctorat Admitere doctorat Calendar admitere doctorat | 1 aprilie – 20 septembrie 2024 | Înscrierea, validarea dosarului și admiterea candidaților. Platformă înscriere candidați: https://admitere.pub.ro. | | 26 aprilie 2024 29 mai 2024 26 iunie 2024 24 iulie 2024 28 august 2024 20 septembrie 2024, 16:00 | Validarea dosarelor de către secretariatul SD-AC. Evaluarea dosarelor de către conducătorii de doctorat. | | 30 aprilie 2024 31 mai 2024 28 iunie 2024 26 iulie 2024 30 august 2024 23 septembrie 2024 | Rezultate evaluare și acordarea calificativului Admis/Respins. [Rezultate aprilie 2024] [Rezultate mai 2024] [Rezultate iunie 2024] [Rezultate iulie 2024] [Rezultate august 2024] [Rezultate septembrie 2024] | | 25-26 septembrie 2024 | Evaluarea candidaților declarați admiși (interviu oral) de către Comisia de admitere și alocarea burselor MEN în baza ierarhiei stabilite. [Listă finală admitere și burse] | | 30 septembrie 2024 | Înmatricularea candidaților declarați admiși. [Rezultate finale] | | 1 octombrie 2024 | Începerea stagiului doctoral. | Legislație și regulament admitere SD-AC organizează ocuparea locurilor disponibile pe bază de concurs conform următoarelor reglementări: - Metodologia privind organizarea și desfășurarea concursului de admitere la doctorat a Instituției Organizatoare de Studii Universitare de Doctorat IOSUD – UPB [link]. - Regulamentul de funcționare al Școlii Doctorale de Automatică și Calculatoare [link]. Admiterea la doctorat se face în limita locurilor alocate anual de: - Ministerul Educației pentru doctoratul în regim de finanțare de la bugetul de stat sub formă de granturi doctorale. - UPB, în calitate de Instituție Organizatoare de Studii Universitare de Doctorat, pentru doctoratul în regim cu taxă, care este suportată de către doctorand. Cuantumul taxelor este publicat aici [link].",
            "(21) Pentru anul universitar 2025-2026, POLITEHNICA Bucureşti organizează concurs de admitere la studiile universitare de doctorat pentru domeniile de doctorat precizate în Anexa 1, care este parte integrantă a acestei Metodologii. (22) Admiterea la doctorat se face în limita locurilor alocate anual de: a) Ministerul Educației pentru doctoratul în regim de finanțare de la bugetul de stat sub formă de granturi doctorale; b) POLITEHNICA Bucureşti, în calitate de Instituție Organizatoare de Studii Universitare de Doctorat (IOSUD) , pentru doctoratul în regim cu taxă. (23) Ocuparea locurilor în regim cu taxă, se confirmă prin achitarea primei rate a taxei de studii şi încheierea contractului de studii. (24) Pe baza granturilor alocate CSUD propune spre aprobare Consiliului de Administraţie distribuţia pe Şcoli doctorale a numărului de locuri pe regimuri de finanţare (de la bugetul de stat sau cu taxă). (25) Costurile aferente depășirii duratei normale a studiilor doctorale finanțate de la bugetul de stat se suportă de către doctoranzi prin plata taxei anuale de studii doctorale stabilite de Senatul POLITEHNICA Bucureşti. Art. 3. ÎNSCRIEREA CANDIDAŢILOR (1) Absolvenții cu diplomă ai învățământului universitar de lungă durată au dreptul să participe la concursul de admitere la doctorat fără a fi absolvit un ciclu de studii aprofundate sau de masterat. (2) Înscrierea la concursul de admitere într-un domeniu de doctorat se poate face indiferent de domeniul în care candidatul a obținut diploma de finalizare a învățământului universitar de lungă durată, de studii aprofundate sau de masterat. (3) Doctoranzii exmatriculați au dreptul să participe la un nou concurs de admitere la doctorat numai pe locurile alocate în regim cu taxă. (4) Candidații depun online dosarul de înscriere în platforma www.admitere.pub.ro, în perioada Decembrie 2024 – Septembrie 2025, dosar care trebuie să conțină următoarele documente: a) Cerere de înscriere (Anexa 2). b) Curriculum vitae. c) Lista de lucrări publicate."
        ],
        "response": "Admiterea la doctorat pentru anul 2024 se va desfășura în perioada 1 aprilie – 20 septembrie 2024. În această perioadă, candidații vor putea să se înscrie, iar validarea dosarului și evaluarea acestora vor avea loc în intervale specifice, culminând cu evaluarea candidaților admiși prin interviu oral în perioada 25-26 septembrie 2024. Înmatricularea candidaților declarați admiși va avea loc pe 30 septembrie 2024, iar stagiul doctoral va începe pe 1 octombrie 2024.\n\nSurse:\n- URL: https://acs.pub.ro/admitere/doctorat/",
        "faithfulness": "0.8571428571428571"
    },
    {
        "id": "7d88f9ee509179deb581d6e5d1aa3d593f5f834c45d79b9e7e5c86d0f69f42cb",
        "user_input": "Ce documente sunt necesare pentru inmatriculare?",
        "retrieved_contexts": [
            "1. Diploma de Bacalaureat însoțită de foaia matricolă (în original – rămâne la dosar); PP 2. Certificat de naștere (în original – copie la dosar); 3. Carte de identitate sau pașaport (în original – copie la dosar); 4. 3 fotografii color – dimensiune 3x4 cm (rămân la dosar); 5. Documente care să ateste rezultatele obținute la concursurile considerate la înscriere (în original – copie la dosar) ; 6. Dovada achitării taxei de înscriere sau dovada scutirii de plata taxei (în original – rămâne la dosar); 7. Cerere de înscriere semnată (în original – rămâne la dosar); 8. Declarație pe proprie răspundere semnată privind veridicitatea documentelor (în original – rămâne la dosar); 9. Adeverință medicală (în original – rămâne la dosar); 10. Dovada achitării taxei de înmatriculare (în original – rămâne la dosar). Taxa de înmatriculare este 50 lei și se poate plăti în aceleași modalități ca și taxa de înscriere",
            "- Foaia matricolă/suplimentul la diplomă, numai în cazul în care se depune diploma de licență/inginer; - Certificat de naștere; - Certificat de căsătorie (daca este cazul); - Buletin/carte de identitate/pașaport; - Dovada de plată a taxei de înscriere la admitere anticipată (50 lei – contul în care se face plata va fi afișat pe site-ul de admitere al universității); - Declarație pe propria răspundere (inclusă în Anexa 2* prin care candidatul declară că nu a mai beneficiat anterior de un loc bugetat la studii universitare de masterat dacă candidează pe un loc fără taxă; - Pentru candidații străini care se înscriu la concurs pentru admiterea la programele cu predare în limba română este necesară dovada de competență lingvistică pentru limba română eliberată de către instituții abilitate ale Ministerului Educației. Prin excepție, candidații care sunt studenți într-un an terminal la studii de licență în POLITEHNICA București în anul universitar 2024-2025 nu trebuie să depună documentele specificate la punctele (b)-(d). * Anexa 2 este generată automat de platforma on-line de înscriere (https://admitere.pub.ro/) Concursul de admitere la studii universitare de masterat constă din două probe: a) Proba 1 – o probă orală de evaluare a cunoștințelor fundamentale ale candidatului, desfășurată cu prezență fizică, cu subiecte dintr-o bibliografie anunțată sau de tip interviu, și corespunde mediei MA a notelor date de membrii comisiei de admitere a programului de masterat la care este înscris candidatul; b) Proba 2 – o probă orală de evaluare a motivației candidatului pentru urmarea programului de studiu, desfășurată cu prezență fizică, care corespunde mediei MB a notelor date de membrii comisiei de admitere a programului de masterat la care este înscris candidatul.",
            "(a) Fişă de înscriere (tip, conform Anexei 2*); (b) Diploma de bacalaureat; (c) Diploma de licență / inginer sau echivalentă acesteia; (d) Foaia matricolă / suplimentul la diplomă; (e) Certificat de naștere; (f) Certificat de căsătorie (dacă este cazul); (g) Buletin / carte de identitate / pașaport; (h) Dovada de plată a taxei de înscriere la admitere anticipată (50 lei); (i) Declarație pe propria răspundere (inclusă in Anexa 2*); (j) Dovada de competență lingvistică pentru limba română (pt. candidații străini) - programe predare lb. română. Prin excepție, candidații care sunt studenți într-un an terminal la studii de licență în POLITEHNICA București în anul universitar 2024-2025 nu trebuie să depună documentele specificate la punctele (b) - (d). * Anexa 2 este generată automat de platforma on-line de înscriere (https://admitere.pub.ro/)",
            "d) Documente copii conform cu originalul (la semnarea contractului de studii doctorale vor aduce documentele în original): - diplome de absolvire (licență, masterat, lungă durată); Metodologie admitere la doctorat 2025 suplimente la diplomă (licență, masterat); - diploma de bacalaureat; - certificat de naștere; - certificat de căsătorie sau alt act de schimbare a numelui (unde este cazul); e) Dovada privind plata taxei de înscriere care se poate achita și online; f) Copie buletin/carte identitate. g) Declarație pe propria răspundere că nu a mai beneficiat anterior de un loc bugetat la studii universitare de doctorat (Anexa 4) h) Propunerea de tematică pentru studiile doctorale (PhD proposal) în limba română sau în limba engleză (Anexa 5) i) Scrisoare de recomandare de la un expert în domeniu. (5) Candidaţii care absolvă în cursul anului 2025 sau înainte de acest an un program de masterat în POLITEHNICA Bucureşti vor depune online numai documentele menţionate la punctele a), b), c), e), f), g), h) şi i). (6) Valoarea taxei de înscriere la concursul de admitere la doctorat este de 200 RON, cu excepția candidaților care au absolvit un program de masterat în POLITEHNICA Bucureşti pentru care taxa de înscriere este de 100 RON. (7) Potrivit legii, copiii personalului didactic și didactic auxiliar aflat în activitate sau pensionat sunt scutiţi de plata taxelor de înscriere la concursul de admitere la studii universitare de doctorat și beneficiază de gratuitate la cazare în cămine. (8) Scutirea de la plata acestor taxe se face numai pe baza documentelor doveditoare prezentate de candidați, respectiv adeverinţă de salariat sau decizia de pensionare a părintelui cadru didactic. (9) Beneficiază de aceleași drepturi prevăzute la alin. (7), persoanele aflate în risc de a-și pierde capacitatea de satisfacere a nevoilor zilnice de trai din cauza unor situații de boală, dizabilitate, sărăcie, în baza declarației pe propria răspundere.",
            "f) certificatul de căsătorie (dacă este cazul); g) buletin/carte de identitate/pașaport; h) dovada de plată a taxei de înscriere la admitere (contul în care se face plata va fi afișat pe site- ul de admitere al universității); i) declarație pe propria răspundere (inclusă in Anexa 1) prin care candidatul declară că nu a mai beneficiat anterior de un loc bugetat la studii de masterat dacă candidează pe un loc fără taxă; Prin excepție, candidații care au promovat examenul de licență în POLITEHNICA București în sesiunile corespunzătoare anului universitar 2024-2025 nu trebuie să depună documentele specificate la punctele (b)- (d) și (f). (3) Pentru înscrierea la concursul de admitere în învățământul universitar de masterat în sesiunea de admitere anticipată, candidații depun online pe site-ul de admitere al universității1 dosarul de înscriere, care trebuie să conțină următoarele documente: a) fișa de înscriere tip3, conform Anexei 2, în care vor menționa, sub semnătură electronică sau scanată și răspundere proprie, toate datele solicitate de formularul respectiv; b) certificatul de naștere; c) certificatul de căsătorie (dacă este cazul); d) situația școlară a anilor de licență anteriori anului curent în care se află sau foaia matricolă/suplimentul la diplomă în cazul în care au absolvit un program de licență într-un an anterior: e) buletin/carte de identitate/pașaport; f) dovada de plată a taxei de înscriere la admitere anticipată (contul în care se face plata va fi afișat pe site-ul de admitere al universității); g) declarație pe propria răspundere (inclusă in Anexa 2) prin care candidatul declară că nu a mai beneficiat anterior de un loc bugetat la studii universitare de masterat dacă candidează pe un loc fără taxă;"
        ],
        "response": "Pentru înmatricularea la studii universitare de masterat, candidații trebuie să depună următoarele documente:\n\n1. **Fișa de înscriere** (tip, conform Anexei 2);\n2. **Diploma de bacalaureat**;\n3. **Diploma de licență / inginer** sau echivalentă acesteia;\n4. **Foaia matricolă / suplimentul la diplomă**;\n5. **Certificat de naștere**;\n6. **Certificat de căsătorie** (dacă este cazul);\n7. **Buletin / carte de identitate / pașaport**;\n8. **Dovada de plată a taxei de înscriere** la admitere anticipată (50 lei);\n9. **Declarație pe propria răspundere** (inclusă în Anexa 2);\n10. **Dovada de competență lingvistică** pentru limba română (pentru candidații străini, în cazul programelor cu predare în limba română).\n\nEste important de menționat că, prin excepție, candidații care sunt studenți într-un an terminal la studii de licență în POLITEHNICA București în anul universitar 2024-2025 nu trebuie să depună documentele specificate la punctele 2-4. \n\nPentru înscrierea la concursul de admitere în învățământul universitar de doctorat, documentele necesare includ:\n1. **Diplome de absolvire** (licență, masterat);\n2. **Diploma de bacalaureat**;\n3. **Certificat de naștere**;\n4. **Certificat de căsătorie** sau alt act de schimbare a numelui (unde este cazul);\n5. **Dovada privind plata taxei de înscriere**;\n6. **Copie buletin/carte identitate**;\n7. **Declarație pe propria răspundere** că nu a mai beneficiat anterior de un loc bugetat la studii universitare de doctorat;\n8. **Propunerea de tematică pentru studiile doctorale** (PhD proposal);\n9. **Scrisoare de recomandare** de la un expert în domeniu.\n\nCandidații care absolvă în cursul anului 2025 sau înainte de acest an un program de masterat în POLITEHNICA București vor depune online numai documentele menționate la punctele a), b), c), e), f), g), h) și i).\n\nSurse:\n- Pliant Admitere Anticipată Master 2025, URL: https://www.sim.upb.ro/wp-content/uploads/2021/01/pdf/Licenta_Planuri/adm/mas/Pliant_Admitere_Anticipata_Master_2025.pdf, pagina: 2\n- Metodologie admitere doctorat 2025-2026, URL: https://upb.ro/wp-content/uploads/2024/12/Metodologie-admitere-doctorat-2025-2026.pdf, pagina: 4\n- Regulament admitere masterat 2025-2026, URL: https://upb.ro/wp-content/uploads/2024/12/Regulament-admitere-masterat-2025-2026.pdf, pagina: 4",
        "faithfulness": "0.8928571428571429"
    },
    {
        "id": "adab32f724fb757c2dd33e8958c46df1de70c312ba686b37fb998e1232182b44",
        "user_input": "Ce documente sunt necesare pentru inscrierea la examenul de admitere?",
        "retrieved_contexts": [
            "Pentru candidații admiși preliminar toate acțiunile din Faza III se desfășoară la facultatea la care s-a înscris și a fost admis. Ses. II-5.57. La facultatea la care a fost admis preliminar: 1. Candidații care s-au înscris on line completează personal dosarul fizic de admitere ce conține documentele menționate în Anexa VII. Acestea sunt în cea mai mare parte originalele documentelor solicitate electronic în timpul înscrierii on-line. Comisia locală de admitere analizează și după caz validează dosarul de admitere. Candidații care s-au înscris direct la secretariatele facultăților au deja dosarul complet și validat. 2. Candidații cu dosarul de admitere completat și validat confirmă dorința de a ocupa locul obținut preliminar prin: • Completarea cererii de înscriere în anul I; • Depunerea diplomei de Bacalaureat în original dacă a obținut un loc finanțat de la buget; • Plata on-line a 500*** 8 lei din taxa de școlarizare (aproximativ ¼ din 7F taxa de școlarizare pentru primul semestru) dacă a fost admis pe un loc cu taxă; • Plata on-line a taxei de înmatriculare în anul I (50lei); 3. În continuare, dacă un candidat care a parcurs cu succes confirmarea locului obținut nu dorește să participe la glisare (internă) în etapa II, el • Rămâne cu locul deja confirmat; • Semnează contractul de studii. Dacă însă, suplimentar, el dorește să participe la glisare (internă) în conformitate cu opțiunile de la înscriere, atunci: • Marchează pe cererea de înscriere că dorește să participe la glisare și confirmă astfel că este de acord să fie promovat pe un loc dintr-o triadă FaDoFi superioră (de la facultatea la care a fost declarat admis) în ierarhia sa de opțiuni, caz în care va fi înscris la noul domeniu și/sau după caz noua formă de finanțare. În acest caz se activează clauzele de modificare automată (în urma glisării interne) a cererii de înscriere;",
            "Validarea și înmatricularea se realizează personal sau prin procură notarială, la sediul facultății la care candidatul a fost declarat pre-admis sau, după caz, pre- admis fără concurs. Ses. I-4.54. Validarea implică completarea dosarului fizic de admitere ce conține documentele menționate în Anexa V. Acestea sunt, în cea mai mare parte, originalele documentelor solicitate electronic în timpul înscrierii on-line la care se adaugă documentele ce atestă absolvirea liceului, promovarea examenului de Bacalaureat și cele ce permit verificarea identității candidatului. Ses. I-4.55. La facultatea la care a fost pre-admis preliminar, în perioada 02-iulie 2025 – 04 iulie 2025: 1. Candidatul completează personal dosarul fizic de admitere. Comisia locală de admitere analizează și, după caz, validează dosarul de admitere. 2. Candidatul cu dosarul de admitere completat și validat confirmă dorința de a ocupa locul obținut preliminar prin: • Cererea de înscriere în anul I; • Depunerea diplomei de Bacalaureat în original; • Plata on-line a taxei de înmatriculare în anul I; Pag. 32 Universitatea Națională de Știință și Tehnologie POLITEHNICA București REGULAMENTUL Concursului de Admitere în Ciclul de Studii Universitare de Licență 2025 3. În continuare, dacă un candidat care a parcurs cu succes validarea dosarului de admitere și confirmarea locului obținut nu dorește să participe la glisarea internă, el rămâne cu locul deja confirmat. Dacă însă, suplimentar, el dorește să participe la glisare în conformitate cu opțiunile de la înscriere, atunci: • Marchează pe cererea de înscriere că dorește să participe la glisare și confirmă astfel că este de acord să fie eventual promovat, în conformitate cu rezultatul glisării, pe un loc superior în ierarhia sa de opțiuni (caz în care va fi înscris la noul domeniu); Ses. I-4.56. În conformitate cu Art.46 din Ordinul 3693/2024, la înmatriculare, candidații semnează contractul de studii (varianta cadru). Ses. I-4.57.",
            "• cereri în urma cărora studentul a beneficiat de sesiuni prelungite; • certificate medicale (dacă este cazul); • contracte de burse private; • contracte/adeverinţe voluntariat • documente din mobilităţile efectuate pe durata studiilor. 3. După finalizarea studiilor o parte din documente se depun la Serviciul Acte de Studii pentru întocmirea actelor de studii, iar restul documentelor rămân la dosarul personal care este depus la Arhivă. 4. (1) Secretariatul facultăţii eliberează studentului înmatriculat legitimaţia de student şi carnetul de student, în care se înscriu notele de la examene sau de la celelalte forme de verificare a cunoştinţelor, pe toată durata şcolarizării. La începutul fiecărui an universitar, după înscrierea MINISTERUL EDUCAȚIEI Universitatea Naţională de Ştiinţă şi Tehnologie POLITEHNICA Bucureşti studentului în anul respectiv de studii, acesta este obligat să prezinte, pentru viză, documentele menționate şi să anunţe eventualele modificări care au intervenit faţă de anul precedent. De asemenea, tot la începutul anului universitar, se vor stabili studentului eventualele diferenţe sau refaceri de discipline (2) În documentele studentului nu sunt admise corecturi, ştersături sau înscrieri de datenereale, acestea constituind falsuri în acte publice şi se sancţionează penal, conform legii. (3) Toate documentele din dosarul personal al studentului sunt cofidenţiale, iar prelucrarea lor se realizează cu respectarea prevederilor Regulamentului (UE) 2016/679 GDPR. (4) În cazul în care studentul pierde documentele personale (carnet de student, legitimație de student etc.), se eliberează duplicate, după publicarea în presă a anunțului privind pierderea acestora, pe baza unei cereri de asumare și a dovezii achitării taxelor aferente. (5) În caz de mobilitate definitivă (transfer), întrerupere de studii, retragere definitivă sau exmatriculare, secretariatul facultăţii îi retrage studentului legitimaţia de studentşi carnetul de student, care se vor păstra la dosarul personal al studentului, iar prezentarea fişei de lichidare completată la toate rubricile este obligatorie. (6) Studenții își vor putea ridica acte din dosarul personal numai în urma prezentării la Secretariatul facultății a Fișei de lichidare.",
            "Validarea dosarului de concurs, Confirmarea locului obținut preliminar, Participarea opțională la glisare și depunerea documentelor pentru înmatriculare se realizează personal sau prin împuternicire notarială la sediul facultății la care candidatul a fost declarat pre-admis. Sunt necesare următoarele documente: Pentru toți candidații",
            "Anx.VII-8. Pentru candidații care sunt deja absolvenți (cu sau fără diplomă) ai unei instituții de învățământ superior și doresc să se înscrie la concursul de admitere în 2025 pentru a se școlariza într-un alt domeniu sunt necesare documentele specificate în tabelul Anx. VII-7 la care se mai adaugă și documentele din tabelul de mai jos"
        ],
        "response": "Pentru înscrierea la examenul de admitere, candidații trebuie să prezinte următoarele documente:\n\n1. Cererea de înscriere în anul I.\n2. Diploma de Bacalaureat în original (dacă a obținut un loc finanțat de la buget).\n3. Plata on-line a taxei de înmatriculare în anul I (50 lei).\n4. Documentele care atestă absolvirea liceului și promovarea examenului de Bacalaureat.\n5. Documentele ce permit verificarea identității candidatului.\n\nAceste documente sunt necesare pentru completarea dosarului fizic de admitere, care va fi analizat și validat de comisia locală de admitere.\n\nSurse:\n- Regulament admitere licență 2025, URL: https://upb.ro/wp-content/uploads/2024/12/Regulament_admitere_licenta_2025.pdf, pagina: 32",
        "faithfulness": "0.8888888888888888"
    },
    {
        "id": "80046228f002577aae06d394d601da2173ffc076b07a149f7118976b9fea381d",
        "user_input": "Cate locuri sunt disponibile pentru admiterea la ACS?",
        "retrieved_contexts": [
            "ACS optimizează orarele de master – fizic/online – în funcție de necesități, ținând cont de reglementările naționale și deciziile Senatului UPB. Admiteri anterioare Informativ, rezultatele admiterii din anii anteriori sunt disponibile aici: 2022, 2023, 2024. Programe de studii ACS oferă 25 programe de studii universitare de masterat acreditate ARACIS în domeniile: - CTI (Calculatoare și Tehnologia Informației) – 13 programe - IS (Ingineria Sistemelor) – 11 programe - IM (Inginerie și Management) – 1 program Broșura master (în curs de actualizare cu noile programe) oferă informații sintetice despre masterat și despre fiecare program. În continuarea acestei pagini sunt prezentate programele și descrierile cursurilor. Versiunea preliminară a planurilor de învățământ este disponibilă AICI. Până la începerea anului școlar pot interveni modificări minore ale planurilor de învâțământ. Calculatoare și Tehnologia Informației | Nr. crt. | Nume program master | ||| | 1. | Arhitecturi Avansate de Calculatoare | ||| | 2. | Administrarea Bazelor de Date | ||| | Catedra organizatoare: Calculatoare Responsabil: Prof.Dr.Ing. Florin Radulescu Tip: Aprofundare / Cercetare avansata Informaţii: Scurtă descriere, Plan învăţământ, Cursuri Pentru a putea urma acest program de masterat, sunt necesare studii de licență într-unul din următoarele domenii: Domeniul fundamental Stiinte ingineresti , domeniile: Calculatoare si Tehnologia Informatie (specializarile Calculatoare , Tehnologia Informatiei , Ingineria Informatiei), Inginerie electronica si telecomunicatii, Ingineria sistemelor (specializarile Automatica si informatica aplicata, Ingineria sistemelor multimedia) , Stiinte Ingineresti Aplicate (specializarile Matematica si informatica aplicata in inginerie)",
            "Regulament [Link] Către platforma de inscriere Programele de master ale FSA (domeniul: Ştiințe Inginerești Aplicate) Număr de locuri disponibile: - 100 Buget - 20 Taxă Calendarul sesiunilor de admitere: Sesiunea I Admitere anticipată - Înscrierea candidaților: 15.12.2024 – 10.05.2025 (Taxa înscriere: 50 RON) - Concurs de admitere: 13.05 – 16.05.2025 - Comunicarea rezultatelor: 13.05 – 17.05.2025 - Înmatricularea candidaților: 01.07 – 31.07.2025 Sesiunea II Iulie 2025 - Înscrierea candidaților: 1.07 – 8.07.2025 - Concurs de admitere: 10.07 – 12.07.2025 - Comunicarea rezultatelor: 10.07 – 12.07.2025 - Înmatricularea candidaților: 10.07 – 31.07.2025 Sesiunea III Septembrie 2025 - Înscrierea candidaților: 2.09 – 13.09.2025 - Concurs de admitere: 16.09 – 17.09.2025 - Comunicarea rezultatelor: 16.09 – 18.09.2025 - Înmatricularea candidaților: 16.09 – 20.09.2025",
            "Cifra de școlarizare solicitată pentru anul universitar 2025 – 2026: – 270 locuri – Buget + granturi acordate de universitate: - 213 locuri – Inginerie electrică – IE (în limba română) - 55 locuri – Inginerie Electrica si Calculatoare / Electrical Engineering and Computers – IEC (în limba engleză) - 2 locuri – Inginerie electrică – IE (în limba română) – locuri școlarizate în beneficiul SRI (Serviciul Român de Informații) (se scot la concurs în sesiunea a II-a) – 50 locuri – Taxă: - 45 locuri – Inginerie electrică (în limba română) - 5 locuri – Inginerie Electrica si Calculatoare / Electrical Engineering and Computers (în limba engleză) * Concursul de admitere se organizează în trei sesiuni: - sesiunea de admitere anticipată: 200 locuri buget + granturi acordate de universitate IE + 50 locuri buget + granturi acordate de universitate IEC; - înscrierea candidaṭilor, 15 decembrie 2024 – 2 iunie 2025; - test opțional UPB de limbă engleză, 21 martie 2025 sau 23 mai 2025; - comunicarea rezultatelor, 11 iunie 2025; - înmatricularea candidaṭilor, 2 – 4 iulie 2025 – conform programării transmisă prin email fiecărui candidat. - sesiunea din iulie: locuri rămase libere după sesiunea de admitere anticipată: … locuri buget + granturi acordate de universitate IE, – locuri buget + granturi acordate de universitate IEC; 2 locuri buget IE-SRI, … locuri taxă IE și … locuri taxă IEC; - înscrierea candidaṭilor: ………………. 2025, ora 16,00 (online până în ………………. 2025, ora 12,00); - test opțional UPB de limbă engleză ………………. 2025; - comunicarea rezultatelor: ………………. 2025; - înmatricularea candidaṭilor: ………………. 2025. - sesiunea din septembrie: locuri rămase libere după sesiunile de admitere anticipată și iulie. - înscrierea candidaṭilor: se va anunța ulterior. - dosarele se vor analiza conform regulamentului afișat pe admitere.pub.ro, în ordinea înscrierii pe platformă.",
            "NUMĂRUL DE LOCURI PENTRU ANUL UNIVERSITAR 2025-2026 ÎN SESIUNEA I PENTRU CANDIDAȚII CARE PARTICIPĂ LA ADMITERE ANTICIPATĂ PRIN CONCURS Atenție! În acest moment datele reflectă intenția și solicitările Universității.",
            "- prin transfer bancar (realizat printr-o aplicate de e-banking sau la ghișeul unei bănci), într-unul dintre următoarele conturi: (detalii privind acest mod de plată urmează a fi oferite în curând) - Faza 4 - Sesiunea I+ 05.07.2025 - 06.07.2025Pentru ocuparea locurilor devenite vacante după înmatricularea și glisarea internă din Sesiunea I, în funcție de numărul acestor locuri, de numărul candidaților care nu au fost pre-admiși dar au baremul îndeplinit, se va organiza o etapă de completare admiși. În ziua de 5 iulie 2025, în intervalul 09:00 – 12:00, comisia locală de admitere invită telefonic, în ordinea descrescătoare a mediilor, primii candidați cu barem îndeplinit, în vederea participării la ocuparea parțială sau integrală a acestor locuri. Candidații care acceptă și confirmă prin SMS participarea, își validează dosarul și se înmatriculează în perioada 5 iulie 2025 (12:00- 16:00) - 6 iulie 2025 (08:00 – 16:00). După finalizarea înmatriculării se generează și se publică listele finale cu candidații declarați admiși anticipat și înmatriculați (6 iulie 2025, ora 18:00). Validarea dosarului de concurs și depunerea documentelor pentru înmatriculare se realizează personal sau prin împuternicire notarială la sediul facultății de Energetică. Sunt necesare următoarele documente: - Diploma de Bacalaureat (sau diploma echivalentă cu aceasta) însoțită de foaia matricolă - Original ***Notă: Pentru candidații care au promovat examenul de Bacalaureat în 2025, dacă liceul nu a eliberat diploma până la data înmatriculării, în locul diplomei de Bacalaureat se admite, în original, adeverința eliberată de liceu în care se menționează atât media generală, cât și notele obținute la probele susținute. Foaia matricolă în original este, și în acest caz, necesară. - Certificatul de naștere al candidatului (original și copie)."
        ],
        "response": "Pentru admiterea la ACS, sunt disponibile 25 de programe de studii universitare de masterat acreditate ARACIS. Detaliile specifice privind numărul de locuri disponibile nu sunt menționate în documentele consultate.\n\nSurse:\n- URL: https://acs.pub.ro/admitere/masterat/",
        "faithfulness": "0.3333333333333333"
    },
    {
        "id": "3a280224d33a7cd2ecb8d99e86847e299a7f8d78a3881f8823820201b6ea10ed",
        "user_input": "Cand are loc testul online de limba de la Politehnica?",
        "retrieved_contexts": [
            "Candidații care la înscriere optează și pentru un domeniu cu limbă de predare engleză, franceză sau germană și care aleg să probeze cunoașterea respectivei limbi prin promovarea testului POLITEHNICA București, vor susține acest test on-line, la data de 10 iulie 2025 (dată valabilă pentru toți candidații) sau 18 iulie 2025 (această a doua dată este valabilă doar pentru candidații înscriși la facultățile la care admiterea anticipată este pe baza rezultatelor la activitățile școlare (dosar)(c-rs)) . Detalii privind organizarea sa pot fi găsite la https://admitere.pub.ro. Ses. II-5.11. Candidații care la înscriere optează pentru (și pentru) triade FaDoFi pentru care școlarizarea se realizează în beneficiul SRI trebuie să fi parcurs cu succes etapa suplimentară de înscriere și evaluare specifică la beneficiar. Ses. II-5.12. Fiecărui candidat cu dosar de înscriere validat de comisia locală i se întocmește o legitimație de concurs, cu fotografie. Candidații descărcată legitimația de concurs din aplicația de admitere (din contul propriu). Pe întreaga perioadă de desfășurare a concursului de admitere cu probe scrise, cu probe vocaționale sau cu probe mixte precum și pe durata interacțiunii directe cu comisiile locale de admitere, candidații vor avea asupra lor cartea de identitate și legitimația de concurs. Ses. II-5.13. După încheierea perioadei de înscriere la concursul de admitere, Comisiile locale de admitere vor publica on-line, cel mai târziu în preziua desfășurării probelor scrise sau vocaționale, listele nominale ale candidaților înscriși, ordonați alfabetic și repartizați pe săli, denumirea, data și ora începerii probelor scrise/vocaționale, precum și durata de desfășurare a acestora. Pag. 36 Universitatea Națională de Știință și Tehnologie POLITEHNICA București REGULAMENTUL Concursului de Admitere în Ciclul de Studii Universitare de Licență 2025 Ses. II-5.14.",
            "Candidații care la înscriere optează pentru un domeniu cu limbă de predare engleză, franceză sau germană și care aleg să probeze cunoașterea respectivei limbi prin promovarea testului POLITEHNICA București, vor susține acest test on-line, la data de 21 martie 2025 (dată valabilă pentru toți candidații) sau 23 mai 2025 (această a doua dată este valabilă doar pentru candidații înscriși la facultățile la care admiterea anticipată este pe baza rezultatelor la activitățile școlare (dosar)). Detalii privind organizarea sa pot fi găsite la https://admitere.pub.ro. Ses. I-4.9. La înscriere, în formularul tipizat menționat anterior, în ordinea preferințelor sale, candidatul poate face opțiuni privind domeniile (numai de la facultatea la care s-a înscris) la care acesta dorește să fie pre-admis. În Sesiunea I sunt disponibile numai locuri cu finanțare de la buget. Ses. I-4.10. Fiecărui candidat cu dosar de înscriere validat de comisia locală i se întocmește o legitimație de concurs, cu fotografie. Candidații descarcă legitimația de concurs din aplicația de admitere (din contul propriu). Pe întreaga perioadă de desfășurare a concursului de admitere cu probe scrise sau vocaționale (c-s, c-v, c-m) și pe durata interacțiunii directe cu comisiile locale de admitere, candidații vor avea asupra lor cartea de identitate și legitimația de concurs. Ses. I-4.11.",
            "Notă: Testul se efectuează cu manechinul sau, după caz, cu partenerul de joc. Anx XII - 26 Universitatea Națională de Știință și Tehnologie POLITEHNICA București Anexa XII Descrierea și punctarea probelor vocaționale Testul nr. 2. NAGE – KOMI (proiectări) / 30 “",
            "ADMITERE 2025 În anul 2025, pentru sesiunea I de admitere organizată de Universitatea Națională de Știință și Tehnologie POLITEHNICA București, Facultatea de Mecanica si Tehnologie, concursul de admitere este organizat pe baza rezultatelor la activitățile școlare (dosar)– bazat trei probe: Proba P1 – media multi-anuală la disciplina Matematică - nota NC1 – pondere 40% - vezi detalii în pag. 2 Proba P2 – media anuală la o disciplină aleasă de candidat, din lista de discipline propusă de Facultatea de Mecanică şi Tehnologie - nota NC2 – pondere 40% - vezi detalii în pag. 3 Proba P3 – formată din două componente - nota NB – pondere 20% - vezi detalii în pag. 4-5 IMPORTANT : Probele P1 și P2 – se bazează pe mediile obținute de candidat la unele dintre disciplinele studiate în clasele a IX-a, a X-a și a XI-a. Proba P3 este formată din două componente. Prima componentă se referă la cunoștințele și competențele generale ale candidatului, certificate în anul 2025, prin mediile generale din clasele a IX-a, a X-a și a XI-a. Cea de-a doua componentă a probei P3 se referă la o serie de caracteristici cognitive, comportamentale și de atitudine ale candidatului pe care Facultatea de Mecanică şi Tehnologie le consideră dezirabile. Proba P1 – media multi-anuală la disciplina Matematică - nota NC1 – pondere 40% Aceasta se calculează cu formula: sau formula: unde: M9 = media anuală la disciplina Matematică, pentru clasa a IX-a M10 = media anuală la disciplina Matematică, pentru clasa a X-a M11 = media anuală la disciplina Matematică, pentru clasa a XI-a IMPORTANT: Media Mb se folosește pentru candidații care NU au în planul de învățământ disciplina Matematică în clasa a XI-a (Profilul Umanist, Filiera Teoretic; Profilul Artistic, Filiera Vocațional; Profilul Teologic, Filiera Vocațional), iar media Ma se folosește pentru restul situațiilor.",
            "Faza III – Inmatriculare – 23 iulie ora 8.00 – 24 iulie ora 16.00. Publicare liste finale (sesiunea II) – 25 iulie 2025, ora 12.00. Universitatea Națională de Știință și Tehnologie POLITEHNICA Bucuresti Centrul Universitar PITESTI FACULTATEA DE MECANICA SI TEHNOLOGIE ADMITERE 2025 In toate sesiunile de admitere - concurs pe baza rezultatelor la activitățile școlare (dosar) – trei probe: proba P1 – media anuala la Matematică - nota NC1 – pondere 40% proba P2 – media anuala la o disciplina la alegere - nota NC2 – pondere 40% proba P3 – cu doua componente - nota NB – pondere 20% Media de admitere: Universitatea Națională de Știință și Tehnologie POLITEHNICA Bucuresti Centrul Universitar PITESTI FACULTATEA DE MECANICA SI TEHNOLOGIE proba P1 - disciplina Matematică - nota NC1 – pondere 40% IMPORTANT: Media Mb folosește pentru candidații care nu au în planul de învățământ disciplina Matematică în clasa a XI- a (Profilul Umanist, Filiera Teoretic; Profilul Artistic, Filiera Vocațional; Profilul Teologic, Filiera Vocațional M9 = media anuala la disciplina Matematică, pentru clasele a IX-a M10 = media anuala la disciplina Matematică, pentru clasele a X-a M11 = media anuala la disciplina Matematică, pentru clasele a XI-a Universitatea Națională de Știință și Tehnologie POLITEHNICA Bucuresti Centrul Universitar PITESTI FACULTATEA DE MECANICA SI TEHNOLOGIE proba P2 – una dintre urmatoarele discipline - nota NC2 – pondere 40% Fizică ,𝐹 = 𝐹9+𝐹10 T, 2 , unde F9= media anuala la disciplina Fizică, pentru clasele a IX-a F10= media anuala la disciplina Fizică, pentru clasele a X-a 𝐼9+𝐼10+𝐼11 Informatică, 𝐼 = 3 , unde I9 = media anuala la disciplina Informatica, pentru clasa a IX-a I10 = media anuala la disciplina Informatica, pentru clasa a X-a I11 = media anuala la disciplina Informatica, pentru clasa a XI-a"
        ],
        "response": "Testul online de limba de la Politehnica va avea loc în două sesiuni: prima sesiune pe data de **21 martie 2025** și a doua sesiune pe **23 mai 2025**. Această a doua dată este valabilă doar pentru candidații înscriși la facultățile la care admiterea anticipată este pe baza rezultatelor la activitățile școlare (dosar). Detalii suplimentare pot fi găsite pe site-ul oficial al universității.\n\nSurse:\n- Regulament admitere licență 2025, URL: https://upb.ro/wp-content/uploads/2024/12/Regulament_admitere_licenta_2025.pdf, pagina: 26\n- Regulament admitere licență 2025, URL: https://upb.ro/wp-content/uploads/2024/12/Regulament_admitere_licenta_2025.pdf, pagina: 36",
        "faithfulness": "0.7142857142857143"
    },
    {
        "id": "a45692a581af96e307733d604fa6f75bfc65024428e9567087a494c16329cad6",
        "user_input": "Ce documente sunt necesare pentru a demonstra cunostintele lingvistice la inscrierea la un program de studii in limba engleza?",
        "retrieved_contexts": [
            "| Varianta | Cum dovedesc la înscriere | Este necesar să susțin testul de limbă POLITEHNICA Bucureşti? |\n|:--|:--|:--|\n| Liceu absolvit în respectiva limbă de predare | Dacă acest lucru nu apare evident din celelalte documente furnizate la înscriere, am grijă să încarc o copie a unui document eliberat de liceu şi din care să reiasă că am urmat un program de studii în respectiva limbă | NU |\n| Certificat de competențe lingvistice pentru respectiva limbă de predare (minim B2); | Încarc o copie a certificatului | NU |\n| Disciplină de tip limbă străină promovată în liceu cu media cel puțin 8,00 (pentru clasele a IX- a,a X-a, a XI-a). | Încarc o copie a unui document eliberat de liceul urmat din care reiese acest lucru | NU |\n| Proba A, B sau C de la examenul de Bacalaureat; | Încare o copie completă a diplomei de Bacalaureat (inclusiv situația la examen) | NU |\n| Aleg să susțin testul de limbă POLITEHNICA Bucureşti; | Nu încarc nimic la înscriere | DA |\n| L La înscriere optez numai pentru domenii pentru care şcolarizarea se desfăşoară în româna | Nu încarc nimic la înscriere | NU |",
            "| Pentru candidații care au optat la programe de studii școlarizate în limbi străine (engleză, franceză, germană), dacă este cazul, documentul/documentele care fac dovada cunoașterii limbii respective. Originalul documentelor din Tabelul Anx.VII-2— Punctul 10. |\n|:--|\n| Pentru candidații care au optat la domeniul Ştiințe ale educației, eseul motivațional al candidatului relativ la capacitatea, dorința și determinarea acestuia de a urma studiile în cadrul domeniului Ştiințe ale educației. Pentru candidații care optează la domeniul Teologie, Binecuvântarea Înaltpreasfințitului Părinte Arhiepiscop sau, după caz, Episcop, ierarhul eparhiei din care provine candidatul (de unde are domiciliul), în vederea înscrierii la Facultatea de Teologie, Litere, Istorie și Arte. Pentru candidații care au optat la domeniul Inginerie industrială — învățământ dual eseul motivațional al candidatului relativ la capacitatea, dorința și determinarea acestuia de a urma studiile universitare în forma de organizare dual, având în vedere particularitățile învățării prin muncă Originalul documentului din Tabelul Anx.IV-2— Punctul 11. |\n| Dovada achitării taxei de înmatriculare (vezi Anx.VIII-3). Original |\n| Pentru candidații care au fost admiși pe un loc cu taxă sau care participă la glisare având activate opțiuni cu taxă, dovada achitării parțiale a taxei de şcolarizare în anul I (vezi Anx.VIII-6). Original ***Notă Pentru candidații care în urma procesului de glisare sunt înmatriculați pe un loc la buget, sau în cazul în care candidatul solicită retragerea de la studiile universitare de licență, din motive personale, acest avans nu se restituie. |",
            "Despre testul de limbă on-line POLITEHNICA București din data de 23 mai 2025 L Ce este cu acest test? Am nevoie de el? Dacă doresc să beneficiez de avantajele studiului într-una din limbile de largă circulație (engleză, franceză, germană) și în lista mea de opțiuni includ domenii la care școlarizarea se desfășoară într-una din acest limbi, trebuie, conform legii, să fac dovada că am cunoștințele lingvistice necesare. Dovada se face folosind oricare dintre variantele de mai jos:",
            "e) deţin certificat de competenţă lingvistică de limbă străină, conform solicitării instituţiei de învăţământ superior, în cazul în care au fost admişi la un program de studii organizat într-o limbă străină, după caz. Sunt exceptaţi cetăţenii străini care provin din ţări unde limba oficială este cea în care se efectuează cursurile şi care dovedesc, cu documente şcolare, că au urmat cursurile în limba de predare a programului de studii universitare. (2) Continuarea studiilor în instituţiile de învăţământ superior din România se va realiza în conformitate cu reglementările interne ale POLITEHNICA Bucureşti, cu condiţia respectării capacităţii de şcolarizare. (3) POLITEHNICA Bucureşti va transmite Ministerului Educaţiei solicitarea de continuare a studiilor, însoţită de avizul comisiei de echivalare a studiilor şi cu menţionarea anului de studiu în care urmează a fi înmatriculat studentul. (4) Continuarea studiilor în POLITEHNICA Bucureşti este condiţionată de obţinerea scrisorii de acceptare la studii, eliberată de Ministerul Educaţiei. (5) În cazul depăşirii perioadei de şcolarizare prevăzute pentru programul de studii la care studentul a fost admis, POLITEHNICA Bucureşti transmite Ministerului Educaţiei dosarul pentru emiterea unei noi scrisori de acceptare la studii. Dosarul va conţine următoarele documente: a) adresa oficială din partea instituţiei de învăţământ superior; b) copie după scrisoarea de acceptare la studii emisă iniţial în favoarea candidatului; c) adeverinţă privind situaţia şcolară a studentului. VIII. ÎNTRERUPEREA STUDIILOR, RETRAGEREA DE LA STUDII, EXMATRICULAREA (1) Studenţii români de pretutindeni pot beneficia de întreruperea studiilor, începând cu anul al II-lea de studii, pe o perioadă de cel mult 2 ani. Redobândirea statutului iniţial este posibilă numai pentru întreruperi de studii pentru caz medical, inclusiv maternitate. În celelalte situaţii reluarea studiilor se poate face doar cu plata taxei de şcolarizare în lei, în cuantumul stabilit pentru cetăţenii români, în conformitate cu regulamentele proprii ale fiecărei instituţii de învăţământ superior.",
            "| | ('Este important ca mențiunile dvs. să fie concrete, nu generale sau vagi. Formulări precum teaching skills sau academic skills nu ne onorează.', 'Orice alte informații privind criteriile de selecţie pot fi furnizate doar în secțiunea IV. În această secțiune veți menționa doar condiții obligatorie specifică') |\n|:--|:--|\n| | postului respectiv. Nu se vor menționa criteriile obligatorii și nici informațiile deja conținute în Metodologia de concurs. |\n| Required languages | Precizați limba de predare a programului de studiu. ... Nivelul de limbă trebuie să fie excellent. |\n| Required languages | LARETEEETIEEEIETEEETEETERETRNT: Clic pentru a selecta nivelul de limbă |\n| Required languages | IC ĂRETEEETIEEETETEEETESTERETANT: Clic pentru a selecta nivelul de limbă |\n| Required languages | Dacă veți menționa limba română, nivelul implicit de limbă va fi mother tongue, fără a mai fi nevoie de altă selecție. |\n| Required research experience | Click pentru a selecta domeniul. Doar dacă domeniul de cercetare solicitat nu se află în listă, vă rugăm să îl precizați aici, Vă contacta ulterior. |\n| Required research experience | Puteți selecta și subdomenii de cercetare din Anexa. Vă rugăm să le menționați în ordinea din listă, sub forma: DOMENIU, subdomeniul 1, subdomeniul n. |\n| Required research experience | Clic aici pentru a selecta vechimea în cercetare. |"
        ],
        "response": "Pentru a demonstra cunoștințele lingvistice la înscrierea la un program de studii în limba engleză, este necesar să prezentați unul dintre următoarele documente:\n\n1. **Liceu absolvit în respectiva limbă de predare**: Dacă acest lucru nu apare evident din celelalte documente furnizate la înscriere, trebuie să încărcați o copie a unui document eliberat de liceu care să ateste că ați urmat un program de studii în limba engleză.\n2. **Certificat de competențe lingvistice**: Un certificat de competență lingvistică pentru limba engleză, cu un nivel minim B2. Trebuie să încărcați o copie a certificatului.\n3. **Disciplină de tip limbă străină promovată în liceu**: O disciplină de tip limbă străină promovată în liceu cu media cel puțin 8,00 (pentru clasele a IX-a, a X-a, a XI-a). Este necesar să încărcați o copie a unui document eliberat de liceul urmat.\n4. **Proba A, B sau C de la examenul de Bacalaureat**: Trebuie să încărcați o copie completă a diplomei de Bacalaureat, inclusiv situația la examen.\n5. **Testul de limbă POLITEHNICA București**: Aveți opțiunea de a susține testul de limbă POLITEHNICA București, fără a fi necesar să încărcați documente la înscriere.\n6. **Înscrierea la domenii în limba română**: Dacă optați doar pentru domenii în care școlarizarea se desfășoară în limba română, nu este necesară prezentarea documentelor de mai sus.\n\nSurse:\n- Testul de limbă on-line POLITEHNICA București, URL: https://fils.upb.ro/wp-content/uploads/2025/02/Test-limba-straina-23-05-detalii-S1-2025.pdf, pagina: 1\n- Metodologie admitere și școlarizare RP septembrie-2024, URL: https://www.fiir.upb.ro/Upload/Master/Admitere/2025/Metodologie_admitere-si-scolarizare_RP_septembrie-2024.pdf, pagina: 10\n- Regulament admitere licență 2025, URL: https://upb.ro/wp-content/uploads/2024/12/Regulament_admitere_licenta_2025.pdf, pagina: 99",
        "faithfulness": "1.0"
    },
    {
        "id": "94bddd69c532484761e6fee498202ba386f687345868f2ab043cdc073023bbe2",
        "user_input": "Cum pot sa ma inscriu la testul online de limba straina?",
        "retrieved_contexts": [
            "Proba A, B sau C de la examenul de Bacalaureat, (încărcați diploma de bacalaureat la certificat lingvistic) - Disciplina de tip „limba străină” promovată în liceu cu media cel puțin 8,00 (în clasele a IX-a, a X-a și a XI-a) (încărcați foaia matricolă la certificat lingvistic) - Test POLITEHNICA București (încărcați emailul cu rezultatul la certificat lingvistic) - 21 Martie 2025 (dată valabilă pentru toți candidații) vor avea grijă să se programeze (detalii aici) până cel târziu pe 19 Martie 2025, ora 12:00 - 23 Mai 2025 (această a doua dată este valabilă doar pentru candidații înscriși la facultățile la care admiterea anticipată se face prin concurs pe baza rezultatelor la activitățile școlare (dosar) vor avea grijă să se programeze până cel târziu pe 21 Mai 2025, ora 12:00 (detalii aici). - Modele de teste : engleza , franceza , germana Sesiunea I admitere anticipată Specificul, condițiile de participare, organizarea și desfășurarea acestei sesiuni se găsesc în Regulament, Capitolul IV. Această sesiune este dedicată: A Candidaților elevi sau absolvenți olimpici și celor cu rezultate deosebite în cadrul concursurilor de profil desfășurate pe parcursul liceului. Aceștia sunt candidați pentru Admitere anticipată fără concurs. Olimpiadele și concursurile luate în considerare sunt descries mai jos, in sectiunea Structura probei de concurs P3 și calculul notei NB în Sesiunea I B Candidaților elevi sau absolvenți care doresc garantarea anticipată (prin pre-admitere) a unui loc pentru studii în POLITEHNICA București. Aceștia sunt candidați pentru Admitere anticipată prin concurs. La FILS se face printr-un concurs pe dosar bazat pe 3 probe (P1, P2 și P3). Probele P1+P2 reprezintă 80% din media generală, iar proba P3, 20% din media generală. Pentru proba P1 se vor lua în considerare mediile din liceu din clasele IX- XI, la disciplina Matematică.",
            "Candidații care la înscriere optează pentru un domeniu cu limbă de predare engleză, franceză sau germană și care aleg să probeze cunoașterea respectivei limbi prin promovarea testului POLITEHNICA București, vor susține acest test on-line, la data de 21 martie 2025 (dată valabilă pentru toți candidații) sau 23 mai 2025 (această a doua dată este valabilă doar pentru candidații înscriși la facultățile la care admiterea anticipată este pe baza rezultatelor la activitățile școlare (dosar)). Detalii privind organizarea sa pot fi găsite la https://admitere.pub.ro. Ses. I-4.9. La înscriere, în formularul tipizat menționat anterior, în ordinea preferințelor sale, candidatul poate face opțiuni privind domeniile (numai de la facultatea la care s-a înscris) la care acesta dorește să fie pre-admis. În Sesiunea I sunt disponibile numai locuri cu finanțare de la buget. Ses. I-4.10. Fiecărui candidat cu dosar de înscriere validat de comisia locală i se întocmește o legitimație de concurs, cu fotografie. Candidații descarcă legitimația de concurs din aplicația de admitere (din contul propriu). Pe întreaga perioadă de desfășurare a concursului de admitere cu probe scrise sau vocaționale (c-s, c-v, c-m) și pe durata interacțiunii directe cu comisiile locale de admitere, candidații vor avea asupra lor cartea de identitate și legitimația de concurs. Ses. I-4.11.",
            "Despre testul de limbă on-line POLITEHNICA București din data de 23 mai 2025 L Ce este cu acest test? Am nevoie de el? Dacă doresc să beneficiez de avantajele studiului într-una din limbile de largă circulație (engleză, franceză, germană) și în lista mea de opțiuni includ domenii la care școlarizarea se desfășoară într-una din acest limbi, trebuie, conform legii, să fac dovada că am cunoștințele lingvistice necesare. Dovada se face folosind oricare dintre variantele de mai jos:",
            "Candidații care la înscriere optează și pentru un domeniu cu limbă de predare engleză, franceză sau germană și care aleg să probeze cunoașterea respectivei limbi prin promovarea testului POLITEHNICA București, vor susține acest test on-line, la data de 10 iulie 2025 (dată valabilă pentru toți candidații) sau 18 iulie 2025 (această a doua dată este valabilă doar pentru candidații înscriși la facultățile la care admiterea anticipată este pe baza rezultatelor la activitățile școlare (dosar)(c-rs)) . Detalii privind organizarea sa pot fi găsite la https://admitere.pub.ro. Ses. II-5.11. Candidații care la înscriere optează pentru (și pentru) triade FaDoFi pentru care școlarizarea se realizează în beneficiul SRI trebuie să fi parcurs cu succes etapa suplimentară de înscriere și evaluare specifică la beneficiar. Ses. II-5.12. Fiecărui candidat cu dosar de înscriere validat de comisia locală i se întocmește o legitimație de concurs, cu fotografie. Candidații descărcată legitimația de concurs din aplicația de admitere (din contul propriu). Pe întreaga perioadă de desfășurare a concursului de admitere cu probe scrise, cu probe vocaționale sau cu probe mixte precum și pe durata interacțiunii directe cu comisiile locale de admitere, candidații vor avea asupra lor cartea de identitate și legitimația de concurs. Ses. II-5.13. După încheierea perioadei de înscriere la concursul de admitere, Comisiile locale de admitere vor publica on-line, cel mai târziu în preziua desfășurării probelor scrise sau vocaționale, listele nominale ale candidaților înscriși, ordonați alfabetic și repartizați pe săli, denumirea, data și ora începerii probelor scrise/vocaționale, precum și durata de desfășurare a acestora. Pag. 36 Universitatea Națională de Știință și Tehnologie POLITEHNICA București REGULAMENTUL Concursului de Admitere în Ciclul de Studii Universitare de Licență 2025 Ses. II-5.14.",
            "| Varianta | Cum dovedesc la înscriere | Este necesar să susțin testul de limbă POLITEHNICA Bucureşti? |\n|:--|:--|:--|\n| Liceu absolvit în respectiva limbă de predare | Dacă acest lucru nu apare evident din celelalte documente furnizate la înscriere, am grijă să încarc o copie a unui document eliberat de liceu şi din care să reiasă că am urmat un program de studii în respectiva limbă | NU |\n| Certificat de competențe lingvistice pentru respectiva limbă de predare (minim B2); | Încarc o copie a certificatului | NU |\n| Disciplină de tip limbă străină promovată în liceu cu media cel puțin 8,00 (pentru clasele a IX- a,a X-a, a XI-a). | Încarc o copie a unui document eliberat de liceul urmat din care reiese acest lucru | NU |\n| Proba A, B sau C de la examenul de Bacalaureat; | Încare o copie completă a diplomei de Bacalaureat (inclusiv situația la examen) | NU |\n| Aleg să susțin testul de limbă POLITEHNICA Bucureşti; | Nu încarc nimic la înscriere | DA |\n| L La înscriere optez numai pentru domenii pentru care şcolarizarea se desfăşoară în româna | Nu încarc nimic la înscriere | NU |"
        ],
        "response": "Pentru a te înscrie la testul online de limbă străină organizat de POLITEHNICA București, trebuie să urmezi pașii următori:\n\n1. **Verifică eligibilitatea**: Asigură-te că optezi pentru un domeniu cu limbă de predare engleză, franceză sau germană.\n2. **Alege data testului**: Testul se va desfășura online pe data de 21 martie 2025 sau 23 mai 2025, în funcție de tipul de admitere ales. Data de 21 martie este valabilă pentru toți candidații, iar 23 mai este specifică pentru cei care se înscriu la facultățile cu admitere anticipată pe baza rezultatelor la activitățile școlare (dosar).\n3. **Programează-te**: Este necesar să te programezi pentru test până cel târziu pe 19 martie 2025 pentru prima dată sau pe 21 mai 2025 pentru a doua dată.\n4. **Detalii suplimentare**: Informații detaliate privind organizarea testului pot fi găsite pe site-ul oficial al universității, la secțiunea dedicată admiterii.\n\nAsigură-te că ai toate documentele necesare pregătite pentru înscriere.\n\nSurse:\n- Regulament admitere licență 2025, URL: https://upb.ro/wp-content/uploads/2024/12/Regulament_admitere_licenta_2025.pdf, pagina: 26\n- Test limbă străină POLITEHNICA București, URL: https://fils.upb.ro/wp-content/uploads/2025/02/Test-limba-straina-23-05-detalii-S1-2025.pdf, pagina: 1",
        "faithfulness": "0.5714285714285714"
    },
    {
        "id": "9a7bb2d09541a925242d7045e304624b503c1d8e5d5db9bb559010c31229583d",
        "user_input": "Ce tipuri de burse sunt disponibile la Politehnica?",
        "retrieved_contexts": [
            "Toate categoriile de burse se acordă la cererea studenților cu excepția burselor speciale, burselor de performanță II și III. Art. 4. (1) Informațiile privind modalitatea de accesare și acordare a burselor de la bugetul de stat se fac publice prin afișarea pe pagina web şi la facultățile din cadrul POLITEHNICII București, la începutul anului universitar. (2) Anunțurile pentru depunerea cererilor şi documentelor justificative în vederea obținerii unor categorii de burse vor fi publicate pe site-ul și la avizierul POLITEHNICII București/ fiecărei facultăți cu minimum 15 zile lucrătoare înainte de data-limită pentru depunerea acestora. Art. 5. Studentul POLITEHNICII București va depune la Secretariatul facultății, respectând data limită, dosarul în vederea obținerii bursei, ce trebuie să conțină următoarele documente,: a) cererea, însoțită de acordul de prelucrare a datelor cu caracter personal; b) copia cărții de identitate; c) documentele justificative specifice tipului de bursă solicitat. Art. 6. Se constituite, la nivelul Universității Naționale de Știință și Tehnologie POLITEHNICA București comisia centrală de atribuire a burselor, iar la nivelul fiecărei facultăți comisia de atribuire a burselor. Art.7. Comisia centrală de atribuire a burselor, prevăzută la art. 6, este formată din: a) Președinte: Prorectorul responsabil cu gestionarea resurselor; b) Directorul Direcției Generale Administrativ-Economice; c) Directorul Direcției Financiar-Contabile; d) Secretarul șef al universității/ Responsabil Probleme Sociale Studențești; e) Șeful Serviciului Social; Page 3 of 16 f) Un consilier juridic; g) Reprezentantul studenților în Consiliul de Administrație al POLITEHNICII București. Art. 8. Comisia centrală de atribuire a burselor are următoarele responsabilități:",
            "* Locuri subvenționate de la buget, pentru școlarizarea în beneficiul SRI (Serviciul Român de Informații) *** Locuri cu taxă, dar subvenționate (fără efort bugetar din partea candidaților admiși) Anx I - 2 Universitatea Națională de Știință și Tehnologie POLITEHNICA București Anexa I Portofoliul de admitere Facultăți – Domenii – Forme de finanțare CENTRUL UNIVERSITAR PITEȘTI",
            "b. burse şi alte forme de sprijin studenților prin proiecte instituționale, fonduri nerambursabile sau din alte surse legal constituite, în conformitate cu metodologiile proprii. c. burse speciale, în baza unei metodologii aprobate de senatul universitar; d. premii, burse şi alte stimulente financiare studenților cu performanțe, respectiv, cu rezultate remarcabile în activitățile extrașcolare sau în activităţi culturale şi sportive, precum şi studenților în situație de risc. (6) POLITEHNICA București poate acorda granturi de studii şi burse românilor de pretutindeni și cetățenilor străini, în conformitate cu metodologiile proprii. Cuantumul bursei este stabilit prin hotărâre a senatului instituției de învățământ superior de stat, la propunerea consiliului de administrație. (7) Studenții pot beneficia și de alte burse, finanțate din bugetul POLITEHNICII București și din alte forme legal constituite, cuantumul acestora fiind stabilit prin hotărârea Senatului Universității, la propunerea Consiliului de Administrație; Page 2 of 16 (8) Studenții români și străini pot beneficia de burse, mobilități și alte drepturi, finanțate din contracte de finanțare externă nerambursabilă, câștigate de către POLITEHNICA București în competiții naționale și internaționale, în cuantumul prevăzut de aceste contracte. Art. 2. Perioada de acordare (1) Bursele, indiferent de categorie, se acordă pe toată durata anului universitar (12 luni), cu excepția burselor sociale ocazionale. Acordarea burselor încetează la data pierderii calității de student sau a neîndeplinirii criteriilor de promovabilitate, după caz. (2) Studenților înmatriculați în ultimul an de studiu al ciclurilor de studii de licență sau de masterat, care beneficiază de orice tip de bursă în ultimul semestru de studii al respectivului ciclu, li se acordă același tip de bursă/burse până la susținerea examenului de finalizare a studiilor în prima sesiune din anul universitar curent. (3) Prin excepție de la prevederile alin. (2), studenții înmatriculați în ultimul an de studiu pot beneficia de orice tip de bursă până la sfârșitul anului universitar curent, în situații temeinic justificate. CAPITOLUL II Atribuirea burselor Art. 3.",
            "| r. crt. | Echipamentul | An [fabr. | Valoarea | Sursa de finanțare la investiției |\n|-----------|----------------|-------------|------------|-------------------------------------|",
            "(3) Direcția Financiar-Contabilă completează în platforma ANS, prin utilizarea contului instituțional, datele privind evidența resurselor financiare și categoriile specifice de cheltuieli. Datele și informațiile comunicate către SU vor fi validate și asumate în momentul închiderii platformei prin semnătura Directorului DFC. Art. 19. (1) Prorectorul responsabil ANS și SU comunică Direcției General Administrativ Economice (DGAE) instrucțiunile și termenele de completare, privind evidența spațiilor dedicate activităților didactice specifice învățământului universitar, precum și alte informații legate de baza tehnico-materială. (2) Datele referitoare la evidența spațiilor și baza tehnico-materială se raportează la data de referință 01 ianuarie, stabilită prin cadrul legislativ specific și operaționalizată în cadrul platformei ANS. (3) DGAE completează macheta privind evidența spațiilor și baza tehnico-materială și o transmite către SU. Datele și informațiile sunt transmise cu asumarea prin semnătura Directorului DGAE. (4) Directorul DGAE se asigură că informațiile sunt corecte și nu există deficiențe în sistemul de colectare, analiză și administrare. SU transmite ulterior datele către Prorector responsabil ANS pentru validarea finală. Dacă informațiile conțin anumite erori sau deficiențe, întregul pachet de date se retransmite către DGAE pentru verificare suplimentară și actualizare, dacă este cazul. (5) După etapa de validare finală acestea sunt introduse în platforma ANS de către persoana desemnată din cadrul DGAE, prin utilizarea contului acesteia. Art. 20. (1) Prorectorul responsabil ANS și SU comunică DGAE instrucțiunile și termenele de completare privind evidența politicii de cazare și respectiv cea specifică burselor pentru raportare. (2) Datele referitoare la structura locurilor de cazare și caracteristicile acestora, respectiv numărul de cantine, precum și cele referitoare la sistemul de burse acordat la nivel instituțional se raportează la data de 01 ianuarie, stabilită prin cadrul legislativ specific și operaționalizată în cadrul platformei ANS. (3) Direcția General Administrativă completează macheta privind evidența locurilor de cazare, a cantinelor și a burselor acordate către SU."
        ],
        "response": "La Universitatea Națională de Știință și Tehnologie POLITEHNICA București sunt disponibile următoarele tipuri de burse:\n\n1. **Burse și alte forme de sprijin** - Acestea sunt oferite studenților prin proiecte instituționale, fonduri nerambursabile sau din alte surse legal constituite, conform metodologiilor proprii.\n2. **Burse speciale** - Aceste burse sunt acordate pe baza unei metodologii aprobate de senatul universitar.\n3. **Burse de performanță** - Acestea sunt destinate studenților cu rezultate remarcabile în activitățile extrașcolare sau în activități culturale și sportive, precum și studenților în situație de risc.\n4. **Granturi de studii** - POLITEHNICA București poate acorda granturi de studii și burse românilor de pretutindeni și cetățenilor străini, conform metodologiilor proprii.\n5. **Burse finanțate din bugetul universității** - Aceste burse sunt stabilite prin hotărârea Senatului Universității, la propunerea Consiliului de Administrație.\n6. **Burse din contracte de finanțare externă** - Studenții pot beneficia de burse, mobilități și alte drepturi, finanțate din contracte de finanțare externă nerambursabilă câștigate de universitate.\n\nBursele se acordă pe toată durata anului universitar, cu excepția burselor sociale ocazionale, și încetează la data pierderii calității de student sau a neîndeplinirii criteriilor de promovabilitate.\n\nSurse:\n- Metodologie burse rectificată, URL: https://upb.ro/wp-content/uploads/2024/12/Metodologie-burse_rectificata.pdf, pagina: 2\n- Metodologie burse rectificată, URL: https://upb.ro/wp-content/uploads/2024/12/Metodologie-burse_rectificata.pdf, pagina: 3",
        "faithfulness": "0.6666666666666666"
    },
    {
        "id": "cc350338d3843f560a407eb1e4fe6b04587503a5f058b2086bb6e636d07d1698",
        "user_input": "Cum pot obtine bursa la Politehnica?",
        "retrieved_contexts": [
            "Perioada in cariera Anul obţinerii 5.14.Membru al unei Academii",
            "Anx XII - 11 Universitatea Națională de Știință și Tehnologie POLITEHNICA București Anexa XII Descrierea și punctarea probelor vocaționale",
            "Anx XII - 21 Universitatea Națională de Știință și Tehnologie POLITEHNICA București Anexa XII Descrierea și punctarea probelor vocaționale",
            "| | | ('Kinetoterapie', 'Psihologie') | ('Știința Mediului', 'Știința Mediului') |\n|:--|:--|:--|:--|\n| | | | |\n| | | | |\n| | | | |\n| | | | |\n| | | | |\n| | | | |\n| | Sănătate | Ştiința Sportului şi Educației Fizice | |\n| | Știinta Mediului | Ştiința Sportului şi Educației Fizice | |\n| | Inginerie Energetică | | |\n| | Educație Fizică şi Sport | Informatică | |\n| | Informatică | Matematică | |\n| | Matematică | Matematică | |\n| 19.0 | Facultatea de Mecanică şi Tehnologie 8 | Ingineria Autovehiculelor | Ingineria Autovehiculelor |\n| 19.0 | Facultatea de Mecanică şi Tehnologie 8 | Ingineria Transporturilor | Ingineria Transporturilor |\n| 19.0 | Facultatea de Mecanică şi Tehnologie 8 | I , Inginerie Industrială | R - Inginerie Industrială |\n| 19.0 | Facultatea de Mecanică şi Tehnologie 8 | Inginerie şi Management | Inginerie şi Management |\n| 20.0 | Facultatea de Electronică, IIIR Comunicații şi Calculatoare | Calculatoare şi Tehnologia Informației 7 | INIR - Inginerie Electrică |\n| 20.0 | Facultatea de Electronică, IIIR Comunicații şi Calculatoare | Inginerie Electrică | INIR - Inginerie Electrică |\n| 20.0 | Facultatea de Electronică, IIIR Comunicații şi Calculatoare | Inginerie Electronică, EPNE . Telecomunicații şi Tehnologii x Informaționale | RRNR a IRMEFSNE Inginerie Electronică, Telecomunicații şi .. - Tehnologii Informaționale |\n| 21.0 | -. , Facultatea de Științe Economice şi Drept ” P | Administrarea Afacerilor | Administrarea Afacerilor |\n| 21.0 | -. , Facultatea de Științe Economice şi Drept ” P | Contabilitate | Contabilitate |\n| 21.0 | -. , Facultatea de Științe Economice şi Drept ” P | Finanțe : | Finanțe : |\n| 21.0 | -. , Facultatea de Științe Economice şi Drept ” P | Management | Management |\n| 21.0 | -. , Facultatea de Științe Economice şi Drept ” P | Drept | Drept |\n| 21.0 | -. , Facultatea de Științe Economice şi Drept ” P | Ştiințe Administrative | Ştiințe Administrative |",
            "CENTRUL UNIVERSITAR PITEȘTI"
        ],
        "response": "Nu am suficiente informații pentru a răspunde la întrebare.",
        "faithfulness": "1.0"
    },
    {
        "id": "6dc139c50eacb98f89503d419db2e7355f342587a3f580696da6f3bccebc430b",
        "user_input": "Care este media minima necesara pentru a obtine o bursa?",
        "retrieved_contexts": [
            "(3) Cuantumul minim al bursei sociale se propune anual, până la data de 1 septembrie, de către Comisia Națională pentru Finanțarea Învățământului Superior (CNFIS), se adoptă prin ordin al ministrului educației și trebuie să acopere cheltuielile minime de masă şi cazare. (4) Cuantumul burselor sociale se stabilește prin hotărâre a senatului universității POLITEHNICA București, la propunerea Consiliului de administrație, în limita fondurilor disponibile și în funcție de nevoile identificate la nivelul comunității studențești, prin consultarea reprezentanților studenților, inclusiv cu organizațiile studențești din POLITEHNICA București. (5) Pentru acordarea burselor sociale, singurul criteriu academic ce se ia în considerare este promovabilitatea. (6) Bursele sociale se cumulează cu alte tipuri de burse, dacă studentul îndeplinește criteriile specifice pentru ambele categorii de burse. (7) Bursele sociale se acordă pe durata legală a programului de studii, până la împlinirea vârstei de 35 de ani. (8) Beneficiarii burselor sociale pot fi: a) studenții orfani de unul sau ambii părinți, studenții care provin din familii monoparentale sau studenții proveniți din centre de plasament și care nu realizează venituri peste plafonul pentru acordarea bursei sociale; b) studenții bolnavi de tuberculoză, care se află în evidența unităților medicale, pe perioada tratamentului tuberculostatic, diabet insulinonecesitant, boli maligne, sindroame de malabsorbție severe, boală cronică de rinichi în program de dializă, astm bronșic persistent moderat sau sever, epilepsie grand mal, cardiopatii congenitale, hepatită cronică cu fibroză avansată (stadiul F3 sau F4), glaucom, miopie gravă, boli imunologice autoimune forme severe, boli rare, tulburări din spectrul autist, boli hematologice severe care necesită tratament continuu sau spitalizări frecvente, surditate bilaterală, fibroză chistică, cei infectați cu virusul HIV sau bolnavi de SIDA, cei cu handicap locomotor și încadrați într-un grad de invaliditate, fără a se lua în considerare nivelul venitului mediu pe membru de familie;",
            "punct de vedere socio-economic, a căror familie nu a realizat în cele 12 luni dinaintea depunerii cererii pentru acordarea acestui tip de bursă un venit lunar net mediu pe membru de familie mai mare de 50% din salariul minim net la nivel național. Această categorie de bursă se poate acorda aceluiași student de două ori în cursul unui an universitar; b) bursa pentru ajutor social ocazional de maternitate, care se acordă studentei sau studentului a cărui soție nu realizează deloc venituri sau venituri mai mari decât salariul de bază minim net la nivel național, constă într-o bursă pentru naștere și lăuzie și o bursă pentru procurarea îmbrăcămintei copilului nou-născut și care se acordă o singură dată în cursul anului universitar pentru fiecare copil născut; c) bursa pentru ajutor social ocazional în caz de deces se poate acorda pentru decesul unui membru al familiei studentului(ei). Prin membru de familie se înțelege soț, soție, copil. În cazul decesului studentului(ei) necăsătorit(e)/căsătorit(e) cu soție/soț care nu realizează venituri, bursa se acordă rudelor de gradul I/succesorului legal o singură dată în cursul anului universitar. (2) Cuantumul acestor burse este stabilit de Senatul universității, la propunerea Consiliului de administrație, cu condiția ca acesta să fie cel puțin egal cu cuantumul lunar al bursei sociale. (3) POLITEHNICA București poate acorda alte stimulente financiare studenților în situație de risc, stabilite de Biroul Consiliului de Administrație. Art. 28. Calculul venitului lunar mediu net (1) Determinarea venitului lunar mediu net al familiei studentului se realizează până la împlinirea vârstei de 26 de ani. La stabilirea venitului mediu net lunar pe membru de familie se iau în calcul toate veniturile nete cu caracter permanent realizate de membrii familiei, supuse impozitului pe venit. Prin venituri nete se înțelege totalitatea sumelor primite/realizate de persoana singură, respectiv de fiecare membru al familiei, reprezentând valoarea obținută după aplicarea cotei de impozitare asupra venitului impozabil stabilit conform prevederilor legale.",
            "TAXA de înscriere Cuantumul taxei de înscriere este de 100 RON pentru înscrierea la sesiunile din iulie și septembrie și de 50 RON pentru înscrierea la sesiunea de admitere anticipată. Taxa de înscriere pentru înscrierea la sesiunea de admitere anticipată este 50 lei și se poate achita având menționate la explicațiile plății: - numele și prenumele complet al candidatului, - Facultatea de bază la care acesta se înscrie pentru concursul de admitere, direct în platforma on-line https://admitere.pub.ro/, cu card bancar.",
            "(2) Pentru studenții cu vârsta între 26 și 35 de ani, venitul lunar mediu net se va calcula ținând cont doar de veniturile personale ale acestora și ale persoanelor pe care le au în grijă, precum copii, soție etc., în conformitate cu prevederile legale în vigoare. (3) În situația în care personalul instituției de învățământ are suspiciuni privind îndeplinirea condițiilor de acordare a bursei sociale, rectorul POLITEHNICII București sesizează situația autorităților publice locale, în vederea efectuării unei anchete sociale. Personalul instituției de învățământ nu efectuează anchete sociale în vederea acordării burselor sociale. (4) După caz, bursa socială poate fi acordată sau retrasă, ca urmare a unei solicitări în acest sens din partea serviciilor publice de asistență socială și pe baza unui raport de anchetă socială. Art. 29. Depunerea documentelor în vederea acordării burselor sociale (1) Conform art. 69 alin. (4) din Legea nr. 207/2015 privind Codul de procedură fiscală, cu modificările și completările ulterioare, verificarea veniturilor declarate de solicitanți se face de către reprezentanții instituției de învățământ superior, respectiv, Comisia de atribuire a burselor la nivel de facultate, cu ajutorul platformei PatrimVen sau prin solicitarea organului central fiscal, în a cărui rază teritorială se află situația beneficiarii, de eliberare a unui document care să ateste situația veniturilor declarate de către aceștia. (2) În vederea acordării burselor sociale, studenții trebuie să depună următoarele documente justificative pe baza cărora se realizează încadrarea în unul dintre tipurile de burse oferite: a) cererea solicitantului, însoțită de o declarație pe propria răspundere privind veniturile nete, cu caracter permanent, obținute pe ultimele 12 luni anterioare cererii, realizate de Page 10 of 16 membrii familiei, supuse impozitului pe venit, și acordul privind prelucrarea datelor cu caracter personal pentru verificarea respectării criteriilor de acordare a bursei; b) pentru situațiile în care există suspiciuni rezonabile, comisia de atribuire a burselor poate solicita studentului să prezinte raportul de anchetă socială, realizat cu respectarea prevederilor legale, din care să reiasă situația exactă a familiei acestuia.",
            "Taxa de înscriere este 125 lei și se poate achita având menționate la explicațiile plății: numele și prenumele complet al candidatului, precum și Facultatea de bază la care acesta se înscrie pentru concursul de admitere, astfel: • direct în platforma on-line https://admitere.pub.ro/, cu card bancar. • prin transfer bancar (realizat într-o aplicate de e-banking sau la ghișeul unei bănci), într-unul dintre următoarele conturi:"
        ],
        "response": "Nu am suficiente informații pentru a răspunde la întrebare.",
        "faithfulness": "1.0"
    },
    {
        "id": "4dc6aec7ff7876808311bd205da2720b8c41308b3764e91fe2c31757b9928b65",
        "user_input": "Care sunt conditiile de promovare a unui an universitar la Politehnica?",
        "retrieved_contexts": [
            "Perioada in cariera Anul obţinerii 5.14.Membru al unei Academii",
            "(7) Bursele, indiferent de categorie, se acordă pe toată durata anului universitar (12 luni), cu excepţia burselor sociale ocazionale. Acordarea burselor încetează la data pierderii calităţii de student sau a neîndeplinirii criteriilor de promovabilitate, după caz, în conformitate cu regulamentele de organizare şi funcţionare ale instituţiilor de învăţământ superior. Capitolul III: OBLIGAȚIILE STUDENȚILOR Art. 15 (1) În mod corelativ, pe durata cât are contract de studii cu POLITEHNICA Bucureşti, studentul, studentul-doctorand sau cursantul, după caz, au următoarele îndatoriri: a) de a învăță în mod sistematic la toate disciplinele din planul de învățământ şi de a-şi însuşi pe deplin cunoştințele predate potrivit programelor universitare sau postuniversitare, după caz, în scopul unei temeinice pregătiri teoretice şi practice; b) de a respecta normele de etică şi de conduită academică în mediul universitar şi de a avea un comportament demn şi conform cu regulile de conviețuire socială în afara acestuia; c) de a respecta Carta, regulamentele și deciziile impuse de POLITEHNICA București; d) de a participa la ședințele structurilor de conducere din cadrul POLITEHNICII București în calitate de reprezentanți aleși ai studenților; e) de a respecta standardele de calitate impuse de către POLITEHNICA București; f) de a respecta drepturile de autor ale altor persoane și de a recunoaște paternitatea informațiilor prezentate în lucrările elaborate g) de a elabora și susține lucrări de evaluare la nivel de disciplină și lucrări de finalizare originale; h) de a sesiza autorităților competente orice nereguli în procesul de învățământ și în cadrul activităților conexe acestuia; i) de a participa la activități academice fără a fi sub influența băuturilor alcoolice sau a altor substanțe interzise; j) de a nu folosi un limbaj și comportament neadecvate mediului universitar; k) de a utiliza în mod corespunzător, conform destinației stabilite, toate facilitățile și subvențiile primite; l) de a semna contractul de studii la începerea fiecărui ciclu de studii. m)",
            "(21) Pentru anul universitar 2025-2026, POLITEHNICA Bucureşti organizează concurs de admitere la studiile universitare de doctorat pentru domeniile de doctorat precizate în Anexa 1, care este parte integrantă a acestei Metodologii. (22) Admiterea la doctorat se face în limita locurilor alocate anual de: a) Ministerul Educației pentru doctoratul în regim de finanțare de la bugetul de stat sub formă de granturi doctorale; b) POLITEHNICA Bucureşti, în calitate de Instituție Organizatoare de Studii Universitare de Doctorat (IOSUD) , pentru doctoratul în regim cu taxă. (23) Ocuparea locurilor în regim cu taxă, se confirmă prin achitarea primei rate a taxei de studii şi încheierea contractului de studii. (24) Pe baza granturilor alocate CSUD propune spre aprobare Consiliului de Administraţie distribuţia pe Şcoli doctorale a numărului de locuri pe regimuri de finanţare (de la bugetul de stat sau cu taxă). (25) Costurile aferente depășirii duratei normale a studiilor doctorale finanțate de la bugetul de stat se suportă de către doctoranzi prin plata taxei anuale de studii doctorale stabilite de Senatul POLITEHNICA Bucureşti. Art. 3. ÎNSCRIEREA CANDIDAŢILOR (1) Absolvenții cu diplomă ai învățământului universitar de lungă durată au dreptul să participe la concursul de admitere la doctorat fără a fi absolvit un ciclu de studii aprofundate sau de masterat. (2) Înscrierea la concursul de admitere într-un domeniu de doctorat se poate face indiferent de domeniul în care candidatul a obținut diploma de finalizare a învățământului universitar de lungă durată, de studii aprofundate sau de masterat. (3) Doctoranzii exmatriculați au dreptul să participe la un nou concurs de admitere la doctorat numai pe locurile alocate în regim cu taxă. (4) Candidații depun online dosarul de înscriere în platforma www.admitere.pub.ro, în perioada Decembrie 2024 – Septembrie 2025, dosar care trebuie să conțină următoarele documente: a) Cerere de înscriere (Anexa 2). b) Curriculum vitae. c) Lista de lucrări publicate.",
            "(7) Rezultatele aşteptate ale învăţării sunt corelate cu competenţele solicitate de ocupaţiile corespunzătoare, conform standardelor ocupaţionale şi/sau Clasificării Europene a Ocupaţiilor (ESCO). Art. 4. Structura anului universitar (1) Structura anului universitar este aprobată de către Senatul Universității, în conformitate cu dispozițiile art. 27 din Legea 199/2023. (2) La începutul fiecărui an universitar, facultățile au obligația afișării pe pagina web structura anului universitar și planurile de învățământ, pentru fiecare program de studii. Fișa disciplinei se aduce la cunoștința studentului de către cadrul didactic titular al disciplinei în cadrul primului curs/seminar al semestrului și se publică pe platforma Moodle. MINISTERUL EDUCAȚIEI Universitatea Naţională de Ştiinţă şi Tehnologie POLITEHNICA Bucureşti Art. 5. Calitatea de Student (1) Calitatea de student în cadrul POLITEHNICII Bucureşti se poate dobândi/redobândi prin unul din următoarele moduri: a) prin concurs de admitere; b) prin mobilitate academică definitivă de la o altă instituție de învățământ superior autorizată să funcționeze provizoriu sau acreditată din țară sau străinătate, conform prevederilor legale; c) prin reînmatriculare la aceeași facultate/domeniu/specializare pentru persoanele care au fost exmatriculate din POLITEHNICA București (în maxim 5 ani de la exmatriculare); d) prin reluarea studiilor, la aceeași facultate/domeniu/specializare unde a făcut întreruperea, pentru studenții care au fost în întrerupere de studii (1 sau 2 ani universitari); e) conform procedurilor legale pentru studenții străini. (2) Înscrierea la studii a unui student se face în baza existenţei unui contract de studii semnat de către părți (student și universitate). (3) Calitatea de student al universităţii se pierde: a) la absolvirea ciclului de studii; b) prin retragere de la studii; c) prin exmatriculare; d) pe perioada întreruperii studiilor . Art. 6. Planurile de învățământ Planurile de învățământ conțin discipline care sunt clasificate, în raport de criterii, astfel: a) după tipul disciplinei: obligatorii, opționale și facultative; b) după categoria formativă: disciplină de sinteză, disciplină de aprofundare, disciplină complementară.",
            "(1) Studentul poate accede, pe durata studiilor universitare de licenţă (începând cu anul II de studii), la începutul fiecărui an universitar, conform prevederilor legale şi reglementărilor interne, pe loc finanţat de la bugetul de stat, în limita locurilor disponibile pentru fiecare an de studii în parte la nivelul fiecărui centru universitar. (2) La începutul fiecărui an universitar, locurile disponibile finanţate de la bugetul de stat sunt redistribuite în ordinea descrescătoare a mediilor obţinute de studenţi în anul anterior. Studenții care nu au ocupat, în urma redistribuirii locurilor, un loc finanțat de la bugetul de stat vor continua studiile în regim cu taxă. (3) În cazul în care, pentru ultimul loc bugetat ce intră în procedura de redistribuire, sunt eligibili mai mulţi studenţi cu aceeaşi medie se va proceda la redistribuirea acestora pe baza unor criterii subsidiare în următoarea ordine: numărul de ECTS acumulate, media generală a anilor de studii până la momentul realizării repartizării sau media de la admitere (pentru studenţii promovaţi din anul I). În cazul în care egalitatea persistă, BExF va stabili şi alte criterii specifice de departajare. (4) Locul finanţat de la bugetul de stat de pe care titularul, din motive personale, solicită să se retragă după începerea anului universitar, până la finalizarea anului calendaristic, este redistribuit următorului student din clasamentul anului respectiv de studii, începând cu semestrul al II-lea al anului universitar. (5) Repartizarea studenţilor pe locurile finanţate de la bugetul de stat se efectuează la nivelul ramurilor de ştiinţă din fiecare facultate, fiind posibilă redistribuirea internă la nivelul fiecărei facultăţi, fără afectarea negativă a finanţării. În situaţia în care numărul locurilor finanţate de la bugetul de stat depăşeste numărul studenţilor înmatriculaţi la un anumit an de studiu (II, III sau IV) şi nu pot fi redistribuite în cadrul facultăţii respective, atunci Consiliul de Administraţie al Universităţii poate decide redistribuirea locurilor bugetate între facultăţi, la nivelul fiecărui an universitar. VI. FINALIZAREA STUDIILOR ART. 29. FINALIZAREA STUDIILOR (1) Finalizarea studiilor de licenţă în POLITEHNICA Bucureştise face prin Examen de Diplomă/Examen de Licenţă."
        ],
        "response": "Nu am suficiente informații pentru a răspunde la întrebare.",
        "faithfulness": "1.0"
    },
    {
        "id": "ca42f02e09457dc7286f69d757f9a616964e1ce37ea72c61cf219cfd143279a0",
        "user_input": "Care este cuantumul taxei de scolarizare la ACS?",
        "retrieved_contexts": [
            "ANS, “se raportează doar datele privind studenții aflați la forma de finanțare cu taxă, inclusiv studenții proveniți din studenți bugetați, care repetă cu taxă un an de studiu sau au depășit durata de studiu subvenționată de stat, stabilită prin lege și plătesc taxe. ” Anual Ministerul Educației alocă, prin HG, cifra de școlarizare – acestea se traduc în locurile finanțate la nivel de universitate de la Bugetul de Stat (BS), pentru ciclurile de învățământ pentru licență, masterat și doctorat. Separat, POLITEHNICA București alocă un număr de locuri pentru studenți în regim de taxă de studii (TS) la învățământul universitar de licență, masterat, respectiv doctorat. Separat, Ministerul Educației alocă locuri finanțate de la bugetul de stat pentru Românii de Pretutindeni (RdP) – acestea sunt locuri fără plata taxelor de școlarizare (i.e. , finanțarea vine de la bugetul de stat), cu bursă suportată sau fără. Cf. Legii nr. 299/2007, “românii de pretutindeni reprezintă: persoanele care își asumă liber identitatea culturală românească; persoanele de origine română și cele care aparțin trăsăturilor lingvistice și culturale românești, care trăiesc în afara granițelor României , indiferent de etnonimul utilizat (armâni, armânji, aromâni, basarabeni, bucovineni, cuțovlahi, daco-români, fărșeroți, herțeni, istro-români, latini dunăreni, macedoromâni, macedo-români, maramureșeni, megleniți, megleno-români, moldoveni, moldovlahi, rrămâni, rumâni, valahi, vlahi, vlasi, volohi, macedo-armânji) precum și toate celelalte forme lexicale semantic legate de cele menționate anterior ; emigranții români, indiferent dacă au păstrat sau nu cetățenia română, precum și descendenții acestora, precum și cetățenii români cu domiciliu sau reședința permanentă în străinătate. ”.",
            "(2) Absolvenţii Universității Naționale de Știință și Tehnologie POLITEHNICA București care repetă examenul de finalizare a studiilor sau care au urmat în regim cu taxă de studii, trebuie să depună la înscriere și chitanța de plată a taxei de examen de finalizare a studiilor, cu valoarea aprobată de Senatul universității pentru anul universitar 2024-2025. Plata acestei taxe se va face online sau la casieria universității. Art. 14. (1) Se pot prezenta la examenul de licență/diplomă/disertaţie numai absolvenţii care au promovat toate activităţile obligatorii cuprinse în planul de învăţământ, astfel: a) absolvenții din promoția 2025; b) absolvenţii din promoţiile anterioare, care nu au susţinut sau nu au promovat examenul de finalizare a studiilor, indiferent de anul absolvirii. (2) Absolvenții au obligația de a-și achita datoriile financiare sau materiale față de universitatea absolvită. Art. 15. (1) După încheierea înscrierii, secretariatele facultăţilor la care s-au făcut înscrierile, vor întocmi, pentru fiecare program de studii/specializări, listele cu candidaţii înscrişi pentru susţinerea examenului de finalizare a studiilor, fiecare listă conţinând toţi candidaţii, în ordine alfabetică, indiferent de instituţia de învăţământ superior care a asigurat şcolarizarea absolvenţilor. (2) Listele cu absolvenţii înscrişi pentru susţinerea examenului de finalizare a studiilor vor fi transmise la secretarii comisiilor de examen imediat după finalizarea acestora, înainte de începerea examenului. Secretarii comisiilor, sub coordonarea preşedinţilor comisiilor, vor întocmi şi aduce la cunoştinţa absolvenţilor, cu cel puţin 1 zi înainte de începerea examenului, listele cu programarea pe zile și ora exactă pentru susținerea probelor de examen. III. ORGANIZAREA ŞI DESFĂŞURAREA EXAMENULUI DE FINALIZARE A STUDIILOR Art. 16. (1) Pentru organizarea şi desfăşurarea examenelor de finalizare a studiilor se constituie următoarele comisii:",
            "Sistemul de taxe școlarizare În Universitatea Națională de Știință și Tehnologie POLITEHNICA București, pentru anul universitar 2024-2025 2024 Cuantumul Nr. taxei Taxa Crt. [RON]",
            "(2) Studentul care solicită retragerea de la studii are obligaţia de a achita taxele şcolare la zi până la data retragerii. Actele de la dosarul personal se eliberează numai în urma prezentării, la decanat, a notei de lichidare semnate. III. TAXELE DE STUDII PENTRU REFACEREA DISCIPLINELOR Art. 21. Definire taxe (1) Se definesc următoarele tipuri de taxe: a) taxa de refacere a unei discipline TD1, pentru studenţii care au maximum 2 discipline de refăcut; b) taxa de refacere a unei discipline TD2, pentru studenţii care au mai mult de 2 discipline de refăcut, dacă promovează anul de studii; c) taxa de refacere a unei discipline TD3, pentru studenţii care nu promovează anul de studii. (2) Cuantumul acestei taxe se stabileşte şi aprobă anual de către Senatul POLITEHNICA Bucureşti. (3) Taxa de refacere a unei discipline se plăteşte în primele două săptămâni de la începutul semestrului în care se reface disciplina sau în conformitate cu alte decizii ale Consiliului de Administraţie al Universităţii. (4) Studenții care nu plătesc taxa de refacere a unei discipline nu pot susține verificări parţiale sau finale la disciplina respectivă. MINISTERUL EDUCAȚIEI Universitatea Naţională de Ştiinţă şi Tehnologie POLITEHNICA Bucureşti (5) Studenții care reprezintă „cazuri sociale” pot beneficia de scutirea la plată a taxei de refacere a unei discipline, cu aprobarea BExF şi acoperirea cheltuielilor din fondurile facultății. (6) Scutirea de plată a taxelor pentru refacerea disciplinelor este validată numai de Consiliul de Administrație al Universităţii. PARTEA A II-A. ACTIVITATEA PROFESIONALĂ A STUDENŢILOR I. PREVEDERI GENERALE II. ÎNSCRIEREA LA FACULTATE ŞI DOCUMENTE NECESARE Art. 22. Înmatricularea studenților admiși și trecerea în an superior (1) Înmatricularea studenților admiși la concursul de admitere în anul I de studii, a studenților transferați de la alte universități sau facultăți și a studenților cărora li s-a aprobat reluarea studiilor, se face prin decizie a Rectorului POLITEHNICA Bucureşti.",
            "(4) Studenții care nu au acumulat numărul de ECTS pentru trecerea în anul de studii superior, pot reface anul de studii cu plata taxei pentru fiecare disciplină nepromovată. Art. 17. Examenul de Disertație (1) Masteratul se încheie cu susţinerea publică a unei Lucrări de disertaţie. Accesul la susținerea Examenului de Disertație este condiționat de obținerea, la disciplinele impuse și opționale, a minimum 60 ECTS, respectiv 120 ECTS, în funcţie de durata programului de studii. (2) Masterandul care a îndeplinit toate cerințele prevăzute în programul de studii universitare de Masterat și a obținut cel puțin media 6 la susținerea publică a Lucrării de disertație primește Diploma de Master, însoțită de suplimentul la diplomă, întocmit conform reglementărilor în vigoare. II.3. REGULI DE ÎNTRERUPERE/REÎNMATRICULARE/RETRAGERE Art. 18. Întreruperea studiilor (1) Întreruperea studiilor se poate face, la cerere, numai la începutul anului universitar, în perioada în care se încheie Contractele de studii/Actele adiționale, și este permisă pentru o durată de cel mult 2 ani universitari. MINISTERUL EDUCAȚIEI Universitatea Naţională de Ştiinţă şi Tehnologie POLITEHNICA Bucureşti (2) Reînscrierea masterandului, după întreruperea studiilor, se face în anul de studii în care are dreptul, în condiţiile respectării regulilor de trecere ale prezentului regulament, beneficiind de recunoaşterea notelor obţinute anterior întreruperii. (3) În cazuri bine justificate, BExF poate aproba întreruperea studiilor începând cu semestrul II. În acest caz, pentru studenții pe locuri cu taxă, reînscrierea este posibilă cu plata a jumătate din taxa anuală de studii. (4) Întreruperea studiilor presupune: a) încetarea contractului de studii şi încheierea unui nou contract de studii, în cazul în care studentul şi-a întrerupt studiile, pe o perioadă de cel puţin două semestre consecutive. Noul contract de studii se încheie în condiţiile rezultate în urma modificării planurilor de învăţământ, inclusiv cele referitoare la modificările de taxe; b) suspendarea contractului de studii."
        ],
        "response": "Nu am suficiente informații pentru a răspunde la întrebare.",
        "faithfulness": "1.0"
    },
    {
        "id": "792bcf58dc1b51c8bc367572c6c72ed6dba033f8a911e11c10a01080f90d65b4",
        "user_input": "Cum pot plati taxa de scolarizare?",
        "retrieved_contexts": [
            "Statutul de masterand cu taxă se păstrează, de regulă, pe întreaga durată de școlarizare. Pentru Centrul Universitar Pitești, forma de finanțare pentru studentul masterand se va stabili în fiecare an, conform ierarhizării studenților după medii, fără a fi menținut locul la buget sau taxă, obținut la admitere, toată perioada școlarizării. Cuantumul taxei, pentru fiecare an de studiu, se aprobă de Senatul Universității, în funcție de costurile specifice școlarizării. Art. 35. În organizarea formațiilor de studiu nu se face distincție între cele două categorii de admiși, cu sau fără taxă. Art. 36. Candidații declarați admiși vor completa și semna olograf contractul de studii universitare de masterat, respectiv un contract individual de studii şi pregătire practică la învăţământul dual, după înmatriculare și nu mai târziu de începutul anului universitar 2025-2026. În caz contrar aceștia vor pierde statutul de masterand. Anexa 1 Universitatea Națională de Știință și Tehnologie POLITEHNICA București FIŞA DE ÎNSCRIERE PENTRU ABSOLVENŢII CU DIPLOMĂ DE LICENŢĂ/INGINER CARE DORESC SĂ URMEZE ÎNVĂŢĂMÂNTUL UNIVERSITAR DE MASTERAT ANUL UNIVERSITAR 2025 – 2026 Sesiunea iulie și septembrie 1. Numele, iniţiala prenumelui tatălui şi prenumele candidatului:",
            "ANS, “se raportează doar datele privind studenții aflați la forma de finanțare cu taxă, inclusiv studenții proveniți din studenți bugetați, care repetă cu taxă un an de studiu sau au depășit durata de studiu subvenționată de stat, stabilită prin lege și plătesc taxe. ” Anual Ministerul Educației alocă, prin HG, cifra de școlarizare – acestea se traduc în locurile finanțate la nivel de universitate de la Bugetul de Stat (BS), pentru ciclurile de învățământ pentru licență, masterat și doctorat. Separat, POLITEHNICA București alocă un număr de locuri pentru studenți în regim de taxă de studii (TS) la învățământul universitar de licență, masterat, respectiv doctorat. Separat, Ministerul Educației alocă locuri finanțate de la bugetul de stat pentru Românii de Pretutindeni (RdP) – acestea sunt locuri fără plata taxelor de școlarizare (i.e. , finanțarea vine de la bugetul de stat), cu bursă suportată sau fără. Cf. Legii nr. 299/2007, “românii de pretutindeni reprezintă: persoanele care își asumă liber identitatea culturală românească; persoanele de origine română și cele care aparțin trăsăturilor lingvistice și culturale românești, care trăiesc în afara granițelor României , indiferent de etnonimul utilizat (armâni, armânji, aromâni, basarabeni, bucovineni, cuțovlahi, daco-români, fărșeroți, herțeni, istro-români, latini dunăreni, macedoromâni, macedo-români, maramureșeni, megleniți, megleno-români, moldoveni, moldovlahi, rrămâni, rumâni, valahi, vlahi, vlasi, volohi, macedo-armânji) precum și toate celelalte forme lexicale semantic legate de cele menționate anterior ; emigranții români, indiferent dacă au păstrat sau nu cetățenia română, precum și descendenții acestora, precum și cetățenii români cu domiciliu sau reședința permanentă în străinătate. ”.",
            "Documentele solicitate pentru scutirea plății taxei de înscriere sunt, după caz: - adeverință de angajat în sistemul de învățământ a unuia dintre părinți eliberată de unitatea de învățământ la care acesta este angajat; - adeverințe de la centrele de plasament sau casele de copii, în cazul candidaților care provin de la un centru de plasament sau de la o casă de copii; - certificatul de deces al unui părinte, în cazul candidaților orfani de un părinte; - certificatele de deces ale părinților, în cazul candidaților orfani de ambii părinți; - dovada că este copil al eroilor martiri sau al răniților din timpul Revoluției din decembrie 1989; - dovada că este copil al unui salariat din Universitatea Națională de Știință și Tehnologie POLITEHNICA; - cerere către Decanul facultății la care candidatul se înscrie la concurs, pentru scutirea de plată a taxei de înscriere însoțită de acte doveditoare care să ateste o situație materială precară, în special pentru candidații proveniți din mediul rural (cupoane de pensii din ultima lună ale părinților; adeverințe care să ateste statutul de șomer al părinților; adeverințe de venit eliberate de primăria comunei în care locuiesc părinții etc.",
            "(2) Absolvenţii Universității Naționale de Știință și Tehnologie POLITEHNICA București care repetă examenul de finalizare a studiilor sau care au urmat în regim cu taxă de studii, trebuie să depună la înscriere și chitanța de plată a taxei de examen de finalizare a studiilor, cu valoarea aprobată de Senatul universității pentru anul universitar 2024-2025. Plata acestei taxe se va face online sau la casieria universității. Art. 14. (1) Se pot prezenta la examenul de licență/diplomă/disertaţie numai absolvenţii care au promovat toate activităţile obligatorii cuprinse în planul de învăţământ, astfel: a) absolvenții din promoția 2025; b) absolvenţii din promoţiile anterioare, care nu au susţinut sau nu au promovat examenul de finalizare a studiilor, indiferent de anul absolvirii. (2) Absolvenții au obligația de a-și achita datoriile financiare sau materiale față de universitatea absolvită. Art. 15. (1) După încheierea înscrierii, secretariatele facultăţilor la care s-au făcut înscrierile, vor întocmi, pentru fiecare program de studii/specializări, listele cu candidaţii înscrişi pentru susţinerea examenului de finalizare a studiilor, fiecare listă conţinând toţi candidaţii, în ordine alfabetică, indiferent de instituţia de învăţământ superior care a asigurat şcolarizarea absolvenţilor. (2) Listele cu absolvenţii înscrişi pentru susţinerea examenului de finalizare a studiilor vor fi transmise la secretarii comisiilor de examen imediat după finalizarea acestora, înainte de începerea examenului. Secretarii comisiilor, sub coordonarea preşedinţilor comisiilor, vor întocmi şi aduce la cunoştinţa absolvenţilor, cu cel puţin 1 zi înainte de începerea examenului, listele cu programarea pe zile și ora exactă pentru susținerea probelor de examen. III. ORGANIZAREA ŞI DESFĂŞURAREA EXAMENULUI DE FINALIZARE A STUDIILOR Art. 16. (1) Pentru organizarea şi desfăşurarea examenelor de finalizare a studiilor se constituie următoarele comisii:",
            "(3) La forma de învăţământ cu frecvenţă, şcolarizarea se face în regim de finanțare de la bugetul de stat sau în regim cu taxă, iar la forma de învăţământ cu frecvenţă redusă şcolarizarea se face numai în regim cu taxă. (4) POLITEHNICA Bucureşti poate organiza, în condițiile legii, învățământ superior dual, care reprezintă o formă de învățământ superior cu frecvență, pentru calificări profesionale de nivel 5, 6, 7 și 8. (5) Curriculumul programului de studii universitare de licenţă cuprinde ansamblul de discipline ce conduce la o calificare universitară, are ca scop rezultate aşteptate ale învăţăriişi este concordant cu nivelul calificării definit în Cadrul Naţional al Calificărilor (CNC). Acesta se stabileşte astfel încât să maximizeze şansele obţinerii calificării identificate şi se aprobă de senatul universitar. (6) Pentru fiecare disciplină se întocmeşte fişa disciplinei, în care sunt formulate cel puţin: numărul de ECTS alocate disciplinei, rezultatele învăţării, conţinutul predării şi învăţării şi practicile asociate învăţării, predării şi evaluării, precum şi ponderile acestora în nota finală. (7) Rezultatele aşteptate ale învăţării sunt corelate cu competenţele solicitate de ocupaţiile corespunzătoare, conform standardelor ocupaţionaleşi/sau Clasificării Europene a Ocupaţiilor (ESCO). ART. 4. STRUCTURA ANULUI UNIVERSITAR (1) Structura anului universitar este aprobată de către Senatul Universității, în conformitate cu dispozițiile art. 27 din Legea 199/2023. (2) La începutul fiecărui an universitar, facultățile au obligația afișării pe pagina web structura anului universitar și planurile de învățământ, pentru fiecare program de studii. Fișa disciplinei se aduce la cunoștința studentului de către cadrul didactic titular al disciplinei în cadrul primului curs/seminar al semestrului și se publică pe platforma Moodle. ART. 5. CALITATEA DE STUDENT (1) Calitatea de student în cadrul POLITEHNICII Bucureşti se poate dobândi/redobândi prin unul din următoarele moduri: a) prin concurs de admitere; b) prin mobilitate academică definitivă de la o altă instituție de învățământ superior autorizată să funcționeze provizoriu sau acreditată din țară sau străinătate, conform prevederilor legale;"
        ],
        "response": "Pentru a plăti taxa de școlarizare la Universitatea Națională de Știință și Tehnologie POLITEHNICA București, studenții trebuie să depună chitanța de plată a taxei de examen de finalizare a studiilor, cu valoarea aprobată de Senatul universității. Plata acestei taxe se poate efectua online sau la casieria universității. Este important ca studenții să se asigure că au achitat toate datoriile financiare față de universitate pentru a putea susține examenul de finalizare a studiilor.\n\nSurse:\n- Regulament privind organizarea si desfasurarea examenelor de absolvire licenta/diploma si disertatie pentru anul universitar 2024-2025, URL: https://upb.ro/wp-content/uploads/2025/02/Regulament-privind-organizarea-si-desfasurarea-examenelor-de-absolvire-licentadiploma-si-disertatie-pentru-anul-universitar-2024_2025.pdf, pagina: 7",
        "faithfulness": "0.8"
    },
    {
        "id": "57fab023698503b8b1029d7373fc4410af853f16b67021b20e21600c6fabdfdd",
        "user_input": "Cum se calculeaza media de bursa la Politehnica?",
        "retrieved_contexts": [
            "Art. 16. (1) Domeniile resurse umane și economic administrativ constituie repere semnificative în sistemul de raportare, construit prin intermediul platformei ANS, în stabilirea sumelor alocate pentru finanțarea universităților. (2) Informațiile aferente acestor patru domenii sunt colectate pe baza evidențelor interne ale universității și susținute prin documentația suport aferentă. Art. 17. (1) Prorectorul responsabil ANS și SU comunică Direcției Informatizare și Resurse Umane (DIRU) instrucțiunile și termenele de completare privind evidența resurselor umane. (2) Datele referitoare la structura de personal, respectiv situația posturilor didactice, a posturilor didactic auxiliare și de cercetare, precum și a personalului nedidactic, se raportează la cele două momente de timp (01 octombrie și 01 ianuarie), stabilite prin cadrul legislativ specific și operaționalizate în cadrul platformei ANS. (3) Direcția Informatizare și Resurse Umane transmite macheta completată privind evidența resurselor umane și situația posturilor didactice și de cercetare, a posturilor personalului didactic auxiliar și a personalului nedidactic, către SU. Informațiile centralizate sunt semnate de către Directorul DIRU. (4) Directorul DIRU se asigură că informațiile sunt corecte și nu există deficiențe în sistemul de colectare, analiză și administrare. SU transmite datele ulterior către Prorector responsabil ANS pentru validarea finală și asumarea prin semnătură. Dacă informațiile conțin anumite erori sau deficiențe, întregul pachet de date se retransmite către Direcția Informatizare și Resurse Umane pentru verificare suplimentară și actualizare, dacă este cazul. (5) După etapa de validare finală, datele sunt introduse final în platforma ANS de către persoana desemnată din cadrul DIRU, folosind contul de utilizator deținut în platforma ANS. Art.18 (1) Prorectorul responsabil ANS și SU comunică Direcției Financiar-Contabilă (DFC) instrucțiunile și termenele de completare, privind evidența cheltuielilor și indicatorii specifici pentru raportare. (2) Datele financiare referitoare la evidența cheltuielilor se raportează la data de referință 01 ianuarie, stabilită prin cadrul legislativ specific și operaționalizată în cadrul platformei ANS.",
            "(6) În cazul în care fondul pentru acordarea burselor sociale nu este utilizat în întregime, acesta se redistribuie pentru acordarea burselor de performanță. (7) Distribuirea burselor sociale se face în ordine crescătoare a venitului net pe membru de familie. (8) Sumele rămase în sold pentru facilități de transport pentru studenți, subvenții pentru cămine-cantine și sumele pentru bursele studenților neridicate în termen pot fi utilizate în anii următori pentru acordarea de burse pentru studenți, precum și pentru alte cheltuieli de natura investițiilor pentru infrastructura de cămine, cantine și pentru susținerea activităților centrelor pentru consiliere și orientare în carieră. Art. 35. Universitatea Națională de Știință și Tehnologie POLITEHNICA București poate suplimenta fondul pentru burse provenit de la bugetul de stat, pentru fiecare categorie de burse, cu fonduri provenite din venituri proprii. Art. 36. (1) Cuantumul burselor de performanță și al burselor pentru învățământ dual se aprobă prin hotărârea Senatului, la propunerea Consiliului de Administrație, ca urmare a consultării cu reprezentanții studenților, inclusiv a organizațiilor studențești reprezentative din POLITEHNICA București. (2) Universitatea Națională de Știință și Tehnologie POLITEHNICA București poate acorda sprijin financiar studenților cu rezultate deosebite, pentru participarea la conferințe sau publicarea de articole științifice, cu aprobarea Consiliului de Administrație. (3) Universitatea Națională de Știință și Tehnologie POLITEHNICA București poate acorda burse pentru stagii de studii universitare și postuniversitare, în vederea susținerii mobilităților temporare efectuate în universități și instituții din țară și străinătate. Decizia cu privire la acordarea burselor pentru stagii de studii universitare și postuniversitare, precum și stabilirea cuantumului acestora se ia de către Biroul Consiliului de Administrație al POLITEHNICII București. Page 13 of 16 CAPITOLUL IV Dispoziții finale Art. 37. În cazul în care există suspiciuni de falsificare a documentelor depuse pentru obținerea unei burse pentru ajutor social, POLITEHNICA București va sesiza organele de anchetă competente și va proceda la sancționarea studentului, în funcție de gravitatea faptei. Art. 38.",
            "(3) Direcția Financiar-Contabilă completează în platforma ANS, prin utilizarea contului instituțional, datele privind evidența resurselor financiare și categoriile specifice de cheltuieli. Datele și informațiile comunicate către SU vor fi validate și asumate în momentul închiderii platformei prin semnătura Directorului DFC. Art. 19. (1) Prorectorul responsabil ANS și SU comunică Direcției General Administrativ Economice (DGAE) instrucțiunile și termenele de completare, privind evidența spațiilor dedicate activităților didactice specifice învățământului universitar, precum și alte informații legate de baza tehnico-materială. (2) Datele referitoare la evidența spațiilor și baza tehnico-materială se raportează la data de referință 01 ianuarie, stabilită prin cadrul legislativ specific și operaționalizată în cadrul platformei ANS. (3) DGAE completează macheta privind evidența spațiilor și baza tehnico-materială și o transmite către SU. Datele și informațiile sunt transmise cu asumarea prin semnătura Directorului DGAE. (4) Directorul DGAE se asigură că informațiile sunt corecte și nu există deficiențe în sistemul de colectare, analiză și administrare. SU transmite ulterior datele către Prorector responsabil ANS pentru validarea finală. Dacă informațiile conțin anumite erori sau deficiențe, întregul pachet de date se retransmite către DGAE pentru verificare suplimentară și actualizare, dacă este cazul. (5) După etapa de validare finală acestea sunt introduse în platforma ANS de către persoana desemnată din cadrul DGAE, prin utilizarea contului acesteia. Art. 20. (1) Prorectorul responsabil ANS și SU comunică DGAE instrucțiunile și termenele de completare privind evidența politicii de cazare și respectiv cea specifică burselor pentru raportare. (2) Datele referitoare la structura locurilor de cazare și caracteristicile acestora, respectiv numărul de cantine, precum și cele referitoare la sistemul de burse acordat la nivel instituțional se raportează la data de 01 ianuarie, stabilită prin cadrul legislativ specific și operaționalizată în cadrul platformei ANS. (3) Direcția General Administrativă completează macheta privind evidența locurilor de cazare, a cantinelor și a burselor acordate către SU.",
            "(3) Cuantumul minim al bursei sociale se propune anual, până la data de 1 septembrie, de către Comisia Națională pentru Finanțarea Învățământului Superior (CNFIS), se adoptă prin ordin al ministrului educației și trebuie să acopere cheltuielile minime de masă şi cazare. (4) Cuantumul burselor sociale se stabilește prin hotărâre a senatului universității POLITEHNICA București, la propunerea Consiliului de administrație, în limita fondurilor disponibile și în funcție de nevoile identificate la nivelul comunității studențești, prin consultarea reprezentanților studenților, inclusiv cu organizațiile studențești din POLITEHNICA București. (5) Pentru acordarea burselor sociale, singurul criteriu academic ce se ia în considerare este promovabilitatea. (6) Bursele sociale se cumulează cu alte tipuri de burse, dacă studentul îndeplinește criteriile specifice pentru ambele categorii de burse. (7) Bursele sociale se acordă pe durata legală a programului de studii, până la împlinirea vârstei de 35 de ani. (8) Beneficiarii burselor sociale pot fi: a) studenții orfani de unul sau ambii părinți, studenții care provin din familii monoparentale sau studenții proveniți din centre de plasament și care nu realizează venituri peste plafonul pentru acordarea bursei sociale; b) studenții bolnavi de tuberculoză, care se află în evidența unităților medicale, pe perioada tratamentului tuberculostatic, diabet insulinonecesitant, boli maligne, sindroame de malabsorbție severe, boală cronică de rinichi în program de dializă, astm bronșic persistent moderat sau sever, epilepsie grand mal, cardiopatii congenitale, hepatită cronică cu fibroză avansată (stadiul F3 sau F4), glaucom, miopie gravă, boli imunologice autoimune forme severe, boli rare, tulburări din spectrul autist, boli hematologice severe care necesită tratament continuu sau spitalizări frecvente, surditate bilaterală, fibroză chistică, cei infectați cu virusul HIV sau bolnavi de SIDA, cei cu handicap locomotor și încadrați într-un grad de invaliditate, fără a se lua în considerare nivelul venitului mediu pe membru de familie;",
            "ANS, “se raportează doar datele privind studenții aflați la forma de finanțare cu taxă, inclusiv studenții proveniți din studenți bugetați, care repetă cu taxă un an de studiu sau au depășit durata de studiu subvenționată de stat, stabilită prin lege și plătesc taxe. ” Anual Ministerul Educației alocă, prin HG, cifra de școlarizare – acestea se traduc în locurile finanțate la nivel de universitate de la Bugetul de Stat (BS), pentru ciclurile de învățământ pentru licență, masterat și doctorat. Separat, POLITEHNICA București alocă un număr de locuri pentru studenți în regim de taxă de studii (TS) la învățământul universitar de licență, masterat, respectiv doctorat. Separat, Ministerul Educației alocă locuri finanțate de la bugetul de stat pentru Românii de Pretutindeni (RdP) – acestea sunt locuri fără plata taxelor de școlarizare (i.e. , finanțarea vine de la bugetul de stat), cu bursă suportată sau fără. Cf. Legii nr. 299/2007, “românii de pretutindeni reprezintă: persoanele care își asumă liber identitatea culturală românească; persoanele de origine română și cele care aparțin trăsăturilor lingvistice și culturale românești, care trăiesc în afara granițelor României , indiferent de etnonimul utilizat (armâni, armânji, aromâni, basarabeni, bucovineni, cuțovlahi, daco-români, fărșeroți, herțeni, istro-români, latini dunăreni, macedoromâni, macedo-români, maramureșeni, megleniți, megleno-români, moldoveni, moldovlahi, rrămâni, rumâni, valahi, vlahi, vlasi, volohi, macedo-armânji) precum și toate celelalte forme lexicale semantic legate de cele menționate anterior ; emigranții români, indiferent dacă au păstrat sau nu cetățenia română, precum și descendenții acestora, precum și cetățenii români cu domiciliu sau reședința permanentă în străinătate. ”."
        ],
        "response": "Nu am suficiente informații pentru a răspunde la întrebare.",
        "faithfulness": "1.0"
    },
    {
        "id": "0d898bce639326d6de179068a593508054d36b4a7cb9c56a135aeb0abfc2cbcd",
        "user_input": "Exista posibilitatea de a plati taxa de scolarizare in rate?",
        "retrieved_contexts": [
            "ANS, “se raportează doar datele privind studenții aflați la forma de finanțare cu taxă, inclusiv studenții proveniți din studenți bugetați, care repetă cu taxă un an de studiu sau au depășit durata de studiu subvenționată de stat, stabilită prin lege și plătesc taxe. ” Anual Ministerul Educației alocă, prin HG, cifra de școlarizare – acestea se traduc în locurile finanțate la nivel de universitate de la Bugetul de Stat (BS), pentru ciclurile de învățământ pentru licență, masterat și doctorat. Separat, POLITEHNICA București alocă un număr de locuri pentru studenți în regim de taxă de studii (TS) la învățământul universitar de licență, masterat, respectiv doctorat. Separat, Ministerul Educației alocă locuri finanțate de la bugetul de stat pentru Românii de Pretutindeni (RdP) – acestea sunt locuri fără plata taxelor de școlarizare (i.e. , finanțarea vine de la bugetul de stat), cu bursă suportată sau fără. Cf. Legii nr. 299/2007, “românii de pretutindeni reprezintă: persoanele care își asumă liber identitatea culturală românească; persoanele de origine română și cele care aparțin trăsăturilor lingvistice și culturale românești, care trăiesc în afara granițelor României , indiferent de etnonimul utilizat (armâni, armânji, aromâni, basarabeni, bucovineni, cuțovlahi, daco-români, fărșeroți, herțeni, istro-români, latini dunăreni, macedoromâni, macedo-români, maramureșeni, megleniți, megleno-români, moldoveni, moldovlahi, rrămâni, rumâni, valahi, vlahi, vlasi, volohi, macedo-armânji) precum și toate celelalte forme lexicale semantic legate de cele menționate anterior ; emigranții români, indiferent dacă au păstrat sau nu cetățenia română, precum și descendenții acestora, precum și cetățenii români cu domiciliu sau reședința permanentă în străinătate. ”.",
            "(3) La forma de învăţământ cu frecvenţă, şcolarizarea se face în regim de finanțare de la bugetul de stat sau în regim cu taxă, iar la forma de învăţământ cu frecvenţă redusă şcolarizarea se face numai în regim cu taxă. (4) POLITEHNICA Bucureşti poate organiza, în condițiile legii, învățământ superior dual, care reprezintă o formă de învățământ superior cu frecvență, pentru calificări profesionale de nivel 5, 6, 7 și 8. (5) Curriculumul programului de studii universitare de licenţă cuprinde ansamblul de discipline ce conduce la o calificare universitară, are ca scop rezultate aşteptate ale învăţăriişi este concordant cu nivelul calificării definit în Cadrul Naţional al Calificărilor (CNC). Acesta se stabileşte astfel încât să maximizeze şansele obţinerii calificării identificate şi se aprobă de senatul universitar. (6) Pentru fiecare disciplină se întocmeşte fişa disciplinei, în care sunt formulate cel puţin: numărul de ECTS alocate disciplinei, rezultatele învăţării, conţinutul predării şi învăţării şi practicile asociate învăţării, predării şi evaluării, precum şi ponderile acestora în nota finală. (7) Rezultatele aşteptate ale învăţării sunt corelate cu competenţele solicitate de ocupaţiile corespunzătoare, conform standardelor ocupaţionaleşi/sau Clasificării Europene a Ocupaţiilor (ESCO). ART. 4. STRUCTURA ANULUI UNIVERSITAR (1) Structura anului universitar este aprobată de către Senatul Universității, în conformitate cu dispozițiile art. 27 din Legea 199/2023. (2) La începutul fiecărui an universitar, facultățile au obligația afișării pe pagina web structura anului universitar și planurile de învățământ, pentru fiecare program de studii. Fișa disciplinei se aduce la cunoștința studentului de către cadrul didactic titular al disciplinei în cadrul primului curs/seminar al semestrului și se publică pe platforma Moodle. ART. 5. CALITATEA DE STUDENT (1) Calitatea de student în cadrul POLITEHNICII Bucureşti se poate dobândi/redobândi prin unul din următoarele moduri: a) prin concurs de admitere; b) prin mobilitate academică definitivă de la o altă instituție de învățământ superior autorizată să funcționeze provizoriu sau acreditată din țară sau străinătate, conform prevederilor legale;",
            "Statutul de masterand cu taxă se păstrează, de regulă, pe întreaga durată de școlarizare. Pentru Centrul Universitar Pitești, forma de finanțare pentru studentul masterand se va stabili în fiecare an, conform ierarhizării studenților după medii, fără a fi menținut locul la buget sau taxă, obținut la admitere, toată perioada școlarizării. Cuantumul taxei, pentru fiecare an de studiu, se aprobă de Senatul Universității, în funcție de costurile specifice școlarizării. Art. 35. În organizarea formațiilor de studiu nu se face distincție între cele două categorii de admiși, cu sau fără taxă. Art. 36. Candidații declarați admiși vor completa și semna olograf contractul de studii universitare de masterat, respectiv un contract individual de studii şi pregătire practică la învăţământul dual, după înmatriculare și nu mai târziu de începutul anului universitar 2025-2026. În caz contrar aceștia vor pierde statutul de masterand. Anexa 1 Universitatea Națională de Știință și Tehnologie POLITEHNICA București FIŞA DE ÎNSCRIERE PENTRU ABSOLVENŢII CU DIPLOMĂ DE LICENŢĂ/INGINER CARE DORESC SĂ URMEZE ÎNVĂŢĂMÂNTUL UNIVERSITAR DE MASTERAT ANUL UNIVERSITAR 2025 – 2026 Sesiunea iulie și septembrie 1. Numele, iniţiala prenumelui tatălui şi prenumele candidatului:",
            "(2) Absolvenţii Universității Naționale de Știință și Tehnologie POLITEHNICA București care repetă examenul de finalizare a studiilor sau care au urmat în regim cu taxă de studii, trebuie să depună la înscriere și chitanța de plată a taxei de examen de finalizare a studiilor, cu valoarea aprobată de Senatul universității pentru anul universitar 2024-2025. Plata acestei taxe se va face online sau la casieria universității. Art. 14. (1) Se pot prezenta la examenul de licență/diplomă/disertaţie numai absolvenţii care au promovat toate activităţile obligatorii cuprinse în planul de învăţământ, astfel: a) absolvenții din promoția 2025; b) absolvenţii din promoţiile anterioare, care nu au susţinut sau nu au promovat examenul de finalizare a studiilor, indiferent de anul absolvirii. (2) Absolvenții au obligația de a-și achita datoriile financiare sau materiale față de universitatea absolvită. Art. 15. (1) După încheierea înscrierii, secretariatele facultăţilor la care s-au făcut înscrierile, vor întocmi, pentru fiecare program de studii/specializări, listele cu candidaţii înscrişi pentru susţinerea examenului de finalizare a studiilor, fiecare listă conţinând toţi candidaţii, în ordine alfabetică, indiferent de instituţia de învăţământ superior care a asigurat şcolarizarea absolvenţilor. (2) Listele cu absolvenţii înscrişi pentru susţinerea examenului de finalizare a studiilor vor fi transmise la secretarii comisiilor de examen imediat după finalizarea acestora, înainte de începerea examenului. Secretarii comisiilor, sub coordonarea preşedinţilor comisiilor, vor întocmi şi aduce la cunoştinţa absolvenţilor, cu cel puţin 1 zi înainte de începerea examenului, listele cu programarea pe zile și ora exactă pentru susținerea probelor de examen. III. ORGANIZAREA ŞI DESFĂŞURAREA EXAMENULUI DE FINALIZARE A STUDIILOR Art. 16. (1) Pentru organizarea şi desfăşurarea examenelor de finalizare a studiilor se constituie următoarele comisii:",
            "** Adeverință din care să rezulte calitatea de student și regimul de finanțare (buget sau cu taxă) pentru programul de studii la care sunt înmatriculați - Original. Atenție! Pot fi admiși și înmatriculați, la concursul de admitere, pentru a urma concomitent două programe de studii numai studenții care la finele sesiunii de examene din vara anului universitar 2024/2025 sunt integraliști. O adeverință în acest sens (sau situația școlară curentă) vor fi necesare la înmatriculare. Anx. VII-10. Pentru candidații care sunt studenți cu taxă (la o facultate din UNSTPB sau din alte universități) și care doresc să treacă în regim fără taxă (pe locuri finanțate de la buget), la același domeniu de studiu se mai adaugă și documentele din tabelul de mai jos. În cazul în care vor fi declarați admiși în numărul de locuri subvenționate de la bugetul de stat, ei vor putea fi înmatriculați în anul de studiu stabilit de reglementările Senatului universității (eventual cu condiția susținerii unor examene de diferență). |"
        ],
        "response": "Nu am suficiente informații pentru a răspunde la întrebare.",
        "faithfulness": "1.0"
    },
    {
        "id": "ca06aa1c1f6ee2c364e7c4c7490434f92031eecdad0aa74e4476f25b062f136c",
        "user_input": "Care este calendarul de admitere?",
        "retrieved_contexts": [
            "Data Semnătura",
            "Masterat – Admitere 2025 | | Sesiunea Mai Calendar: | Înscriere: | 15 decembrie – 9 mai (ora 16): admitere.pub.ro | | Verificarea dosarelor: | 14 aprilie – 9 mai | | Concurs: | 13-16 mai (planificarea detaliată va fi afișată după finalizarea înscrierilor) | | Rezultate: | 17 mai | | Înmatriculare: | în intervalui 01-31 iulie (după obținerea licenței, conform unui calendar ce va fi afișat ulterior) | În sesiunea Mai vor fi scoase la concurs locuri la toate programele cu excepția EGOV, SCPD și SSA. Numărul orientativ de locuri scoase la concurs va fi afișat în curând. Informații generale pentru candidați Facultatea de Automatică și Calculatoare (ACS) organizează concursul de admitere în învățământul universitar de masterat, în anul 2025, în 3 sesiuni: - admitere anticipată (mai) - sesiunea iulie - sesiunea septembrie Informații generale la nivel UPB privind admiterea la masterat (calendar, regulament admitere, regulament studii etc. – in curs de actualizare): https://upb.ro/admitere/admitere-masterat/ Înscrierea la concurs se face prin intermediul platformei admitere.pub.ro. Toate informațiile specifice ACS privind concursul (modul de desfășurare a probelor, tematica, bibliografia, planificare interviuri, rezultate, înmatricularea candidaților admiși etc.) vor fi afișate pe această pagina. Concursul va consta din cele 2 probe prevăzute de regulamentul de admitere - evaluarea cunoștințelor fundamentale - evaluarea motivației candidatului Modul de desfășurare a probelor, tematica și bibliografia: - domeniul CTI - domeniile IS si IM Mod mixt (fizic + online) Standardele naționale recente de calitate pentru învățământul superior permit desfășurarea de studii în regim mixt. Pentru domeniile de master CTI, IS, IM se pot desfășura în regim online sincron maxim 60% din activitățile de curs și 35% din cele de aplicații și cercetare.",
            "| Calendarul desfășurării concursului de Sesiunea | admitere în învățământul universitar de masterat lulie 2025 |\n|:--|:--|\n| Înscrierea candidaților | 30.06 — 07.07.2025 |\n| Concurs de admitere | 09.07 — 11.07.2025 |\n| Comunicarea rezultatelor | 09.07 — 13.07.2025 |\n| Înmatricularea candidaților | 15.07 —31.07.2025 |",
            "Procesul de Admitere în sesiunea Septembrie la studiile universitare de masterat va începe pe data de 02.09.2024. Calendarul pentru Sesiunea III de Admitere 2024 este următorul: înscrierea candidaților: 02.09 - 13.09.2024, Concursul de admitere: 16.09 – 17.09.2024, Comunicarea rezultatelor: 16.09 – 18.09.2024, Înmatricularea candidaților: 16.09 – 20.09.2024. Admiterea se face conform Regulamentului privind organizarea și desfășurarea concursului de admitere în ciclul de studii universitare de masterat. Înscrierea la concursul de admitere pentru studiile de masterat in Sesiunea III de Admitere, sesiunea septembrie, se face online pe site-ul https://admitere.pub.ro conform regulamentului amintit. Programarea examenelor este disponibila aici.",
            "* Calendarul concursului se stabilește de către fiecare facultate în intervalele specificate mai sus. Calendarul, data/datele concursului, tematicile și bibliografia (dacă este cazul) se aduc la cunoștința candidaților prin afișare pe site-urile facultăților cu minim 6 luni înainte de începerea concursului. ** În ultima zi de înscriere a fiecărei perioade, înscrierea se poate face numai până la ora 16:00. Anexa 3"
        ],
        "response": "# Calendarul de Admitere\n\n## Sesiunea Septembrie 2024\n- **Înscrierea candidaților:** 02.09 - 13.09.2024  \n- **Concursul de admitere:** 16.09 – 17.09.2024  \n- **Comunicarea rezultatelor:** 16.09 – 18.09.2024  \n- **Înmatricularea candidaților:** 16.09 – 20.09.2024  \n\n## Sesiunea Iulie 2025\n- **Înscrierea candidaților:** 30.06 — 07.07.2025  \n- **Concurs de admitere:** 09.07 — 11.07.2025  \n- **Comunicarea rezultatelor:** 09.07 — 13.07.2025  \n- **Înmatricularea candidaților:** 15.07 — 31.07.2025  \n\n## Sesiunea Mai 2025\n- **Înscriere:** 15 decembrie – 9 mai (ora 16)  \n- **Verificarea dosarelor:** 14 aprilie – 9 mai  \n- **Concurs:** 13-16 mai  \n- **Rezultate:** 17 mai  \n- **Înmatriculare:** 01-31 iulie  \n\nAceste date sunt esențiale pentru candidați și trebuie respectate conform regulamentului de admitere.\n\nSurse:\n- URL: https://chimie.upb.ro/admitere/programe-de-studii-de-masterat/\n- Sursa: https://www.fiir.upb.ro/Upload/Master/Admitere/2025/admitere_anticipata/ADMITERE_MASTERAT_FIIR-2025-Informatii_generale.pdf, URL: https://www.fiir.upb.ro/Upload/Master/Admitere/2025/admitere_anticipata/ADMITERE_MASTERAT_FIIR-2025-Informatii_generale.pdf, pagina: 2\n- URL: https://acs.pub.ro/admitere/masterat/",
        "faithfulness": "0.8235294117647058"
    },
    {
        "id": "4e76ea0bc0d2f7972d24bab730244b67ee1c48d58fe4ea624f4866a20dd4165e",
        "user_input": "Cum pot intra pe locurile pentru olimpici la admiterea la licenta la ACS?",
        "retrieved_contexts": [
            "Olimpiade, concursuri și categorii de rezultate ce permit pre-admiterea/admiterea fără concurs la diverse facultăți din Universitatea Națională de Știință și Tehnologie POLITEHNICA București (UNSTPB) CENTRUL UNIVERSITAR BUCUREȘTI Olimpiada/Concursul Rezultat",
            "Admiterea olimpicilor și a candidaților cu rezultate deosebite Universitatea Națională de Știință și Tehnologie POLITEHNICA Bucuresti Centrul Universitar PITESTI FACULTATEA DE MECANICA SI TEHNOLOGIE LINK platforma de admitere https://admitere.pub.ro/Admitere/site/alegeCentru LINK informatii admitere https://www.upit.ro/ro/academia-reorganizata/facultatea-de-mecanica-si-tehnologie-2 https://www.facebook.com/FMT.UPIT https://www.instagram.com/fmt.upit/ Telefon informatii admitere 0348 453 150 si 0348 453 155 Universitatea Națională de Știință și Tehnologie POLITEHNICA Bucuresti Centrul Universitar PITESTI FACULTATEA DE MECANICA SI TEHNOLOGIE Apasa Universitatea Națională de Știință și Tehnologie POLITEHNICA Bucuresti Centrul Universitar PITESTI FACULTATEA DE MECANICA SI TEHNOLOGIE Apasa Universitatea Națională de Știință și Tehnologie POLITEHNICA Bucuresti Centrul Universitar PITESTI FACULTATEA DE MECANICA SI TEHNOLOGIE Apasa 10-Dec-24 Universitatea Națională de Știință și Tehnologie POLITEHNICA Bucuresti Centrul Universitar PITESTI FACULTATEA DE MECANICA SI TEHNOLOGIE Se introduc datele Universitatea Națională de Știință și Tehnologie POLITEHNICA Bucuresti Centrul Universitar PITESTI FACULTATEA DE MECANICA SI TEHNOLOGIE Componența dosarului de concurs la înscrierea on-line în Sesiunea I 01. Certificatul de naștere al candidatului (copie scanată/fotografie, format *.jpg sau *.pdf) încărcată on-line în platforma https://admitere.pub.ro 02. Act de identitate candidat aflat în perioada de valabilitate la data înscrierii – copie scanată/fotografie, format *.jpg sau *.pdf, încărcată on-line în platforma https://admitere.pub.ro 03. 1 fotografie (tip pașaport/CI, color, minim 2MP, format *.jpg) încărcată on-line în platforma https://admitere.pub.ro 04.",
            "cu ediția 2022 Anx VI - 2 Universitatea Națională de Știință și Tehnologie POLITEHNICA București Anexa VI Admiterea olimpicilor și a candidaților cu rezultate deosebite OLIMPIADE ȘI CONCURSURI ȘCOLARE",
            "cu ediția 2022 Anx VI - 2 Universitatea Națională de Știință și Tehnologie POLITEHNICA București Anexa VI Admiterea olimpicilor și a candidaților cu rezultate deosebite OLIMPIADE ȘI CONCURSURI ȘCOLARE",
            "Anx VI - 1 Obs. Universitatea Națională de Știință și Tehnologie POLITEHNICA București Anexa VI Admiterea olimpicilor și a candidaților cu rezultate deosebite CONCURSURI NAȚIONALE"
        ],
        "response": "Pentru a intra pe locurile pentru olimpici la admiterea la licență la Universitatea Națională de Știință și Tehnologie POLITEHNICA București (UNSTPB), este necesar să aveți rezultate deosebite obținute la olimpiade sau concursuri naționale. Detaliile specifice privind admiterea olimpicilor și a candidaților cu rezultate deosebite sunt reglementate în Anexa VI a regulamentului de admitere. Vă recomand să consultați regulamentul pentru a verifica criteriile exacte și documentele necesare pentru înscriere.\n\nSurse:\n- Regulament admitere licență 2025, URL: https://upb.ro/wp-content/uploads/2024/12/Regulament_admitere_licenta_2025.pdf, pagina: 78\n- Regulament admitere licență 2025, URL: https://upb.ro/wp-content/uploads/2024/12/Regulament_admitere_licenta_2025.pdf, pagina: 79",
        "faithfulness": "0.6666666666666666"
    },
    {
        "id": "8cb084e9e43ef7c643e974c27f649bf2f7304724ef7c49f9aba4fbecde9879eb",
        "user_input": "In ce ordine se face admiterea candidatilor la Politehnica?",
        "retrieved_contexts": [
            "| ('Calendarul desfășurării concursului de admitere în învăţământul universitar de masterat Sesiunea Septembrie 2025', 'Înscrierea candidaţilor') | ('Calendarul desfășurării concursului de admitere în învăţământul universitar de masterat Sesiunea Septembrie 2025', '01.09 — 13.09.2025') |\n|:--|:--|\n| Concurs de admitere | 15.09—17.09.2025 |\n| Comunicarea rezultatelor | 16.09 — 17.09.2025 |\n| Înmatricularea candidaților | 17.09 — 19.09.2025 |",
            "• Faza III – Admitere Etapa II – Validare, confirmare, participare la glisare internă, înscriere și înmatriculare în anul I o În funcție de numărul candidaților, de spațiile și de resursele umane disponibile, Comisiile locale de admitere organizează procesul astfel încât să se asigure fluența necesară. În consecință este posibil ca acest proces să implice programarea persoanelor admise preliminar pe zile și ore. o Pentru facultățile și domeniile la care candidații au susținut probe scrise (c-s) (în Centrul Universitar București) sau au susținut concurs cu probe vocaționale (c-v) sau concurs mixt (c-m) (în Centrul Universitar Pitești): ▪ Validarea dosarului (necesară numai pentru candidații care s-au înscris on-line), confirmarea locului obținut, cererea de înscriere, solicitarea pentru participarea opțională la glisare internă și înmatricularea candidaților admiși preliminar, se fac la sediul facultăților la care aceștia au fost declarați admiși, zilnic, între orele 08:00-16:00, începând cu ziua de 16 iulie, ora 08:00 și terminând cu ziua de 17 iulie, ora 16:00 ▪ Candidații declarați admiși preliminar și care nu s-au înmatriculat în Faza III vor pierde locul rezervat în Faza II și vor fi eliminați din concursul de admitere; ▪ Eventualele locuri rămase vacante ca urmare a neînmatriculării candidaților admiși preliminar vor fi disponibilizate pentru glisarea internă din data de 18 iulie (cu candidați deja înmatriculați și care și- au activat opțiunea de glisare). ▪ Pentru aceste facultăți și domenii, în data de 18 iulie, ora 12:00 vor fi afișate listele cu candidații admiși și înmatriculați în Sesiunea II; ▪ Ulterior, dacă este cazul, facultățile pot activa etapa suplimentară de completare (18-19 iulie 2025 Sesiunea II+), cu primii candidați (în ordinea mediilor) care nu au fost admiși preliminar dar îndeplinesc baremul minim de admitere",
            "Universitatea Națională de Știință și Tehnologie POLITEHNICA București REGULAMENTUL Concursului de Admitere în Ciclul de Studii Universitare de Licență 2025 seama de opțiunile din fișa de înscriere , indicându-se și domeniul la care au obținut un loc; b. listele candidaților cu barem îndeplinit. Aceștia sunt candidați care au îndeplinit baremul minim de admitere, dar nu au avut media necesară admiterii în contextul numărului de locuri scoase la concurs. Acești candidați nu sunt eligibili pentru Faza III din Sesiunea II, dar sunt eligibili, în ordinea mediilor pentru Sesiunea II+ și, de asemenea, pot participa printr-o procedură simplificată (fără a mai fi necesară reintroducerea tuturor datelor din fișa de înscriere) și cu o reducere semnificativă a taxei de înscriere la eventualele sesiuni următoare (Sesiunea III.x) din concursul de admitere 2025; c. lista candidaților declarați respinși/neeligibili pentru admiterea prin concurs, în ordine alfabetică. Aceștia sunt candidați ale căror date furnizate la înscriere sunt insuficiente sau neconforme, mediile nu pot fi calculate sau nu îndeplinesc baremul minim de admitere. Ses. II-5.51. Eventualele contestații cu privire la modul de desfășurare a concursului sau asupra rezultatelor acestuia se vor depune on-line la facultatea de bază (pentru adresa e- mail la care pot fi transmise contestațiile, vezi platforma on-line https://admitere.pub.ro), în termen de cel mult 24 de ore de la publicarea rezultatelor. Pentru probele vocaționale orale pot fi admise numai contestații referitoare la vicii de procedură. Rezultatul analizării contestațiilor se va comunica în ziua următoare depunerii contestațiilor, prin publicare pe platforma on-line https://admitere.pub.ro. După expirarea termenului de rezolvare și de răspuns (prin publicare) la contestații, rezultatul concursului de admitere este definitiv și nu mai poate fi modificat. Ses.",
            "Validarea dosarului de concurs, Confirmarea locului obținut preliminar, Participarea opțională la glisare și depunerea documentelor pentru înmatriculare se realizează personal sau prin împuternicire notarială la sediul facultății la care candidatul a fost declarat pre-admis. Sunt necesare următoarele documente: Pentru toți candidații",
            "| | Pentru candidații care sunt absolvenți ai unei instituții de învățământ superior și care se încadrează într-una din categoriile: -* sunt absolvenți cu diplomă și sunt admiși anticipat pentru a urma un nou program de studii/domeniu sau - ** sunt absolvenți dar nu au susținut examenul de licență (diplomă) și au fost admiși anticipat să urmeze un nou program de studii/domeniu |\n|:--|:--|\n| | Pachet de documente necesar înmatriculării candidaților admişi Vezi Tabelul Anx.V-l toate (00...12), la dintre variantele |\n| 0..12 | punctele care se adaugă, după caz, una de mai jos |\n| | Documente suplimentare (necesare înmatriculării acestei categorii de |\n| 13 | candidați). * Diploma de licență însoțită de supliment/foaia matricolă sau diplomă de absolvire a unei instituții de învățământ superior, precizându-se regimul de finanțare în care au fost efectuate studiile (buget sau cu taxă). |\n| 13 | Originalul documentelor din Tabelul Anx.IV-3 — Punctul 12. ** Adeverință din care să rezulte calitatea de absolvent fără diplomă de licență, precizându-se regimul de finanțare în care au fost efectuate studiile (buget sau cu taxă). Originalul documentelor din Tabelul Anx.IV-3 — Punctul 12. |"
        ],
        "response": "Admiterea candidaților la Universitatea Națională de Știință și Tehnologie POLITEHNICA București se desfășoară în mai multe etape, conform regulamentului de admitere. Procesul include următoarele faze:\n\n1. **Înscrierea candidaților**: Aceasta se realizează în perioada 01.09 — 13.09.2025.\n2. **Concurs de admitere**: Se desfășoară între 15.09 — 17.09.2025.\n3. **Comunicarea rezultatelor**: Rezultatele sunt anunțate în perioada 16.09 — 17.09.2025.\n4. **Înmatricularea candidaților**: Aceasta se efectuează între 17.09 — 19.09.2025.\n\nEste important ca toți candidații să respecte aceste termene pentru a asigura o admitere corectă și eficientă.\n\nSurse:\n- Calendarul desfășurării concursului de admitere în învăţământul universitar de masterat Sesiunea Septembrie 2025, URL: https://www.fiir.upb.ro/Upload/Master/Admitere/2025/admitere_anticipata/ADMITERE_MASTERAT_FIIR-2025-Informatii_generale.pdf, pagina: 3",
        "faithfulness": "0.8333333333333334"
    },
    {
        "id": "9a47e67451fab3002976607a35aca4d774b4a40786e6c247b4ac3e3e8d91694b",
        "user_input": "Ma pot inscrie la examenul de admitere la licenta la mai multe facultati?",
        "retrieved_contexts": [
            "** Adeverință din care să rezulte calitatea de student și regimul de finanțare (buget sau cu taxă) pentru programul de studii la care sunt înmatriculați - Original. Atenție! Pot fi admiși și înmatriculați, la concursul de admitere, pentru a urma concomitent două programe de studii numai studenții care la finele sesiunii de examene din vara anului universitar 2024/2025 sunt integraliști. O adeverință în acest sens (sau situația școlară curentă) vor fi necesare la înmatriculare. Anx. VII-10. Pentru candidații care sunt studenți cu taxă (la o facultate din UNSTPB sau din alte universități) și care doresc să treacă în regim fără taxă (pe locuri finanțate de la buget), la același domeniu de studiu se mai adaugă și documentele din tabelul de mai jos. În cazul în care vor fi declarați admiși în numărul de locuri subvenționate de la bugetul de stat, ei vor putea fi înmatriculați în anul de studiu stabilit de reglementările Senatului universității (eventual cu condiția susținerii unor examene de diferență). |",
            "Doar daca este cazul (a doua facultate, întreruperi, …): - adeverinţă din care să rezulte calitatea de student şi regimul de studiu (cu sau fără taxă), pentru cei care renunţă la continuarea studiilor sau se înscriu la concurs ca să urmeze un alt domeniu de studiu. Pot participa la concursul de admitere pentru a urma concomitent două domenii de studiu numai studenţii care la finele sesiunii de examene din vara anului universitar 2018/2019 sunt integralişti, acest lucru fiind precizat în adeverinţă. În acest caz, diploma de bacalaureat sau diploma echivalentă acesteia se va prezenta în copie legalizată (originalul rămânând la prima facultate); - adeverinţă(e) din care să rezulte perioada(ele) în care au fost studenţi şi regimul de studiu (cu sau fără taxă) pentru candidaţii care au renunţat la continuarea studiilor în instituţii de învăţământ superior de stat; - adeverinţă din care să rezulte calitatea de student al unei instituţii de învăţământ superior particular cu precizarea domeniului de studiu urmat, care trebuie să fie acreditat sau autorizat, pentru studenţii care se înscriu la concurs la un acelaşi domeniu. În acest caz se va prezenta diploma de bacalaureat sau diploma echivalentă acesteia în copie legalizată (originalul rămânând la prima facultate); - adeverinţă din care să rezulte calitatea de absolvent fără diplomă de licenţă sau diplomă de absolvire al unei instituţii de învăţământ superior de stat sau particular, precizându-se regimul în care au fost efectuate studiile (cu sau fără taxă), pentru absolvenţii care doresc să urmeze un alt domeniu de studiu; Pentru înscrierea la concurs, candidaţii vor depune personal dosarul la secretariatul facultăţii. Când? Preînscrieri (2 aprilie – 20 iulie 2019) În această etapă, candidații se preînscriu online – își înregistrează datele personale și opțiunile privind înscrierea la concursul de admitere. Astfel, înscrierea candidaților la secretariatele facultăților va dura mai puțin, pentru că datele înregistrate vor fi doar verificate pe baza actelor în original. Înscrieri (15 – 20 iulie 2019) În această etapă candidații se prezintă personal cu actele necesare la secretariatele facultăților la care doresc să se înscrie, între orele 0900-1600.",
            "În ceea ce privește necesitatea de a fi promovat examenul de Bacalaureat în momentul participării la concursul de admitere la Universitatea Națională de Știință și Tehnologie POLITEHNICA București (UNSTPB), în anul 2025, sunt valabile următoarele: • Pot fi admiși și înmatriculați prin Concursul de admitere în UNSTPB numai absolvenți de liceu cu diplomă de bacalaureat (sau diplomă echivalentă acesteia). • La înscriere pot participa și elevi din clasa a XII-a sau absolvenți de liceu care încă nu au promovat examenul de Bacalaureat, dar admiterea și înmatricularea sunt accesibile numai candidaților ce dețin diplomă de Bacalaureat (sau diplomă echivalentă acesteia). CP-2.2. Un candidat declarat admis poate beneficia de finanțare de la bugetul de stat pentru un singur program de licență. Costurile aferente depășirii duratei învățământului gratuit, prevăzute de lege (durata normală pentru respectivul program de studii), se suportă de către student. Candidatul admis la mai multe universități/domenii de studiu pe locurile fără taxă este obligat să opteze pentru domeniul de studii la care dorește să fie finanțat de la bugetul de stat, la o singură facultate dintr-o instituție de învățământ superior. Opțiunea sa este confirmată prin depunerea diplomei de Bacalaureat în original la dosarul de concurs. CP-2.3. Se pot înscrie la concurs și studenți ai UNSTPB sau ai altor instituții de învățământ superior de stat sau particular acreditate sau autorizate, înmatriculați în anii precedenți pe locuri finanțate de la bugetul de stat sau în regim cu taxă, care renunță sau au renunțat la continuarea studiilor în domeniul respectiv și doresc să studieze un alt domeniu în Universitatea Națională de Știință și Tehnologie POLITEHNICA București (UNSTPB). Pentru candidații admiși și înmatriculați într-un nou program de studii universitare, din finanțarea de la buget alocată pentru durata normală a noului program se scade cea corespunzătoare anilor de studiu finanțați de la buget pentru programul/programele anterioare. CP-2.4.",
            "Anx IV - 2 Universitatea Națională de Știință și Tehnologie POLITEHNICA București Anexa IV Componența dosarului de concurs la înscrierea on-line în Sesiunea I ** Adeverință din care să rezulte calitatea de student și regimul de finanțare (buget sau cu taxă) pentru programul de studii la care sunt înmatriculați. Atenție! Pot fi admiși și înmatriculați, la concursul de admitere, pentru a urma concomitent două programe de studii numai studenții care la finele sesiunii de examene din vara anului universitar 2024/2025 sunt integraliști. O adeverință în acest sens (sau situația școlară curentă) va fi necesară la înmatriculare. Anx. IV-5. Pentru candidații care sunt studenți cu taxă (la o facultate din UNSTPB sau din alte universități) și care doresc să treacă în regim fără taxă (pe locuri finanțate de la buget) la același domeniu de studiu, se mai adaugă și documentele din tabelul de mai jos. În cazul în care vor fi declarați admiși în numărul de locuri subvenționate de la bugetul de stat, ei vor putea fi înmatriculați în anul de studiu stabilit de reglementările Senatului universității (eventual cu condiția susținerii unor examene de diferență) Pentru candidații care sunt/au fost studenți cu taxă (la o facultate din UNSTPB sau din alte universități) care doresc să continue studiile la același domeniu, în regim fără taxă și care: -* sunt studenți în UNSTPB sau ** sunt studenți în cadrul altor universități | ___| Pachet de documente necesar înscrierii candidaților 1..11 Vezi tabelul Anx. IV-2 toate punctele (01...11), la care se adaugă, după caz, una dintre variantele de mai jos + Documente suplimentare (necesare înscrierii acestei categorii de candidați) 12 Nu sunt necesare documente suplimentare ** Adeverință din care să rezulte calitatea de student și regimul de finanțare. Atenție! Situația școlară curentă la universitatea urmată (cu toate disciplinele școlarizate și cu rezultatele obținute) va fi necesară la înmatriculare. Anexa IV -2. Taxa de înscriere. Cuantum/Plată/Scutire de plată",
            "Admitere licență INFORMAȚII GENERALE DESPRE ADMITERE An Universitar 2025-2026 SESIUNEA I – ADMITERE ANTICIPATĂ NUMĂR LOCURI ÎN SESIUNEA I – ADMITERE ANTICIPATĂ, PRIN CONCURS PE BAZA REZULTATELOR LA ACTIVITĂȚILE ȘCOLARE (DOSAR) * 125 LOCURI (LA BUGET) * Concursuri Naționale Școlare Aprobate pentru calculul notei NB (P3) în Sesiunea I – Admitere Anticipată, an universitar 2025-2026 Regulament privind organizarea și desfășurarea concursului de admitere în ciclul de studii universitare de licență, an universitar_2025-2026 Date contact pentru informații suplimentare: Adresa de e-mail: admitere.fim@upb.ro Tel: 0765 966 123/ 0749 382 825, luni-vineri, interval orar: 10:00-15:00"
        ],
        "response": "Da, te poți înscrie la examenul de admitere la mai multe facultăți. Totuși, este important de menționat că, în cazul în care ești declarat admis la mai multe universități sau domenii de studiu pe locurile fără taxă, ești obligat să optezi pentru un singur domeniu de studii la care dorești să beneficiezi de finanțare de la bugetul de stat. Această opțiune trebuie confirmată prin depunerea diplomei de Bacalaureat în original la dosarul de concurs. De asemenea, pentru a urma concomitent două programe de studii, trebuie să fii integralist la finele sesiunii de examene din vara anului universitar anterior, iar acest lucru trebuie să fie specificat în adeverința pe care o prezinți la înmatriculare.\n\nSurse:\n- Regulament admitere licență 2025, URL: https://upb.ro/wp-content/uploads/2024/12/Regulament_admitere_licenta_2025.pdf, pagina: 11\n- Regulament admitere licență 2025, URL: https://upb.ro/wp-content/uploads/2024/12/Regulament_admitere_licenta_2025.pdf, pagina: 96",
        "faithfulness": "1.0"
    },
    {
        "id": "8cdd314aa6cbad1bf1bdc79d89d001b2b33f869a17c6c1914464d9ce89c65a7f",
        "user_input": "Care sunt disciplinele de concurs de la examenul de admitere la licenta?",
        "retrieved_contexts": [
            "Universitatea Națională de Știință și Tehnologie POLITEHNICA București Anexa II Discipline pentru probele de concurs P1 și P2. Calculul notelor la disciplinele de concurs",
            "În ceea ce privește probele de concurs, în Sesiunea I, două dintre acestea (P1 și respectiv P2) se bazează, după caz, fie pe mediile obținute de candidat, în timpul liceului, la disciplinele selectate (vezi Anexa II-1.1) dacă acesta s-a înscris la o facultate la care admiterea anticipată este prin concurs pe baza rezultatelor la activitățile școlare (dosar) (c-rs), fie pe baza notelor obținute la examenul scris din data de 05 aprilie 2025 la disciplinele selectate (vezi Anexa II-1.2) dacă acesta s-a înscris la o facultate la care admiterea anticipată este prin concurs cu probe scrise (c-s) sau, după caz, la probele vocaționale din data de 10 mai 2025, la disciplinele selectate (vezi Anexa II-1.3), dacă acesta s-a înscris la o facultate la care admiterea anticipată este prin concurs cu probe vocaționale (c-v). În cazul candidaților care s-au înscris la o facultate cu concurs mixt (c-m) proba P1 se bazează pe mediile obținute de candidat în timpul liceului iar P2, pe baza notei obținute la proba scrisă sau vocațională susținută în data de 10 mai 2025, la disciplina selectată (vezi Anexa II-1.4). În Sesiunea I, Proba P3 se bazează pe mediile generale obținute de candidat în clasele a IX-a, a X-a și a XI- a, precum și pe o serie de activități suplimentare pe care acesta le-a desfășurat în anii de liceu (vezi Anexa III). Pag. 26 Universitatea Națională de Știință și Tehnologie POLITEHNICA București REGULAMENTUL Concursului de Admitere în Ciclul de Studii Universitare de Licență 2025 l IV.2. Despre Faza II – Admitere preliminară IV.2.1 Desfășurarea probelor scrise ***2F Ses. I-4.12. La intrarea în sala de concurs candidații prezintă comisiei de supraveghere legitimația de concurs și cartea de identitate, pentru confruntarea cu datele înscrise în tabelul nominal al sălii respective.",
            "DESFĂȘURAREA CONCURSULUI DE ADMITERE Concursul de admitere la studii universitare de masterat constă din două probe: a) Proba 1 – o probă orală sau scrisă de evaluare a cunoștințelor fundamentale ale candidatului, desfășurată cu prezență fizică sau susținută on-line, cu subiecte dintr-o bibliografie anunțată sau de tip interviu, și corespunde mediei MA a notelor date de membrii comisiei de admitere a programului de masterat la care este înscris candidatul. Media MA se va obține ca medie aritmetică a notelor obținute la fiecare din cele 4 criterii de mai jos. Criteriul 1 – Susținerea unei scurte prelegeri, pe o temă aleasă de candidat, în domeniul masterului ales ca primă opțiune; Criteriul 2 – participarea la un stagiu Erasmus în anii de licență/participarea la un concurs internațional; Criteriul 3 – câștigarea unui premiu la concursurile studențești la nivel național/local; Criteriul 4 - Rezultate profesionale în studiile de licență absolvite în domeniul programului de master - se apreciază gradul de apropiere între programul de master ales ca primă opțiune și domeniul studiilor de licență absolvite. b) Proba 2 - o probă orală sau scrisă de evaluare a motivației candidatului pentru urmarea programului de studiu, desfășurată cu prezență fizică sau susținută on-line, care corespunde mediei MB a notelor date de membrii comisiei de admitere a programului de masterat la care este înscris candidatul. Media MB se obține cu ajutorul relației: MB = 𝑚𝑖𝑛 (𝑠𝑢𝑚𝑎(𝑛𝑖), 10), 𝑖 = 1,2,3, ... , 7 unde ni reprezintă numărul de puncte obținut la evaluarea bazată pe fiecare din cele șapte criterii utilizate de către Facultatea de Mecanică și Tehnologie. Criteriul 1 = SRS – Existența unei scrisori de recomandare pentru „domeniu”, din partea conducerii societății unde acesta este angajat sau a societății unde își desfășoară/şi-a desfășurat stagiul de practică în perioada licenței. Se va lua în considerare max. 1 recomandare punctată cu n = 1 punct.",
            "Anexa II-1.3 pentru concurs cu probe vocaționale (c-v) și respectiv Anexa II-1.4 pentru concurs mixt(c-m). • Odată acestea stabilite, candidatul poate selecta în ordinea preferințelor sale triadele Facultate-Domeniu-Finanțare (FaDoFi) compatibile cu disciplinele alese, de la facultatea la care se înscrie. Ses. II-5.9. Conținutul dosarului de înscriere este detaliat în Anexa VII. El include date de identificare și contact, precum și alte date și documente necesare probelor de concurs P1, P2 și respectiv P3. Dosarul de înscriere conține un formular tipizat, iar candidații vor completa toate datele solicitate, sub răspundere proprie privind corectitudinea, veridicitatea și conformitatea cu propriile intenții privind admiterea În Sesiunea II înscrierea la concurs (Faza I) se poate face: ▪ Pentru facultățile și domeniile la care candidații au susținut probe scrise (c-s) (în Centrul Universitar București) sau au susținut concurs cu probe vocaționale (c-v) sau concurs mixt (c-m) (în Centrul Universitar Pitești): o on-line, prin Internet, în perioada 07 iulie – 10 iulie, ora 12.00, sau o personal, la secretariatul facultății, beneficiind de suport direct, în perioada 10 iulie – 11 iulie, ora 16:00 ▪ Pentru facultățile și domeniile la care candidații au susținut concurs pe baza rezultatelor la activitățile școlare (dosar) (c-rs) (atât în Centrul Universitar București cât și în Centrul Universitar Pitești): o on-line, prin Internet, în perioada 07 iulie – 20 iulie, ora 12.00, sau o personal, la secretariatul facultății, beneficiind de suport direct, în zilele 20 iulie, ora 8:00-14:00 și respectiv 21 iulie, ora 8:00-16:00 Ses. II-5.10.",
            "M F I PCI Universitatea Națională de Știință și Tehnologie POLITEHNICA București Anexa II Discipline pentru probele de concurs P1 și P2. Calculul notelor la disciplinele de concurs"
        ],
        "response": "Disciplinele de concurs pentru examenul de admitere la licență sunt detaliate în Anexa II a regulamentului. Acestea includ disciplinele selectate de candidați, care sunt utilizate pentru evaluarea la probele P1 și P2. Informațiile specifice despre disciplinele respective pot fi găsite în documentul regulamentar, dar nu sunt enumerate explicit în conținutul extras. Este recomandat să consultați Anexa II pentru detalii complete despre disciplinele de concurs.\n\nSurse:\n- Universitatea Națională de Știință și Tehnologie POLITEHNICA București Anexa II Discipline pentru probele de concurs P1 și P2. Calculul notelor la disciplinele de concurs, URL: https://upb.ro/wp-content/uploads/2024/12/Regulament_admitere_licenta_2025.pdf, pagina: 52",
        "faithfulness": "0.8"
    },
    {
        "id": "58a2ce94254f504de60e61f582d80f742dc587d1e53e88457463ff8bc8b1908d",
        "user_input": "Care este cuantumul taxei de inscriere la examenul de admitere la licenta la Politehnica?",
        "retrieved_contexts": [
            "(2) Absolvenţii Universității Naționale de Știință și Tehnologie POLITEHNICA București care repetă examenul de finalizare a studiilor sau care au urmat în regim cu taxă de studii, trebuie să depună la înscriere și chitanța de plată a taxei de examen de finalizare a studiilor, cu valoarea aprobată de Senatul universității pentru anul universitar 2024-2025. Plata acestei taxe se va face online sau la casieria universității. Art. 14. (1) Se pot prezenta la examenul de licență/diplomă/disertaţie numai absolvenţii care au promovat toate activităţile obligatorii cuprinse în planul de învăţământ, astfel: a) absolvenții din promoția 2025; b) absolvenţii din promoţiile anterioare, care nu au susţinut sau nu au promovat examenul de finalizare a studiilor, indiferent de anul absolvirii. (2) Absolvenții au obligația de a-și achita datoriile financiare sau materiale față de universitatea absolvită. Art. 15. (1) După încheierea înscrierii, secretariatele facultăţilor la care s-au făcut înscrierile, vor întocmi, pentru fiecare program de studii/specializări, listele cu candidaţii înscrişi pentru susţinerea examenului de finalizare a studiilor, fiecare listă conţinând toţi candidaţii, în ordine alfabetică, indiferent de instituţia de învăţământ superior care a asigurat şcolarizarea absolvenţilor. (2) Listele cu absolvenţii înscrişi pentru susţinerea examenului de finalizare a studiilor vor fi transmise la secretarii comisiilor de examen imediat după finalizarea acestora, înainte de începerea examenului. Secretarii comisiilor, sub coordonarea preşedinţilor comisiilor, vor întocmi şi aduce la cunoştinţa absolvenţilor, cu cel puţin 1 zi înainte de începerea examenului, listele cu programarea pe zile și ora exactă pentru susținerea probelor de examen. III. ORGANIZAREA ŞI DESFĂŞURAREA EXAMENULUI DE FINALIZARE A STUDIILOR Art. 16. (1) Pentru organizarea şi desfăşurarea examenelor de finalizare a studiilor se constituie următoarele comisii:",
            "5. 10. 14. Numărul chitanţei pentru plata taxei de înscriere la concursul de admitere: 15. În cazul în care candidez și sunt admis pe un loc fără taxă (la buget) declar pe propria răspundere că nu am mai urmat un alt program de masterat în regim de fără taxă. 16. În cazul în care admiterea include o probă/probe susținute online: - sunt de acord ca proba să fie înregistrată; - declar că toate răspunsurile vor fi personale și că respect Codul de etică și deontologie profesională al Universității Naționale de Știință și Tehnologie POLITEHNICA București. 17. Subsemnatul declar cele de mai sus pe propria răspundere. Am luat la cunoştinţă că declararea unor informaţii false conduce automat la pierderea locului ocupat prin concursul de admitere. De asemenea am luat la cunoştinţă că POLITEHNICA Bucureşti prelucrează datele mele cu caracter personal în scopul admiterii şi finalizării studiilor şi de faptul că sunt obligat să furnizez datele cunoscând că refuzul determină neînscrierea la concursul de admitere. Datele vor fi dezvăluite Ministerului Educaţiei Naţionale, şi Băncilor. Conform Regulamentului 679/2016 privind protecția persoanelor fizice în ceea ce privește prelucrarea datelor cu caracter personal și privind libera circulație a acestor date și de abrogare a Directivei 95/46/CE (Regulamentul general privind protecția datelor)cunosc faptul că beneficiez de drepturile prevăzute în Capitolul III al regulamentului intitulat, „Drepturile persoanei vizate”. De asemenea, am luat la cunoştinţă că beneficiez de dreptul de a mă adresa cu plângere Autorităţii Naţionale de Supraveghere a Prelucrării datelor cu caracter personal şi justiţiei. Candidat: Semnătura Data: Anexa 2 Universitatea Națională de Știință și Tehnologie POLITEHNICA București FIŞA DE ÎNSCRIERE PENTRU ABSOLVENŢII CU DIPLOMĂ DE LICENŢĂ/INGINER CARE DORESC SĂ URMEZE ÎNVĂŢĂMÂNTUL UNIVERSITAR DE MASTERAT ANUL UNIVERSITAR 2025 – 2026 Sesiunea de admitere anticipată 1. Numele, iniţiala prenumelui tatălui şi prenumele candidatului:",
            "14. Numărul chitanţei pentru plata taxei de înscriere la concursul de admitere: 15. În cazul în care candidez și sunt admis pe un loc fără taxă (la buget) declar pe propria răspundere că nu am mai urmat un alt program de masterat în regim de fără taxă. 16. În cazul în care admiterea include o probă/probe susținute online: - sunt de acord ca proba să fie înregistrată; - declar că toate răspunsurile vor fi personale și că respect Codul de etică și deontologie profesională al Universității Naționale de Știință și Tehnologie POLITEHNICA București 17. Subsemnatul declar cele de mai sus pe propria răspundere. Am luat la cunoştinţă că declararea unor informaţii false conduce automat la pierderea locului ocupat prin concursul de admitere. De asemenea am luat la cunoştinţă că POLITEHNICA Bucureşti prelucrează datele mele cu caracter personal în scopul admiterii şi finalizării studiilor şi de faptul că sunt obligat să furnizez datele cunoscând că refuzul determină neînscrierea la concursul de admitere. Datele vor fi dezvăluite Ministerului Educaţiei Naţionale, şi Băncilor. Conform Regulamentului 679/2016 privind protecția persoanelor fizice în ceea ce privește prelucrarea datelor cu caracter personal și privind libera circulație a acestor date și de abrogare a Directivei 95/46/CE (Regulamentul general privind protecția datelor), cunosc faptul că beneficiez de drepturile prevăzute în Capitolul III al regulamentului intitulat, „Drepturile persoanei vizate”. De asemenea, am luat la cunoştinţă că beneficiez de dreptul de a mă adresa cu plângere Autorităţii Naţionale de Supraveghere a Prelucrării datelor cu caracter personal şi justiţiei. Candidat: Semnătura Data: 13",
            "14. Numărul chitanţei pentru plata taxei de înscriere la concursul de admitere: 15. În cazul în care candidez și sunt admis pe un loc fără taxă (la buget) declar pe propria răspundere că nu am mai urmat un alt program de masterat în regim de fără taxă. 16. În cazul în care admiterea include o probă/probe susținute online: - sunt de acord ca proba să fie înregistrată; - declar că toate răspunsurile vor fi personale și că respect Codul de etică și deontologie profesională al Universității Naționale de Știință și Tehnologie POLITEHNICA București 17. Subsemnatul declar cele de mai sus pe propria răspundere. Am luat la cunoştinţă că declararea unor informaţii false conduce automat la pierderea locului ocupat prin concursul de admitere. De asemenea am luat la cunoştinţă că POLITEHNICA Bucureşti prelucrează datele mele cu caracter personal în scopul admiterii şi finalizării studiilor şi de faptul că sunt obligat să furnizez datele cunoscând că refuzul determină neînscrierea la concursul de admitere. Datele vor fi dezvăluite Ministerului Educaţiei Naţionale, şi Băncilor. Conform Regulamentului 679/2016 privind protecția persoanelor fizice în ceea ce privește prelucrarea datelor cu caracter personal și privind libera circulație a acestor date și de abrogare a Directivei 95/46/CE (Regulamentul general privind protecția datelor), cunosc faptul că beneficiez de drepturile prevăzute în Capitolul III al regulamentului intitulat, „Drepturile persoanei vizate”. De asemenea, am luat la cunoştinţă că beneficiez de dreptul de a mă adresa cu plângere Autorităţii Naţionale de Supraveghere a Prelucrării datelor cu caracter personal şi justiţiei. Candidat: Semnătura Data: Universitatea Națională de Știință și Tehnologie POLITEHNICA București Calendarul desfășurării concursului de admitere în învățământul universitar de masterat* Anul universitar 2025-2026",
            "14. Numărul chitanţei pentru plata taxei de înscriere la concursul de admitere: 15. În cazul în care candidez și sunt admis pe un loc fără taxă (la buget) declar pe propria răspundere că nu am mai urmat un alt program de masterat în regim de fără taxă. 16. În cazul în care admiterea include o probă/probe susținute online: - sunt de acord ca proba să fie înregistrată; - declar că toate răspunsurile vor fi personale și că respect Codul de etică și deontologie profesională al Universității Naționale de Știință și Tehnologie POLITEHNICA București 17. Subsemnatul declar cele de mai sus pe propria răspundere. Am luat la cunoştinţă că declararea unor informaţii false conduce automat la pierderea locului ocupat prin concursul de admitere. De asemenea am luat la cunoştinţă că POLITEHNICA Bucureşti prelucrează datele mele cu caracter personal în scopul admiterii şi finalizării studiilor şi de faptul că sunt obligat să furnizez datele cunoscând că refuzul determină neînscrierea la concursul de admitere. Datele vor fi dezvăluite Ministerului Educaţiei Naţionale, şi Băncilor. Conform Legii nr. 677/2001, cu modificările ulterioare, cunosc faptul că beneficiez de dreptul la informare, dreptul de acces, de intervenţie şi opoziţie asupra datelor furnizate precum şi dreptul de a nu fi supus unei decizii individuale, prin înaintarea unei cereri scrise, datată şi semnată, Universității Naționale de Știință și Tehnologie POLITEHNICA București. De asemenea, am luat la cunoştinţă că beneficiez de dreptul de a mă adresa cu plângere Autorităţii Naţionale de Supraveghere a Prelucrării datelor cu caracter personal şi justiţiei. Candidat: Semnătura Data: 12"
        ],
        "response": "Nu am suficiente informații pentru a răspunde la întrebare.",
        "faithfulness": "1.0"
    },
    {
        "id": "d46a59c6f47aa587fd4a4400b6dd70f8df82824f50e6fb89c2a6911ff04ae2b4",
        "user_input": "Care este cuantumul taxei de inscriere la examenul de admitere la master la Politehnica?",
        "retrieved_contexts": [
            "(2) Absolvenţii Universității Naționale de Știință și Tehnologie POLITEHNICA București care repetă examenul de finalizare a studiilor sau care au urmat în regim cu taxă de studii, trebuie să depună la înscriere și chitanța de plată a taxei de examen de finalizare a studiilor, cu valoarea aprobată de Senatul universității pentru anul universitar 2024-2025. Plata acestei taxe se va face online sau la casieria universității. Art. 14. (1) Se pot prezenta la examenul de licență/diplomă/disertaţie numai absolvenţii care au promovat toate activităţile obligatorii cuprinse în planul de învăţământ, astfel: a) absolvenții din promoția 2025; b) absolvenţii din promoţiile anterioare, care nu au susţinut sau nu au promovat examenul de finalizare a studiilor, indiferent de anul absolvirii. (2) Absolvenții au obligația de a-și achita datoriile financiare sau materiale față de universitatea absolvită. Art. 15. (1) După încheierea înscrierii, secretariatele facultăţilor la care s-au făcut înscrierile, vor întocmi, pentru fiecare program de studii/specializări, listele cu candidaţii înscrişi pentru susţinerea examenului de finalizare a studiilor, fiecare listă conţinând toţi candidaţii, în ordine alfabetică, indiferent de instituţia de învăţământ superior care a asigurat şcolarizarea absolvenţilor. (2) Listele cu absolvenţii înscrişi pentru susţinerea examenului de finalizare a studiilor vor fi transmise la secretarii comisiilor de examen imediat după finalizarea acestora, înainte de începerea examenului. Secretarii comisiilor, sub coordonarea preşedinţilor comisiilor, vor întocmi şi aduce la cunoştinţa absolvenţilor, cu cel puţin 1 zi înainte de începerea examenului, listele cu programarea pe zile și ora exactă pentru susținerea probelor de examen. III. ORGANIZAREA ŞI DESFĂŞURAREA EXAMENULUI DE FINALIZARE A STUDIILOR Art. 16. (1) Pentru organizarea şi desfăşurarea examenelor de finalizare a studiilor se constituie următoarele comisii:",
            "Valoarea taxei de înscriere la concursul de admitere la doctorat este de 200 RON, cu excepția candidaților care au absolvit un program de masterat în POLITEHNICA București pentru care taxa de înscriere este de 100 RON. Pasul 3: Evaluarea dosarului și a candidatului SD-AC asigură permanent transparenţa procedurilor de selecţie şi admitere la doctorat, a criteriilor de evaluare şi a standardelor impuse candidaţilor, egalitatea de șanse și nediscriminarea de orice tip. Conducătorul de doctorat evaluează individual dosarul de concurs al candidatului, validând sau invalidând aplicația acestuia. Pentru avizului pozitiv al conducătorului de doctorat se poate organiza un interviu online. În cadrul interviului, candidatul este așteptat să prezinte pe scurt parcursul său academic și profesional și, după caz, rezultatele de cercetare cele mai relevante. De asemenea, candidatul va expune tematica și preocupările de cercetare ştiinţifică vizate în cadrul tezei de doctorat, cu accent pe contribuțiile și soluțiile noi ce vor fi investigate. În urma evaluării, candidatul primește calificativul Admis sau Respins din partea coordonatorului de doctorat. În cazul în care este Admis, candidatul va participa la concursul de admitere la nivelul Școlii Doctorale, în vederea alocării un loc la programul doctoral din cadrul SD-AC (buget sau taxă), inclusiv a burselor doctorale acordate de către minister. Pasul 4: Alocarea locurilor (admiterea finală) și a burselor de doctorat Conform calendarului, comisia de admitere realizează evaluarea candidaților declarați Admiși de către coordonatorul de doctorat în vederea alocării locurilor la programul doctoral din cadrul SD-AC (buget sau taxă) și acordării burselor de doctorat. Candidaţii vor fi apreciaţi în raport cu nivelul de pregătire şi informare în domeniu, cu capacitatea de a evidenția orientările majore ale cercetării, cu capacitatea de a formula soluţii şi căi de rezolvare (teoretice şi experimentale) pentru tema de cercetare vizată, cât și cu privire la capacitatea de a urma programul doctoral. Criteriile cantitative de evaluare sunt prezentate în Metodologia de admitere, articolul 5 (Anexa 3) [link].",
            "(4) Studenții care nu au acumulat numărul de ECTS pentru trecerea în anul de studii superior, pot reface anul de studii cu plata taxei pentru fiecare disciplină nepromovată. Art. 17. Examenul de Disertație (1) Masteratul se încheie cu susţinerea publică a unei Lucrări de disertaţie. Accesul la susținerea Examenului de Disertație este condiționat de obținerea, la disciplinele impuse și opționale, a minimum 60 ECTS, respectiv 120 ECTS, în funcţie de durata programului de studii. (2) Masterandul care a îndeplinit toate cerințele prevăzute în programul de studii universitare de Masterat și a obținut cel puțin media 6 la susținerea publică a Lucrării de disertație primește Diploma de Master, însoțită de suplimentul la diplomă, întocmit conform reglementărilor în vigoare. II.3. REGULI DE ÎNTRERUPERE/REÎNMATRICULARE/RETRAGERE Art. 18. Întreruperea studiilor (1) Întreruperea studiilor se poate face, la cerere, numai la începutul anului universitar, în perioada în care se încheie Contractele de studii/Actele adiționale, și este permisă pentru o durată de cel mult 2 ani universitari. MINISTERUL EDUCAȚIEI Universitatea Naţională de Ştiinţă şi Tehnologie POLITEHNICA Bucureşti (2) Reînscrierea masterandului, după întreruperea studiilor, se face în anul de studii în care are dreptul, în condiţiile respectării regulilor de trecere ale prezentului regulament, beneficiind de recunoaşterea notelor obţinute anterior întreruperii. (3) În cazuri bine justificate, BExF poate aproba întreruperea studiilor începând cu semestrul II. În acest caz, pentru studenții pe locuri cu taxă, reînscrierea este posibilă cu plata a jumătate din taxa anuală de studii. (4) Întreruperea studiilor presupune: a) încetarea contractului de studii şi încheierea unui nou contract de studii, în cazul în care studentul şi-a întrerupt studiile, pe o perioadă de cel puţin două semestre consecutive. Noul contract de studii se încheie în condiţiile rezultate în urma modificării planurilor de învăţământ, inclusiv cele referitoare la modificările de taxe; b) suspendarea contractului de studii.",
            "5. 10. 14. Numărul chitanţei pentru plata taxei de înscriere la concursul de admitere: 15. În cazul în care candidez și sunt admis pe un loc fără taxă (la buget) declar pe propria răspundere că nu am mai urmat un alt program de masterat în regim de fără taxă. 16. În cazul în care admiterea include o probă/probe susținute online: - sunt de acord ca proba să fie înregistrată; - declar că toate răspunsurile vor fi personale și că respect Codul de etică și deontologie profesională al Universității Naționale de Știință și Tehnologie POLITEHNICA București. 17. Subsemnatul declar cele de mai sus pe propria răspundere. Am luat la cunoştinţă că declararea unor informaţii false conduce automat la pierderea locului ocupat prin concursul de admitere. De asemenea am luat la cunoştinţă că POLITEHNICA Bucureşti prelucrează datele mele cu caracter personal în scopul admiterii şi finalizării studiilor şi de faptul că sunt obligat să furnizez datele cunoscând că refuzul determină neînscrierea la concursul de admitere. Datele vor fi dezvăluite Ministerului Educaţiei Naţionale, şi Băncilor. Conform Regulamentului 679/2016 privind protecția persoanelor fizice în ceea ce privește prelucrarea datelor cu caracter personal și privind libera circulație a acestor date și de abrogare a Directivei 95/46/CE (Regulamentul general privind protecția datelor)cunosc faptul că beneficiez de drepturile prevăzute în Capitolul III al regulamentului intitulat, „Drepturile persoanei vizate”. De asemenea, am luat la cunoştinţă că beneficiez de dreptul de a mă adresa cu plângere Autorităţii Naţionale de Supraveghere a Prelucrării datelor cu caracter personal şi justiţiei. Candidat: Semnătura Data: Anexa 2 Universitatea Națională de Știință și Tehnologie POLITEHNICA București FIŞA DE ÎNSCRIERE PENTRU ABSOLVENŢII CU DIPLOMĂ DE LICENŢĂ/INGINER CARE DORESC SĂ URMEZE ÎNVĂŢĂMÂNTUL UNIVERSITAR DE MASTERAT ANUL UNIVERSITAR 2025 – 2026 Sesiunea de admitere anticipată 1. Numele, iniţiala prenumelui tatălui şi prenumele candidatului:",
            "14. Numărul chitanţei pentru plata taxei de înscriere la concursul de admitere: 15. În cazul în care candidez și sunt admis pe un loc fără taxă (la buget) declar pe propria răspundere că nu am mai urmat un alt program de masterat în regim de fără taxă. 16. În cazul în care admiterea include o probă/probe susținute online: - sunt de acord ca proba să fie înregistrată; - declar că toate răspunsurile vor fi personale și că respect Codul de etică și deontologie profesională al Universității Naționale de Știință și Tehnologie POLITEHNICA București 17. Subsemnatul declar cele de mai sus pe propria răspundere. Am luat la cunoştinţă că declararea unor informaţii false conduce automat la pierderea locului ocupat prin concursul de admitere. De asemenea am luat la cunoştinţă că POLITEHNICA Bucureşti prelucrează datele mele cu caracter personal în scopul admiterii şi finalizării studiilor şi de faptul că sunt obligat să furnizez datele cunoscând că refuzul determină neînscrierea la concursul de admitere. Datele vor fi dezvăluite Ministerului Educaţiei Naţionale, şi Băncilor. Conform Regulamentului 679/2016 privind protecția persoanelor fizice în ceea ce privește prelucrarea datelor cu caracter personal și privind libera circulație a acestor date și de abrogare a Directivei 95/46/CE (Regulamentul general privind protecția datelor), cunosc faptul că beneficiez de drepturile prevăzute în Capitolul III al regulamentului intitulat, „Drepturile persoanei vizate”. De asemenea, am luat la cunoştinţă că beneficiez de dreptul de a mă adresa cu plângere Autorităţii Naţionale de Supraveghere a Prelucrării datelor cu caracter personal şi justiţiei. Candidat: Semnătura Data: 13"
        ],
        "response": "Cuantumul taxei de înscriere la examenul de admitere la masterat la Universitatea Națională de Știință și Tehnologie POLITEHNICA București nu este specificat în documentele disponibile. Vă recomand să consultați site-ul oficial al universității sau să contactați secretariatul pentru informații precise referitoare la taxa de înscriere pentru anul universitar 2025-2026.",
        "faithfulness": "0.3333333333333333"
    },
    {
        "id": "8e8feb4bb95081061951eea70be7ff1b9cad13838f8abf9026a1da670400a6ec",
        "user_input": "Care este cuantumul taxei de inscriere la examenul de admitere la doctorat la ACS?",
        "retrieved_contexts": [
            "Valoarea taxei de înscriere la concursul de admitere la doctorat este de 200 RON, cu excepția candidaților care au absolvit un program de masterat în POLITEHNICA București pentru care taxa de înscriere este de 100 RON. Pasul 3: Evaluarea dosarului și a candidatului SD-AC asigură permanent transparenţa procedurilor de selecţie şi admitere la doctorat, a criteriilor de evaluare şi a standardelor impuse candidaţilor, egalitatea de șanse și nediscriminarea de orice tip. Conducătorul de doctorat evaluează individual dosarul de concurs al candidatului, validând sau invalidând aplicația acestuia. Pentru avizului pozitiv al conducătorului de doctorat se poate organiza un interviu online. În cadrul interviului, candidatul este așteptat să prezinte pe scurt parcursul său academic și profesional și, după caz, rezultatele de cercetare cele mai relevante. De asemenea, candidatul va expune tematica și preocupările de cercetare ştiinţifică vizate în cadrul tezei de doctorat, cu accent pe contribuțiile și soluțiile noi ce vor fi investigate. În urma evaluării, candidatul primește calificativul Admis sau Respins din partea coordonatorului de doctorat. În cazul în care este Admis, candidatul va participa la concursul de admitere la nivelul Școlii Doctorale, în vederea alocării un loc la programul doctoral din cadrul SD-AC (buget sau taxă), inclusiv a burselor doctorale acordate de către minister. Pasul 4: Alocarea locurilor (admiterea finală) și a burselor de doctorat Conform calendarului, comisia de admitere realizează evaluarea candidaților declarați Admiși de către coordonatorul de doctorat în vederea alocării locurilor la programul doctoral din cadrul SD-AC (buget sau taxă) și acordării burselor de doctorat. Candidaţii vor fi apreciaţi în raport cu nivelul de pregătire şi informare în domeniu, cu capacitatea de a evidenția orientările majore ale cercetării, cu capacitatea de a formula soluţii şi căi de rezolvare (teoretice şi experimentale) pentru tema de cercetare vizată, cât și cu privire la capacitatea de a urma programul doctoral. Criteriile cantitative de evaluare sunt prezentate în Metodologia de admitere, articolul 5 (Anexa 3) [link].",
            "(2) Absolvenţii Universității Naționale de Știință și Tehnologie POLITEHNICA București care repetă examenul de finalizare a studiilor sau care au urmat în regim cu taxă de studii, trebuie să depună la înscriere și chitanța de plată a taxei de examen de finalizare a studiilor, cu valoarea aprobată de Senatul universității pentru anul universitar 2024-2025. Plata acestei taxe se va face online sau la casieria universității. Art. 14. (1) Se pot prezenta la examenul de licență/diplomă/disertaţie numai absolvenţii care au promovat toate activităţile obligatorii cuprinse în planul de învăţământ, astfel: a) absolvenții din promoția 2025; b) absolvenţii din promoţiile anterioare, care nu au susţinut sau nu au promovat examenul de finalizare a studiilor, indiferent de anul absolvirii. (2) Absolvenții au obligația de a-și achita datoriile financiare sau materiale față de universitatea absolvită. Art. 15. (1) După încheierea înscrierii, secretariatele facultăţilor la care s-au făcut înscrierile, vor întocmi, pentru fiecare program de studii/specializări, listele cu candidaţii înscrişi pentru susţinerea examenului de finalizare a studiilor, fiecare listă conţinând toţi candidaţii, în ordine alfabetică, indiferent de instituţia de învăţământ superior care a asigurat şcolarizarea absolvenţilor. (2) Listele cu absolvenţii înscrişi pentru susţinerea examenului de finalizare a studiilor vor fi transmise la secretarii comisiilor de examen imediat după finalizarea acestora, înainte de începerea examenului. Secretarii comisiilor, sub coordonarea preşedinţilor comisiilor, vor întocmi şi aduce la cunoştinţa absolvenţilor, cu cel puţin 1 zi înainte de începerea examenului, listele cu programarea pe zile și ora exactă pentru susținerea probelor de examen. III. ORGANIZAREA ŞI DESFĂŞURAREA EXAMENULUI DE FINALIZARE A STUDIILOR Art. 16. (1) Pentru organizarea şi desfăşurarea examenelor de finalizare a studiilor se constituie următoarele comisii:",
            "(4) Studenții care nu au acumulat numărul de ECTS pentru trecerea în anul de studii superior, pot reface anul de studii cu plata taxei pentru fiecare disciplină nepromovată. Art. 17. Examenul de Disertație (1) Masteratul se încheie cu susţinerea publică a unei Lucrări de disertaţie. Accesul la susținerea Examenului de Disertație este condiționat de obținerea, la disciplinele impuse și opționale, a minimum 60 ECTS, respectiv 120 ECTS, în funcţie de durata programului de studii. (2) Masterandul care a îndeplinit toate cerințele prevăzute în programul de studii universitare de Masterat și a obținut cel puțin media 6 la susținerea publică a Lucrării de disertație primește Diploma de Master, însoțită de suplimentul la diplomă, întocmit conform reglementărilor în vigoare. II.3. REGULI DE ÎNTRERUPERE/REÎNMATRICULARE/RETRAGERE Art. 18. Întreruperea studiilor (1) Întreruperea studiilor se poate face, la cerere, numai la începutul anului universitar, în perioada în care se încheie Contractele de studii/Actele adiționale, și este permisă pentru o durată de cel mult 2 ani universitari. MINISTERUL EDUCAȚIEI Universitatea Naţională de Ştiinţă şi Tehnologie POLITEHNICA Bucureşti (2) Reînscrierea masterandului, după întreruperea studiilor, se face în anul de studii în care are dreptul, în condiţiile respectării regulilor de trecere ale prezentului regulament, beneficiind de recunoaşterea notelor obţinute anterior întreruperii. (3) În cazuri bine justificate, BExF poate aproba întreruperea studiilor începând cu semestrul II. În acest caz, pentru studenții pe locuri cu taxă, reînscrierea este posibilă cu plata a jumătate din taxa anuală de studii. (4) Întreruperea studiilor presupune: a) încetarea contractului de studii şi încheierea unui nou contract de studii, în cazul în care studentul şi-a întrerupt studiile, pe o perioadă de cel puţin două semestre consecutive. Noul contract de studii se încheie în condiţiile rezultate în urma modificării planurilor de învăţământ, inclusiv cele referitoare la modificările de taxe; b) suspendarea contractului de studii.",
            "III. SESIUNEA SEPTEMBRIE 2025 Pentru înscrierea la concursul de admitere în învățământul universitar de masterat, candidații depun online, pe site-ul https://admitere.pub.ro sau fizic, la secretariatul facultății, dosarul de înscriere. Cuantumul taxei de înscriere este de 100 RON.",
            "Regulament Metodologie Repartitia locurilor bugetate Anexa 2 Anexa 3 Anexa 5 Taxe aplicabile studiilor universitare de doctorat, 2014 - 2015"
        ],
        "response": "Cuantumul taxei de înscriere la concursul de admitere la doctorat la ACS este de 200 RON. Totuși, pentru candidații care au absolvit un program de masterat în POLITEHNICA București, taxa de înscriere este redusă la 100 RON.\n\nSurse:\n- URL: https://acs.pub.ro/admitere/doctorat/",
        "faithfulness": "0.6666666666666666"
    },
    {
        "id": "87c308a74a5a7b6a29e2256febc48141defccbc0dab8fc6c6b7f98f9036abefe",
        "user_input": "Cand se afiseaza rezultatele la admiterea la licenta la ACS?",
        "retrieved_contexts": [
            "ACS optimizează orarele de master – fizic/online – în funcție de necesități, ținând cont de reglementările naționale și deciziile Senatului UPB. Admiteri anterioare Informativ, rezultatele admiterii din anii anteriori sunt disponibile aici: 2022, 2023, 2024. Programe de studii ACS oferă 25 programe de studii universitare de masterat acreditate ARACIS în domeniile: - CTI (Calculatoare și Tehnologia Informației) – 13 programe - IS (Ingineria Sistemelor) – 11 programe - IM (Inginerie și Management) – 1 program Broșura master (în curs de actualizare cu noile programe) oferă informații sintetice despre masterat și despre fiecare program. În continuarea acestei pagini sunt prezentate programele și descrierile cursurilor. Versiunea preliminară a planurilor de învățământ este disponibilă AICI. Până la începerea anului școlar pot interveni modificări minore ale planurilor de învâțământ. Calculatoare și Tehnologia Informației | Nr. crt. | Nume program master | ||| | 1. | Arhitecturi Avansate de Calculatoare | ||| | 2. | Administrarea Bazelor de Date | ||| | Catedra organizatoare: Calculatoare Responsabil: Prof.Dr.Ing. Florin Radulescu Tip: Aprofundare / Cercetare avansata Informaţii: Scurtă descriere, Plan învăţământ, Cursuri Pentru a putea urma acest program de masterat, sunt necesare studii de licență într-unul din următoarele domenii: Domeniul fundamental Stiinte ingineresti , domeniile: Calculatoare si Tehnologia Informatie (specializarile Calculatoare , Tehnologia Informatiei , Ingineria Informatiei), Inginerie electronica si telecomunicatii, Ingineria sistemelor (specializarile Automatica si informatica aplicata, Ingineria sistemelor multimedia) , Stiinte Ingineresti Aplicate (specializarile Matematica si informatica aplicata in inginerie)",
            "** - Rezultate preliminare: 11 iunie 2025, ora 12:00 - Contestații: pot fi depuse online până la date de 12 iunie 2025, ora 12:00 - Rezultatele finale privind admiterea preliminară: 16 iunie 2025, ora 12:00 Admiterea anticipată fără concurs - Absolvenții de liceu cu diplomă de bacalaureat, care au obținut în perioada studiilor liceale distincții la olimpiadele școlare internaționale, recunoscute de Ministerul Educației și Cercetării, beneficiază de dreptul de a se înscrie, la cerere, fără susținerea concursului de admitere, în cadrul numărului de locuri/granturi alocate, în învățământul superior de stat în domenii de studiu corespunzătoare disciplinelor la care au fost distinși, putând urma, fără taxe de școlarizare, cursurile a două facultăți în instituții de învățământ superior de stat. - În plus, față de prevederile anterioare, în anul 2023, pentru obținerea statutului de pre-admis fără concurs în cadrul Facultății de Energetică, în condițiile legii și cu respectarea cadrului definit prin hotărârile Senatului UPB, vor fi luate în considerare următoarele olimpiade și concursuri (vezi Anexa VI - REGULAMENT PRIVIND ORGANIZAREA ȘI DESFĂȘURAREA CONCURSULUI DE ADMITERE ÎN CICLUL DE STUDII UNIVERSITARE DE LICENȚĂ ANUL UNIVERSITAR 2025-2026). Admiterea anticipată prin concurs Media generală de admitere (MG) se determină cu relația: - MG = (4*MC + NB)/5 (unde MC este media notelor de concurs, iar NB reprezintă nota pentru proba P3. Media notelor de concurs (MC) se calculează cu formula: - MC = (NC1 + NC2)/2 (unde notele NC1 și respectiv NC2 sunt obținute la probele de concurs P1 și respectiv P2. La proba de concurs P1 se evaluează rezultatele obținute de candidat la Matematică (M) în clasele a IX-a, a X-a și a XI-a, iar nota obținută se calculează astfel: - M = Ma = (M9 + M10 + M11)/3 sau M = Mb = (M9 + M10)/2 (în funcție de specialitatea absolvită la liceu.",
            "o Rezultatele finale privind admiterea preliminară din Sesiunea I vor fi publicate la data de: ▪ 12 aprilie, ora 12:00 pentru facultățile și domeniile la care candidații au susținut probe scrise (c-s) (în Centrul Universitar București); ▪ 14 mai, ora 12:00 pentru facultățile și domeniile la care candidații au susținut concurs cu probe vocaționale (c-v) sau concurs mixt (c-m) (în Centrul Universitar Pitești); Pag. 17 Universitatea Națională de Știință și Tehnologie POLITEHNICA București REGULAMENTUL Concursului de Admitere în Ciclul de Studii Universitare de Licență 2025 ▪ 16 iunie, ora 12:00 pentru restul facultăților și domeniilor la care candidații au susținut concurs pe baza rezultatelor la activitățile școlare (dosar) (c-rs) (atât în Centrul Universitar București cât și în Centrul Universitar Pitești) . • Faza III – Admitere Etapa II – Validare, confirmare, participare la glisare (opțional) înscriere în anul I și înmatriculare începe la data de 02 iulie, ora 08:00 și se încheie după trei zile (04 iulie, ora 16:00). o Validarea implică, pentru fiecare candidat, completarea dosarului de concurs cu documentele originale solicitate (vezi Anexa V), verificarea promovării examenului de Bacalaureat și verificarea conformității datelor introduse în Faza I cu cele din documentele originale furnizate. Pentru a fi admis și înmatriculat candidatul trebuie să fi promovat examenul de Bacalaureat, să fi fost declarat pre-admis în Faza II, să aibă dosarul de admitere complet (cu toate documentele solicitate), iar datele furnizate la înscriere în Faza I să fie conforme cu documentele originale aduse în Faza III. o Validarea, confirmarea locului obținut, solicitarea pentru participare la glisare (opțional), înscrierea în anul I și ulterior înmatricularea se face la sediul facultăților la care aceștia au fost declarați pre-admiși, zilnic, între orele 08:00-16:00, începând cu ziua de 02 iulie, ora 8:00 și terminând cu ziua de 04 iulie, ora 16:00).",
            "În cadrul Sesiunii I – Admitere anticipată există 3 faze cu desfășurare succesivă – Înscriere, Admitere preliminară, Validare, confirmare, înscriere în anul I și înmatriculare admiși anticipat, după cum urmează: - Faza I – Înscriere (pe platforma on-line https://admitere.pub.ro) Începe la 15 decembrie 2024, odată cu deschiderea aplicației on-line pentru înscriere și se va termina în data de 02 iunie 2025, ora 16:00. - Faza II – Admitere preliminară Rezultatele intermediare obținute în urma evaluării dosarelor de concurs și ordonării candidaților în funcție de media generală de concurs vor fi afișate în data de 11 iunie 2025, ora 12:00. Fiecare candidat poate vizualiza rezultatul obținut în contul său din platforma on-line https://admitere.pub.ro . Eventualele contestații vor putea fi depuse on-line până la data de 12 iunie 2025, ora 12:00. Rezultatele finale privind pre-admiterea vor fi publicate la data de 16 iunie 2025, ora 12:00. - Faza III – Validare, confirmare, înscriere în anul I și înmatriculare admiși anticipat Începe în data de 02 iulie 2025, ora 08:00 și se încheie în data de 04 iulie 2025, ora 16:00. Validarea și înmatricularea implică, pentru fiecare candidat, completarea dosarului de concurs cu documentele originale solicitate și depunerea acestora la secretariatul facultății (060042 Splaiul Independenţei 313, corp J, sector 6, Bucureşti, România, Tel: 021 4029624, 0214029566, Fax: 0213181017). ATENȚIE! Pentru a deveni studenți, candidații care au fost declarați pre-admiși trebuie să obțină diploma de Bacalaureat și să se înmatriculeze între 02 și 04 iulie 2025, orele 8:00 – 16:00 la secretariatul facultății (060042 Splaiul Independenţei 313, corp J, sector 6, Bucureşti, România, Tel: 021 4029624, 0214029566, Fax: 0213181017)!",
            "- Examen scris (ambele probe): 14 Iulie începând cu ora 09:00 - Afișare rezultate preliminare: 15 iulie - Afișare rezultate finale concurs: 16 iulie - Validare, confirmare, înscriere în anul I și înmatriculare: 16 Iulie ora 9.00 – 17 Iulie ora 16.00, conform programării, fizic, la sediul facultății - Daca se va organiza Sesiunea 2+ (in funcție de situația locurilor vacante): Validare, confirmare, înscriere în anul I și înmatriculare candidati Sesiunea 2+: 18 Iulie ora 9.00 – 19 Iulie ora 16.00, fizic, la sediul facultății - Rezultate finale admiși și înscriși în anul I: 19 Iulie Înscrierea se face prin portalul https://admitere.pub.ro Detalii despre condițiile de admitere si întreg Calendarul Sesiunii 2 – Admitere sunt disponibile aici. Date de contact: telefon 021 402 91 79"
        ],
        "response": "Rezultatele preliminare la admiterea la licență la ACS vor fi afișate pe 15 iulie, iar rezultatele finale ale concursului vor fi disponibile pe 16 iulie. Aceste date sunt parte din calendarul admiterii pentru sesiunea de licență.\n\nSurse:\n- URL: https://acs.pub.ro/admitere/licenta/",
        "faithfulness": "0.75"
    },
    {
        "id": "2927d417c3cf5412c3c302419071e3dab4151aaa55f96f40e78377103e8e72df",
        "user_input": "Cand se afiseaza rezultatele la admiterea la licenta la FAIMA?",
        "retrieved_contexts": [
            "** - Rezultate preliminare: 11 iunie 2025, ora 12:00 - Contestații: pot fi depuse online până la date de 12 iunie 2025, ora 12:00 - Rezultatele finale privind admiterea preliminară: 16 iunie 2025, ora 12:00 Admiterea anticipată fără concurs - Absolvenții de liceu cu diplomă de bacalaureat, care au obținut în perioada studiilor liceale distincții la olimpiadele școlare internaționale, recunoscute de Ministerul Educației și Cercetării, beneficiază de dreptul de a se înscrie, la cerere, fără susținerea concursului de admitere, în cadrul numărului de locuri/granturi alocate, în învățământul superior de stat în domenii de studiu corespunzătoare disciplinelor la care au fost distinși, putând urma, fără taxe de școlarizare, cursurile a două facultăți în instituții de învățământ superior de stat. - În plus, față de prevederile anterioare, în anul 2023, pentru obținerea statutului de pre-admis fără concurs în cadrul Facultății de Energetică, în condițiile legii și cu respectarea cadrului definit prin hotărârile Senatului UPB, vor fi luate în considerare următoarele olimpiade și concursuri (vezi Anexa VI - REGULAMENT PRIVIND ORGANIZAREA ȘI DESFĂȘURAREA CONCURSULUI DE ADMITERE ÎN CICLUL DE STUDII UNIVERSITARE DE LICENȚĂ ANUL UNIVERSITAR 2025-2026). Admiterea anticipată prin concurs Media generală de admitere (MG) se determină cu relația: - MG = (4*MC + NB)/5 (unde MC este media notelor de concurs, iar NB reprezintă nota pentru proba P3. Media notelor de concurs (MC) se calculează cu formula: - MC = (NC1 + NC2)/2 (unde notele NC1 și respectiv NC2 sunt obținute la probele de concurs P1 și respectiv P2. La proba de concurs P1 se evaluează rezultatele obținute de candidat la Matematică (M) în clasele a IX-a, a X-a și a XI-a, iar nota obținută se calculează astfel: - M = Ma = (M9 + M10 + M11)/3 sau M = Mb = (M9 + M10)/2 (în funcție de specialitatea absolvită la liceu.",
            "În cadrul Sesiunii I – Admitere anticipată există 3 faze cu desfășurare succesivă – Înscriere, Admitere preliminară, Validare, confirmare, înscriere în anul I și înmatriculare admiși anticipat, după cum urmează: - Faza I – Înscriere (pe platforma on-line https://admitere.pub.ro) Începe la 15 decembrie 2024, odată cu deschiderea aplicației on-line pentru înscriere și se va termina în data de 02 iunie 2025, ora 16:00. - Faza II – Admitere preliminară Rezultatele intermediare obținute în urma evaluării dosarelor de concurs și ordonării candidaților în funcție de media generală de concurs vor fi afișate în data de 11 iunie 2025, ora 12:00. Fiecare candidat poate vizualiza rezultatul obținut în contul său din platforma on-line https://admitere.pub.ro . Eventualele contestații vor putea fi depuse on-line până la data de 12 iunie 2025, ora 12:00. Rezultatele finale privind pre-admiterea vor fi publicate la data de 16 iunie 2025, ora 12:00. - Faza III – Validare, confirmare, înscriere în anul I și înmatriculare admiși anticipat Începe în data de 02 iulie 2025, ora 08:00 și se încheie în data de 04 iulie 2025, ora 16:00. Validarea și înmatricularea implică, pentru fiecare candidat, completarea dosarului de concurs cu documentele originale solicitate și depunerea acestora la secretariatul facultății (060042 Splaiul Independenţei 313, corp J, sector 6, Bucureşti, România, Tel: 021 4029624, 0214029566, Fax: 0213181017). ATENȚIE! Pentru a deveni studenți, candidații care au fost declarați pre-admiși trebuie să obțină diploma de Bacalaureat și să se înmatriculeze între 02 și 04 iulie 2025, orele 8:00 – 16:00 la secretariatul facultății (060042 Splaiul Independenţei 313, corp J, sector 6, Bucureşti, România, Tel: 021 4029624, 0214029566, Fax: 0213181017)!",
            "sesiunea de admitere anticipată, sesiunea din iulie 2025 și sesiunea din septembrie 2025, conform următorului calendar: Sesiunea I Admitere anticipată 2025 Înscrierea candidaților 15.12.2024 – 10.05.2025 Taxa înscriere: 50 RON Concurs de admitere 13.05 – 16.05.2025 Comunicarea rezultatelor 13.05 – 17.05.2025 Înmatricularea candidaților 01.07 – 31.07.2025 Sesiunea II Iulie 2025 Înscrierea candidaților 01.07 – 08.07.2025 Taxa înscriere: 100 RON Concurs de admitere 10.07 – 12.07.2025 Comunicarea rezultatelor 10.07 – 13.07.2025 Înmatricularea candidaților 10.07 – 31.07.2025 Sesiunea III Septembrie 2025 Înscrierea candidaților 02.09 – 13.09.2025 Taxa înscriere: 100 RON Concurs de admitere 16.09 – 17.09.2025 Comunicarea rezultatelor 16.09 – 18.09.2025 Înmatricularea candidaților 16.09 – 20.09.2025 Specializări în domeniul inginerie aerospațială: - Structuri aeronautice și spațiale - Propulsie aerospațială și protecția mediului - Avionica și navigație aerospațială - Inginerie si management aerospațial - Ingineria Transportului Aerian (Air transport engineering) - Sisteme Holistice Spațiale - Management aeronautic Specializări în domeniul inginerie industrială: - Grafică inginerească și design Admitere Master sesiunea septembrie 2024 << Rezultate admitere master sesiunea septembrie 2024 >> << Link admitere master sesiunea septembrie 2024, 16.09.2024 >> << Programare interviu master sesiunea septembrie 2024, 16.09.2024 >> Admitere Master sesiunea iulie 2024 << Rezultate admitere master sesiunea iulie 2024 >> << Link-ul Microsoft Teams pentru interviul la master sesiunea iulie 2024, 10-07-2024, ora 10:00 >> << Programare interviu master sesiunea iulie 2024 >> Admitere Master sesiunea mai 2024 << Rezultate admitere master sesiunea mai 2024 >> << Link-ul Microsoft Teams pentru interviul la master sesiunea mai 2024, 13-05-2024, ora 10:00 >> << Programare admitere master sesiunea mai 2024 >> Calendarul desfășurării concursului de admitere în învățământul universitar de masterat* Anul universitar 2024-2025 Inscrierea se face pe site-ul www.admitere.pub.ro |",
            "- Examen scris (ambele probe): 14 Iulie începând cu ora 09:00 - Afișare rezultate preliminare: 15 iulie - Afișare rezultate finale concurs: 16 iulie - Validare, confirmare, înscriere în anul I și înmatriculare: 16 Iulie ora 9.00 – 17 Iulie ora 16.00, conform programării, fizic, la sediul facultății - Daca se va organiza Sesiunea 2+ (in funcție de situația locurilor vacante): Validare, confirmare, înscriere în anul I și înmatriculare candidati Sesiunea 2+: 18 Iulie ora 9.00 – 19 Iulie ora 16.00, fizic, la sediul facultății - Rezultate finale admiși și înscriși în anul I: 19 Iulie Înscrierea se face prin portalul https://admitere.pub.ro Detalii despre condițiile de admitere si întreg Calendarul Sesiunii 2 – Admitere sunt disponibile aici. Date de contact: telefon 021 402 91 79",
            "Candidații declarați pre-admiși și care nu au confirmat locul sau care nu au dosarul complet validat vor pierde locul rezervat în faza de pre-admitere și vor fi eliminați din concursul de admitere. Sesiunea 1 – Admitere anticipată – Calendar - Perioada și modalitatea de înscriere: - Online, direct prin intermediul platformei de admitere între Decembrie 2024 – 30 Martie 2025 ora 16:00 - Examen scris (ambele probe): 5 Aprilie începând cu ora 09:00 - Afișare rezultate preliminare: 9 Aprilie - Afișare rezultate finale concurs: 12 Aprilie - Validare, confirmare, înscriere în anul I și înmatriculare: 2 Iulie ora 9.00 – 4 Iulie ora 16.00, conform programării, fizic, la sediul facultății - Rezultate finale admiși anticipat și înscriși în anul I: 5 Iulie Sesiunea 2 – Admitere – Informații Admitere pe bază de examen scris cu 2 probe P1 și P2 (80%) și a rezultatelor școlare obținute la examenul național de Bacalaureat (20%). - P1 – examen scris la disciplina Matematică - Programa analitică este disponibilă la finalul regulamentului de admitere aici - P2 – examen scris la disciplina Fizică sau Informatică în funcție de opțiunea candidatului la înscriere - Programele analitice sunt disponibile la finalul regulamentului de admitere aici Culegerile cu teste pregătitoare pentru admitere la Matematică, Fizică și Informatică se pot găsi la Libraria UPB Informații suplimentare despre proba de informatica sunt disponibile aici. Candidații pot opta la admitere, pentru un loc la domeniul Calculatoare și Tehnologia Informației (buget și taxă) sau Ingineria Sistemelor (buget și taxă). Înscrierea se face prin portalul https://admitere.pub.ro. Din totalul cifrei de școlarizare se vor scade candidații admiși și înmatriculați în Sesiunea de admitere anticipată. Numărul total de locuri poate fi vizualizat si pe site-ul admitere.pub.ro . Detalii despre condițiile de admitere si întreg Calendarul Sesiunii 2 – Admitere sunt disponibile aici."
        ],
        "response": "Rezultatele la admiterea la licență la FAIMA (Facultatea de Inginerie Mecanica și Mecatronică) se afișează în următoarele date:\n\n- **Sesiunea 1 – Admitere anticipată**: \n  - Afișare rezultate preliminare: **9 Aprilie 2025**\n  - Afișare rezultate finale concurs: **12 Aprilie 2025**\n\n- **Sesiunea 2 – Admitere**: \n  - Afișare rezultate preliminare: **15 Iulie 2025**\n  - Afișare rezultate finale concurs: **16 Iulie 2025**\n\nAceste date sunt conform calendarului de admitere publicat pe site-ul oficial al universității.\n\nSurse:\n- URL: https://acs.pub.ro/admitere/licenta/",
        "faithfulness": "0.5714285714285714"
    },
    {
        "id": "d81bd916e98b41c42bc76d1703a6fbb3aaa54c5ee65bf56ab4cd150ebdfe690b",
        "user_input": "Ce facultati sunt in cadrul Politehnicii?",
        "retrieved_contexts": [
            "(1) Admiterea la studiile universitare de masterat se organizează în cadrul facultăților care au programe de studiu aprobate de Senatul Universității Naționale de Știință și Tehnologie POLITEHNICA București și Ministerul Educației, acreditate de ARACIS și publicate în hotărâre de guvern; programele de studii sunt afișate pe site-ul universității și, pentru fiecare facultate în parte, pe site-ul facultății. (2) Admiterea la studiile universitare de masterat se face prin concurs, iar numărul de locuri este aprobat de: • Ministerul Educației, pentru cele finanțate de la bugetul de stat; • Senatul universității, pentru cele în regim cu taxă de studii. (3) Facultățile hotărăsc distribuirea locurilor acordate pentru cele trei sesiuni de admitere (în funcție de necesități specifice) și informează Consiliul de Administrație al Universității Naționale de Știință și Tehnologie POLITEHNICA București cu privire la această distribuire. (4) Formațiile de studii se stabilesc de către Senat. Pentru anul universitar 2025– 2026, formațiile de studiu la masterat trebuie să fie de minimum 20 masteranzi, respectând o medie de minimum 25 masteranzi pe facultate. Facultățile care vor alcătui formații de studiu pentru programele de masterat cu un număr mai mic de studenți decât cel specificat vor norma orele aferente activităților didactice la acele formații de studiu cu o reducere proporțională cu raportul dintre numărul de studenți din formații și numărul minim impus. Art. 6. (1) Un candidat declarat admis pentru un program de studii universitare de masterat poate beneficia de finanțare de la bugetul de stat o singură dată. (2) Un candidat admis în sesiunea de admitere anticipată Mai sau Iulie de admitere nu va putea candida pentru alt program în sesiunea septembrie decât daca renunța, în prealabil, la locul ocupat. Retragerea se face printr-o cerere scrisă către Decan, semnată, trimisă pe email sau depusă la secretariat. Art. 7. La înscriere, candidații vor declara, pe proprie răspundere, dacă au mai urmat alte programe de masterat cu finanțare de la bugetul de stat.",
            "| Nr. crt. | - - Domeniul de studiu | Facultăți - studii universitare de 7 , - licență | Facultăți — studii universitare de ' masterat |\n|-----------:|:--|:--|:--|\n| 1 | e . Administrarea Afacerilor | 1. Facultatea de Ştiințe Economice şi Drept | 21. Facultatea de Ştiințe Economice şi M ' Drept |\n| 2 | Arte Vizuale | 2;%. Facultatea de Teologie, Litere, Istorie și Arte | : |\n| 3 | . - ENE Asistență Socială | 22. Facultatea de Științe ale Educației, \" , IET . Ştiințe Sociale şi Psihologie | 22. Facultatea de Ştiințe ale Educației, . - - DIRT . Ştiințe Sociale şi Psihologie |\n| 4 | , . Biologie | 18. Facultatea de Ştiințe, Educație Fizică - NIIRR și Informatică | 18. Facultatea de Ştiințe, Educație Fizică - — . . şi Informatică |\n| 5 | , . Biotehnologii | 11. Facultatea de Inginerie Chimică şi , e ' Biotehnologii | 11. Facultatea de Inginerie Chimică și , . Biotehnologii |\n| 6 | Calculatoare şi Tehnologia Informației | 03. Facultatea de Automatică şi Calculatoare | 03. Facultatea de Automatică şi Calculatoare |\n| 6 | Calculatoare şi Tehnologia Informației | 04. Facultatea de Electronică, Telecomunicații şi Tehnologia Informației | 04. Facultatea de Electronică, Telecomunicații şi Tehnologia Informației |\n| 6 | Calculatoare şi Tehnologia Informației | 12. Facultatea de Inginerie în Limbi Străine | 12. Facultatea de Inginerie în Limbi Străine |\n| 6 | Calculatoare şi Tehnologia Informației | 20. Facultatea de Electronică, NIIER Comunicații şi Calculatoare | 17. Catedra UNESCO |\n| 7 | Chimi imie | 18. Facultatea de Ştiințe, Educație Fizică - , și Informatică | 18. Facultatea De Ştiințe, Educație Fizică , - şi Informatică |\n| 8 | - Contabilitate | 21. Facultatea de Ştiințe Economice şi M Drept | 21. Facultatea de Ştiințe Economice şi , ” Drept |",
            "| 9 | Drept P | 21. Facultatea de Ştiințe Economice şi Drept | 21. Facultatea de Ştiințe Economice şi Drept.1 |\n|:--|:--|:--|:--|\n| 0 | . Economie | - | 15. Facultatea de Antreprenoriat, MIRRERIE - Ingineria şi Managementul Afacerilor |\n| l | | 18. Facultatea de Ştiințe, Educație Fizică și Informatică | |\n| 2 | - . Filologie | - | 23. Facultatea de Teologie, Litere, Istorie , & şi Arte |\n| 3 | , Finanțe ” | 21. Facultatea de Ştiințe Economice şi M Drept | 21. Facultatea de Ştiințe Economice şi , ” Drept |\n| 4 | , - Horticultură | 18. Facultatea de Ştiințe, Educație Fizică . - 7 , și Informatică | - |\n| 53 | . Informatică | 18. Facultatea de Ştiințe, Educație Fizică , g și Informatică | 18. Facultatea de Ştiințe, Educație Fizică - — ' ' şi Informatică |\n| 6 | Ingineria Autovehiculelor | 08. Facultatea de Transporturi | 08. Facultatea de Transporturi |\n| 6 | Ingineria Autovehiculelor | UNIN 19. Facultatea de Mecanică şi Tehnologie | UUR 19. Facultatea de Mecanică şi Tehnologie |\n| 17 | NIIE . Ingineria Materialelor | 10. Facultatea de Ştiința şi Ingineria - VIIR SI IE Materialelor | 10. Facultatea de Ştiința şi Ingineria Materialelor |\n| 17 | NIIE . Ingineria Materialelor | 10. Facultatea de Ştiința şi Ingineria - VIIR SI IE Materialelor | 14. Facultatea de Inginerie Medicală |\n| 18 | NII NEN Ingineria Mediului | 07. Facultatea de Ingineria Sistemelor , , Biotehnice | — . 02. Facultatea de Energetică |\n| 18 | NII NEN Ingineria Mediului | 10. Facultatea de Ştiința şi Ingineria Materialelor | 07. Facultatea de Ingineria Sistemelor Biotehnice |\n| 18 | NII NEN Ingineria Mediului | 11. Facultatea de Inginerie Chimică şi & ' Biotehnologii | — , 08. Facultatea de Transporturi |\n| 18 | NII NEN Ingineria Mediului | 18. Facultatea de Ştiințe, Educație Fizică și Informatică | 10. Facultatea de Ştiința şi Ingineria Materialelor |\n| 18 | NII NEN Ingineria Mediului | | 11. Facultatea De Inginerie Chimica Si Biotehnologii |\n| 18 | NII NEN Ingineria Mediului | 07. Facultatea de Ingineria Sistemelor Biotehnice | 07. Facultatea de Ingineria Sistemelor Biotehnice |",
            "| Universitățile/țările implicate: |\n|:--|\n| Perioada de derulare a proiectului: |",
            "| Pentru facultăți din Centrul Universitar BUCUREȘTI | Pentru facultăți din Centrul Universitar PITEȘTI |\n|------------------------------------------------------|----------------------------------------------------|"
        ],
        "response": "Nu am suficiente informații pentru a răspunde la întrebare.",
        "faithfulness": "0.0"
    },
    {
        "id": "cef7ed545dcccbad85d79e3f6a244fc0e3f6d16db1f2e1080eec7be83c4c3e9f",
        "user_input": "Cate programe de studii de masterat sunt la ACS?",
        "retrieved_contexts": [
            "ACS optimizează orarele de master – fizic/online – în funcție de necesități, ținând cont de reglementările naționale și deciziile Senatului UPB. Admiteri anterioare Informativ, rezultatele admiterii din anii anteriori sunt disponibile aici: 2022, 2023, 2024. Programe de studii ACS oferă 25 programe de studii universitare de masterat acreditate ARACIS în domeniile: - CTI (Calculatoare și Tehnologia Informației) – 13 programe - IS (Ingineria Sistemelor) – 11 programe - IM (Inginerie și Management) – 1 program Broșura master (în curs de actualizare cu noile programe) oferă informații sintetice despre masterat și despre fiecare program. În continuarea acestei pagini sunt prezentate programele și descrierile cursurilor. Versiunea preliminară a planurilor de învățământ este disponibilă AICI. Până la începerea anului școlar pot interveni modificări minore ale planurilor de învâțământ. Calculatoare și Tehnologia Informației | Nr. crt. | Nume program master | ||| | 1. | Arhitecturi Avansate de Calculatoare | ||| | 2. | Administrarea Bazelor de Date | ||| | Catedra organizatoare: Calculatoare Responsabil: Prof.Dr.Ing. Florin Radulescu Tip: Aprofundare / Cercetare avansata Informaţii: Scurtă descriere, Plan învăţământ, Cursuri Pentru a putea urma acest program de masterat, sunt necesare studii de licență într-unul din următoarele domenii: Domeniul fundamental Stiinte ingineresti , domeniile: Calculatoare si Tehnologia Informatie (specializarile Calculatoare , Tehnologia Informatiei , Ingineria Informatiei), Inginerie electronica si telecomunicatii, Ingineria sistemelor (specializarile Automatica si informatica aplicata, Ingineria sistemelor multimedia) , Stiinte Ingineresti Aplicate (specializarile Matematica si informatica aplicata in inginerie)",
            "(1) Admiterea la studiile universitare de masterat se organizează în cadrul facultăților care au programe de studiu aprobate de Senatul Universității Naționale de Știință și Tehnologie POLITEHNICA București și Ministerul Educației, acreditate de ARACIS și publicate în hotărâre de guvern; programele de studii sunt afișate pe site-ul universității și, pentru fiecare facultate în parte, pe site-ul facultății. (2) Admiterea la studiile universitare de masterat se face prin concurs, iar numărul de locuri este aprobat de: • Ministerul Educației, pentru cele finanțate de la bugetul de stat; • Senatul universității, pentru cele în regim cu taxă de studii. (3) Facultățile hotărăsc distribuirea locurilor acordate pentru cele trei sesiuni de admitere (în funcție de necesități specifice) și informează Consiliul de Administrație al Universității Naționale de Știință și Tehnologie POLITEHNICA București cu privire la această distribuire. (4) Formațiile de studii se stabilesc de către Senat. Pentru anul universitar 2025– 2026, formațiile de studiu la masterat trebuie să fie de minimum 20 masteranzi, respectând o medie de minimum 25 masteranzi pe facultate. Facultățile care vor alcătui formații de studiu pentru programele de masterat cu un număr mai mic de studenți decât cel specificat vor norma orele aferente activităților didactice la acele formații de studiu cu o reducere proporțională cu raportul dintre numărul de studenți din formații și numărul minim impus. Art. 6. (1) Un candidat declarat admis pentru un program de studii universitare de masterat poate beneficia de finanțare de la bugetul de stat o singură dată. (2) Un candidat admis în sesiunea de admitere anticipată Mai sau Iulie de admitere nu va putea candida pentru alt program în sesiunea septembrie decât daca renunța, în prealabil, la locul ocupat. Retragerea se face printr-o cerere scrisă către Decan, semnată, trimisă pe email sau depusă la secretariat. Art. 7. La înscriere, candidații vor declara, pe proprie răspundere, dacă au mai urmat alte programe de masterat cu finanțare de la bugetul de stat.",
            "(2) Admiterea la studiile universitare de doctorat se face pe baza unui concurs organizat de POLITEHNICA București, prin IOSUD. (3) Studiile universitare de doctorat reprezintă al III-lea ciclu de studii universitare și permit dobândirea unei calificări de nivelul 8 din EQF/CEC și din CNC. Acestea se desfășoară în conformitate cu prevederile Regulamentului-cadru privind studiile universitare de doctorat. (4) Admiterea în ciclul de studii universitare de doctorat se organizează pe domenii de doctorat în cadrul școlilor doctorale autorizate provizoriu sau acreditate. (5) Admiterea la studii universitare de doctorat este procesul de selecție a candidaților pentru fiecare poziție vacantă de student-doctorand pe care conducătorii de doctorat din cadrul școlii doctorale decid să o propună spre ocupare în cadrul sesiunilor de admitere organizate. (6) Studiile universitare de doctorat se organizează la forma de învățământ cu frecvență sau cu frecvență redusă atât pe locuri în regim de finanțare de la bugetul de stat sub formă de granturi doctorale, cât și pe locuri în regim cu taxă sau alte surse legal constituite. (7) Doctoratul se poate desfășura în limba română, într-o limbă a minorităților naționale sau într-o limbă de circulație internațională, conform contractului de studii doctorale încheiat între IOSUD, conducătorul de doctorat și studentul-doctorand. (8) Studiile universitare de doctorat au o durată de 4 ani. (9) Numărul de locuri în regim de finanțare de la bugetul de stat pe fiecare instituție organizatoare de studii universitare de doctorat este stabilit prin ordin al ministrului educației, iar numărul de locuri în regim cu taxă este fixat prin hotărâre a Senatului universitar (10) Programele de studii universitare de doctorat se organizează în şcoli doctorale şi sunt Metodologie admitere la doctorat 2025 de două tipuri: a) doctorat ştiinţific, care are ca finalitate producerea de cunoaştere ştiinţifică originală, relevantă internaţional, pe baza unor metode ştiinţifice, organizat numai la forma de învăţământ cu frecvenţă.",
            "Masterat Detalii despre admiterea la masterat se găsesc aici >A fost activată, în platforma de opționale, posibilitatea de a aplica pentru disciplinele opționale și schimbări de discipline. Solicitările se pot introduce până MARȚI 08 oct 2024 ora 14. Mai multe instructiuni au fost postate pe canalul de Informare master de pe Teams. Programe de studii Facultatea de Automatică și Calculatoare oferă 24 programe de studii universitare de masterat acreditate de către ARACIS în domeniile: - Calculatoare și Tehnologia Informației – 12 programe - Ingineria Sistemelor – 11 programe - Inginerie și Management – 1 program BROŞURA MASTER oferă informații sintetice despre masterat și despre fiecare program, iar în continuarea acestei pagini sunt prezentate planurile de învăţământ şi descrierile cursurilor. *planurile de invatamant 2023-2025 sunt in curs de avizare de catre CF si Senat. Calculatoare și Tehnologia Informației | Nr. crt. | Nume program master | ||| | 1. | Arhitecturi Avansate de Calculatoare | ||| | 2. | Administrarea Bazelor de Date | ||| | Catedra organizatoare: Calculatoare Responsabil: Prof.Dr.Ing. Florin Radulescu Tip: Aprofundare / Cercetare avansata Informaţii: Scurtă descriere, Plan învăţământ, Cursuri Pentru a putea urma acest program de masterat, sunt necesare studii de licență într-unul din următoarele domenii: Domeniul fundamental Stiinte ingineresti , domeniile: Calculatoare si Tehnologia Informatie (specializarile Calculatoare , Tehnologia Informatiei , Ingineria Informatiei), Inginerie electronica si telecomunicatii, Ingineria sistemelor (specializarile Automatica si informatica aplicata, Ingineria sistemelor multimedia) , Stiinte Ingineresti Aplicate (specializarile Matematica si informatica aplicata in inginerie) Domeniul fundamental Stiinte Exacte , domeniile : Matematica (specializarea Matematica informatica) , Informatica (specializarile Informatica , informatica aplicata) Domeniul fundamental Stiinte Economice, domeniile: Economie, Administrarea Afacerilor, Economie si Afaceri Internationale, Management , Marketing | |||| | 3.",
            "Programe de master Pentru continuarea studiilor de licență și obținerea diplomei de master, Facultatea de Inginerie Aerospațială oferă 7 programe de studii de masterat în ingineria aerospațială și unul în ingineria industrială (GID), învățământ la zi, 2 ani, 120 puncte credit transferabile prin sistemul european ECTS: *Directorul departamentului (DD) / Responsabilul programului de studii (RPS) – daca este un cadru didactic distinct"
        ],
        "response": "Facultatea de Automatică și Calculatoare (ACS) oferă 25 de programe de studii universitare de masterat acreditate ARACIS, împărțite în următoarele domenii: 13 programe în domeniul Calculatoare și Tehnologia Informației, 11 programe în domeniul Ingineria Sistemelor și 1 program în domeniul Inginerie și Management.\n\nSurse:\n- URL: https://acs.pub.ro/admitere/masterat/\n- URL: https://acs.pub.ro/educatie/masterat/",
        "faithfulness": "0.7142857142857143"
    },
    {
        "id": "4e3440fd64827adee5730b8702f67e72867f21e5bb45e6eb38eab88c54da694a",
        "user_input": "Ce materii sunt la facultatea de Automatica si Calculatoare?",
        "retrieved_contexts": [
            "| Automatică și Informatică Industrială | ||| | Catedra organizatoare: AII Responsabil: Prof.Dr.Ing. Sergiu Stelian Iliescu, Tip: Aprofundare / Cercetare avansata Informaţii: Scurtă descriere, Plan învăţământ, Cursuri Pentru a putea urma acest program de masterat, sunt necesare studii de licență într-unul din următoarele domenii: Domeniul fundamental Stiinte Ingineresti , domeniile: Ingineria Sistemelor, Calculatoare si Tehnologia Informatiei, Inginerie Electrica, Inginerie Electronica si Telecomunicatii si Inginerie Industriala | |||| | 17. | Managementul și Protecția Informației | ||| | Catedra organizatoare: AII Responsabil: Prof.Dr.Ing. Dorin Carstoiu, Prof.dr.ing. Anca Daniela Ionita Tip: Aprofundare / Cercetare avansata Informaţii: Scurtă descriere, Plan învăţământ, Cursuri Pentru a putea urma acest program de masterat, sunt necesare studii de licență într-unul din următoarele domenii: Domeniul fundamental Stiinte Ingineresti , domeniile: Ingineria Sistemelor, Calculatoare si Tehnologia Informatiei, Inginerie Electrica, Inginerie Electronica si Telecomunicatii, Stiinte Ingineresti Aplicate | |||| | 18. | Prelucrări Complexe de Semnal în Aplicații Multimedia | ||| | Catedra organizatoare: AII Responsabil: Prof.Dr.Ing. Dan Popescu Tip: Aprofundare / Cercetare avansata Informaţii: Scurtă descriere, Plan învăţământ, Cursuri Pentru a putea urma acest program de masterat, sunt necesare studii de licență într-unul din următoarele domenii: Domeniul fundamental Stiinte Ingineresti , domeniile: Ingineria Sistemelor, Calculatoare si Tehnologia Informatiei, Inginerie Electrica, Inginerie Electronica si Telecomunicatii, Stiinte Ingineresti Aplicate, Ingineria Mediului | |||| | 19. | Service Engineering and Management – în engleză | ||| | Catedra organizatoare: Calculatoare + AII Responsabil: Conf.dr.ing.",
            "| Robotică și Automatizări – în engleză | ||| | Catedra organizatoare: AII+AIS Responsabil: Conf.dr.ing. Florin Anton, Tip: Aprofundare / Cercetare avansata Informaţii: Scurtă descriere, Plan învăţământ, Cursuri Pentru a putea urma acest program de masterat, sunt necesare studii de licență într-unul din următoarele domenii: Domeniul fundamental Stiinte Ingineresti, domeniul : Ingineria Sistemelor , Calculatoare si tehnologia informatiei , Inginerie Electrica , Inginerie electronica si telecomunicatii , Inginerie Industriala | |||| | 24. | Analiza avansată de date pentru afaceri – în engleză | ||| | Catedra organizatoare: AIS / AII / Calculatoare Responsabil: Prof.Dr.Ing. Monica Dragoicea Tip: Aprofundare / Cercetare avansata Informaţii: Scurtă descriere, Plan învăţământ, Cursuri Pentru a putea urma acest program de masterat, sunt necesare studii de licență într-unul din următoarele domenii: | Inginerie și Management | Nr. crt. | Nume program master | ||| | 25. | Ingineria și Managementul Sistemelor de Afaceri | ||| | Catedra organizatoare: AIS Responsabil: Prof.Dr.Ing. Ioan Ștefan Sacală Tip: Interdisciplinar / Transdisciplinar Informaţii: Scurtă descriere, Plan învăţământ, Cursuri Pentru a putea urma acest program de masterat, sunt necesare studii de licență într-unul din următoarele domenii: Domeniul fundamental Stiinte Ingineresti, domeniile : Ingineria Sistemelor, Inginerie si Management | Catedra organizatoare: Calculatoare Responsabil: Prof.Dr.Ing. Nicolae Tapus Tip: Aprofundare / Cercetare avansata Informaţii: Scurtă descriere, Plan învăţământ, Cursuri Pentru a putea urma acest program de masterat, sunt necesare studii de licență într-unul din următoarele domenii:",
            "| Inteligență Artificială – în engleză | ||| | Catedra organizatoare: Calculatoare Responsabil: Prof.Dr.Ing. Adina Florea Tip: Aprofundare / Cercetare avansata Informaţii: Scurtă descriere, Plan învăţământ, Cursuri Pentru a putea urma acest program de masterat, sunt necesare studii de licență într-unul din următoarele domenii: Domeniul fundamental Stiinte ingineresti , domeniile: Calculatoare si Tehnologia Informatie (specializarile Calculatoare , Tehnologia Informatiei , Ingineria Informatiei), Inginerie electronica si telecomunicatii, Ingineria sistemelor (specializarile Automatica si informatica aplicata) , Stiinte Ingineresti Aplicate (specializarile Matematica si informatica aplicata in inginerie) Domeniul fundamental Stiinte Exacte , domeniile : Matematica (specializarea Matematica informatica) , Informatica (specializarile Informatica , informatica aplicata) | |||| | 6. | Ingineria Sistemelor Internet | ||| | Catedra organizatoare: Calculatoare Responsabil: Prof.Dr.Ing. Stefan Trausan-Matu Tip: Aprofundare / Cercetare avansata Informaţii: Scurtă descriere, Plan învăţământ, Cursuri Pentru a putea urma acest program de masterat, sunt necesare studii de licență într-unul din următoarele domenii: Domeniul fundamental Stiinte ingineresti , domeniile: Calculatoare si Tehnologia Informatie (specializarile Calculatoare , Tehnologia Informatiei , Ingineria Informatiei), Inginerie electronica si telecomunicatii, Ingineria sistemelor (specializarile Automatica si informatica aplicata, Ingineria sistemelor multimedia) | |||| | 7. | Management în Tehnologia Informației | ||| | Catedra organizatoare: Calculatoare Responsabil: Prof.Dr.Ing. Florica Moldoveanu Tip: Interdisciplinar / Transdisciplinar Informaţii: Scurtă descriere, Plan învăţământ, Cursuri Pentru a putea urma acest program de masterat, sunt necesare studii de licență într-unul din următoarele domenii:",
            "b) punerea la dispoziţia personalului universităţii, potrivit specificului muncii lor, a instalaţiilor, utilajelor, maşinilor, aparatelor, uneltelor, materiilor prime, materialelor, documentaţiei şi echipamentului de protecţie şi de lucru, precum şi luarea de măsuri pentru asigurarea stării lor corespunzătoare în vederea utilizării depline a capacităţii de muncă şi de cercetare şi a folosirii complete şi eficiente a timpului de lucru; c) stabilirea instrucţiunilor pentru funcţionarea şi exploatarea instalaţiilor, maşinilor, agregatelor şi utilajelor folosite în universitate, instrucţiunilor tehnice de lucru, normelor de manipulare, depozitare şi folosire a materiilor prime şi a materialelor, instrucţiunilor proprii de protecţie a muncii, precum şi a celorlalte norme specifice activităţii din universitate; d) asigurarea condiţiilor de protecţie a muncii şi de respectare a normelor igienico- sanitare, asigurarea instruirii personalului în acest domeniu; e) elaborarea regulilor proprii pentru aplicarea normelor de protecţie a muncii, corespunzător condiţiilor în care se desfăşoară activitatea la locurile de muncă; f) adoptarea de măsuri pentru autorizarea exercitării meseriilor şi a profesiilor prevăzute în normele de protecţia muncii; g) aprovizionarea la timp şi în bune condiţii a tuturor compartimentelor de lucru cu materii prime, materiale, combustibil şi energie, cu respectarea consumurilor specifice; h) informarea personalului cu privire la legislaţia în vigoare, pentru cunoaşterea drepturilor şi îndatoririlor ce le revin; i) examinarea şi aplicarea sugestiilor şi propunerilor făcute de către personalul universităţii pentru îmbunătăţirea activităţii în toate compartimentele, precum şi informarea acestora asupra modului de rezolvare a problemelor care intervin; j) adoptarea măsurilor pentru eliberarea de legitimaţii de serviciu întregului personal al universităţii, cu indicarea funcţiei fiecăruia; k) asigurarea prin structurile organizatorice competente a unei stări corespunzătoare bibliotecii, laboratoarelor, încălzitului încăperilor, iluminatului etc, în vederea bunei desfăşurări a procesului de învăţământ şi a activităţii de cercetare ştiinţifică; l) asigurarea repausului saptămânal conform prevederilor legale;",
            "Domeniul fundamental Stiinte ingineresti , domeniile: Calculatoare si Tehnologia Informatie (specializarile Calculatoare , Tehnologia Informatiei , Ingineria Informatiei), Inginerie electronica si telecomunicatii, Ingineria sistemelor (specializarile Automatica si informatica aplicata) , Stiinte Ingineresti Aplicate (specializarile Matematica si informatica aplicata in inginerie) Domeniul fundamental Stiinte Exacte , domeniile : Matematica (specializarea Matematica informatica) , Informatica (specializarile Informatica , informatica aplicata) | |||| | 6. | Ingineria Sistemelor Internet | ||| | Catedra organizatoare: Calculatoare Responsabil: Prof.Dr.Ing. Stefan Trausan-Matu Tip: Aprofundare / Cercetare avansata Informaţii: Scurtă descriere, Plan învăţământ, Cursuri Pentru a putea urma acest program de masterat, sunt necesare studii de licență într-unul din următoarele domenii: Domeniul fundamental Stiinte ingineresti , domeniile: Calculatoare si Tehnologia Informatie (specializarile Calculatoare , Tehnologia Informatiei , Ingineria Informatiei), Inginerie electronica si telecomunicatii, Ingineria sistemelor (specializarile Automatica si informatica aplicata, Ingineria sistemelor multimedia) | |||| | 7. | Management în Tehnologia Informației | ||| | Catedra organizatoare: Calculatoare Responsabil: Prof.Dr.Ing. Florica Moldoveanu Tip: Interdisciplinar / Transdisciplinar Informaţii: Scurtă descriere, Plan învăţământ, Cursuri Pentru a putea urma acest program de masterat, sunt necesare studii de licență într-unul din următoarele domenii: Domeniul fundamental Stiinte ingineresti, domeniile: Calculatoare si Tehnologia Informatiei, Domeniul fundamental Stiinte exacte, domeniile: Matematica ( specializarea Matematica-Informatica), Informatica ( specializarile Informatica si informatica aplicata). Domeniul fundamental Stiinte Economice, domeniile: Management ( specializarea Management ), Cibernetica, | |||| | 8."
        ],
        "response": "Nu am suficiente informații pentru a răspunde la întrebare.",
        "faithfulness": "1.0"
    },
    {
        "id": "6c4bc5f5e424f2da45557bc65c43715010271b7b953eb3b8dd5b4bf855f1eb44",
        "user_input": "Care sunt conditiile de admitere la licenta la ETTI?",
        "retrieved_contexts": [
            "Durata totală cumulată a ciclului de studii universitare de licență și masterat trebuie să fie de cel puțin 300 de credite transferabile (ECTS). (15) În vederea înscrierii la concursul de admitere la doctorat, la nivelul IOSUD se realizează recunoașterea creditelor (ECTS) sau a punctelor de credit alocate pentru studiile universitare de licență și masterat obținute în străinătate, cu condiția cumulării celor 300 de credite transferabile (ECTS). (16) Cetățenii statelor membre ale Uniunii Europene, ai statelor aparținând Spațiului Economic European și ai Confederației Elvețiene, precum și cetățenii britanici și membrii familiilor acestora, ca beneficiari ai Acordului privind retragerea Regatului Unit al Marii Britanii și Irlandei de Nord din Uniunea Europeană și din Comunitatea Europeană a Energiei Atomice 2019/C 384 I/01 pot participa la admiterea în toate ciclurile de studii universitare, în aceleași condiții prevăzute de lege pentru cetățenii români, inclusiv în ceea ce privește taxele de școlarizare. (17) La admiterea la studii universitare de doctorat se pot înscrie și cetățeni care nu fac parte din Uniunea Europeană, Spațiul Economic European și Confederația Elvețiană (extracomunitari), absolvenți ai studiilor universitare de masterat sau absolvenți cu diplomă de licență sau echivalentă ai studiilor universitare de lungă durată (5, 6 ani). Recunoașterea studiilor efectuate de către aceștia Metodologie admitere la doctorat 2025 în afara României se va realiza de către Direcția de specialitate din cadrul Ministerului Educației. (18) Un candidat admis beneficiază o singură dată de finanţare de la bugetul de stat pentru ciclul de studii universitare de doctorat; candidaţii vor completa la înscriere o declaraţie pe propria răspundere prin care vor confirma că nu au mai beneficiat/nu beneficiază de o altă finanţare de la bugetul de stat pentru ciclul de studii doctorale. (19) Programul de doctorat se desfășoară în limba română sau într-o limbă de circulație internațională. (20) Selecția candidatului pentru o poziție vacantă de student-doctorand este realizată de o comisie de concurs aprobată de Consiliul Școlii doctorale.",
            "Regulament [Link] Către platforma de inscriere Programele de master ale FSA (domeniul: Ştiințe Inginerești Aplicate) Număr de locuri disponibile: - 100 Buget - 20 Taxă Calendarul sesiunilor de admitere: Sesiunea I Admitere anticipată - Înscrierea candidaților: 15.12.2024 – 10.05.2025 (Taxa înscriere: 50 RON) - Concurs de admitere: 13.05 – 16.05.2025 - Comunicarea rezultatelor: 13.05 – 17.05.2025 - Înmatricularea candidaților: 01.07 – 31.07.2025 Sesiunea II Iulie 2025 - Înscrierea candidaților: 1.07 – 8.07.2025 - Concurs de admitere: 10.07 – 12.07.2025 - Comunicarea rezultatelor: 10.07 – 12.07.2025 - Înmatricularea candidaților: 10.07 – 31.07.2025 Sesiunea III Septembrie 2025 - Înscrierea candidaților: 2.09 – 13.09.2025 - Concurs de admitere: 16.09 – 17.09.2025 - Comunicarea rezultatelor: 16.09 – 18.09.2025 - Înmatricularea candidaților: 16.09 – 20.09.2025",
            "(2) Media generală de admitere se constituie ca medie aritmetică dintre nota acordată de comisia/comisiile constituite de Şcoala doctorală privind evaluarea dosarelor electronice ale candidaţilor declaraţi admişi de către conducătorii de doctorat şi media generală a anilor de studii, calculată prin luarea în considerare a anilor de studii de licenţă şi masterat sau de lunga Metodologie admitere la doctorat 2025 durata (Anexa 3). Media generală de admitere trebuie sa fie minim 7,00. (3) Înmatricularea candidaților admiși se face online în termen de 7 2 ore de la data afișării electronice a rezultatelor finale, fiind condiționată de prezentarea dovezii privind absolvirea unui program de masterat (diploma de masterat sau adeverință de absolvire). (4) Candidaţii admişi vor completa şi semna olograf contractul de studii universitare de doctorat până la începutul anului universitar 2025-2026. Contractul se oficializează prin semnaturile olografe ale conducătorului de doctorat și Directorului Şcolii doctorale. Metodologie admitere la doctorat 2025 Anexa 1 Lista domeniilor doctorale organizate de POLITEHNICA București",
            "TAXA de înscriere Cuantumul taxei de înscriere este de 100 RON pentru înscrierea la sesiunile din iulie și septembrie și de 50 RON pentru înscrierea la sesiunea de admitere anticipată. Taxa de înscriere pentru înscrierea la sesiunea de admitere anticipată este 50 lei și se poate achita având menționate la explicațiile plății: - numele și prenumele complet al candidatului, - Facultatea de bază la care acesta se înscrie pentru concursul de admitere, direct în platforma on-line https://admitere.pub.ro/, cu card bancar.",
            "Taxa de înscriere este 125 lei și se poate achita având menționate la explicațiile plății: numele și prenumele complet al candidatului, precum și Facultatea de bază la care acesta se înscrie pentru concursul de admitere, astfel: • direct în platforma on-line https://admitere.pub.ro/, cu card bancar. • prin transfer bancar (realizat într-o aplicate de e-banking sau la ghișeul unei bănci), într-unul dintre următoarele conturi:"
        ],
        "response": "Nu am suficiente informații pentru a răspunde la întrebare.",
        "faithfulness": "1.0"
    },
    {
        "id": "78da218c6c82856f17eafbc49905a900e9e812b623544dc3085c6f28059b3e46",
        "user_input": "Care este cuantumul burselor?",
        "retrieved_contexts": [
            "ANS, “se raportează doar datele privind studenții aflați la forma de finanțare cu taxă, inclusiv studenții proveniți din studenți bugetați, care repetă cu taxă un an de studiu sau au depășit durata de studiu subvenționată de stat, stabilită prin lege și plătesc taxe. ” Anual Ministerul Educației alocă, prin HG, cifra de școlarizare – acestea se traduc în locurile finanțate la nivel de universitate de la Bugetul de Stat (BS), pentru ciclurile de învățământ pentru licență, masterat și doctorat. Separat, POLITEHNICA București alocă un număr de locuri pentru studenți în regim de taxă de studii (TS) la învățământul universitar de licență, masterat, respectiv doctorat. Separat, Ministerul Educației alocă locuri finanțate de la bugetul de stat pentru Românii de Pretutindeni (RdP) – acestea sunt locuri fără plata taxelor de școlarizare (i.e. , finanțarea vine de la bugetul de stat), cu bursă suportată sau fără. Cf. Legii nr. 299/2007, “românii de pretutindeni reprezintă: persoanele care își asumă liber identitatea culturală românească; persoanele de origine română și cele care aparțin trăsăturilor lingvistice și culturale românești, care trăiesc în afara granițelor României , indiferent de etnonimul utilizat (armâni, armânji, aromâni, basarabeni, bucovineni, cuțovlahi, daco-români, fărșeroți, herțeni, istro-români, latini dunăreni, macedoromâni, macedo-români, maramureșeni, megleniți, megleno-români, moldoveni, moldovlahi, rrămâni, rumâni, valahi, vlahi, vlasi, volohi, macedo-armânji) precum și toate celelalte forme lexicale semantic legate de cele menționate anterior ; emigranții români, indiferent dacă au păstrat sau nu cetățenia română, precum și descendenții acestora, precum și cetățenii români cu domiciliu sau reședința permanentă în străinătate. ”.",
            "(6) În cazul în care fondul pentru acordarea burselor sociale nu este utilizat în întregime, acesta se redistribuie pentru acordarea burselor de performanță. (7) Distribuirea burselor sociale se face în ordine crescătoare a venitului net pe membru de familie. (8) Sumele rămase în sold pentru facilități de transport pentru studenți, subvenții pentru cămine-cantine și sumele pentru bursele studenților neridicate în termen pot fi utilizate în anii următori pentru acordarea de burse pentru studenți, precum și pentru alte cheltuieli de natura investițiilor pentru infrastructura de cămine, cantine și pentru susținerea activităților centrelor pentru consiliere și orientare în carieră. Art. 35. Universitatea Națională de Știință și Tehnologie POLITEHNICA București poate suplimenta fondul pentru burse provenit de la bugetul de stat, pentru fiecare categorie de burse, cu fonduri provenite din venituri proprii. Art. 36. (1) Cuantumul burselor de performanță și al burselor pentru învățământ dual se aprobă prin hotărârea Senatului, la propunerea Consiliului de Administrație, ca urmare a consultării cu reprezentanții studenților, inclusiv a organizațiilor studențești reprezentative din POLITEHNICA București. (2) Universitatea Națională de Știință și Tehnologie POLITEHNICA București poate acorda sprijin financiar studenților cu rezultate deosebite, pentru participarea la conferințe sau publicarea de articole științifice, cu aprobarea Consiliului de Administrație. (3) Universitatea Națională de Știință și Tehnologie POLITEHNICA București poate acorda burse pentru stagii de studii universitare și postuniversitare, în vederea susținerii mobilităților temporare efectuate în universități și instituții din țară și străinătate. Decizia cu privire la acordarea burselor pentru stagii de studii universitare și postuniversitare, precum și stabilirea cuantumului acestora se ia de către Biroul Consiliului de Administrație al POLITEHNICII București. Page 13 of 16 CAPITOLUL IV Dispoziții finale Art. 37. În cazul în care există suspiciuni de falsificare a documentelor depuse pentru obținerea unei burse pentru ajutor social, POLITEHNICA București va sesiza organele de anchetă competente și va proceda la sancționarea studentului, în funcție de gravitatea faptei. Art. 38.",
            "(3) Direcția Financiar-Contabilă completează în platforma ANS, prin utilizarea contului instituțional, datele privind evidența resurselor financiare și categoriile specifice de cheltuieli. Datele și informațiile comunicate către SU vor fi validate și asumate în momentul închiderii platformei prin semnătura Directorului DFC. Art. 19. (1) Prorectorul responsabil ANS și SU comunică Direcției General Administrativ Economice (DGAE) instrucțiunile și termenele de completare, privind evidența spațiilor dedicate activităților didactice specifice învățământului universitar, precum și alte informații legate de baza tehnico-materială. (2) Datele referitoare la evidența spațiilor și baza tehnico-materială se raportează la data de referință 01 ianuarie, stabilită prin cadrul legislativ specific și operaționalizată în cadrul platformei ANS. (3) DGAE completează macheta privind evidența spațiilor și baza tehnico-materială și o transmite către SU. Datele și informațiile sunt transmise cu asumarea prin semnătura Directorului DGAE. (4) Directorul DGAE se asigură că informațiile sunt corecte și nu există deficiențe în sistemul de colectare, analiză și administrare. SU transmite ulterior datele către Prorector responsabil ANS pentru validarea finală. Dacă informațiile conțin anumite erori sau deficiențe, întregul pachet de date se retransmite către DGAE pentru verificare suplimentară și actualizare, dacă este cazul. (5) După etapa de validare finală acestea sunt introduse în platforma ANS de către persoana desemnată din cadrul DGAE, prin utilizarea contului acesteia. Art. 20. (1) Prorectorul responsabil ANS și SU comunică DGAE instrucțiunile și termenele de completare privind evidența politicii de cazare și respectiv cea specifică burselor pentru raportare. (2) Datele referitoare la structura locurilor de cazare și caracteristicile acestora, respectiv numărul de cantine, precum și cele referitoare la sistemul de burse acordat la nivel instituțional se raportează la data de 01 ianuarie, stabilită prin cadrul legislativ specific și operaționalizată în cadrul platformei ANS. (3) Direcția General Administrativă completează macheta privind evidența locurilor de cazare, a cantinelor și a burselor acordate către SU.",
            "(4) Locul finanţat de la bugetul de stat de pe care titularul, din motive personale, solicită să se retragă după începerea anului universitar, până la finalizarea anului calendaristic, este redistribuit următorului student din clasamentul anului respectiv de studii, începând cu semestrul al II-lea al anului universitar. (5) Repartizarea studenţilor pe locurile finanţate de la bugetul de stat se efectuează la nivelul ramurilor de ştiinţă din fiecare facultate, fiind posibilă redistribuirea internă la nivelul fiecărei facultăţi, fără afectarea negativă a finanţării. În situaţia în care numărul locurilor finanţate de la bugetul de stat depăşeste numărul studenţilor înmatriculaţi la un anumit an de studiu (II, III sai IV) şi nu pot fi redistribuite în cadrul facultăţii respective, atunci Consiliul de Administraţie al Universităţii poate decide redistribuirea locurilor bugetate între facultăţi, la nivelul fiecărui an universitar. VI. FINALIZAREA STUDIILOR Art. 29. Finalizarea studiilor (1) Finalizarea studiilor de masterat în POLITEHNICA Bucureşti se face prin susținerea Lucrării de disertație (Examen de Disertație). (2) Înscrierea la Examenul de Disertație este condiționată de acumularea ECTS aferente disciplinelor obligatorii şi opționale din planul de învățământ al programului formativ al studentului. (3) Media minimă de promovarea Examenului de Disertație este 6. MINISTERUL EDUCAȚIEI Universitatea Naţională de Ştiinţă şi Tehnologie POLITEHNICA Bucureşti (4) Departamentele sunt obligate să stabilească titlurile temelor Lucrărilor de disertație şi conducătorii ştiințifici şi să le aducă la cunoștința masteranzilor la începutul anului universitar terminal. (5) Modul de desfăşurare a Examenului de Disertație se face în conformitate cu regulamentul de organizare şi desfãşurare a examenelor de finalizare a studiilor, aprobat de către Senatul POLITEHNICA Bucureşti. (6) Absolvenţii care au promovat Examenul de Disertație primesc Diploma de Master. VII. RECOMPENSE ŞI SANCŢIUNI Art. 30. Recompense Pentru rezultate deosebite în activitatea profesională, știinţifică și de cercetare şi pentru implicarea în activităţile comunităţii, universitatea poate acorda studentului următoarele recompense:",
            "(3) Cuantumul minim al bursei sociale se propune anual, până la data de 1 septembrie, de către Comisia Națională pentru Finanțarea Învățământului Superior (CNFIS), se adoptă prin ordin al ministrului educației și trebuie să acopere cheltuielile minime de masă şi cazare. (4) Cuantumul burselor sociale se stabilește prin hotărâre a senatului universității POLITEHNICA București, la propunerea Consiliului de administrație, în limita fondurilor disponibile și în funcție de nevoile identificate la nivelul comunității studențești, prin consultarea reprezentanților studenților, inclusiv cu organizațiile studențești din POLITEHNICA București. (5) Pentru acordarea burselor sociale, singurul criteriu academic ce se ia în considerare este promovabilitatea. (6) Bursele sociale se cumulează cu alte tipuri de burse, dacă studentul îndeplinește criteriile specifice pentru ambele categorii de burse. (7) Bursele sociale se acordă pe durata legală a programului de studii, până la împlinirea vârstei de 35 de ani. (8) Beneficiarii burselor sociale pot fi: a) studenții orfani de unul sau ambii părinți, studenții care provin din familii monoparentale sau studenții proveniți din centre de plasament și care nu realizează venituri peste plafonul pentru acordarea bursei sociale; b) studenții bolnavi de tuberculoză, care se află în evidența unităților medicale, pe perioada tratamentului tuberculostatic, diabet insulinonecesitant, boli maligne, sindroame de malabsorbție severe, boală cronică de rinichi în program de dializă, astm bronșic persistent moderat sau sever, epilepsie grand mal, cardiopatii congenitale, hepatită cronică cu fibroză avansată (stadiul F3 sau F4), glaucom, miopie gravă, boli imunologice autoimune forme severe, boli rare, tulburări din spectrul autist, boli hematologice severe care necesită tratament continuu sau spitalizări frecvente, surditate bilaterală, fibroză chistică, cei infectați cu virusul HIV sau bolnavi de SIDA, cei cu handicap locomotor și încadrați într-un grad de invaliditate, fără a se lua în considerare nivelul venitului mediu pe membru de familie;"
        ],
        "response": "Nu am suficiente informații pentru a răspunde la întrebare.",
        "faithfulness": "1.0"
    },
    {
        "id": "3d679d915128361cbdd2778184225c7d4a06c7d06d60299cddf912ae7f1f9189",
        "user_input": "Care este cuantumul bursei sociale?",
        "retrieved_contexts": [
            "(6) În cazul în care fondul pentru acordarea burselor sociale nu este utilizat în întregime, acesta se redistribuie pentru acordarea burselor de performanță. (7) Distribuirea burselor sociale se face în ordine crescătoare a venitului net pe membru de familie. (8) Sumele rămase în sold pentru facilități de transport pentru studenți, subvenții pentru cămine-cantine și sumele pentru bursele studenților neridicate în termen pot fi utilizate în anii următori pentru acordarea de burse pentru studenți, precum și pentru alte cheltuieli de natura investițiilor pentru infrastructura de cămine, cantine și pentru susținerea activităților centrelor pentru consiliere și orientare în carieră. Art. 35. Universitatea Națională de Știință și Tehnologie POLITEHNICA București poate suplimenta fondul pentru burse provenit de la bugetul de stat, pentru fiecare categorie de burse, cu fonduri provenite din venituri proprii. Art. 36. (1) Cuantumul burselor de performanță și al burselor pentru învățământ dual se aprobă prin hotărârea Senatului, la propunerea Consiliului de Administrație, ca urmare a consultării cu reprezentanții studenților, inclusiv a organizațiilor studențești reprezentative din POLITEHNICA București. (2) Universitatea Națională de Știință și Tehnologie POLITEHNICA București poate acorda sprijin financiar studenților cu rezultate deosebite, pentru participarea la conferințe sau publicarea de articole științifice, cu aprobarea Consiliului de Administrație. (3) Universitatea Națională de Știință și Tehnologie POLITEHNICA București poate acorda burse pentru stagii de studii universitare și postuniversitare, în vederea susținerii mobilităților temporare efectuate în universități și instituții din țară și străinătate. Decizia cu privire la acordarea burselor pentru stagii de studii universitare și postuniversitare, precum și stabilirea cuantumului acestora se ia de către Biroul Consiliului de Administrație al POLITEHNICII București. Page 13 of 16 CAPITOLUL IV Dispoziții finale Art. 37. În cazul în care există suspiciuni de falsificare a documentelor depuse pentru obținerea unei burse pentru ajutor social, POLITEHNICA București va sesiza organele de anchetă competente și va proceda la sancționarea studentului, în funcție de gravitatea faptei. Art. 38.",
            "(3) Cuantumul minim al bursei sociale se propune anual, până la data de 1 septembrie, de către Comisia Națională pentru Finanțarea Învățământului Superior (CNFIS), se adoptă prin ordin al ministrului educației și trebuie să acopere cheltuielile minime de masă şi cazare. (4) Cuantumul burselor sociale se stabilește prin hotărâre a senatului universității POLITEHNICA București, la propunerea Consiliului de administrație, în limita fondurilor disponibile și în funcție de nevoile identificate la nivelul comunității studențești, prin consultarea reprezentanților studenților, inclusiv cu organizațiile studențești din POLITEHNICA București. (5) Pentru acordarea burselor sociale, singurul criteriu academic ce se ia în considerare este promovabilitatea. (6) Bursele sociale se cumulează cu alte tipuri de burse, dacă studentul îndeplinește criteriile specifice pentru ambele categorii de burse. (7) Bursele sociale se acordă pe durata legală a programului de studii, până la împlinirea vârstei de 35 de ani. (8) Beneficiarii burselor sociale pot fi: a) studenții orfani de unul sau ambii părinți, studenții care provin din familii monoparentale sau studenții proveniți din centre de plasament și care nu realizează venituri peste plafonul pentru acordarea bursei sociale; b) studenții bolnavi de tuberculoză, care se află în evidența unităților medicale, pe perioada tratamentului tuberculostatic, diabet insulinonecesitant, boli maligne, sindroame de malabsorbție severe, boală cronică de rinichi în program de dializă, astm bronșic persistent moderat sau sever, epilepsie grand mal, cardiopatii congenitale, hepatită cronică cu fibroză avansată (stadiul F3 sau F4), glaucom, miopie gravă, boli imunologice autoimune forme severe, boli rare, tulburări din spectrul autist, boli hematologice severe care necesită tratament continuu sau spitalizări frecvente, surditate bilaterală, fibroză chistică, cei infectați cu virusul HIV sau bolnavi de SIDA, cei cu handicap locomotor și încadrați într-un grad de invaliditate, fără a se lua în considerare nivelul venitului mediu pe membru de familie;",
            "punct de vedere socio-economic, a căror familie nu a realizat în cele 12 luni dinaintea depunerii cererii pentru acordarea acestui tip de bursă un venit lunar net mediu pe membru de familie mai mare de 50% din salariul minim net la nivel național. Această categorie de bursă se poate acorda aceluiași student de două ori în cursul unui an universitar; b) bursa pentru ajutor social ocazional de maternitate, care se acordă studentei sau studentului a cărui soție nu realizează deloc venituri sau venituri mai mari decât salariul de bază minim net la nivel național, constă într-o bursă pentru naștere și lăuzie și o bursă pentru procurarea îmbrăcămintei copilului nou-născut și care se acordă o singură dată în cursul anului universitar pentru fiecare copil născut; c) bursa pentru ajutor social ocazional în caz de deces se poate acorda pentru decesul unui membru al familiei studentului(ei). Prin membru de familie se înțelege soț, soție, copil. În cazul decesului studentului(ei) necăsătorit(e)/căsătorit(e) cu soție/soț care nu realizează venituri, bursa se acordă rudelor de gradul I/succesorului legal o singură dată în cursul anului universitar. (2) Cuantumul acestor burse este stabilit de Senatul universității, la propunerea Consiliului de administrație, cu condiția ca acesta să fie cel puțin egal cu cuantumul lunar al bursei sociale. (3) POLITEHNICA București poate acorda alte stimulente financiare studenților în situație de risc, stabilite de Biroul Consiliului de Administrație. Art. 28. Calculul venitului lunar mediu net (1) Determinarea venitului lunar mediu net al familiei studentului se realizează până la împlinirea vârstei de 26 de ani. La stabilirea venitului mediu net lunar pe membru de familie se iau în calcul toate veniturile nete cu caracter permanent realizate de membrii familiei, supuse impozitului pe venit. Prin venituri nete se înțelege totalitatea sumelor primite/realizate de persoana singură, respectiv de fiecare membru al familiei, reprezentând valoarea obținută după aplicarea cotei de impozitare asupra venitului impozabil stabilit conform prevederilor legale.",
            "(5) Copiii personalului aflat în activitate în sistemul de învăţământ sau ai celor care s-au pensionat din sistemul de învăţământ, copiii cu unul sau ambii părinţi decedaţi, copiii din familii monoparentale, precum şi cei care provin din grupurile defavorizate definite conform Legii asistenţei sociale nr. 292/2011, cu modificările şi completările ulterioare, beneficiază, după momentul înmatriculării, de gratuitate la cazare în cămine şi internate, fiind sprijiniţi prin subvenţie pentru cămine-cantine majorată de Ministerul Educaţiei. Art. 14 (1) Studenţii pot beneficia de următoarele tipuri de burse din fondurile de la bugetul de stat: (a) burse de excelență olimpică I/ internațională; (b) burse de performanță; (c) burse de studiu; (d) burse pentru masterat didactic; (e) burse pentru învățământ dual; (f) burse sociale; (g) burse speciale; (h) burse de performanță sportivă. (2) Bursele menționate la alin. (1) se acordă în baza criteriilor specifice stabilite prin Metodologia de acordare a burselor și altor forme de sprijin pentru studenții din cadrul POLITEHNICA București. (3) Studenții pot beneficia de burse speciale din fondurile proprii ale POLITEHNICII București pentru stimularea și recompensarea performanțelor academice, culturale artistice și/ sau sportive ale studenților, precum și implicarea acestora în activități extracurriculare derulate în departamentele administrative ale instituției, care deservesc comunitatea academică . (4) Studenții pot beneficia de burse acordate de către operatorii economici și/sau autoritățile locale, cu respectarea legislației în vigoare. (5) Studenţii pot beneficia de burse din venituri proprii extrabugetare ale universității, precum şi alte tipuri de burse, în baza Metodologiei de acordare a burselor și altor forme de sprijin pentru studenții din cadrul POLITEHNICA București, aprobate de senat. (6) Bursele sociale se cumulează cu alte tipuri de burse, dacă studentul îndeplineşte criteriile specifice stabilite în Metodologia de acordare a burselor și altor forme de sprijin pentru studenții din cadrul POLITEHNICA București, pentru ambele categorii de burse;",
            "ANS, “se raportează doar datele privind studenții aflați la forma de finanțare cu taxă, inclusiv studenții proveniți din studenți bugetați, care repetă cu taxă un an de studiu sau au depășit durata de studiu subvenționată de stat, stabilită prin lege și plătesc taxe. ” Anual Ministerul Educației alocă, prin HG, cifra de școlarizare – acestea se traduc în locurile finanțate la nivel de universitate de la Bugetul de Stat (BS), pentru ciclurile de învățământ pentru licență, masterat și doctorat. Separat, POLITEHNICA București alocă un număr de locuri pentru studenți în regim de taxă de studii (TS) la învățământul universitar de licență, masterat, respectiv doctorat. Separat, Ministerul Educației alocă locuri finanțate de la bugetul de stat pentru Românii de Pretutindeni (RdP) – acestea sunt locuri fără plata taxelor de școlarizare (i.e. , finanțarea vine de la bugetul de stat), cu bursă suportată sau fără. Cf. Legii nr. 299/2007, “românii de pretutindeni reprezintă: persoanele care își asumă liber identitatea culturală românească; persoanele de origine română și cele care aparțin trăsăturilor lingvistice și culturale românești, care trăiesc în afara granițelor României , indiferent de etnonimul utilizat (armâni, armânji, aromâni, basarabeni, bucovineni, cuțovlahi, daco-români, fărșeroți, herțeni, istro-români, latini dunăreni, macedoromâni, macedo-români, maramureșeni, megleniți, megleno-români, moldoveni, moldovlahi, rrămâni, rumâni, valahi, vlahi, vlasi, volohi, macedo-armânji) precum și toate celelalte forme lexicale semantic legate de cele menționate anterior ; emigranții români, indiferent dacă au păstrat sau nu cetățenia română, precum și descendenții acestora, precum și cetățenii români cu domiciliu sau reședința permanentă în străinătate. ”."
        ],
        "response": "Cuantumul minim al bursei sociale se propune anual, până la data de 1 septembrie, de către Comisia Națională pentru Finanțarea Învățământului Superior (CNFIS) și se adoptă prin ordin al ministrului educației. Acesta trebuie să acopere cheltuielile minime de masă și cazare. Cuantumul burselor sociale se stabilește prin hotărâre a senatului universității POLITEHNICA București, la propunerea Consiliului de administrație, în limita fondurilor disponibile și în funcție de nevoile identificate la nivelul comunității studențești, prin consultarea reprezentanților studenților, inclusiv cu organizațiile studențești din POLITEHNICA București.\n\nSurse:\n- Metodologie burse rectificata, URL: https://upb.ro/wp-content/uploads/2024/12/Metodologie-burse_rectificata.pdf, pagina: 8",
        "faithfulness": "1.0"
    },
    {
        "id": "f93ec7d134033d42a12ec9f2cbd480625e52bff36f6d22e05d43a933746f3df9",
        "user_input": "Ce presupune sesiunea 3 de admitere la licenta?",
        "retrieved_contexts": [
            "SESIUNEA II. ADMITERE FAZA 3. Admitere – etapa a II-a 23-25.07.2025, (la secretariatul facultății) • Similară fazei III a Sesiunii (detalii aici). I de Admitere Anticipată SESIUNEA III. ADMITERE - COMPLETARE • august – septembrie 2025 • pentru locurile rămase neocupate în sesiunile I și II • detaliile pentru aceasta sesiune se stabilesc după Sesiunea a II-a și vor fi anunțate ulterior. •Pentru alte detalii puteți accesa regulamentul de admitere al U.P.B. •Pentru neclarități ne puteți contacta, pe e-mail, la: admitere@chimie.upb.ro",
            "3 Sesiunea 1 -Admitere anticipată fără concurs Condiții participare -continuare -",
            "Candidații declarați admiși preliminar la finalul Fazei II și care nu s-au înmatriculat în Faza III vor pierde locul rezervat în Sesiunea II și vor fi eliminați din concurs. În data de 26 Iulie, ora 12:00 vor fi publicate listele cu candidații admiși și înmatriculați în Sesiunea II. *Opțional, la latitudinea fiecărui candidat care la sfârșitul Fazei II din sesiunea curentă a fost declarat admis preliminar sau preliminar în așteptare. **Aceasta plată este în contul taxei sale de școlarizare. Dacă un candidat ajunge în urma glisării la un loc finanțat de la buget, aceasta plată se va returna integral. Detalii despre concursul de admitere 2020 se vor afisa in curand aici. Intre timp puteti consulta site-ul oficial UPB Rezultate Finale Admitere 2019 <Admisi si înmatriculati 2019> Cerem scuze candidaților care nu au putut accesa acest server în anumite zile! Un atac Denial of Service a împiedicat accesul. Dacă se mai întâmplă, toate informațiile despre admitere sunt afișate și la avizierul facultății. Sesiunea a doua de Admitere Sesiunea de ocupare a locurilor vacante (Iulie-Septembrie) este deschisă în zilele de vineri 26, luni 29, marți 30 și miercuri 31 iulie, precum și 9, 10 și 11 septembrie 2019 orele 9-13 la secretariatul facultății. Vom afișa la sfârșitul fiecărei zile situația ocupării locurilor vacante. După prima zi (26 iulie) mai sunt disponibile 8 locuri la taxă (IA.X). După a doua zi (29 iulie) mai sunt disponibile 7 locuri la taxă (IA.X). După a treia zi (30 iulie) mai sunt disponibile 5 locuri la taxă (IA.X). După a patra zi (31 iulie) mai sunt disponibile 3 locuri la taxă (IA.X). Rezultate Finale Admitere Sesiunea Iulie 2019 Din cei 220 candidați admiși la buget s-au înmatriculat 215. Pe cele 5 locuri devenite astfel vacante au promovat cinci candidați admiși anterior la taxă, în ordinea mediilor (4 la IA și 1 la IAen).",
            "În cadrul Sesiunii I – Admitere anticipată există 3 faze cu desfășurare succesivă – Înscriere, Admitere preliminară, Validare, confirmare, înscriere în anul I și înmatriculare admiși anticipat, după cum urmează: - Faza I – Înscriere (pe platforma on-line https://admitere.pub.ro) Începe la 15 decembrie 2024, odată cu deschiderea aplicației on-line pentru înscriere și se va termina în data de 02 iunie 2025, ora 16:00. - Faza II – Admitere preliminară Rezultatele intermediare obținute în urma evaluării dosarelor de concurs și ordonării candidaților în funcție de media generală de concurs vor fi afișate în data de 11 iunie 2025, ora 12:00. Fiecare candidat poate vizualiza rezultatul obținut în contul său din platforma on-line https://admitere.pub.ro . Eventualele contestații vor putea fi depuse on-line până la data de 12 iunie 2025, ora 12:00. Rezultatele finale privind pre-admiterea vor fi publicate la data de 16 iunie 2025, ora 12:00. - Faza III – Validare, confirmare, înscriere în anul I și înmatriculare admiși anticipat Începe în data de 02 iulie 2025, ora 08:00 și se încheie în data de 04 iulie 2025, ora 16:00. Validarea și înmatricularea implică, pentru fiecare candidat, completarea dosarului de concurs cu documentele originale solicitate și depunerea acestora la secretariatul facultății (060042 Splaiul Independenţei 313, corp J, sector 6, Bucureşti, România, Tel: 021 4029624, 0214029566, Fax: 0213181017). ATENȚIE! Pentru a deveni studenți, candidații care au fost declarați pre-admiși trebuie să obțină diploma de Bacalaureat și să se înmatriculeze între 02 și 04 iulie 2025, orele 8:00 – 16:00 la secretariatul facultății (060042 Splaiul Independenţei 313, corp J, sector 6, Bucureşti, România, Tel: 021 4029624, 0214029566, Fax: 0213181017)!",
            "• Faza II – Admitere preliminară, • Faza III – Admitere – Etapa II – Validare, confirmare loc, participare la glisare internă***4F 5, înscriere în anul I și înmatriculare. Pentru obținerea statutului de candidat admis, înscris în anul I și înmatriculat, parcurgerea tuturor fazelor din această sesiune este obligatorie. l V.1. Despre Faza I – Înscriere la concurs Ses. II-5.6. Candidații care intenționează să participe la concursul de admitere în UNSTPB trebuie să-și aleagă mai întâi facultatea la care își doresc să urmeze unul dintre programele de studii. Înscrierea la concursul de admitere se va face la această facultate (care va fi denumită, pe scurt, facultate de bază). Ses. II-5.7. În Sesiunea II – Admitere un candidat se poate înscrie la o singură facultate din UNSTPB (facultatea de bază) și va plăti on-line o singură taxă de înscriere⁂ Ses. II-5.8. În ceea ce privește opțiunile: • Candidatul alege, în prima fază, disciplinele pentru probele P1 și P2 dintre cele valabile la facultatea la care se înscrie (vezi Anexa II-1.1 pentru concurs pe baza rezultatelor la activitățile școlare (dosar) (c-rs), Anexa II-1.2 pentru ⁂ Prin excepție, candidații de la facultățile cu concurs cu probe scrise sau vocaționale (c-s, c-v, c-m) care nu au fost declarați admiși preliminar la sfârșitul Fazei II din Sesiunea II, dacă doresc, se mai pot înscrie la concursul de admitere încă deschis în Sesiunea II, la una dintre celelalte facultăți (cu concurs pe baza rezultatelor la activitățile școlare). Atenție însă, că în această ultimă situație există posibilitatea de a nu putea participa la Sesiunea II+ de la facultățile cu concurs cu probe scrise sau vocaționale. Universitatea Națională de Știință și Tehnologie POLITEHNICA București REGULAMENTUL Concursului de Admitere în Ciclul de Studii Universitare de Licență 2025 concurs cu probe scrise (c-s),"
        ],
        "response": "Sesiunea III de admitere la licență este destinată completării locurilor rămase neocupate în sesiunile I și II. Aceasta se va desfășura în perioada august-septembrie 2025, iar detaliile specifice pentru această sesiune vor fi stabilite și anunțate ulterior, după finalizarea Sesiunii II. Este important de menționat că pentru a participa la această sesiune, candidații trebuie să fie conștienți de faptul că locurile disponibile vor fi cele care nu au fost ocupate în sesiunile anterioare.\n\nSurse:\n- Sursa: https://chimie.upb.ro/administrare/content/doc/admitere/brosura/doc.pdf, URL: https://chimie.upb.ro/administrare/content/doc/admitere/brosura/doc.pdf, pagina: 13",
        "faithfulness": "0.8333333333333334"
    },
    {
        "id": "b4b0bd6deb3d7e131ef0f3ba392460c680ecb05afbcba048efd184cb15342b6e",
        "user_input": "Cand are loc simularea examenului de admitere la licenta la ACS?",
        "retrieved_contexts": [
            "Candidați vor pregăti pentru examenul de admitere o prezentare bazată pe propunerea de tematica pentru studiile doctorale (PhD proposal) în limba română sau în limba engleză după modelul acesta [prezentare]. Pasul 5: Înmatriculare Rezultatele concursului de admitere sunt validate și afișate pe pagina de admitere a SD-AC (vezi calendarul admiterii). Toți candidații declarați admiși se vor înmatricula online în termen de 48 de ore de la data afișării rezultatelor (condiționată de prezentarea dovezii privind absolvirea unui program de masterat (diplomă de masterat sau adeverință de absolvire, foaie matricolă)). Înmatricularea constă în încărcarea pe platforma de admitere a dovezii de plată a taxei de înmatriculare în valoare de 50 RON. Aceasta se achită online, toate informațiile necesare fiind disponibile în platformă. Toți candidații declarați admiși vor completa și semna olograf contractul de studii universitare de doctorat până la începutul anului universitar. Pentru candidații străini din țări UE și non-UE Pentru candidații cetățeni ai statelor UE înscrierile se fac în conformitate cu: https://international.upb.ro/international-students/applying/students-from-eu-countries Pentru candidații cetățeni ai statelor non-UE înscrierile se fac în conformitate cu: https://international.upb.ro/international-students/applying/students-from-non-eu-countries Candidații străini vor urma aceleași proceduri și același flux de validare a dosarelor și admitere ca cetățenii români. Aceștia se pot prezenta la concursul de admitere începând cu luna iulie după validarea actelor de înscriere.",
            "Procesul de Admitere în sesiunea Septembrie la studiile universitare de masterat va începe pe data de 02.09.2024. Calendarul pentru Sesiunea III de Admitere 2024 este următorul: înscrierea candidaților: 02.09 - 13.09.2024, Concursul de admitere: 16.09 – 17.09.2024, Comunicarea rezultatelor: 16.09 – 18.09.2024, Înmatricularea candidaților: 16.09 – 20.09.2024. Admiterea se face conform Regulamentului privind organizarea și desfășurarea concursului de admitere în ciclul de studii universitare de masterat. Înscrierea la concursul de admitere pentru studiile de masterat in Sesiunea III de Admitere, sesiunea septembrie, se face online pe site-ul https://admitere.pub.ro conform regulamentului amintit. Programarea examenelor este disponibila aici.",
            "II-47. Plicurile cu grilele de evaluare vor fi predate reprezentanților Comisiilor locale de admitere (decani, prodecani) cu cel puțin o oră înainte de termenul limită stabilit pentru încheierea probei de concurs respective, iar aceștia, la rândul lor, predau plicurile sigilate responsabililor de sală, cu cel mult o jumătate de oră înainte de încheierea probei de concurs. Anexa II-3. Probe vocaționale de concurs – Specificații și evaluare Anx. II-48. Atât în Sesiunea I cât și în sesiunea II, probele P1 și P2 (la concursul cu probe vocaționale) și proba P2 (la concursul mixt cu tandemul rezultat la activitățile școlare - vocațional) se vor desfășura și evalua în conformitate cu specificațiile din Anexa XII Anx II - 18 Universitatea Națională de Știință și Tehnologie POLITEHNICA București Anexa III Structura probei de concurs P3 și calculul notei NB. Anexa III. Structura probei de concurs P3 și calculul notei NB în Sesiunea I Anx. III-1. În Sesiunea I – Admitere anticipată, Proba P3 este formată din două componente. Prima dintre ele se referă la cunoștințele și competențele generale ale candidatului, certificate în anul 2025, prin mediile generale din clasele a IX-a, a X-a și a XI- a. Cea de a doua componentă a probei P3 se referă la o serie de caracteristici cognitive, comportamentale și de atitudine ale candidatului pe care UNSTPB le consideră dezirabile și pe care facultățile le consideră un factor potențator pentru activitatea și calitatea studenților și absolvenților lor. Această a doua componentă este cuantificată prin utilizarea unui set suplimentar de criterii de evaluare. Anx. III-2. În calculul notei pentru proba P3 cele două componente participă cu ponderi egale. 𝑁𝐵 = 𝐶𝐺1 + 𝐶𝐺2 2 unde NB reprezintă nota pentru proba P3, CG1 reprezintă nota pentru prima componentă, iar CG2 reprezintă nota pentru cea de a doua componentă. NB, CG1 și CG2 sunt exprimate cu două zecimale (obținute prin trunchiere). Anx.III-3.",
            "ADMITERE 2025 În anul 2025, pentru sesiunea I de admitere organizată de Universitatea Națională de Știință și Tehnologie POLITEHNICA București, Facultatea de Mecanica si Tehnologie, concursul de admitere este organizat pe baza rezultatelor la activitățile școlare (dosar)– bazat trei probe: Proba P1 – media multi-anuală la disciplina Matematică - nota NC1 – pondere 40% - vezi detalii în pag. 2 Proba P2 – media anuală la o disciplină aleasă de candidat, din lista de discipline propusă de Facultatea de Mecanică şi Tehnologie - nota NC2 – pondere 40% - vezi detalii în pag. 3 Proba P3 – formată din două componente - nota NB – pondere 20% - vezi detalii în pag. 4-5 IMPORTANT : Probele P1 și P2 – se bazează pe mediile obținute de candidat la unele dintre disciplinele studiate în clasele a IX-a, a X-a și a XI-a. Proba P3 este formată din două componente. Prima componentă se referă la cunoștințele și competențele generale ale candidatului, certificate în anul 2025, prin mediile generale din clasele a IX-a, a X-a și a XI-a. Cea de-a doua componentă a probei P3 se referă la o serie de caracteristici cognitive, comportamentale și de atitudine ale candidatului pe care Facultatea de Mecanică şi Tehnologie le consideră dezirabile. Proba P1 – media multi-anuală la disciplina Matematică - nota NC1 – pondere 40% Aceasta se calculează cu formula: sau formula: unde: M9 = media anuală la disciplina Matematică, pentru clasa a IX-a M10 = media anuală la disciplina Matematică, pentru clasa a X-a M11 = media anuală la disciplina Matematică, pentru clasa a XI-a IMPORTANT: Media Mb se folosește pentru candidații care NU au în planul de învățământ disciplina Matematică în clasa a XI-a (Profilul Umanist, Filiera Teoretic; Profilul Artistic, Filiera Vocațional; Profilul Teologic, Filiera Vocațional), iar media Ma se folosește pentru restul situațiilor.",
            "ACS optimizează orarele de master – fizic/online – în funcție de necesități, ținând cont de reglementările naționale și deciziile Senatului UPB. Admiteri anterioare Informativ, rezultatele admiterii din anii anteriori sunt disponibile aici: 2022, 2023, 2024. Programe de studii ACS oferă 25 programe de studii universitare de masterat acreditate ARACIS în domeniile: - CTI (Calculatoare și Tehnologia Informației) – 13 programe - IS (Ingineria Sistemelor) – 11 programe - IM (Inginerie și Management) – 1 program Broșura master (în curs de actualizare cu noile programe) oferă informații sintetice despre masterat și despre fiecare program. În continuarea acestei pagini sunt prezentate programele și descrierile cursurilor. Versiunea preliminară a planurilor de învățământ este disponibilă AICI. Până la începerea anului școlar pot interveni modificări minore ale planurilor de învâțământ. Calculatoare și Tehnologia Informației | Nr. crt. | Nume program master | ||| | 1. | Arhitecturi Avansate de Calculatoare | ||| | 2. | Administrarea Bazelor de Date | ||| | Catedra organizatoare: Calculatoare Responsabil: Prof.Dr.Ing. Florin Radulescu Tip: Aprofundare / Cercetare avansata Informaţii: Scurtă descriere, Plan învăţământ, Cursuri Pentru a putea urma acest program de masterat, sunt necesare studii de licență într-unul din următoarele domenii: Domeniul fundamental Stiinte ingineresti , domeniile: Calculatoare si Tehnologia Informatie (specializarile Calculatoare , Tehnologia Informatiei , Ingineria Informatiei), Inginerie electronica si telecomunicatii, Ingineria sistemelor (specializarile Automatica si informatica aplicata, Ingineria sistemelor multimedia) , Stiinte Ingineresti Aplicate (specializarile Matematica si informatica aplicata in inginerie)"
        ],
        "response": "Nu am suficiente informații pentru a răspunde la întrebare.",
        "faithfulness": "1.0"
    },
    {
        "id": "79eeea066fdea6e1255d7cbdd8b62ad0e79be934c6cf83ad5f9c662b6717e3a2",
        "user_input": "Cum se calculeaza media de admitere la licenta?",
        "retrieved_contexts": [
            "(2) Media generală de admitere se constituie ca medie aritmetică dintre nota acordată de comisia/comisiile constituite de Şcoala doctorală privind evaluarea dosarelor electronice ale candidaţilor declaraţi admişi de către conducătorii de doctorat şi media generală a anilor de studii, calculată prin luarea în considerare a anilor de studii de licenţă şi masterat sau de lunga Metodologie admitere la doctorat 2025 durata (Anexa 3). Media generală de admitere trebuie sa fie minim 7,00. (3) Înmatricularea candidaților admiși se face online în termen de 7 2 ore de la data afișării electronice a rezultatelor finale, fiind condiționată de prezentarea dovezii privind absolvirea unui program de masterat (diploma de masterat sau adeverință de absolvire). (4) Candidaţii admişi vor completa şi semna olograf contractul de studii universitare de doctorat până la începutul anului universitar 2025-2026. Contractul se oficializează prin semnaturile olografe ale conducătorului de doctorat și Directorului Şcolii doctorale. Metodologie admitere la doctorat 2025 Anexa 1 Lista domeniilor doctorale organizate de POLITEHNICA București",
            "Valoarea taxei de înscriere la concursul de admitere la doctorat este de 200 RON, cu excepția candidaților care au absolvit un program de masterat în POLITEHNICA București pentru care taxa de înscriere este de 100 RON. Pasul 3: Evaluarea dosarului și a candidatului SD-AC asigură permanent transparenţa procedurilor de selecţie şi admitere la doctorat, a criteriilor de evaluare şi a standardelor impuse candidaţilor, egalitatea de șanse și nediscriminarea de orice tip. Conducătorul de doctorat evaluează individual dosarul de concurs al candidatului, validând sau invalidând aplicația acestuia. Pentru avizului pozitiv al conducătorului de doctorat se poate organiza un interviu online. În cadrul interviului, candidatul este așteptat să prezinte pe scurt parcursul său academic și profesional și, după caz, rezultatele de cercetare cele mai relevante. De asemenea, candidatul va expune tematica și preocupările de cercetare ştiinţifică vizate în cadrul tezei de doctorat, cu accent pe contribuțiile și soluțiile noi ce vor fi investigate. În urma evaluării, candidatul primește calificativul Admis sau Respins din partea coordonatorului de doctorat. În cazul în care este Admis, candidatul va participa la concursul de admitere la nivelul Școlii Doctorale, în vederea alocării un loc la programul doctoral din cadrul SD-AC (buget sau taxă), inclusiv a burselor doctorale acordate de către minister. Pasul 4: Alocarea locurilor (admiterea finală) și a burselor de doctorat Conform calendarului, comisia de admitere realizează evaluarea candidaților declarați Admiși de către coordonatorul de doctorat în vederea alocării locurilor la programul doctoral din cadrul SD-AC (buget sau taxă) și acordării burselor de doctorat. Candidaţii vor fi apreciaţi în raport cu nivelul de pregătire şi informare în domeniu, cu capacitatea de a evidenția orientările majore ale cercetării, cu capacitatea de a formula soluţii şi căi de rezolvare (teoretice şi experimentale) pentru tema de cercetare vizată, cât și cu privire la capacitatea de a urma programul doctoral. Criteriile cantitative de evaluare sunt prezentate în Metodologia de admitere, articolul 5 (Anexa 3) [link].",
            "Total 2,4 PANGLICĂ",
            "- Nota NC2 pentru proba P2 se calculează prin mediere aritmetică și trunchiere la două zecimale luând în considerare punctajul total acordat de fiecare membru evaluator al comisiei Anx XII - 36",
            "Taxa de înscriere este 125 lei și se poate achita având menționate la explicațiile plății: numele și prenumele complet al candidatului, precum și Facultatea de bază la care acesta se înscrie pentru concursul de admitere, astfel: • direct în platforma on-line https://admitere.pub.ro/, cu card bancar. • prin transfer bancar (realizat într-o aplicate de e-banking sau la ghișeul unei bănci), într-unul dintre următoarele conturi:"
        ],
        "response": "Nu am suficiente informații pentru a răspunde la întrebare.",
        "faithfulness": "1.0"
    },
    {
        "id": "b57d566b39ba8905753094a65e751b633d51c56133799d92f91a798a386b2df1",
        "user_input": "Daca ma inscriu la mai multe facultati pot plati o singura taxa de inscriere?",
        "retrieved_contexts": [
            "5. 10. 14. Numărul chitanţei pentru plata taxei de înscriere la concursul de admitere: 15. În cazul în care candidez și sunt admis pe un loc fără taxă (la buget) declar pe propria răspundere că nu am mai urmat un alt program de masterat în regim de fără taxă. 16. În cazul în care admiterea include o probă/probe susținute online: - sunt de acord ca proba să fie înregistrată; - declar că toate răspunsurile vor fi personale și că respect Codul de etică și deontologie profesională al Universității Naționale de Știință și Tehnologie POLITEHNICA București. 17. Subsemnatul declar cele de mai sus pe propria răspundere. Am luat la cunoştinţă că declararea unor informaţii false conduce automat la pierderea locului ocupat prin concursul de admitere. De asemenea am luat la cunoştinţă că POLITEHNICA Bucureşti prelucrează datele mele cu caracter personal în scopul admiterii şi finalizării studiilor şi de faptul că sunt obligat să furnizez datele cunoscând că refuzul determină neînscrierea la concursul de admitere. Datele vor fi dezvăluite Ministerului Educaţiei Naţionale, şi Băncilor. Conform Regulamentului 679/2016 privind protecția persoanelor fizice în ceea ce privește prelucrarea datelor cu caracter personal și privind libera circulație a acestor date și de abrogare a Directivei 95/46/CE (Regulamentul general privind protecția datelor)cunosc faptul că beneficiez de drepturile prevăzute în Capitolul III al regulamentului intitulat, „Drepturile persoanei vizate”. De asemenea, am luat la cunoştinţă că beneficiez de dreptul de a mă adresa cu plângere Autorităţii Naţionale de Supraveghere a Prelucrării datelor cu caracter personal şi justiţiei. Candidat: Semnătura Data: Anexa 2 Universitatea Națională de Știință și Tehnologie POLITEHNICA București FIŞA DE ÎNSCRIERE PENTRU ABSOLVENŢII CU DIPLOMĂ DE LICENŢĂ/INGINER CARE DORESC SĂ URMEZE ÎNVĂŢĂMÂNTUL UNIVERSITAR DE MASTERAT ANUL UNIVERSITAR 2025 – 2026 Sesiunea de admitere anticipată 1. Numele, iniţiala prenumelui tatălui şi prenumele candidatului:",
            "1..13 14 15 Original Anx. VIII-4. Candidații care sunt studenți cu taxă (la o facultate din UNSTPB sau din alte universități) și care doresc să treacă în regim fără taxă (pe locuri finanțate de la buget) la același domeniu de studiu și au fost declarați admiși pe locuri subvenționate de la bugetul de stat vor putea fi înmatriculați în anul de studiu stabilit de reglementările Senatului universității (eventual cu condiția susținerii unor examene de diferență). Pentru înmatriculare sunt necesare documentele specificate în tabelul Anx. VIII-1 la care se mai adaugă și documentele din tabelul de mai jos.",
            "14. Numărul chitanţei pentru plata taxei de înscriere la concursul de admitere: 15. În cazul în care candidez și sunt admis pe un loc fără taxă (la buget) declar pe propria răspundere că nu am mai urmat un alt program de masterat în regim de fără taxă. 16. În cazul în care admiterea include o probă/probe susținute online: - sunt de acord ca proba să fie înregistrată; - declar că toate răspunsurile vor fi personale și că respect Codul de etică și deontologie profesională al Universității Naționale de Știință și Tehnologie POLITEHNICA București 17. Subsemnatul declar cele de mai sus pe propria răspundere. Am luat la cunoştinţă că declararea unor informaţii false conduce automat la pierderea locului ocupat prin concursul de admitere. De asemenea am luat la cunoştinţă că POLITEHNICA Bucureşti prelucrează datele mele cu caracter personal în scopul admiterii şi finalizării studiilor şi de faptul că sunt obligat să furnizez datele cunoscând că refuzul determină neînscrierea la concursul de admitere. Datele vor fi dezvăluite Ministerului Educaţiei Naţionale, şi Băncilor. Conform Regulamentului 679/2016 privind protecția persoanelor fizice în ceea ce privește prelucrarea datelor cu caracter personal și privind libera circulație a acestor date și de abrogare a Directivei 95/46/CE (Regulamentul general privind protecția datelor), cunosc faptul că beneficiez de drepturile prevăzute în Capitolul III al regulamentului intitulat, „Drepturile persoanei vizate”. De asemenea, am luat la cunoştinţă că beneficiez de dreptul de a mă adresa cu plângere Autorităţii Naţionale de Supraveghere a Prelucrării datelor cu caracter personal şi justiţiei. Candidat: Semnătura Data: 13",
            "14. Numărul chitanţei pentru plata taxei de înscriere la concursul de admitere: 15. În cazul în care candidez și sunt admis pe un loc fără taxă (la buget) declar pe propria răspundere că nu am mai urmat un alt program de masterat în regim de fără taxă. 16. În cazul în care admiterea include o probă/probe susținute online: - sunt de acord ca proba să fie înregistrată; - declar că toate răspunsurile vor fi personale și că respect Codul de etică și deontologie profesională al Universității Naționale de Știință și Tehnologie POLITEHNICA București 17. Subsemnatul declar cele de mai sus pe propria răspundere. Am luat la cunoştinţă că declararea unor informaţii false conduce automat la pierderea locului ocupat prin concursul de admitere. De asemenea am luat la cunoştinţă că POLITEHNICA Bucureşti prelucrează datele mele cu caracter personal în scopul admiterii şi finalizării studiilor şi de faptul că sunt obligat să furnizez datele cunoscând că refuzul determină neînscrierea la concursul de admitere. Datele vor fi dezvăluite Ministerului Educaţiei Naţionale, şi Băncilor. Conform Regulamentului 679/2016 privind protecția persoanelor fizice în ceea ce privește prelucrarea datelor cu caracter personal și privind libera circulație a acestor date și de abrogare a Directivei 95/46/CE (Regulamentul general privind protecția datelor), cunosc faptul că beneficiez de drepturile prevăzute în Capitolul III al regulamentului intitulat, „Drepturile persoanei vizate”. De asemenea, am luat la cunoştinţă că beneficiez de dreptul de a mă adresa cu plângere Autorităţii Naţionale de Supraveghere a Prelucrării datelor cu caracter personal şi justiţiei. Candidat: Semnătura Data: Universitatea Națională de Știință și Tehnologie POLITEHNICA București Calendarul desfășurării concursului de admitere în învățământul universitar de masterat* Anul universitar 2025-2026",
            "14. Numărul chitanţei pentru plata taxei de înscriere la concursul de admitere: 15. În cazul în care candidez și sunt admis pe un loc fără taxă (la buget) declar pe propria răspundere că nu am mai urmat un alt program de masterat în regim de fără taxă. 16. În cazul în care admiterea include o probă/probe susținute online: - sunt de acord ca proba să fie înregistrată; - declar că toate răspunsurile vor fi personale și că respect Codul de etică și deontologie profesională al Universității Naționale de Știință și Tehnologie POLITEHNICA București 17. Subsemnatul declar cele de mai sus pe propria răspundere. Am luat la cunoştinţă că declararea unor informaţii false conduce automat la pierderea locului ocupat prin concursul de admitere. De asemenea am luat la cunoştinţă că POLITEHNICA Bucureşti prelucrează datele mele cu caracter personal în scopul admiterii şi finalizării studiilor şi de faptul că sunt obligat să furnizez datele cunoscând că refuzul determină neînscrierea la concursul de admitere. Datele vor fi dezvăluite Ministerului Educaţiei Naţionale, şi Băncilor. Conform Legii nr. 677/2001, cu modificările ulterioare, cunosc faptul că beneficiez de dreptul la informare, dreptul de acces, de intervenţie şi opoziţie asupra datelor furnizate precum şi dreptul de a nu fi supus unei decizii individuale, prin înaintarea unei cereri scrise, datată şi semnată, Universității Naționale de Știință și Tehnologie POLITEHNICA București. De asemenea, am luat la cunoştinţă că beneficiez de dreptul de a mă adresa cu plângere Autorităţii Naţionale de Supraveghere a Prelucrării datelor cu caracter personal şi justiţiei. Candidat: Semnătura Data: 12"
        ],
        "response": "Nu am suficiente informații pentru a răspunde la întrebare.",
        "faithfulness": "1.0"
    },
    {
        "id": "ecab8c578b19ca0c0cdf795ef8aacb49be547faadd7e1fd4df06107076833b83",
        "user_input": "Cum pot opta pentru cazare la camin?",
        "retrieved_contexts": [
            "(2) În campusul studențesc Regie, accesul vizitatorilor și studenților necăminiști este permis zilnic, în intervalul orar 00:00- 24:00, iar în campusul Leu (spaţii de cazare), în intervalul orar 06:00-22:00, numai după legitimarea și înregistrarea lor în Registrul de evidență persoane. (3) Accesul studenților căminişti, în campusurile Regie şi Leu (spaţii de cazare), este permis în intervalul 00:00- 24:00, după legitimare. Art. 8. Deplasarea pietonală se va efectua numai pe trotuar, iar în lipsa acestuia cât mai aproape de marginea din partea dreaptă a părţii carosabile, în direcţia de mers. Art. 9. Pietonii vor traversa doar prin locurile unde sunt indicatoare și marcaje rutiere; atunci când acestea lipsesc, traversarea se va face pe la colțul intersecțiilor. CAPITOLUL III - Accesul și parcarea autovehiculelor Art. 10. Accesul unui vehicul cu motor (auto sau moto) în incinta universităţii este un privilegiu, nu un drept. Locurile de parcare nu sunt garantate, ele fiind puse la dispoziție numai în conformitate cu politicile și regulile stabilite la nivelul conducerii instituţiei. Art. 11. Intrarea si ieșirea din universitate se realizeaza numai prin Punctele de Control Acces special amenajate în acest scop și dotate cu sistem de bariere, după cum urmează:",
            "studenților - în spațiile de cazare/cantine, pe baza legitimației de cămin eliberată şi vizată la zi de administratorul căminului, iar în spațiile de învățământ – pe baza carnetului de student eliberat şi vizat la zi de secretariatele facultăților U.P.B; (3) personalului societăților comerciale ce dețin spații închiriate în incinta universităţii - pe baza unei legitimații/card eliberat/eliberată de către Serviciului Valorificare Resurse, în baza aprobării Directorului Direcției Dezvoltare Patrimoniu; (4) reprezentanților mass-media (redactori, reporteri, fotoreporteri, operatori, tehnicieni radio-tv etc.) - cu aprobarea conducerii universităţii - în baza documentelor de identitate și a legitimației de presă, vizată la zi; aceștia vor fi preluați de către un reprezentant al Serviciului de Relatii Publice, care îi va însoți pe toata durata șederii în incinta universității; (5) terțe persoane – numai prin zonele de acces (conf. anexei II), în baza actului de identitate și după înregistrarea în Registrul de evidență a persoanelor, constituit la fiecare punct de acces în locațiile universității. Art. 7. (1) Programul de acces pietonal în incinta universității (spațile de învațământ și administrative) este:",
            "| Website for details | additional job | Puteți introduce orice adresă http:// la suplimentare despre poziția scoasă la | care pot fi găsite informații concurs. |\n|:--|:--|:--|:--|\n| Benefits | | Vă rugăm să păstrați conținutul standard la All academic staff aa NUSTPB enjoy and professional development accommodation in NUSTPB residences, research infrastructure, and software for Puteți completa cu orice alte informații | nivel instituțional. . several benefits, such as training opportunities, holiday leave, banking facilities, access to remote working. neredundante. |\n| Eligibility criteria | | În cazul tuturor posturior de asistent determinată, Punctul de contact Euraxess va obligatorie: The candidates must provide doctoral school they have been enrolled to, status. Nu este nevoie să adăugați cerințele | universitar pe perioadă face următoarea mențiune a document issued by the certifying the PhD candidate formulate în Metodologie. |\n| Selection process | | Calendarul de concurs în formă sintetică. anunțuri publicate în platformă. | Puteți folosi ca reper alte |\n| Additional comments | | Orice alte informații pe care le posibile întrebări referitoare la poziția | considerați relevante, răspunsuri la scoasă la concurs etc. |",
            "Acces la serviciile unui interpret de limbaj mimico-gestual, dacă asistenţa sa este necesară şi solicitată de către acestea; b) cu privire la accesibilitate: Acces adaptat în în spaţiile campusului universitar (amfiteatre, săli de curs, săli de laborator/activităţi practice/seminare, biblioteci, săli de sport, spaţii de cazare, cantine etc.), conform prevederilor legale în vigoare; Acces gratuit cu autoturismul personal în campusul universitar şi loc de parcare a acestuia, după caz; Spații de cazare și grupuri sanitare adaptate nevoilor acestora, precum şi prioritate la ocuparea locurilor de cazare în căminele studenţeşti, în special a locurilor de cazare situate la parter, în clădiri adaptate accesului persoanelor cu dizabilităţi; Acces gratuit la dispozitivele/echipamentele/software-urile asistive existente în universitate pentru facilitarea desfăşurării procesului de predare-învăţare; c) privind servicii de suport: Servicii specializate gratuite de consiliere și asistență psihopedagogică/vocațională/pentru carieră, prin Centrul de Consiliere şi Orientare în Carieră al universității Servicii de asistenţă medicală, stomatologică şi psihologică gratuite în cabinetele medicale, cabinetele stomatologice din universitate, în policlinici şi unităţi spitaliceşti, conform prevederilor legale în vigoare, în limita disponibilității; Servicii de asistență în desfășurarea activităților didactice, adaptate nevoilor individuale; Însoțitor în timpul activităților didactice sau în timpul susţinerii examenelor de evaluare a cunoştinţelor, la solicitarea acestora, după caz; d) de natura financiară: Dreptul la toate categoriile de burse, inclusiv burse sociale, conform prevederilor legale în vigoare; Reducere, la cerere, cu 50% a tarifelor pentru cazare şi masă la cantinele studenţeşti ale universității; Reducere sau gratuitate, după caz, a costurilor de transport, cu respectarea prevederilor legale în vigoare; e) de natură socială: Acces la oportunităţi de învăţare, oferite de programe de mobilitate naţionale şi internaţionale, conform prevederilor legale în vigoare; Acces la activitățile nonformale/extracurriculare organizate de universitate;",
            "m) asigurarea pentru întregul personal din universitate a dreptului efectuării concediului de odihnă în fiecare an calendaristic, în conformitate cu prevederilor legale; n) întocmirea evaluărilor, privind activitatea profesională a salariaţilor, conform legislaţiei în vigoare şi a reglementărilor proprii; Conducerea Universităţii, prin conducătorii structurilor organizatorice de specialitate, răspunde de funcţionarea, utilizarea şi exploatarea sigură şi fără întrerupere a instalaţiilor, utilajelor şi maşinilor cu regim de funcţionare continuu sau cu grad ridicat de pericol în exploatare, de respectarea riguroasă a disciplinei tehnologice şi aplicarea tuturor normelor privind buna desfăşurare a procesului de muncă, având obligaţia să: Regulament Intern UNIVERSITATEA POLITEHNICA DIN BUCUREȘTI a) asigure recepţionarea, punerea în funcţiune a instalaţiilor, utilajelor şi maşinilor, cu respectarea strictă a prevederilor din documentaţia tehnică de execuţie; b) asigure respectarea riguroasă a normativelor tehnice privind exploatarea instalaţiilor, utilajelor şi a maşinilor, precum şi a echipamentelor acestora, cu aparatura de măsură, control şi automatizare, verificarea şi menţinerea aparaturii în stare de perfectă funcţionare; c) asigure efectuarea operaţiunilor de întreţinere, revizii şi reparaţii, cu respectarea riguroasă a normelor şi normativelor tehnice; d) asigurare desfăşurarea procesului de muncă în condiţii de siguranţă; e) asigurare asistenţă tehnică prin personal calificat; f) asigure luarea de măsuri pentru respectarea regulilor de protecţia muncii, de prevenire şi stingere a incendiilor, dotarea locurilor de muncă cu mijloace specifice de protecţie; g) asigure personalul cu echipament de protecţie şi de lucru; h) asigure efectuarea serviciului de pază şi ordine, stabilirea de reguli stricte privind intrarea şi ieşirea din Universitate, interzicerea accesului în unitate a persoanelor care se prezintă la programul de lucru sub influenţa băuturilor alcoolice. IV. Drepturile salariaților 1. Salariatii Universitatii beneficiază de toate drepturile prevăzute în favoarea lor de legile în vigoare"
        ],
        "response": "Pentru a opta pentru cazare la cămin, studenții trebuie să se prezinte la secretariatele facultăților U.P.B. pentru a obține informații detaliate despre disponibilitatea locurilor și procedurile de aplicare. Este important să aveți legitimația de student eliberată și vizată la zi, care va fi necesară pentru accesul în spațiile de cazare. De asemenea, este recomandat să verificați regulamentele specifice ale universității referitoare la cazare, care pot include termene limită și criterii de eligibilitate.\n\nSurse:\n- Regulament acces UPB actualizat noiembrie 2022, URL: https://upb.ro/wp-content/uploads/2025/04/Regulament-acces-UPB_actualizat-noiembrie-2022-01.pdf, pagina: 4",
        "faithfulness": "0.14285714285714285"
    },
    {
        "id": "9b6a85c92f83f5c03fd7492b0f18befa3cca4bf51bd56cac8309083454e0ddf4",
        "user_input": "Care este structura unui an universitar?",
        "retrieved_contexts": [
            "| Universitățile/țările implicate: |\n|:--|\n| Perioada de derulare a proiectului: |",
            "1. La începutul anului universitar (în primele 15 zile), studentul este obligat să completeze și să semneze Contractul anual de studii/Actul Adiţional(indiferent de regimul de studii cu sau fără taxă), document care certifică încadrarea sa în procesul de învățământ și includerea într-o formaţie de studii. 2. Prin Contractul anual de studii studentul se obligă să frecventeze și să promoveze disciplinele asumate. 3. Contractul anual de studii nu se poate modifica în timpul anului universitar în sensul modificării disciplinelor asumate din planul de învățământ. 4. Studentul care nu semnează Contractul anual de studii în perioada programată nu este înmatriculat în anul universitar respectiv. 5. În Contractul anual de studii se vor înscrie și toate disciplinele nepromovate. 6. Pentru disciplinele opționale și facultative studentul optează cel mai târziu în prima săptămână a anului universitar. 7. Disciplinele facultative se organizează în regim „cu taxă”, la cererea studenţilor, cu excepţia disciplinelor prevăzute în programul de pregătire psiho-pedagogică. 8. Nu există o limită superioară a numărului total de ECTS din Contractul anual de studii. 23 MINISTERUL EDUCAȚIEI Universitatea Naţională de Ştiinţă şi Tehnologie POLITEHNICA Bucureşti Anexa 2 Dosarul personal al studentului 1. Înscrierea studentului în registrul matricol se face pe baza dosarului personal care va cuprinde următoarele documente: fişa de înscriere de la concursul de admitere; lucrările de la concursul de admitere (dacă este cazul); • diploma de bacalaureat și foaie matricolă, în original; • diploma de licență şi și suplimentul la aceasta, în original; • diplomă echivalentă (diploma de licență emisă de un alt stat și atestatul de echivalare emis de CNRED/scrisorii de acceptare la studii) pentru studenții străini; • copie conform cu originalul după certificatul de naştere; • 2 fotografii; • adeverinţă medicală; • copie după cartea de identitate sau paşaport; • acte care atestă schimbarea numelui, în copie legalizată sau în copie conform cu originalul (dacă este cazul). 2. În perioada şcolarizării dosarul personal se completează cu următoarele documente:",
            "(1) Studentul poate accede, pe durata studiilor universitare de licenţă (începând cu anul II de studii), la începutul fiecărui an universitar, conform prevederilor legale şi reglementărilor interne, pe loc finanţat de la bugetul de stat, în limita locurilor disponibile pentru fiecare an de studii în parte la nivelul fiecărui centru universitar. (2) La începutul fiecărui an universitar, locurile disponibile finanţate de la bugetul de stat sunt redistribuite în ordinea descrescătoare a mediilor obţinute de studenţi în anul anterior. Studenții care nu au ocupat, în urma redistribuirii locurilor, un loc finanțat de la bugetul de stat vor continua studiile în regim cu taxă. (3) În cazul în care, pentru ultimul loc bugetat ce intră în procedura de redistribuire, sunt eligibili mai mulţi studenţi cu aceeaşi medie se va proceda la redistribuirea acestora pe baza unor criterii subsidiare în următoarea ordine: numărul de ECTS acumulate, media generală a anilor de studii până la momentul realizării repartizării sau media de la admitere (pentru studenţii promovaţi din anul I). În cazul în care egalitatea persistă, BExF va stabili şi alte criterii specifice de departajare. (4) Locul finanţat de la bugetul de stat de pe care titularul, din motive personale, solicită să se retragă după începerea anului universitar, până la finalizarea anului calendaristic, este redistribuit următorului student din clasamentul anului respectiv de studii, începând cu semestrul al II-lea al anului universitar. (5) Repartizarea studenţilor pe locurile finanţate de la bugetul de stat se efectuează la nivelul ramurilor de ştiinţă din fiecare facultate, fiind posibilă redistribuirea internă la nivelul fiecărei facultăţi, fără afectarea negativă a finanţării. În situaţia în care numărul locurilor finanţate de la bugetul de stat depăşeste numărul studenţilor înmatriculaţi la un anumit an de studiu (II, III sau IV) şi nu pot fi redistribuite în cadrul facultăţii respective, atunci Consiliul de Administraţie al Universităţii poate decide redistribuirea locurilor bugetate între facultăţi, la nivelul fiecărui an universitar. VI. FINALIZAREA STUDIILOR ART. 29. FINALIZAREA STUDIILOR (1) Finalizarea studiilor de licenţă în POLITEHNICA Bucureştise face prin Examen de Diplomă/Examen de Licenţă.",
            "(7) Bursele, indiferent de categorie, se acordă pe toată durata anului universitar (12 luni), cu excepţia burselor sociale ocazionale. Acordarea burselor încetează la data pierderii calităţii de student sau a neîndeplinirii criteriilor de promovabilitate, după caz, în conformitate cu regulamentele de organizare şi funcţionare ale instituţiilor de învăţământ superior. Capitolul III: OBLIGAȚIILE STUDENȚILOR Art. 15 (1) În mod corelativ, pe durata cât are contract de studii cu POLITEHNICA Bucureşti, studentul, studentul-doctorand sau cursantul, după caz, au următoarele îndatoriri: a) de a învăță în mod sistematic la toate disciplinele din planul de învățământ şi de a-şi însuşi pe deplin cunoştințele predate potrivit programelor universitare sau postuniversitare, după caz, în scopul unei temeinice pregătiri teoretice şi practice; b) de a respecta normele de etică şi de conduită academică în mediul universitar şi de a avea un comportament demn şi conform cu regulile de conviețuire socială în afara acestuia; c) de a respecta Carta, regulamentele și deciziile impuse de POLITEHNICA București; d) de a participa la ședințele structurilor de conducere din cadrul POLITEHNICII București în calitate de reprezentanți aleși ai studenților; e) de a respecta standardele de calitate impuse de către POLITEHNICA București; f) de a respecta drepturile de autor ale altor persoane și de a recunoaște paternitatea informațiilor prezentate în lucrările elaborate g) de a elabora și susține lucrări de evaluare la nivel de disciplină și lucrări de finalizare originale; h) de a sesiza autorităților competente orice nereguli în procesul de învățământ și în cadrul activităților conexe acestuia; i) de a participa la activități academice fără a fi sub influența băuturilor alcoolice sau a altor substanțe interzise; j) de a nu folosi un limbaj și comportament neadecvate mediului universitar; k) de a utiliza în mod corespunzător, conform destinației stabilite, toate facilitățile și subvențiile primite; l) de a semna contractul de studii la începerea fiecărui ciclu de studii. m)",
            "(1) Admiterea la studiile universitare de masterat se organizează în cadrul facultăților care au programe de studiu aprobate de Senatul Universității Naționale de Știință și Tehnologie POLITEHNICA București și Ministerul Educației, acreditate de ARACIS și publicate în hotărâre de guvern; programele de studii sunt afișate pe site-ul universității și, pentru fiecare facultate în parte, pe site-ul facultății. (2) Admiterea la studiile universitare de masterat se face prin concurs, iar numărul de locuri este aprobat de: • Ministerul Educației, pentru cele finanțate de la bugetul de stat; • Senatul universității, pentru cele în regim cu taxă de studii. (3) Facultățile hotărăsc distribuirea locurilor acordate pentru cele trei sesiuni de admitere (în funcție de necesități specifice) și informează Consiliul de Administrație al Universității Naționale de Știință și Tehnologie POLITEHNICA București cu privire la această distribuire. (4) Formațiile de studii se stabilesc de către Senat. Pentru anul universitar 2025– 2026, formațiile de studiu la masterat trebuie să fie de minimum 20 masteranzi, respectând o medie de minimum 25 masteranzi pe facultate. Facultățile care vor alcătui formații de studiu pentru programele de masterat cu un număr mai mic de studenți decât cel specificat vor norma orele aferente activităților didactice la acele formații de studiu cu o reducere proporțională cu raportul dintre numărul de studenți din formații și numărul minim impus. Art. 6. (1) Un candidat declarat admis pentru un program de studii universitare de masterat poate beneficia de finanțare de la bugetul de stat o singură dată. (2) Un candidat admis în sesiunea de admitere anticipată Mai sau Iulie de admitere nu va putea candida pentru alt program în sesiunea septembrie decât daca renunța, în prealabil, la locul ocupat. Retragerea se face printr-o cerere scrisă către Decan, semnată, trimisă pe email sau depusă la secretariat. Art. 7. La înscriere, candidații vor declara, pe proprie răspundere, dacă au mai urmat alte programe de masterat cu finanțare de la bugetul de stat."
        ],
        "response": "Nu am suficiente informații pentru a răspunde la întrebare.",
        "faithfulness": "1.0"
    },
    {
        "id": "17400baf0f3810b8995108a0ab078bc1edcbd2091bfed1f81daedd22dd6ca517",
        "user_input": "Cand are loc admiterea la licenta la ACS?",
        "retrieved_contexts": [
            "Masterat – Admitere 2025 | | Sesiunea Mai Calendar: | Înscriere: | 15 decembrie – 9 mai (ora 16): admitere.pub.ro | | Verificarea dosarelor: | 14 aprilie – 9 mai | | Concurs: | 13-16 mai (planificarea detaliată va fi afișată după finalizarea înscrierilor) | | Rezultate: | 17 mai | | Înmatriculare: | în intervalui 01-31 iulie (după obținerea licenței, conform unui calendar ce va fi afișat ulterior) | În sesiunea Mai vor fi scoase la concurs locuri la toate programele cu excepția EGOV, SCPD și SSA. Numărul orientativ de locuri scoase la concurs va fi afișat în curând. Informații generale pentru candidați Facultatea de Automatică și Calculatoare (ACS) organizează concursul de admitere în învățământul universitar de masterat, în anul 2025, în 3 sesiuni: - admitere anticipată (mai) - sesiunea iulie - sesiunea septembrie Informații generale la nivel UPB privind admiterea la masterat (calendar, regulament admitere, regulament studii etc. – in curs de actualizare): https://upb.ro/admitere/admitere-masterat/ Înscrierea la concurs se face prin intermediul platformei admitere.pub.ro. Toate informațiile specifice ACS privind concursul (modul de desfășurare a probelor, tematica, bibliografia, planificare interviuri, rezultate, înmatricularea candidaților admiși etc.) vor fi afișate pe această pagina. Concursul va consta din cele 2 probe prevăzute de regulamentul de admitere - evaluarea cunoștințelor fundamentale - evaluarea motivației candidatului Modul de desfășurare a probelor, tematica și bibliografia: - domeniul CTI - domeniile IS si IM Mod mixt (fizic + online) Standardele naționale recente de calitate pentru învățământul superior permit desfășurarea de studii în regim mixt. Pentru domeniile de master CTI, IS, IM se pot desfășura în regim online sincron maxim 60% din activitățile de curs și 35% din cele de aplicații și cercetare.",
            "ACS optimizează orarele de master – fizic/online – în funcție de necesități, ținând cont de reglementările naționale și deciziile Senatului UPB. Admiteri anterioare Informativ, rezultatele admiterii din anii anteriori sunt disponibile aici: 2022, 2023, 2024. Programe de studii ACS oferă 25 programe de studii universitare de masterat acreditate ARACIS în domeniile: - CTI (Calculatoare și Tehnologia Informației) – 13 programe - IS (Ingineria Sistemelor) – 11 programe - IM (Inginerie și Management) – 1 program Broșura master (în curs de actualizare cu noile programe) oferă informații sintetice despre masterat și despre fiecare program. În continuarea acestei pagini sunt prezentate programele și descrierile cursurilor. Versiunea preliminară a planurilor de învățământ este disponibilă AICI. Până la începerea anului școlar pot interveni modificări minore ale planurilor de învâțământ. Calculatoare și Tehnologia Informației | Nr. crt. | Nume program master | ||| | 1. | Arhitecturi Avansate de Calculatoare | ||| | 2. | Administrarea Bazelor de Date | ||| | Catedra organizatoare: Calculatoare Responsabil: Prof.Dr.Ing. Florin Radulescu Tip: Aprofundare / Cercetare avansata Informaţii: Scurtă descriere, Plan învăţământ, Cursuri Pentru a putea urma acest program de masterat, sunt necesare studii de licență într-unul din următoarele domenii: Domeniul fundamental Stiinte ingineresti , domeniile: Calculatoare si Tehnologia Informatie (specializarile Calculatoare , Tehnologia Informatiei , Ingineria Informatiei), Inginerie electronica si telecomunicatii, Ingineria sistemelor (specializarile Automatica si informatica aplicata, Ingineria sistemelor multimedia) , Stiinte Ingineresti Aplicate (specializarile Matematica si informatica aplicata in inginerie)",
            "▪ În ziua de 18 iulie 2025, în intervalul 09:00 – 16:00, comisia locală de admitere invită telefonic, în ordinea descrescătoare a mediilor, primii candidați cu barem îndeplinit, în vederea participării la ocuparea parțială sau integrală a acestor locuri. Candidații care acceptă și confirmă prin SMS participarea, își validează dosarul și se înmatriculează în data de 19 iulie 2025, sau dacă este posibil, chiar în data de 18 iulie 2025. ▪ După finalizarea înmatriculării, Comisia centrală și Comisiile locale de admitere generează și publică listele finale cu candidații declarați admiși anticipat și înmatriculați (19 iulie, ora 18:00) Ses. II-5.65. Pentru facultățile și domeniile care organizează Sesiunea II+ și la care candidații au susținut concurs pe baza rezultatelor la activitățile școlare (dosar) (c-rs) (atât în Centrul Universitar București cât și în Centrul Universitar Pitești): ▪ În ziua de 25 iulie 2025, în intervalul 09:00 – 16:00, comisia locală de admitere invită telefonic, în ordinea descrescătoare a mediilor, primii candidați cu barem îndeplinit, în vederea participării la ocuparea parțială sau integrală a acestor locuri. Candidații care acceptă și confirmă prin SMS participarea, își validează dosarul și se înmatriculează în data de 26 iulie 2025, sau dacă este posibil, chiar în data de 25 iulie 2025. ▪ După finalizarea înmatriculării, Comisia centrală și Comisiile locale de admitere generează și publică listele finale cu candidații declarați admiși anticipat și înmatriculați (27 iulie, ora 12:00) Pag. 45 Universitatea Națională de Știință și Tehnologie POLITEHNICA București REGULAMENTUL Concursului de Admitere în Ciclul de Studii Universitare de Licență 2025 VI. SESIUNEA III – ADMITERE-COMPLETARE ȘI ALTE DISPOZIŢII FINALE Ses. III/DF-6.1. După finalizarea înmatriculării din Sesiunea II/II+, Comisia centrală și Comisiile locale de admitere stabilesc eventualele locuri vacante pentru fiecare dintre facultăți.",
            "- Examen scris (ambele probe): 14 Iulie începând cu ora 09:00 - Afișare rezultate preliminare: 15 iulie - Afișare rezultate finale concurs: 16 iulie - Validare, confirmare, înscriere în anul I și înmatriculare: 16 Iulie ora 9.00 – 17 Iulie ora 16.00, conform programării, fizic, la sediul facultății - Daca se va organiza Sesiunea 2+ (in funcție de situația locurilor vacante): Validare, confirmare, înscriere în anul I și înmatriculare candidati Sesiunea 2+: 18 Iulie ora 9.00 – 19 Iulie ora 16.00, fizic, la sediul facultății - Rezultate finale admiși și înscriși în anul I: 19 Iulie Înscrierea se face prin portalul https://admitere.pub.ro Detalii despre condițiile de admitere si întreg Calendarul Sesiunii 2 – Admitere sunt disponibile aici. Date de contact: telefon 021 402 91 79",
            "sesiunea de admitere anticipată, sesiunea din iulie 2025 și sesiunea din septembrie 2025, conform următorului calendar: Sesiunea I Admitere anticipată 2025 Înscrierea candidaților 15.12.2024 – 10.05.2025 Taxa înscriere: 50 RON Concurs de admitere 13.05 – 16.05.2025 Comunicarea rezultatelor 13.05 – 17.05.2025 Înmatricularea candidaților 01.07 – 31.07.2025 Sesiunea II Iulie 2025 Înscrierea candidaților 01.07 – 08.07.2025 Taxa înscriere: 100 RON Concurs de admitere 10.07 – 12.07.2025 Comunicarea rezultatelor 10.07 – 13.07.2025 Înmatricularea candidaților 10.07 – 31.07.2025 Sesiunea III Septembrie 2025 Înscrierea candidaților 02.09 – 13.09.2025 Taxa înscriere: 100 RON Concurs de admitere 16.09 – 17.09.2025 Comunicarea rezultatelor 16.09 – 18.09.2025 Înmatricularea candidaților 16.09 – 20.09.2025 Specializări în domeniul inginerie aerospațială: - Structuri aeronautice și spațiale - Propulsie aerospațială și protecția mediului - Avionica și navigație aerospațială - Inginerie si management aerospațial - Ingineria Transportului Aerian (Air transport engineering) - Sisteme Holistice Spațiale - Management aeronautic Specializări în domeniul inginerie industrială: - Grafică inginerească și design Admitere Master sesiunea septembrie 2024 << Rezultate admitere master sesiunea septembrie 2024 >> << Link admitere master sesiunea septembrie 2024, 16.09.2024 >> << Programare interviu master sesiunea septembrie 2024, 16.09.2024 >> Admitere Master sesiunea iulie 2024 << Rezultate admitere master sesiunea iulie 2024 >> << Link-ul Microsoft Teams pentru interviul la master sesiunea iulie 2024, 10-07-2024, ora 10:00 >> << Programare interviu master sesiunea iulie 2024 >> Admitere Master sesiunea mai 2024 << Rezultate admitere master sesiunea mai 2024 >> << Link-ul Microsoft Teams pentru interviul la master sesiunea mai 2024, 13-05-2024, ora 10:00 >> << Programare admitere master sesiunea mai 2024 >> Calendarul desfășurării concursului de admitere în învățământul universitar de masterat* Anul universitar 2024-2025 Inscrierea se face pe site-ul www.admitere.pub.ro |"
        ],
        "response": "Admiterea la licență la Facultatea de Automatică și Calculatoare (ACS) are loc conform următorului calendar:\n\n- **Examen scris (ambele probe)**: 14 Iulie începând cu ora 09:00\n- **Afișare rezultate preliminare**: 15 iulie\n- **Afișare rezultate finale concurs**: 16 iulie\n- **Validare, confirmare, înscriere în anul I și înmatriculare**: 16 Iulie ora 9.00 – 17 Iulie ora 16.00, conform programării, fizic, la sediul facultății.\n- **Dacă se va organiza Sesiunea 2+ (în funcție de situația locurilor vacante)**: Validare, confirmare, înscriere în anul I și înmatriculare candidați Sesiunea 2+: 18 Iulie ora 9.00 – 19 Iulie ora 16.00, fizic, la sediul facultății.\n- **Rezultate finale admiși și înscriși în anul I**: 19 Iulie.\n\nÎnscrierea se face prin portalul [admitere.pub.ro](https://admitere.pub.ro).\n\nSurse:\n- URL: https://acs.pub.ro/admitere/licenta/",
        "faithfulness": "0.8888888888888888"
    },
    {
        "id": "e280469d87caccab8d29c2eabc83d6e519c622b594f9d6f6461f042f132a1f28",
        "user_input": "Cand are loc admiterea la licenta?",
        "retrieved_contexts": [
            "▪ În ziua de 18 iulie 2025, în intervalul 09:00 – 16:00, comisia locală de admitere invită telefonic, în ordinea descrescătoare a mediilor, primii candidați cu barem îndeplinit, în vederea participării la ocuparea parțială sau integrală a acestor locuri. Candidații care acceptă și confirmă prin SMS participarea, își validează dosarul și se înmatriculează în data de 19 iulie 2025, sau dacă este posibil, chiar în data de 18 iulie 2025. ▪ După finalizarea înmatriculării, Comisia centrală și Comisiile locale de admitere generează și publică listele finale cu candidații declarați admiși anticipat și înmatriculați (19 iulie, ora 18:00) Ses. II-5.65. Pentru facultățile și domeniile care organizează Sesiunea II+ și la care candidații au susținut concurs pe baza rezultatelor la activitățile școlare (dosar) (c-rs) (atât în Centrul Universitar București cât și în Centrul Universitar Pitești): ▪ În ziua de 25 iulie 2025, în intervalul 09:00 – 16:00, comisia locală de admitere invită telefonic, în ordinea descrescătoare a mediilor, primii candidați cu barem îndeplinit, în vederea participării la ocuparea parțială sau integrală a acestor locuri. Candidații care acceptă și confirmă prin SMS participarea, își validează dosarul și se înmatriculează în data de 26 iulie 2025, sau dacă este posibil, chiar în data de 25 iulie 2025. ▪ După finalizarea înmatriculării, Comisia centrală și Comisiile locale de admitere generează și publică listele finale cu candidații declarați admiși anticipat și înmatriculați (27 iulie, ora 12:00) Pag. 45 Universitatea Națională de Știință și Tehnologie POLITEHNICA București REGULAMENTUL Concursului de Admitere în Ciclul de Studii Universitare de Licență 2025 VI. SESIUNEA III – ADMITERE-COMPLETARE ȘI ALTE DISPOZIŢII FINALE Ses. III/DF-6.1. După finalizarea înmatriculării din Sesiunea II/II+, Comisia centrală și Comisiile locale de admitere stabilesc eventualele locuri vacante pentru fiecare dintre facultăți.",
            "Masterat – Admitere 2025 | | Sesiunea Mai Calendar: | Înscriere: | 15 decembrie – 9 mai (ora 16): admitere.pub.ro | | Verificarea dosarelor: | 14 aprilie – 9 mai | | Concurs: | 13-16 mai (planificarea detaliată va fi afișată după finalizarea înscrierilor) | | Rezultate: | 17 mai | | Înmatriculare: | în intervalui 01-31 iulie (după obținerea licenței, conform unui calendar ce va fi afișat ulterior) | În sesiunea Mai vor fi scoase la concurs locuri la toate programele cu excepția EGOV, SCPD și SSA. Numărul orientativ de locuri scoase la concurs va fi afișat în curând. Informații generale pentru candidați Facultatea de Automatică și Calculatoare (ACS) organizează concursul de admitere în învățământul universitar de masterat, în anul 2025, în 3 sesiuni: - admitere anticipată (mai) - sesiunea iulie - sesiunea septembrie Informații generale la nivel UPB privind admiterea la masterat (calendar, regulament admitere, regulament studii etc. – in curs de actualizare): https://upb.ro/admitere/admitere-masterat/ Înscrierea la concurs se face prin intermediul platformei admitere.pub.ro. Toate informațiile specifice ACS privind concursul (modul de desfășurare a probelor, tematica, bibliografia, planificare interviuri, rezultate, înmatricularea candidaților admiși etc.) vor fi afișate pe această pagina. Concursul va consta din cele 2 probe prevăzute de regulamentul de admitere - evaluarea cunoștințelor fundamentale - evaluarea motivației candidatului Modul de desfășurare a probelor, tematica și bibliografia: - domeniul CTI - domeniile IS si IM Mod mixt (fizic + online) Standardele naționale recente de calitate pentru învățământul superior permit desfășurarea de studii în regim mixt. Pentru domeniile de master CTI, IS, IM se pot desfășura în regim online sincron maxim 60% din activitățile de curs și 35% din cele de aplicații și cercetare.",
            "Acestea vor fi trimise pe mail la adresa admitere.energetica@upb.ro, iar rezultatul acestora se anunță în cel mult 24 de ore de la încheierea termenului de depunere a contestațiilor. - Faza 4 - Înmatricularea candidaților 01.07.2025 - 07.07.2025Înmatricularea candidaților - 01.07.2025-07.07.2025 Înmatricularea candidaților admiși în sesiunea de admitere anticipată se va face la secretariatul facultății, în perioada 01/07/2025-07/07/2025, în intervalul orar 9:00-16:00. Pentru înmatriculare, candidații admiși în admiterea anticipată trebuie să depună la secretariatul facultății unde au fost admiși următoarele documente: • forma fizică a fișei de înscriere; • 2 fotografii, realizată recent, color, format 3x4 cm; • diploma de bacalaureat (în original); • diploma de licență/inginer sau echivalentă acesteia; candidații care au promovat examenul de licență în sesiunea iunie-iulie 2025 pot depune la înscriere, pentru sesiunile imediat următoare, în locul diplomei de licență, adeverința de absolvire eliberată de facultate, în care se menționează atât media generală de la examenul de diplomă/licență cât și mediile generale obținute în fiecare an de studiu (în original); • foaia matricolă/suplimentul la diplomă, numai în cazul în care se depune diploma de licență/inginer (în original); • certificatul de naștere (copie conform cu originalul); • certificatul de căsătorie (dacă este cazul, copie conform cu originalul); • buletin/carte de identitate/pașaport (copie conform cu originalul); • dovada de plată a taxei de înscriere la admitere (contul în care se face plata va fi afișat pe site-ul de admitere al Universității); • dovada de plată a taxei de înmatriculare la admitere (contul în care se face plata va fi afișat pe site-ul de admitere al Universității); În caz contrar aceștia vor pierde statutul de masterand.",
            "Procesul de Admitere în sesiunea Septembrie la studiile universitare de masterat va începe pe data de 02.09.2024. Calendarul pentru Sesiunea III de Admitere 2024 este următorul: înscrierea candidaților: 02.09 - 13.09.2024, Concursul de admitere: 16.09 – 17.09.2024, Comunicarea rezultatelor: 16.09 – 18.09.2024, Înmatricularea candidaților: 16.09 – 20.09.2024. Admiterea se face conform Regulamentului privind organizarea și desfășurarea concursului de admitere în ciclul de studii universitare de masterat. Înscrierea la concursul de admitere pentru studiile de masterat in Sesiunea III de Admitere, sesiunea septembrie, se face online pe site-ul https://admitere.pub.ro conform regulamentului amintit. Programarea examenelor este disponibila aici.",
            "** - Rezultate preliminare: 11 iunie 2025, ora 12:00 - Contestații: pot fi depuse online până la date de 12 iunie 2025, ora 12:00 - Rezultatele finale privind admiterea preliminară: 16 iunie 2025, ora 12:00 Admiterea anticipată fără concurs - Absolvenții de liceu cu diplomă de bacalaureat, care au obținut în perioada studiilor liceale distincții la olimpiadele școlare internaționale, recunoscute de Ministerul Educației și Cercetării, beneficiază de dreptul de a se înscrie, la cerere, fără susținerea concursului de admitere, în cadrul numărului de locuri/granturi alocate, în învățământul superior de stat în domenii de studiu corespunzătoare disciplinelor la care au fost distinși, putând urma, fără taxe de școlarizare, cursurile a două facultăți în instituții de învățământ superior de stat. - În plus, față de prevederile anterioare, în anul 2023, pentru obținerea statutului de pre-admis fără concurs în cadrul Facultății de Energetică, în condițiile legii și cu respectarea cadrului definit prin hotărârile Senatului UPB, vor fi luate în considerare următoarele olimpiade și concursuri (vezi Anexa VI - REGULAMENT PRIVIND ORGANIZAREA ȘI DESFĂȘURAREA CONCURSULUI DE ADMITERE ÎN CICLUL DE STUDII UNIVERSITARE DE LICENȚĂ ANUL UNIVERSITAR 2025-2026). Admiterea anticipată prin concurs Media generală de admitere (MG) se determină cu relația: - MG = (4*MC + NB)/5 (unde MC este media notelor de concurs, iar NB reprezintă nota pentru proba P3. Media notelor de concurs (MC) se calculează cu formula: - MC = (NC1 + NC2)/2 (unde notele NC1 și respectiv NC2 sunt obținute la probele de concurs P1 și respectiv P2. La proba de concurs P1 se evaluează rezultatele obținute de candidat la Matematică (M) în clasele a IX-a, a X-a și a XI-a, iar nota obținută se calculează astfel: - M = Ma = (M9 + M10 + M11)/3 sau M = Mb = (M9 + M10)/2 (în funcție de specialitatea absolvită la liceu."
        ],
        "response": "Admiterea la studiile universitare de licență va avea loc conform următorului calendar: Rezultatele preliminare vor fi anunțate pe 11 iunie 2025, iar contestațiile pot fi depuse online până pe 12 iunie 2025. Rezultatele finale privind admiterea preliminară vor fi comunicate pe 16 iunie 2025. De asemenea, există posibilitatea de admitere anticipată pentru absolvenții de liceu cu distincții la olimpiadele școlare internaționale, care pot solicita înscrierea fără susținerea concursului de admitere. Detalii suplimentare pot fi găsite în regulamentul de admitere.\n\nSurse:\n- URL: https://energ.upb.ro/admitere/licenta/informatii-admitere",
        "faithfulness": "1.0"
    },
    {
        "id": "20c34bc717b4a3fabe286b6a16b52eaad81a0ac9e6bd7fda2e90f26bfaa00c21",
        "user_input": "Cand are loc admiterea la master?",
        "retrieved_contexts": [
            "Admitere master - informații Regulamentul privind organizarea și desfășurarea concursului de admitere în învățământul universitar de masterat anul universitar 2025-2026 poate fi consultat aici https://admitere.pub.ro/. Admitere anticipată Numarul de locuri - In curand. La sesiunea de admitere anticipată pot candida studenți într-un an terminal al studiilor de licență sau absolvenți ai unui program de studii de licență din anii anteriori, care doresc garantarea anticipată (prin pre-admitere) a unui loc pentru studii de masterat în POLITEHNICA București. Pentru validarea și înmatricularea candidaților astfel pre-admiși, promovarea examenului de Licență/Diplomă până la data prevăzută pentru înmatriculare este, conform legii, o condiție necesară. Pot candida la admiterea la studii universitare de masterat cetățenii statelor membre ale Uniunii Europene, ai statelor aparținând Spațiului Economic European și Confederației Elvețiene, în aceleași condiții prevăzute de lege pentru cetățenii români, inclusiv în ceea ce privește taxele de școlarizare. - Faza 1 - Înscriere 15.12.2024 - 09.05.2025Înscriere - 15.12.2024-9.05.2025 Pentru înscrierea la concursul de admitere în învățământul universitar de masterat în sesiunea de admitere anticipată, candidații depun online pe site-ul de admitere al universității dosarul de înscriere, care trebuie să conțină următoarele documente: a) fișa de înscriere tip, conform Anexei 2, în care vor menționa, sub semnătură electronică sau scanată și răspundere proprie, toate datele solicitate de formularul respectiv; b) certificatul de naștere; c) certificatul de căsătorie (dacă este cazul); d) situația școlară a anilor de licență anteriori anului curent în care se află sau foaia matricolă/suplimentul la diplomă în cazul în care au absolvit un program de licență într-un an anterior: e) buletin/carte de identitate/pașaport; f) dovada de plată a taxei de înscriere la admitere anticipată (contul în care se face plata va fi afișat pe site-ul de admitere al universității);",
            "Procesul de Admitere în sesiunea Septembrie la studiile universitare de masterat va începe pe data de 02.09.2024. Calendarul pentru Sesiunea III de Admitere 2024 este următorul: înscrierea candidaților: 02.09 - 13.09.2024, Concursul de admitere: 16.09 – 17.09.2024, Comunicarea rezultatelor: 16.09 – 18.09.2024, Înmatricularea candidaților: 16.09 – 20.09.2024. Admiterea se face conform Regulamentului privind organizarea și desfășurarea concursului de admitere în ciclul de studii universitare de masterat. Înscrierea la concursul de admitere pentru studiile de masterat in Sesiunea III de Admitere, sesiunea septembrie, se face online pe site-ul https://admitere.pub.ro conform regulamentului amintit. Programarea examenelor este disponibila aici.",
            "Modificare date admitere masterat sesiunea august-septembrie 2020 Inscriere | 17.08.2020 – 11.09.2020 | Concurs admitere | 14.09.2020 – 15.09.2020 | Comunicare rezultate, depunere contestatii si inmatriculare | 16.09.2020 – 17.09.2020 | Depunere documente pentru candidatii admisi si inmatriculati in ambele sesiuni (programare – site facultate) | 10 – 18 septembrie 2020 | Continutul dosarului (documente care se depun) Comisii admitere Masterat - Sesiunea septembrie 2020 ( Cu link-uri canale Microsoft Teams) Inscriere online Masterat 2020 - https://admitere.pub.ro/ REGULAMENT PRIVIND ORGANIZAREA ȘI DESFĂȘURAREA CONCURSULUI DE ADMITERE ÎN ÎNVĂŢĂMÂNTUL UNIVERSITAR DE MASTERAT Sesiunea Iunie 2020 Candidati declarati admisi - sesiunea iulie 2020 Inscriere online Masterat 2020 - https://admitere.pub.ro/ Comisii admitere Masterat - sesiunea iulie 2020 ( Cu link-uri canale Microsoft Teams) REGULAMENT PRIVIND ORGANIZAREA ȘI DESFĂȘURAREA CONCURSULUI DE ADMITERE ÎN ÎNVĂŢĂMÂNTUL UNIVERSITAR DE MASTERAT Admitere masterat 2019 Facultatea de Inginerie Industrială și Robotică Concursul de admitere în învățământul universitar de masterat se organizează în două sesiuni, în iulie și septembrie 2019: Sesiunea a II a Sesiunea I: Examen de admitere: 11-12 iulie Program înscriere (Sala CB 017): Luni, miercuri și vineri / 9.00 – 16.00 Marți și joi / 12.00 – 18.00 Sâmbătă și duminică / 10.00 – 14.00 Taxa de înscriere este de 50 lei. Pentru alegerea unei specializări consultați următoarele informații: Conţinutul dosarului de înscriere: Pentru înscrierea la concursul de admitere în învăţământul universitar de masterat, candidaţii vor prezenta la înscriere un dosar plic, care trebuie să conţină următoarele documente:",
            "Masterat – Admitere 2025 | | Sesiunea Mai Calendar: | Înscriere: | 15 decembrie – 9 mai (ora 16): admitere.pub.ro | | Verificarea dosarelor: | 14 aprilie – 9 mai | | Concurs: | 13-16 mai (planificarea detaliată va fi afișată după finalizarea înscrierilor) | | Rezultate: | 17 mai | | Înmatriculare: | în intervalui 01-31 iulie (după obținerea licenței, conform unui calendar ce va fi afișat ulterior) | În sesiunea Mai vor fi scoase la concurs locuri la toate programele cu excepția EGOV, SCPD și SSA. Numărul orientativ de locuri scoase la concurs va fi afișat în curând. Informații generale pentru candidați Facultatea de Automatică și Calculatoare (ACS) organizează concursul de admitere în învățământul universitar de masterat, în anul 2025, în 3 sesiuni: - admitere anticipată (mai) - sesiunea iulie - sesiunea septembrie Informații generale la nivel UPB privind admiterea la masterat (calendar, regulament admitere, regulament studii etc. – in curs de actualizare): https://upb.ro/admitere/admitere-masterat/ Înscrierea la concurs se face prin intermediul platformei admitere.pub.ro. Toate informațiile specifice ACS privind concursul (modul de desfășurare a probelor, tematica, bibliografia, planificare interviuri, rezultate, înmatricularea candidaților admiși etc.) vor fi afișate pe această pagina. Concursul va consta din cele 2 probe prevăzute de regulamentul de admitere - evaluarea cunoștințelor fundamentale - evaluarea motivației candidatului Modul de desfășurare a probelor, tematica și bibliografia: - domeniul CTI - domeniile IS si IM Mod mixt (fizic + online) Standardele naționale recente de calitate pentru învățământul superior permit desfășurarea de studii în regim mixt. Pentru domeniile de master CTI, IS, IM se pot desfășura în regim online sincron maxim 60% din activitățile de curs și 35% din cele de aplicații și cercetare.",
            "Admitere master Admitere Master 2025 << Regulament admitere master 2025 >> Concursul de admitere în învățământul universitar de masterat în anul universitar 2025 – 2026 se desfășoară conform Regulamentului privind organizarea și desfășurarea concursului de admitere în învățământul de masterat în POLITEHNICA București. Concursul de admitere se organizează în trei sesiuni:"
        ],
        "response": "Admiterea la studiile universitare de masterat se desfășoară în mai multe sesiuni. În sesiunea de admitere din septembrie 2024, procesul va începe pe data de 02.09.2024, iar calendarul este următorul:\n- Înscrierea candidaților: 02.09 - 13.09.2024\n- Concursul de admitere: 16.09 – 17.09.2024\n- Comunicarea rezultatelor: 16.09 – 18.09.2024\n- Înmatricularea candidaților: 16.09 – 20.09.2024.\n\nDe asemenea, în anul 2025, admiterea se va organiza în trei sesiuni: o sesiune anticipată în mai, o sesiune în iulie și o sesiune în septembrie. Detaliile pentru sesiunea din mai sunt următoarele:\n- Înscriere: 15 decembrie – 9 mai (ora 16)\n- Concurs: 13-16 mai\n- Rezultate: 17 mai\n- Înmatriculare: 01-31 iulie.\n\nPentru mai multe informații, candidații pot consulta regulamentul de admitere disponibil pe site-ul universității.\n\nSurse:\n- URL: https://chimie.upb.ro/admitere/programe-de-studii-de-masterat/\n- URL: https://acs.pub.ro/admitere/masterat/",
        "faithfulness": "0.9473684210526315"
    },
    {
        "id": "3c5b225ce0ad1a29dcc2ac706c9f74bf091f76929fee2b8ff16fca57d7b17fbf",
        "user_input": "Cand are loc admiterea la doctorat?",
        "retrieved_contexts": [
            "Doctorat Admitere doctorat Calendar admitere doctorat | 1 aprilie – 20 septembrie 2024 | Înscrierea, validarea dosarului și admiterea candidaților. Platformă înscriere candidați: https://admitere.pub.ro. | | 26 aprilie 2024 29 mai 2024 26 iunie 2024 24 iulie 2024 28 august 2024 20 septembrie 2024, 16:00 | Validarea dosarelor de către secretariatul SD-AC. Evaluarea dosarelor de către conducătorii de doctorat. | | 30 aprilie 2024 31 mai 2024 28 iunie 2024 26 iulie 2024 30 august 2024 23 septembrie 2024 | Rezultate evaluare și acordarea calificativului Admis/Respins. [Rezultate aprilie 2024] [Rezultate mai 2024] [Rezultate iunie 2024] [Rezultate iulie 2024] [Rezultate august 2024] [Rezultate septembrie 2024] | | 25-26 septembrie 2024 | Evaluarea candidaților declarați admiși (interviu oral) de către Comisia de admitere și alocarea burselor MEN în baza ierarhiei stabilite. [Listă finală admitere și burse] | | 30 septembrie 2024 | Înmatricularea candidaților declarați admiși. [Rezultate finale] | | 1 octombrie 2024 | Începerea stagiului doctoral. | Legislație și regulament admitere SD-AC organizează ocuparea locurilor disponibile pe bază de concurs conform următoarelor reglementări: - Metodologia privind organizarea și desfășurarea concursului de admitere la doctorat a Instituției Organizatoare de Studii Universitare de Doctorat IOSUD – UPB [link]. - Regulamentul de funcționare al Școlii Doctorale de Automatică și Calculatoare [link]. Admiterea la doctorat se face în limita locurilor alocate anual de: - Ministerul Educației pentru doctoratul în regim de finanțare de la bugetul de stat sub formă de granturi doctorale. - UPB, în calitate de Instituție Organizatoare de Studii Universitare de Doctorat, pentru doctoratul în regim cu taxă, care este suportată de către doctorand. Cuantumul taxelor este publicat aici [link].",
            "Admitere doctorat Admiterea la studiile universitare de doctorat se organizează continuu în perioada Aprilie-Septembrie 2022, conform Metodologiei privind organizarea şi desfăşurarea concursului de admitere la doctorat în anul universitar 2022- 2023 Admiterea la doctorat se organizează la nivelul Şcolii doctorale de Inginerie Energetică (SDIEn) pentru domeniul de Inginerie energetică. Informațiile despre admiterea la studii universitare de doctorat se găsesc la adresa http://doctorat.energetica.upb.ro/admitere.html",
            "- 3 - 5 iulie 2017: susținerea probei de concurs, afișarea rezultatelor, încheierea contractelor de studii doctorale. Această sesiune de admitere la studii universitare de doctorat se adresează, cu precădere, absolvenților UPB de masterat care își prezintă DISERTAȚIA în perioada 26 iunie - 30 iunie 2017. Candidatii completeaza numai Anexa 2, Anexa 3 si Anexa 5 Program Admitere Doctorat sesiunea IULIE 2017 Procedura de Admitere la Doctorat 2017 Comisie Admitere Doctorat 2017 Repartiție locuri pe Școli Doctorale Metodologia de admitere, dar și alte date sunt prezentate la: http://www.upb.ro/admitere-doctorat.html Admitere Doctorat 2016 Rezultate colocviu admitere doctorat 2016 - Candidații admiși la studii universitare de doctorat – cu bursa - Candidații admiși la studii universitare de doctorat – fara bursa - Candidații admiși la studii universitare de doctorat – cu taxa Planificare examen concurs de admitere la studii universitare de doctorat - septembrie 2016 Sesiunea a II-a: 5 - 30 septembrie 2016 - 5 - 27 septembrie 2016: înscrierea candidaților (taxa de înscriere este de 200 lei). - 28 - 30 septembrie 2016: susținerea probei de concurs, afișarea rezultatelor, încheierea contractelor de studii doctorale. Sesiunea I. - Candidații admiși la studii universitare de doctorat, cu subvenționare de la buget Sesiunea I. 27 iunie - 8 iulie 2016 - Programarea probei de concurs Admiterea la studii universitare de doctorat pentru anul univ. 2016 - 2017 se va desfășura în două sesiuni: Sesiunea I 27 iunie - 8 iulie 2016 și, respectiv, Sesiunea a II-a 5 - 28 septembrie 2016, astfel: Sesiunea I 27 iunie - 8 iulie 2016 - 27 iunie - 6 iulie 2016: înscrierea candidaților (taxa de înscriere este de 150 lei). - 7 - 8 iulie 2016: susținerea probei de concurs, afișarea rezultatelor, încheierea contractelor de studii doctorale.",
            "Această sesiune de admitere la studii universitare de doctorat se adresează, cu precădere, absolvenților UPB de masterat care își prezintă DISERTAȚIA în perioada 27 iunie - 3 iulie 2016. Sesiunea a II-a 5 - 30 septembrie 2016 - 5 - 27 septembrie 2016: înscrierea candidaților (taxa de înscriere este de 200 lei). - 28 - 30 septembrie 2016: susținerea probei de concurs, afișarea rezultatelor, încheierea contractelor de studii doctorale. Comisiile pentru Admiterea la Studii universitare de doctorat 2016 Formularele completate și celelalte documente necesare la înscriere se depun la Biroul Doctorate/ Secretariatul Școlii Doctorale IMST, Rectorat UPB, camera R 308. Metodologia de admitere, formularele de înscriere (anexele 2, 3) și alte date sunt prezentate mai jos, precum și la: http://www.upb.ro/admitere-doctorat.html | FORMULARE | | | Cerere | Metodologia de admitere | | Fișă de înscriere | Conducători științifici de doctorat | | Locuri repartizate pe școli doctorale | Admitere Doctorat 2015 Rezultate colocviu admitere doctorat 2015 - Candidații admiși la studii universitare de doctorat – cu bursa - Candidații admiși la studii universitare de doctorat – fara bursa - Candidații admiși la studii universitare de doctorat – cu taxa Admiterea la studii universitare de doctorat se organizează in sesiunea septembrie-octombrie, în conformitate cu următorul program: Susţinerea probei de specialitate, validarea rezultatelor concursului, semnarea contractelor de studii doctorale şi înscrierea doctoranzilor - conform planificarii (vezi mai jos). Susţinerea probei de specialitate, validarea rezultatelor concursului, semnarea contractelor de studii doctorale şi înscrierea doctoranzilor - 12 octombrie 2015. COLOCVIUL DE ADMITERE LA DOCTORAT Etapa a II a | | Departamentul de Masini si Sisteme de Productie | |",
            "- Probele de concurs din cadrul admiterii la Studiile Universitare de Doctorat 2020 sunt programate pe 14.09.2020 si 15.09.2020 in regim online pe platforma Microsoft Teams, cu inregistrare, prin organizarea de catre fiecare Comisie de examinare Ci. ORDIN nr. 5.229 din 17 august 2020 OM 4206/06.05.2020 Comisii, date sustinere & link admitere on-line Rezultate Admitere Doctorat - Sesiunea Iunie-Iulie 2020 Conducatorii de doctorat OM 4206/06.05.2020 Comisii, date sustinere & link admitere on-line Pentru inscriere on-line acceseaza https://admitere.pub.ro/Admitere/site/index Admitere Doctorat 2019 Rezultate Admitere Doctorat - Sesiunea Septembrie 2019 Regulament Studii Universitare de Doctorat Program admitere doctorat - sesiunea septembrie 2019 Concursul de admitere la studii universitare de doctorat – sesiunea septembrie2019 se va desfășura după cum se prezintă [aici]. În legătură cu numărul de locuri la doctorat subvenționate de la buget, se subliniază că se va solicita suplimentarea acestuia, de la MEN, dacă numărul candidaților care realizează media generală de admitere, de minimum 8, depășește numărul de locuri repartizate initial. Metodologie UPB Admitere Doctorat Conducătorii științifici de doctorat/ 2019 - 20 Concursul de admitere la studii universitare de doctorat 2019 se va desfășura în două sesiuni, după cum se prezintă mai jos. Sesiune | Înscriere candidați | Proba de concurs | Finalizare/Transmitere rezultate | I | 26.06 – 08.07.2019 | 09 - 10.07.2019 | 11.07.2019 | II | 26.08 – 20.09.2019 | Numărul de locuri și numărul de burse subvenționate de la buget, comisiile și data probei de concurs, precum și alte elemente privind organizarea și desfășurarea concursului de admitere la studii universitare de doctorat se prezintă mai jos."
        ],
        "response": "Admiterea la doctorat se va desfășura în perioada 1 aprilie – 20 septembrie 2024. În această perioadă, candidații trebuie să se înscrie, iar dosarele lor vor fi validate și evaluate de conducătorii de doctorat. Rezultatele evaluării vor fi anunțate în intervale specifice, iar evaluarea candidaților admiși va avea loc între 25-26 septembrie 2024. Înmatricularea candidaților declarați admiși va avea loc pe 30 septembrie 2024, iar stagiul doctoral va începe pe 1 octombrie 2024.\n\nSurse:\n- URL: https://acs.pub.ro/admitere/doctorat/",
        "faithfulness": "1.0"
    },
    {
        "id": "0678f9cd1f3c160ff968e1358214e797cd79dd8ee0007da052f818c9f14064d8",
        "user_input": "Ce documente sunt necesare pentru inmatriculare?",
        "retrieved_contexts": [
            "1. Diploma de Bacalaureat însoțită de foaia matricolă (în original – rămâne la dosar); PP 2. Certificat de naștere (în original – copie la dosar); 3. Carte de identitate sau pașaport (în original – copie la dosar); 4. 3 fotografii color – dimensiune 3x4 cm (rămân la dosar); 5. Documente care să ateste rezultatele obținute la concursurile considerate la înscriere (în original – copie la dosar) ; 6. Dovada achitării taxei de înscriere sau dovada scutirii de plata taxei (în original – rămâne la dosar); 7. Cerere de înscriere semnată (în original – rămâne la dosar); 8. Declarație pe proprie răspundere semnată privind veridicitatea documentelor (în original – rămâne la dosar); 9. Adeverință medicală (în original – rămâne la dosar); 10. Dovada achitării taxei de înmatriculare (în original – rămâne la dosar). Taxa de înmatriculare este 50 lei și se poate plăti în aceleași modalități ca și taxa de înscriere",
            "Validarea dosarului de concurs, Confirmarea locului obținut preliminar, Participarea opțională la glisare și depunerea documentelor pentru înmatriculare se realizează personal sau prin împuternicire notarială la sediul facultății la care candidatul a fost declarat pre-admis. Sunt necesare următoarele documente: Pentru toți candidații",
            "- Certificatul de naștere al candidatului (original și copie). - Act de identitate candidat (Carte de identitate sau Pașaport) (original și copie) aflat în perioada de valabilitate la data înscrierii, iar dacă acesta a expirat, o copie după vechiul act de identitate și originalul noului act. - 3 fotografii color, pe hârtie fotografică (tip pașaport/CI, recente, identice, dimensiune 3x4 cm). Pe spatele fiecărei fotografii se scrie numele, inițiala tatălui și prenumele. - Situație școlară, adeverință, foaie matricolă sau alt document/documente emis/emise de liceul de la care provine candidatul, în care sunt specificate mediile obținute de candidat, în timpul liceului, la disciplinele selectate pentru proba P1 și, respectiv, P2, cât și mediile generale obținute de către acesta în clasele a IX-a, a X-a și a XI-a pentru proba P3. - Dacă este cazul, documente care să ateste rezultatele obținute de candidat la o serie de activități suplimentare pe care acesta le-a desfășurat în anii de liceu. - Dovada achitării taxei de înscriere la concurs sau dovadă prin care să reiasă faptul că poate fi scutit de această taxă. - Cererea de înscriere la concurs semnată de candidat. - Declarație pe proprie răspundere, semnată de candidat, privind veridicitatea datelor și a documentelor furnizate de acesta în cadrul procesului de înscriere. - Adeverința medicală din care să rezulte că este apt medical. - Dovada achitării taxei de înmatriculare. Taxa de înmatriculare este de 50 lei și se poate achita având menționate la explicațiile plății: numele și prenumele complet al candidatului precum și „Facultatea de Energetică”, astfel: - direct, prin platforma on-line https://admitere.pub.ro/, cu card bancar;",
            "10 11 12 Dovada achitării taxei de înmatriculare (vezi Anx. VIII-5). 13 Anx. VIII-2. Pentru candidații care sunt deja absolvenți (cu sau fără diplomă) ai unei instituții de învățământ superior, care s-au înscris la concursul de admitere în 2025 pentru a se școlariza într-un alt domeniu și care au fost declarați admiși, sunt necesare documentele specificate în tabelul Anx. VIII-1 la care se mai adaugă și documentele din tabelul de mai jos.",
            "| Pachet de documente necesare validării dosarului de concurs şi ulterior înmatriculării candidaților admiși | Originalul rămâne în dosarul candidatului |\n|:--|:--|\n| Certificatul de naștere al candidatului. Originalul documentului din Tabelul Anx.VII-2 — Punctul 01. | |\n| Act de identitate candidat (Carte de identitate sau Pașaport) aflat în perioada de valabilitate la data înscrierii. iar dacă acesta a expirat, o copie după vechiul act de identitate și originalul noului act. Originalul documentului din Tabelul Anx.VII-2 — Punctul 02. | |\n| 3 fotografii color, pe hârtie fotografică (tip pașaport/Cl,frontal, fundal neutru, recente, identice, dimensiune 3x4 cm). | |\n| Diploma de Bacalaureat (sau diploma echivalentă cu aceasta) însoțită de foaia matricolă. Original ***Notă | Da pt. candidați - admişi preliminar pe un loc finanțat la buget; |\n| Pentru candidații care au promovat examenul de Bacalaureat în 2025, dacă liceul nu a eliberat diploma până la data înmatriculării, în locul diplomei de Bacalaureat se admite, în original, adeverința eliberată de liceu în care se menționează atât media generală, cât și notele obținute la probele susținute. Foaia matricolă în original este și, în acest caz, necesară. Originalul documentelor din Tabelul Anx.VII-2 — Punctul 04. | - admişi preliminar pe un loc cu taxă şi care participă la glisare cu opțiuni la buget; |\n| | NU pt. candidații - admişi preliminar pe un loc cu taxă şi care nu participă la glisare; - admişi preliminar pe un loc cu taxă şi care participă la glisare numai cu opțiuni cu taxă; |\n| Dacă este cazul, documente care să ateste rezultatele deosebite în cadrul olimpiadelor și concursurilor de profil în anii de liceu (vezi Anexa VI). Originalul documentelor din Tabelul Anx.VII-2— Punctul 05. | |\n| Dovada achitării taxei de înscriere la concurs sau dovadă prin care să reiasă faptul că poate fi scutit de această taxă. Originalul documentelor din Tabelul Anx.VII-2 — Punctul 06. | |\n| emnată de candidat. Originalul documentelor din Tabelul Anx.VII-2 — Punctul 07. | |\n| Declarație pe proprie răspundere, semnată de candidat, privind veridicitatea datelor și a documentelor furnizate de acesta în cadrul procesului de înscriere. Originalul documentelor din Tabelul Anx.VII-2 — Punctul 08. | |\n| Adeverință medicală din care să rezulte că este apt medical sau, dacă este cazul, carnetul de legitimare Notă: Pentru sportivi, adeverința medicală poate fi suplinită de carnetul de legitimare cu viza medicală în termen de valabilitate pe perioada examenului de admitere Originalul documentului din Tabelul Anx.VII-2 — Punctul 09. | Da - adeverința medicală NU -carnetul de legitimare |"
        ],
        "response": "# Documente necesare pentru înmatriculare\n\nPentru înmatricularea candidaților admiși, sunt necesare următoarele documente:\n\n1. **Certificatul de naștere** al candidatului (original și copie).\n2. **Act de identitate** (Carte de identitate sau Pașaport) aflat în perioada de valabilitate la data înscrierii; dacă acesta a expirat, se va prezenta o copie după vechiul act de identitate și originalul noului act.\n3. **3 fotografii color** pe hârtie fotografică (tip pașaport/CI, recente, identice, dimensiune 3x4 cm), cu numele, inițiala tatălui și prenumele scrise pe spate.\n4. **Diploma de Bacalaureat** (sau diploma echivalentă) însoțită de foaia matricolă (original).\n5. **Documente care să ateste rezultatele obținute** la concursurile de profil, dacă este cazul (original).\n6. **Dovada achitării taxei de înscriere** la concurs sau dovada scutirii de plată a acestei taxe (original).\n7. **Cererea de înscriere** la concurs semnată de candidat (original).\n8. **Declarație pe proprie răspundere** semnată de candidat, privind veridicitatea datelor și documentelor furnizate (original).\n9. **Adeverință medicală** din care să rezulte că este apt medical (original).\n10. **Dovada achitării taxei de înmatriculare**, care este de 50 lei (original).\n\nTaxa de înmatriculare se poate achita online sau direct la sediul facultății.\n\nSurse:\n- Regulament admitere licență 2025, URL: https://upb.ro/wp-content/uploads/2024/12/Regulament_admitere_licenta_2025.pdf, pagina: 98\n- URL: https://energ.upb.ro/admitere/licenta/informatii-admitere",
        "faithfulness": "0.9333333333333333"
    },
    {
        "id": "1315a041d3d3f5fd92fd7bbb3a8e5cdbd5278965982ff90aba4a35f5a5a1d533",
        "user_input": "Ce documente sunt necesare pentru inscrierea la examenul de admitere?",
        "retrieved_contexts": [
            "Candidați vor pregăti pentru examenul de admitere o prezentare bazată pe propunerea de tematica pentru studiile doctorale (PhD proposal) în limba română sau în limba engleză după modelul acesta [prezentare]. Pasul 5: Înmatriculare Rezultatele concursului de admitere sunt validate și afișate pe pagina de admitere a SD-AC (vezi calendarul admiterii). Toți candidații declarați admiși se vor înmatricula online în termen de 48 de ore de la data afișării rezultatelor (condiționată de prezentarea dovezii privind absolvirea unui program de masterat (diplomă de masterat sau adeverință de absolvire, foaie matricolă)). Înmatricularea constă în încărcarea pe platforma de admitere a dovezii de plată a taxei de înmatriculare în valoare de 50 RON. Aceasta se achită online, toate informațiile necesare fiind disponibile în platformă. Toți candidații declarați admiși vor completa și semna olograf contractul de studii universitare de doctorat până la începutul anului universitar. Pentru candidații străini din țări UE și non-UE Pentru candidații cetățeni ai statelor UE înscrierile se fac în conformitate cu: https://international.upb.ro/international-students/applying/students-from-eu-countries Pentru candidații cetățeni ai statelor non-UE înscrierile se fac în conformitate cu: https://international.upb.ro/international-students/applying/students-from-non-eu-countries Candidații străini vor urma aceleași proceduri și același flux de validare a dosarelor și admitere ca cetățenii români. Aceștia se pot prezenta la concursul de admitere începând cu luna iulie după validarea actelor de înscriere.",
            "10 11 12 Dovada achitării taxei de înmatriculare (vezi Anx. VIII-5). 13 Anx. VIII-2. Pentru candidații care sunt deja absolvenți (cu sau fără diplomă) ai unei instituții de învățământ superior, care s-au înscris la concursul de admitere în 2025 pentru a se școlariza într-un alt domeniu și care au fost declarați admiși, sunt necesare documentele specificate în tabelul Anx. VIII-1 la care se mai adaugă și documentele din tabelul de mai jos.",
            "| Pachet de documente necesar validării dosarului de concurs şi ulterior înmatriculării candidaților admişi anticipat | Rămâne în dosarul candidatului înmatriculat |\n|:--|:--|\n| Diploma de Bacalaureat (sau diploma echivalentă cu aceasta) însoțită de foaia matricolă Original ***Notă | Da pt. candidații: - pre-admişi; - admişi în etapa de completare |\n| Pentru candidații care au promovat examenul de Bacalaureat în 2025, dacă liceul nu a eliberat diploma până la data înmatriculării, în locul diplomei de Bacalaureat se admite, în original, adeverința eliberată de liceu în care se menționează atât media generală, cât și notele obținute la probele susținute. Foaia matricolă în original este, şi în acest caz, necesară. | (Sesiunea I+) |\n| Certificatul de naștere al candidatului. Originalul documentului din Tabelul Anx.IV-2 — Punctul 01 | |\n| Act de identitate candidat (Carte de identitate sau Pașaport) aflat în perioada de valabilitate la data înscrierii, iar dacă acesta a expirat, o copie după vechiul act de identitate și originalul noului act. Originalul documentului din Tabelul Anx.IV-2 — Punctul 02. | |\n| 3 fotografii color, pe hârtie fotografică (tip pașaport/Cl, recente, identice, dimensiune 3x4 cm). | |\n| Situație şcolară, adeverință, foaie matricolă sau alt document/documente emis/emise de liceul de la care provine candidatul, în care sunt specificate mediile obținute de candidat, în timpul liceului, la disciplinele selectate pentru proba PI și, respectiv, P2, cât și mediile generale obținute de către acesta în clasele a IX-a, a X-a și a XI-a pentru proba P3. Originalul documentelor din Tabelul Anx.IV-2 — Punctul 04. | |\n| Dacă este cazul, documente care să ateste rezultatele obținute de candidat la o serie de activități suplimentare pe care acesta le-a desfăşurat în anii de liceu. Originalul documentelor din Tabelul Anx.IV-2— Punctul 05. și/sau, acolo unde este cazul, Originalul documentelor corespunzătoare prevăzute în Anexa VI. — Admiterea olimpicilor și a candidaților cu rezultate deosebite. | |\n| Dovada achitării taxei de înscriere la concurs sau dovadă prin care să reiasă faptul că poate fi scutit de această taxă. Originalul documentelor din Tabelul Anx.IV-2— Punctul 06. | |\n| Cererea de înscriere la concurs semnată de candidat. Originalul documentelor din Tabelul Anx.IV-2— Punctul 07. | |\n| Declarație pe proprie răspundere, semnată de candidat, privind veridicitatea datelor și a documentelor furnizate de acesta în cadrul procesului de înscriere. Originalul documentelor din Tabelul Anx.IV-2 — Punctul 08. | |\n| Adeverința medicală din care să rezulte că este apt medical sau, dacă este cazul, carnetul de legitimare. Notă: Pentru sportivi, adeverința medicală poate fi suplinită de carnetul de legitimare cu viza medicală în termen de valabilitate pe perioada examenului de admitere Originalul documentului din Tabelul Anx.IV-2— Punctul 09. | Da - adeverința medicală NU -carnetul de legitimare |\n| Pentru candidații care au optat la programe de studii şcolarizate în limbi străine (engleză, franceză, germană), dacă este cazul, documentul/documentele care fac dovada cunoaşterii limbii respective. Originalul documentelor din Tabelul Anx.IV-2— Punctul 10. | |\n| Pentru candidații care au optat la domeniul Ştiințe ale educației, eseul motivațional al candidatului relativ la capacitatea, dorința și determinarea acestuia de a urma studiile în cadrul domeniului Ştiințe ale educației. Pentru candidații care optează la domeniul Teologie, Binecuvântarea Înaltpreasfințitului Părinte Arhiepiscop sau, după caz, Episcop, ierarhul eparhiei din care provine candidatul (de unde are domiciliul), în vederea înscrierii la Facultatea de Teologie, Litere, Istorie și Arte. Originalul documentului din Tabelul Anx.IV-2— Punctul 11. | |\n| Dovada achitării taxei de înmatriculare (vezi Anx.V-5). Original | |",
            "Anx.VII-8. Pentru candidații care sunt deja absolvenți (cu sau fără diplomă) ai unei instituții de învățământ superior și doresc să se înscrie la concursul de admitere în 2025 pentru a se școlariza într-un alt domeniu sunt necesare documentele specificate în tabelul Anx. VII-7 la care se mai adaugă și documentele din tabelul de mai jos",
            "Pentru candidații admiși preliminar toate acțiunile din Faza III se desfășoară la facultatea la care s-a înscris și a fost admis. Ses. II-5.57. La facultatea la care a fost admis preliminar: 1. Candidații care s-au înscris on line completează personal dosarul fizic de admitere ce conține documentele menționate în Anexa VII. Acestea sunt în cea mai mare parte originalele documentelor solicitate electronic în timpul înscrierii on-line. Comisia locală de admitere analizează și după caz validează dosarul de admitere. Candidații care s-au înscris direct la secretariatele facultăților au deja dosarul complet și validat. 2. Candidații cu dosarul de admitere completat și validat confirmă dorința de a ocupa locul obținut preliminar prin: • Completarea cererii de înscriere în anul I; • Depunerea diplomei de Bacalaureat în original dacă a obținut un loc finanțat de la buget; • Plata on-line a 500*** 8 lei din taxa de școlarizare (aproximativ ¼ din 7F taxa de școlarizare pentru primul semestru) dacă a fost admis pe un loc cu taxă; • Plata on-line a taxei de înmatriculare în anul I (50lei); 3. În continuare, dacă un candidat care a parcurs cu succes confirmarea locului obținut nu dorește să participe la glisare (internă) în etapa II, el • Rămâne cu locul deja confirmat; • Semnează contractul de studii. Dacă însă, suplimentar, el dorește să participe la glisare (internă) în conformitate cu opțiunile de la înscriere, atunci: • Marchează pe cererea de înscriere că dorește să participe la glisare și confirmă astfel că este de acord să fie promovat pe un loc dintr-o triadă FaDoFi superioră (de la facultatea la care a fost declarat admis) în ierarhia sa de opțiuni, caz în care va fi înscris la noul domeniu și/sau după caz noua formă de finanțare. În acest caz se activează clauzele de modificare automată (în urma glisării interne) a cererii de înscriere;"
        ],
        "response": "Pentru înscrierea la examenul de admitere, candidații trebuie să prezinte următoarele documente:\n\n1. **Diploma de Bacalaureat** (sau diploma echivalentă) însoțită de foaia matricolă, în original.\n2. **Certificatul de naștere** al candidatului, original.\n3. **Act de identitate** (Carte de identitate sau Pașaport) aflat în perioada de valabilitate, original.\n4. **3 fotografii color** recente, pe hârtie fotografică (tip pașaport, dimensiune 3x4 cm).\n5. **Situație școlară** (adeverință, foaie matricolă) emisă de liceul de proveniență, în original.\n6. **Documente care atestă rezultatele** obținute la activități suplimentare, dacă este cazul, în original.\n7. **Dovada achitării taxei de înscriere** la concurs, în original.\n8. **Cererea de înscriere** la concurs, semnată de candidat, în original.\n9. **Declarație pe proprie răspundere** privind veridicitatea datelor și documentelor furnizate, semnată de candidat, în original.\n10. **Adeverința medicală** care să ateste că este apt medical, în original.\n11. **Documente care fac dovada cunoașterii limbii** respective, pentru candidații care optează pentru programe în limbi străine, în original.\n12. **Eseul motivațional** pentru candidații care optează la domeniul Științe ale educației, în original, dacă este cazul.\n\nAceste documente sunt necesare pentru validarea dosarului de concurs și ulterior pentru înmatricularea candidaților admiși.\n\nSurse:\n- Regulament admitere licență 2025, URL: https://upb.ro/wp-content/uploads/2024/12/Regulament_admitere_licenta_2025.pdf, pagina: 75",
        "faithfulness": "0.9333333333333333"
    },
    {
        "id": "1a7ea8c41e01ad35b4d68c28ba3848c03acdce96b39ea48e5b7aa998e435a17f",
        "user_input": "Cate locuri sunt disponibile pentru admiterea la ACS?",
        "retrieved_contexts": [
            "ACS optimizează orarele de master – fizic/online – în funcție de necesități, ținând cont de reglementările naționale și deciziile Senatului UPB. Admiteri anterioare Informativ, rezultatele admiterii din anii anteriori sunt disponibile aici: 2022, 2023, 2024. Programe de studii ACS oferă 25 programe de studii universitare de masterat acreditate ARACIS în domeniile: - CTI (Calculatoare și Tehnologia Informației) – 13 programe - IS (Ingineria Sistemelor) – 11 programe - IM (Inginerie și Management) – 1 program Broșura master (în curs de actualizare cu noile programe) oferă informații sintetice despre masterat și despre fiecare program. În continuarea acestei pagini sunt prezentate programele și descrierile cursurilor. Versiunea preliminară a planurilor de învățământ este disponibilă AICI. Până la începerea anului școlar pot interveni modificări minore ale planurilor de învâțământ. Calculatoare și Tehnologia Informației | Nr. crt. | Nume program master | ||| | 1. | Arhitecturi Avansate de Calculatoare | ||| | 2. | Administrarea Bazelor de Date | ||| | Catedra organizatoare: Calculatoare Responsabil: Prof.Dr.Ing. Florin Radulescu Tip: Aprofundare / Cercetare avansata Informaţii: Scurtă descriere, Plan învăţământ, Cursuri Pentru a putea urma acest program de masterat, sunt necesare studii de licență într-unul din următoarele domenii: Domeniul fundamental Stiinte ingineresti , domeniile: Calculatoare si Tehnologia Informatie (specializarile Calculatoare , Tehnologia Informatiei , Ingineria Informatiei), Inginerie electronica si telecomunicatii, Ingineria sistemelor (specializarile Automatica si informatica aplicata, Ingineria sistemelor multimedia) , Stiinte Ingineresti Aplicate (specializarile Matematica si informatica aplicata in inginerie)",
            "Din cei 40 candidați admiși la taxă s-au înmatriculat 31, rămânând disponibile pentru următoarea sesiune de admitere 9 locuri la taxă (IA.X). Pentru candidații din licee rurale 1 loc a fost ocupat prin înmatriculare și mai sunt 5 locuri disponibile (4 la IA și 1 la IAen). La românii de pretutindeni există 17 candidați admiși în principiu, dosarele lor fiind în lucru la Biroul de Studenți Internaționali. Îi vom afișa când procedura lor va fi completă. Rezultate Admitere iulie 2019 Etapa I După etapa I de admitere s-au ocupat 220 locuri din 220 la IA buget, 40 locuri din 40 la IA taxă, 1 loc la IA liceu rural. Au rămas disponibile 5 locuri rezervate pentru absolvenții liceelor rurale. Important pentru concursul din 22-23 iulie 2019 Rezultatele concursului sunt vizibile online pe admitere.pub.ro cu CNP-ul candidatului. Listele se vor afișa la avizier pe 24 iulie 2019 dimineața și de asemenea sunt afișate mai sus. Candidații declarați admiși sunt rugați să se înmatriculeze la Secretariat miercuri 24 sau joi 25 iulie 2019, orele 8-18, altfel locurile respective devin vacante. Pe ele vor avansa candidații admiși la taxă care au optat pentru buget, dar care n-au obținut în primă instanță media necesară. Pentru locurile vacante la taxă se va organiza o a doua etapă de admitere dacă va fi cazul. Candidații respinși de asemenea sunt rugați să-și retragă dosarul în aceeași perioadă. Candidații respinși cu barem se pot înmatricula la facultățile unde au fost redistribuiți. Candidații respinși cu barem care nu au optat pentru alte facultăți se pot înscrie cu această medie obținută în sesiunea a II-a la orice facultate din UPB care mai are locuri disponibile. *** Concursul va avea loc în Campus Polizu în sălile afișate pe site-ul Admitere UPB și la avizier.",
            "Regulament [Link] Către platforma de inscriere Programele de master ale FSA (domeniul: Ştiințe Inginerești Aplicate) Număr de locuri disponibile: - 100 Buget - 20 Taxă Calendarul sesiunilor de admitere: Sesiunea I Admitere anticipată - Înscrierea candidaților: 15.12.2024 – 10.05.2025 (Taxa înscriere: 50 RON) - Concurs de admitere: 13.05 – 16.05.2025 - Comunicarea rezultatelor: 13.05 – 17.05.2025 - Înmatricularea candidaților: 01.07 – 31.07.2025 Sesiunea II Iulie 2025 - Înscrierea candidaților: 1.07 – 8.07.2025 - Concurs de admitere: 10.07 – 12.07.2025 - Comunicarea rezultatelor: 10.07 – 12.07.2025 - Înmatricularea candidaților: 10.07 – 31.07.2025 Sesiunea III Septembrie 2025 - Înscrierea candidaților: 2.09 – 13.09.2025 - Concurs de admitere: 16.09 – 17.09.2025 - Comunicarea rezultatelor: 16.09 – 18.09.2025 - Înmatricularea candidaților: 16.09 – 20.09.2025",
            "Admitere licență - informații Regulamentul privind organizarea și desfășurarea concursului de admitere în ciclul de studii universitare de licență anul universitar 2025-2026 poate fi consultat prin accesarea https://admitere.pub.ro/. Admitere anticipată CalendarBuget: 320 locuri Numărul de locuri disponibile în Sesiunea I pentru candidații care participă la admiterea anticipată prin concurs este limitat. Candidații eligibili vor fi declarați admiși anticipat (prin concurs), în limita locurilor menționate anterior și li se va garanta locul dacă promovează examenul de Bacalaureat și parcurg cu succes Faza III - Validare, confirmare, înscriere în anul I și înmatriculare. **DOMENIUL: Inginerie Energetică ** PROGRAME DE STUDIU: - Energetică şi Ingineria Fluidelor - Energetică şi Tehnologii Informatice - Energetică şi Tehnologii de Mediu - Energetică şi Tehnologii Nucleare - Ingineria Sistemelor Electroenergetice - Managementul Energiei - Termoenergetică (*) Studenţii vor fi repartizaţi pe specializările domeniului Inginerie Energetică la sfârşitul anului II de studii. - Faza 1 - Înscriere online la sesiunea curentă 15.12.2024 - 02.06.2025În Sesiunea I – Admitere anticipată un candidat se poate înscrie la o singură facultate din UNSTPB (facultatea de bază) și va plăti on-line o singură taxă de înscriere*. Înscrierea se face pe platforma https://admitere.pub.ro/. Pachetul de documente necesar înscrierii candidaților: - Certificatul de naștere al candidatului (copie scanată/fotografie, format *.jpg sau *.pdf) încărcată on-line în platforma https://admitere.pub.ro. - Act de identitate candidat (Carte de identitate sau Pașaport) aflat în perioada de valabilitate la data înscrierii – copie scanată/fotografie, format *.jpg sau *.pdf, încărcată on-line în platforma https://admitere.pub.ro - 1 fotografie (tip pașaport/CI, color, minim 2MP, format *.jpg) încărcată on-line în platforma https://admitere.pub.ro.",
            "Cifra de școlarizare solicitată pentru anul universitar 2025 – 2026: – 270 locuri – Buget + granturi acordate de universitate: - 213 locuri – Inginerie electrică – IE (în limba română) - 55 locuri – Inginerie Electrica si Calculatoare / Electrical Engineering and Computers – IEC (în limba engleză) - 2 locuri – Inginerie electrică – IE (în limba română) – locuri școlarizate în beneficiul SRI (Serviciul Român de Informații) (se scot la concurs în sesiunea a II-a) – 50 locuri – Taxă: - 45 locuri – Inginerie electrică (în limba română) - 5 locuri – Inginerie Electrica si Calculatoare / Electrical Engineering and Computers (în limba engleză) * Concursul de admitere se organizează în trei sesiuni: - sesiunea de admitere anticipată: 200 locuri buget + granturi acordate de universitate IE + 50 locuri buget + granturi acordate de universitate IEC; - înscrierea candidaṭilor, 15 decembrie 2024 – 2 iunie 2025; - test opțional UPB de limbă engleză, 21 martie 2025 sau 23 mai 2025; - comunicarea rezultatelor, 11 iunie 2025; - înmatricularea candidaṭilor, 2 – 4 iulie 2025 – conform programării transmisă prin email fiecărui candidat. - sesiunea din iulie: locuri rămase libere după sesiunea de admitere anticipată: … locuri buget + granturi acordate de universitate IE, – locuri buget + granturi acordate de universitate IEC; 2 locuri buget IE-SRI, … locuri taxă IE și … locuri taxă IEC; - înscrierea candidaṭilor: ………………. 2025, ora 16,00 (online până în ………………. 2025, ora 12,00); - test opțional UPB de limbă engleză ………………. 2025; - comunicarea rezultatelor: ………………. 2025; - înmatricularea candidaṭilor: ………………. 2025. - sesiunea din septembrie: locuri rămase libere după sesiunile de admitere anticipată și iulie. - înscrierea candidaṭilor: se va anunța ulterior. - dosarele se vor analiza conform regulamentului afișat pe admitere.pub.ro, în ordinea înscrierii pe platformă."
        ],
        "response": "Pentru admiterea la ACS, sunt disponibile 100 de locuri la buget și 20 de locuri la taxă, conform informațiilor disponibile pe site-ul oficial al FSA.\n\nSurse:\n- URL: http://fsa.pub.ro/admitere-master",
        "faithfulness": "0.0"
    },
    {
        "id": "b836cdfd91f703a4e7f93002e7f77108d213a58066d8d1dc64cf678490fc0a8e",
        "user_input": "Cand are loc testul online de limba de la Politehnica?",
        "retrieved_contexts": [
            "Candidații care la înscriere optează pentru un domeniu cu limbă de predare engleză, franceză sau germană și care aleg să probeze cunoașterea respectivei limbi prin promovarea testului POLITEHNICA București, vor susține acest test on-line, la data de 21 martie 2025 (dată valabilă pentru toți candidații) sau 23 mai 2025 (această a doua dată este valabilă doar pentru candidații înscriși la facultățile la care admiterea anticipată este pe baza rezultatelor la activitățile școlare (dosar)). Detalii privind organizarea sa pot fi găsite la https://admitere.pub.ro. Ses. I-4.9. La înscriere, în formularul tipizat menționat anterior, în ordinea preferințelor sale, candidatul poate face opțiuni privind domeniile (numai de la facultatea la care s-a înscris) la care acesta dorește să fie pre-admis. În Sesiunea I sunt disponibile numai locuri cu finanțare de la buget. Ses. I-4.10. Fiecărui candidat cu dosar de înscriere validat de comisia locală i se întocmește o legitimație de concurs, cu fotografie. Candidații descarcă legitimația de concurs din aplicația de admitere (din contul propriu). Pe întreaga perioadă de desfășurare a concursului de admitere cu probe scrise sau vocaționale (c-s, c-v, c-m) și pe durata interacțiunii directe cu comisiile locale de admitere, candidații vor avea asupra lor cartea de identitate și legitimația de concurs. Ses. I-4.11.",
            "Candidații care la înscriere optează și pentru un domeniu cu limbă de predare engleză, franceză sau germană și care aleg să probeze cunoașterea respectivei limbi prin promovarea testului POLITEHNICA București, vor susține acest test on-line, la data de 10 iulie 2025 (dată valabilă pentru toți candidații) sau 18 iulie 2025 (această a doua dată este valabilă doar pentru candidații înscriși la facultățile la care admiterea anticipată este pe baza rezultatelor la activitățile școlare (dosar)(c-rs)) . Detalii privind organizarea sa pot fi găsite la https://admitere.pub.ro. Ses. II-5.11. Candidații care la înscriere optează pentru (și pentru) triade FaDoFi pentru care școlarizarea se realizează în beneficiul SRI trebuie să fi parcurs cu succes etapa suplimentară de înscriere și evaluare specifică la beneficiar. Ses. II-5.12. Fiecărui candidat cu dosar de înscriere validat de comisia locală i se întocmește o legitimație de concurs, cu fotografie. Candidații descărcată legitimația de concurs din aplicația de admitere (din contul propriu). Pe întreaga perioadă de desfășurare a concursului de admitere cu probe scrise, cu probe vocaționale sau cu probe mixte precum și pe durata interacțiunii directe cu comisiile locale de admitere, candidații vor avea asupra lor cartea de identitate și legitimația de concurs. Ses. II-5.13. După încheierea perioadei de înscriere la concursul de admitere, Comisiile locale de admitere vor publica on-line, cel mai târziu în preziua desfășurării probelor scrise sau vocaționale, listele nominale ale candidaților înscriși, ordonați alfabetic și repartizați pe săli, denumirea, data și ora începerii probelor scrise/vocaționale, precum și durata de desfășurare a acestora. Pag. 36 Universitatea Națională de Știință și Tehnologie POLITEHNICA București REGULAMENTUL Concursului de Admitere în Ciclul de Studii Universitare de Licență 2025 Ses. II-5.14.",
            "româna II. Am ales să susțin testul, ce trebuie să fac? 1. Mă înscriu (anunț cine sunt și pentru ce limbă susțin testul). 2. Obțin accesul la platforma on-line de test. 3. Susțin testul. 4. Primesc rezultatul. III.Etapele testului on-line POLITEHNICA București A – Înscriere Candidații trebuie să se înscrie pentru a putea susține testul on-line POLITEHNICA București din data de 23 mai 2025 prin completarea formularului de la adresa https://forms.office.com/e/2AWesNbYr9 Adresa de e-mail completată in formular trebuie să fie aceeași adresa de e-mail pe care candidatul a utilizat-o sau o va utiliza în cadrul procesului de înscriere la concurs de pe pagina http://admitere.pub.ro/. Formularul trebuie completat până cel târziu pe 21 mai 2025 ora 12:00. Toate câmpurile din formular sunt obligatorii! Candidații care nu au completat la timp si în integralitate formularul nu vor putea susține testul on-line POLITEHNICA București. B – Obținere date acces În urma completării formularului, candidatul va primi pe adresa de e-mail pe care a utilizat- o un e-mail care va conține următoarele informații necesare pentru susținerea testului on-line: 1. Link accesare platformă test de limbă on-line; 2. User și parolă necesare pentru accesarea testului propriu-zis. E- mailul se va trimite pe data de 21 mai 2025, după ora 14:00 C – Susținerea testului de limbă Candidatul accesează platforma în care va susține testul on-line POLITEHNICA București folosind datele de la punctul anterior. Testul pentru limba engleză începe la ora 10:00. Testul pentru limba germană începe la ora 12:00. Testul pentru limba franceză începe la ora 14:00. Testul devine disponibil pentru dvs. la ora programată mai sus. Pentru pornirea testului, formularea răspunsurilor, precum și pentru încărcarea acestora, aveți la dispoziție cel mult 100 min (contorizate din momentul în care dvs. ați pornit testul). Testul se va închide automat după 120 min de la ora de început programată, chiar daca nu l-ați finalizat între timp. D – Primire rezultate",
            "Proba A, B sau C de la examenul de Bacalaureat, (încărcați diploma de bacalaureat la certificat lingvistic) - Disciplina de tip „limba străină” promovată în liceu cu media cel puțin 8,00 (în clasele a IX-a, a X-a și a XI-a) (încărcați foaia matricolă la certificat lingvistic) - Test POLITEHNICA București (încărcați emailul cu rezultatul la certificat lingvistic) - 21 Martie 2025 (dată valabilă pentru toți candidații) vor avea grijă să se programeze (detalii aici) până cel târziu pe 19 Martie 2025, ora 12:00 - 23 Mai 2025 (această a doua dată este valabilă doar pentru candidații înscriși la facultățile la care admiterea anticipată se face prin concurs pe baza rezultatelor la activitățile școlare (dosar) vor avea grijă să se programeze până cel târziu pe 21 Mai 2025, ora 12:00 (detalii aici). - Modele de teste : engleza , franceza , germana Sesiunea I admitere anticipată Specificul, condițiile de participare, organizarea și desfășurarea acestei sesiuni se găsesc în Regulament, Capitolul IV. Această sesiune este dedicată: A Candidaților elevi sau absolvenți olimpici și celor cu rezultate deosebite în cadrul concursurilor de profil desfășurate pe parcursul liceului. Aceștia sunt candidați pentru Admitere anticipată fără concurs. Olimpiadele și concursurile luate în considerare sunt descries mai jos, in sectiunea Structura probei de concurs P3 și calculul notei NB în Sesiunea I B Candidaților elevi sau absolvenți care doresc garantarea anticipată (prin pre-admitere) a unui loc pentru studii în POLITEHNICA București. Aceștia sunt candidați pentru Admitere anticipată prin concurs. La FILS se face printr-un concurs pe dosar bazat pe 3 probe (P1, P2 și P3). Probele P1+P2 reprezintă 80% din media generală, iar proba P3, 20% din media generală. Pentru proba P1 se vor lua în considerare mediile din liceu din clasele IX- XI, la disciplina Matematică.",
            "Art. 21. Programul detaliat de desfășurare a probelor de concurs se afișează cel mai târziu în preziua probelor. În cazul în care probele se desfășoară online, se va indica și ora aproximativă de intrare la examen a fiecărui candidat. În cazul probelor desfășurate cu prezență fizică, se va indica ora de începere a examenului și ora la care toți candidații trebuie să fie prezenți în sală. Art. 22. Candidații care participă la o probă de concurs orală care se desfășoară on-line trebuie: (a) să declare la începerea probei ca sunt de acord ca proba să fie înregistrată și (b) să declare la începerea probei că toate răspunsurile vor fi personale și că respectă Codul de etică și deontologie profesională al Universității Naționale de Știință și Tehnologie POLITEHNICA București Art. 23. Candidații care săvârșesc orice act fraudulos sunt exmatriculați din concurs, în urma deciziei Comisiei de admitere a facultății. Art. 24. Rezultatele concursului, pentru fiecare din cele trei sesiuni de admitere, verificate și aprobate de Comisia de admitere a facultății, vor fi transmise semnate electronic sau olograf la Rectorat, în format centralizat (situația centralizatoare) și de tip catalog. Reprezentanții Comisiei de admitere a facultății vor verifica corectitudinea întocmirii cataloagelor și vor asigura semnarea acestora. Art. 25. Eventualele contestații se depun în termen de 24 ore de la afișarea rezultatelor concursului de admitere, iar rezultatul acestora se anunță în cel mult 24 de ore de la încheierea termenului de depunere a contestațiilor. Modalitatea de depunere a contestațiilor va fi afișată pe site-ul fiecărei facultăți. Art. 26. Pentru rezolvarea contestațiilor depuse de candidați, decanul facultății numește comisii, formate din 2 cadre didactice de specialitate, altele decât cele care au participat la probele de concurs."
        ],
        "response": "Testul online de limbă de la Politehnica București are loc în două date: \n1. **21 martie 2025** - această dată este valabilă pentru toți candidații. \n2. **23 mai 2025** - această a doua dată este valabilă doar pentru candidații înscriși la facultățile la care admiterea anticipată se face pe baza rezultatelor la activitățile școlare (dosar). Detalii suplimentare pot fi găsite pe site-ul oficial al universității.\n\nSurse:\n- Regulament admitere licență 2025, URL: https://upb.ro/wp-content/uploads/2024/12/Regulament_admitere_licenta_2025.pdf, pagina: 26\n- Test limbă străină 23-05 detalii S1 2025, URL: https://fils.upb.ro/wp-content/uploads/2025/02/Test-limba-straina-23-05-detalii-S1-2025.pdf, pagina: 1",
        "faithfulness": "0.75"
    },
    {
        "id": "3ec86f6a18a186a02a112b9c2c0af900853e2adc5ff89194721b463e4d30b228",
        "user_input": "Ce documente sunt necesare pentru a demonstra cunostintele lingvistice la inscrierea la un program de studii in limba engleza?",
        "retrieved_contexts": [
            "| Pentru candidații care au optat la programe de studii școlarizate în limbi străine (engleză, franceză, germană), dacă este cazul, documentul/documentele care fac dovada cunoașterii limbii respective. Originalul documentelor din Tabelul Anx.VII-2— Punctul 10. |\n|:--|\n| Pentru candidații care au optat la domeniul Ştiințe ale educației, eseul motivațional al candidatului relativ la capacitatea, dorința și determinarea acestuia de a urma studiile în cadrul domeniului Ştiințe ale educației. Pentru candidații care optează la domeniul Teologie, Binecuvântarea Înaltpreasfințitului Părinte Arhiepiscop sau, după caz, Episcop, ierarhul eparhiei din care provine candidatul (de unde are domiciliul), în vederea înscrierii la Facultatea de Teologie, Litere, Istorie și Arte. Pentru candidații care au optat la domeniul Inginerie industrială — învățământ dual eseul motivațional al candidatului relativ la capacitatea, dorința și determinarea acestuia de a urma studiile universitare în forma de organizare dual, având în vedere particularitățile învățării prin muncă Originalul documentului din Tabelul Anx.IV-2— Punctul 11. |\n| Dovada achitării taxei de înmatriculare (vezi Anx.VIII-3). Original |\n| Pentru candidații care au fost admiși pe un loc cu taxă sau care participă la glisare având activate opțiuni cu taxă, dovada achitării parțiale a taxei de şcolarizare în anul I (vezi Anx.VIII-6). Original ***Notă Pentru candidații care în urma procesului de glisare sunt înmatriculați pe un loc la buget, sau în cazul în care candidatul solicită retragerea de la studiile universitare de licență, din motive personale, acest avans nu se restituie. |",
            "Despre testul de limbă on-line POLITEHNICA București din data de 23 mai 2025 L Ce este cu acest test? Am nevoie de el? Dacă doresc să beneficiez de avantajele studiului într-una din limbile de largă circulație (engleză, franceză, germană) și în lista mea de opțiuni includ domenii la care școlarizarea se desfășoară într-una din acest limbi, trebuie, conform legii, să fac dovada că am cunoștințele lingvistice necesare. Dovada se face folosind oricare dintre variantele de mai jos:",
            "| Varianta | Cum dovedesc la înscriere | Este necesar să susțin testul de limbă POLITEHNICA Bucureşti? |\n|:--|:--|:--|\n| Liceu absolvit în respectiva limbă de predare | Dacă acest lucru nu apare evident din celelalte documente furnizate la înscriere, am grijă să încarc o copie a unui document eliberat de liceu şi din care să reiasă că am urmat un program de studii în respectiva limbă | NU |\n| Certificat de competențe lingvistice pentru respectiva limbă de predare (minim B2); | Încarc o copie a certificatului | NU |\n| Disciplină de tip limbă străină promovată în liceu cu media cel puțin 8,00 (pentru clasele a IX- a,a X-a, a XI-a). | Încarc o copie a unui document eliberat de liceul urmat din care reiese acest lucru | NU |\n| Proba A, B sau C de la examenul de Bacalaureat; | Încare o copie completă a diplomei de Bacalaureat (inclusiv situația la examen) | NU |\n| Aleg să susțin testul de limbă POLITEHNICA Bucureşti; | Nu încarc nimic la înscriere | DA |\n| L La înscriere optez numai pentru domenii pentru care şcolarizarea se desfăşoară în româna | Nu încarc nimic la înscriere | NU |",
            "e) deţin certificat de competenţă lingvistică de limbă străină, conform solicitării instituţiei de învăţământ superior, în cazul în care au fost admişi la un program de studii organizat într-o limbă străină, după caz. Sunt exceptaţi cetăţenii străini care provin din ţări unde limba oficială este cea în care se efectuează cursurile şi care dovedesc, cu documente şcolare, că au urmat cursurile în limba de predare a programului de studii universitare. (2) Continuarea studiilor în instituţiile de învăţământ superior din România se va realiza în conformitate cu reglementările interne ale POLITEHNICA Bucureşti, cu condiţia respectării capacităţii de şcolarizare. (3) POLITEHNICA Bucureşti va transmite Ministerului Educaţiei solicitarea de continuare a studiilor, însoţită de avizul comisiei de echivalare a studiilor şi cu menţionarea anului de studiu în care urmează a fi înmatriculat studentul. (4) Continuarea studiilor în POLITEHNICA Bucureşti este condiţionată de obţinerea scrisorii de acceptare la studii, eliberată de Ministerul Educaţiei. (5) În cazul depăşirii perioadei de şcolarizare prevăzute pentru programul de studii la care studentul a fost admis, POLITEHNICA Bucureşti transmite Ministerului Educaţiei dosarul pentru emiterea unei noi scrisori de acceptare la studii. Dosarul va conţine următoarele documente: a) adresa oficială din partea instituţiei de învăţământ superior; b) copie după scrisoarea de acceptare la studii emisă iniţial în favoarea candidatului; c) adeverinţă privind situaţia şcolară a studentului. VIII. ÎNTRERUPEREA STUDIILOR, RETRAGEREA DE LA STUDII, EXMATRICULAREA (1) Studenţii români de pretutindeni pot beneficia de întreruperea studiilor, începând cu anul al II-lea de studii, pe o perioadă de cel mult 2 ani. Redobândirea statutului iniţial este posibilă numai pentru întreruperi de studii pentru caz medical, inclusiv maternitate. În celelalte situaţii reluarea studiilor se poate face doar cu plata taxei de şcolarizare în lei, în cuantumul stabilit pentru cetăţenii români, în conformitate cu regulamentele proprii ale fiecărei instituţii de învăţământ superior.",
            "• Numele și prenumele; • Facultatea, ciclul de studiu și anul de studiu; • Datele de contact; • Tipul mobilității: studiu sau plasament; Instituția gazdă, localitatea, țara; • Perioada deplasării. În această etapă, solicitantul va încărca următoarele documente, în format pdf: • Learning agreement; • Invitația oficială; • Situația școlară aferentă anilor de studiu efectuați/Adeverința de studii doctorale; • Atestatul lingvistic (EN/FR/DE); • Copie CI; • Extras cont bancar în Euro; • CV-ul tip Europass; • Scrisoarea de motivație redactată într-o limbă de circulație internațională. Această aplicație va fi încărcată în platforma https://travel.upb.ro cu minimum 30 zile înainte de efectuarea deplasării. Etapa 2: Cererea de deplasare a studenților, masteranzilor sau doctoranzilor va fi aprobată prin utilizarea semnăturii electronice avansată (AdES)de către: • Responsabilul ERASMUS+ din facultate (prodecan); • Direcția Informatizare și Resurse Umane; • Serviciul ERASMUS+. Etapa 3: Serviciul ERASMUS+, prin responsabilii procesului de deplasare, va genera Dispoziția Rectorului. Aceasta va fi aprobată prin utilizarea semnăturilor electronice calificate (QES) de către: • Serviciul ERASMUS+; • Controlul Financiar-Preventiv; • Direcția Financiar-Contabilă; • Rector. Dispoziția Rectorului se va aproba în termen de 5 zile lucrătoare, urmând ca după aprobarea acesteia solicitantul să fie informat prin e-mail ca procesul s-a finalizat cu succes și poate descărca documentul semnat. ANEXA II Lista candidaților la statutul de student Erasmus+ pentru mobilități de studiu (MS) / plasament (MP)"
        ],
        "response": "Pentru a demonstra cunoștințele lingvistice la înscrierea la un program de studii în limba engleză, candidații trebuie să prezinte unul sau mai multe dintre următoarele documente:\n\n1. **Liceu absolvit în respectiva limbă de predare**: Dacă acest lucru nu apare evident din celelalte documente furnizate la înscriere, este necesar să se încarce o copie a unui document eliberat de liceu care să ateste că au urmat un program de studii în limba engleză.\n2. **Certificat de competențe lingvistice**: Un certificat care atestă competența lingvistică în limba engleză, cu un nivel minim B2.\n3. **Disciplină de tip limbă străină promovată în liceu**: O copie a unui document eliberat de liceu care să demonstreze că au promovat o disciplină de tip limbă străină cu media cel puțin 8,00 (pentru clasele a IX-a, a X-a, a XI-a).\n4. **Proba de la examenul de Bacalaureat**: O copie completă a diplomei de Bacalaureat, inclusiv situația la examen, care să ateste promovarea probei de limbă străină.\n5. **Testul de limbă POLITEHNICA București**: Candidații pot alege să susțină testul de limbă organizat de POLITEHNICA București, fără a fi necesar să încarce alte documente la înscriere.\n\nEste important ca documentele să fie prezentate conform cerințelor instituției de învățământ superior, iar cetățenii străini din țări unde limba oficială este engleza sunt exceptați de la această cerință, cu condiția să dovedească că au urmat cursurile în limba de predare a programului de studii universitare.\n\nSurse:\n- Testul de limbă on-line POLITEHNICA București, URL: https://fils.upb.ro/wp-content/uploads/2025/02/Test-limba-straina-23-05-detalii-S1-2025.pdf, pagina: 1\n- Metodologie admitere și școlarizare, URL: https://www.fiir.upb.ro/Upload/Master/Admitere/2025/Metodologie_admitere-si-scolarizare_RP_septembrie-2024.pdf, pagina: 10",
        "faithfulness": "1.0"
    },
    {
        "id": "638b09dbf688329e136c700f2f7d28054fb1a6f70daef19e4f4d5391f17fd4f2",
        "user_input": "Cum pot sa ma inscriu la testul online de limba straina?",
        "retrieved_contexts": [
            "româna II. Am ales să susțin testul, ce trebuie să fac? 1. Mă înscriu (anunț cine sunt și pentru ce limbă susțin testul). 2. Obțin accesul la platforma on-line de test. 3. Susțin testul. 4. Primesc rezultatul. III.Etapele testului on-line POLITEHNICA București A – Înscriere Candidații trebuie să se înscrie pentru a putea susține testul on-line POLITEHNICA București din data de 23 mai 2025 prin completarea formularului de la adresa https://forms.office.com/e/2AWesNbYr9 Adresa de e-mail completată in formular trebuie să fie aceeași adresa de e-mail pe care candidatul a utilizat-o sau o va utiliza în cadrul procesului de înscriere la concurs de pe pagina http://admitere.pub.ro/. Formularul trebuie completat până cel târziu pe 21 mai 2025 ora 12:00. Toate câmpurile din formular sunt obligatorii! Candidații care nu au completat la timp si în integralitate formularul nu vor putea susține testul on-line POLITEHNICA București. B – Obținere date acces În urma completării formularului, candidatul va primi pe adresa de e-mail pe care a utilizat- o un e-mail care va conține următoarele informații necesare pentru susținerea testului on-line: 1. Link accesare platformă test de limbă on-line; 2. User și parolă necesare pentru accesarea testului propriu-zis. E- mailul se va trimite pe data de 21 mai 2025, după ora 14:00 C – Susținerea testului de limbă Candidatul accesează platforma în care va susține testul on-line POLITEHNICA București folosind datele de la punctul anterior. Testul pentru limba engleză începe la ora 10:00. Testul pentru limba germană începe la ora 12:00. Testul pentru limba franceză începe la ora 14:00. Testul devine disponibil pentru dvs. la ora programată mai sus. Pentru pornirea testului, formularea răspunsurilor, precum și pentru încărcarea acestora, aveți la dispoziție cel mult 100 min (contorizate din momentul în care dvs. ați pornit testul). Testul se va închide automat după 120 min de la ora de început programată, chiar daca nu l-ați finalizat între timp. D – Primire rezultate",
            "Candidații care la înscriere optează pentru un domeniu cu limbă de predare engleză, franceză sau germană și care aleg să probeze cunoașterea respectivei limbi prin promovarea testului POLITEHNICA București, vor susține acest test on-line, la data de 21 martie 2025 (dată valabilă pentru toți candidații) sau 23 mai 2025 (această a doua dată este valabilă doar pentru candidații înscriși la facultățile la care admiterea anticipată este pe baza rezultatelor la activitățile școlare (dosar)). Detalii privind organizarea sa pot fi găsite la https://admitere.pub.ro. Ses. I-4.9. La înscriere, în formularul tipizat menționat anterior, în ordinea preferințelor sale, candidatul poate face opțiuni privind domeniile (numai de la facultatea la care s-a înscris) la care acesta dorește să fie pre-admis. În Sesiunea I sunt disponibile numai locuri cu finanțare de la buget. Ses. I-4.10. Fiecărui candidat cu dosar de înscriere validat de comisia locală i se întocmește o legitimație de concurs, cu fotografie. Candidații descarcă legitimația de concurs din aplicația de admitere (din contul propriu). Pe întreaga perioadă de desfășurare a concursului de admitere cu probe scrise sau vocaționale (c-s, c-v, c-m) și pe durata interacțiunii directe cu comisiile locale de admitere, candidații vor avea asupra lor cartea de identitate și legitimația de concurs. Ses. I-4.11.",
            "Candidații care la înscriere optează și pentru un domeniu cu limbă de predare engleză, franceză sau germană și care aleg să probeze cunoașterea respectivei limbi prin promovarea testului POLITEHNICA București, vor susține acest test on-line, la data de 10 iulie 2025 (dată valabilă pentru toți candidații) sau 18 iulie 2025 (această a doua dată este valabilă doar pentru candidații înscriși la facultățile la care admiterea anticipată este pe baza rezultatelor la activitățile școlare (dosar)(c-rs)) . Detalii privind organizarea sa pot fi găsite la https://admitere.pub.ro. Ses. II-5.11. Candidații care la înscriere optează pentru (și pentru) triade FaDoFi pentru care școlarizarea se realizează în beneficiul SRI trebuie să fi parcurs cu succes etapa suplimentară de înscriere și evaluare specifică la beneficiar. Ses. II-5.12. Fiecărui candidat cu dosar de înscriere validat de comisia locală i se întocmește o legitimație de concurs, cu fotografie. Candidații descărcată legitimația de concurs din aplicația de admitere (din contul propriu). Pe întreaga perioadă de desfășurare a concursului de admitere cu probe scrise, cu probe vocaționale sau cu probe mixte precum și pe durata interacțiunii directe cu comisiile locale de admitere, candidații vor avea asupra lor cartea de identitate și legitimația de concurs. Ses. II-5.13. După încheierea perioadei de înscriere la concursul de admitere, Comisiile locale de admitere vor publica on-line, cel mai târziu în preziua desfășurării probelor scrise sau vocaționale, listele nominale ale candidaților înscriși, ordonați alfabetic și repartizați pe săli, denumirea, data și ora începerii probelor scrise/vocaționale, precum și durata de desfășurare a acestora. Pag. 36 Universitatea Națională de Știință și Tehnologie POLITEHNICA București REGULAMENTUL Concursului de Admitere în Ciclul de Studii Universitare de Licență 2025 Ses. II-5.14.",
            "Despre testul de limbă on-line POLITEHNICA București din data de 23 mai 2025 L Ce este cu acest test? Am nevoie de el? Dacă doresc să beneficiez de avantajele studiului într-una din limbile de largă circulație (engleză, franceză, germană) și în lista mea de opțiuni includ domenii la care școlarizarea se desfășoară într-una din acest limbi, trebuie, conform legii, să fac dovada că am cunoștințele lingvistice necesare. Dovada se face folosind oricare dintre variantele de mai jos:",
            "| Varianta | Cum dovedesc la înscriere | Este necesar să susțin testul de limbă POLITEHNICA Bucureşti? |\n|:--|:--|:--|\n| Liceu absolvit în respectiva limbă de predare | Dacă acest lucru nu apare evident din celelalte documente furnizate la înscriere, am grijă să încarc o copie a unui document eliberat de liceu şi din care să reiasă că am urmat un program de studii în respectiva limbă | NU |\n| Certificat de competențe lingvistice pentru respectiva limbă de predare (minim B2); | Încarc o copie a certificatului | NU |\n| Disciplină de tip limbă străină promovată în liceu cu media cel puțin 8,00 (pentru clasele a IX- a,a X-a, a XI-a). | Încarc o copie a unui document eliberat de liceul urmat din care reiese acest lucru | NU |\n| Proba A, B sau C de la examenul de Bacalaureat; | Încare o copie completă a diplomei de Bacalaureat (inclusiv situația la examen) | NU |\n| Aleg să susțin testul de limbă POLITEHNICA Bucureşti; | Nu încarc nimic la înscriere | DA |\n| L La înscriere optez numai pentru domenii pentru care şcolarizarea se desfăşoară în româna | Nu încarc nimic la înscriere | NU |"
        ],
        "response": "Pentru a te înscrie la testul online de limbă străină POLITEHNICA București, trebuie să urmezi următorii pași:\n\n1. **Înscriere**: Completează formularul de înscriere disponibil la adresa [https://forms.office.com/e/2AWesNbYr9](https://forms.office.com/e/2AWesNbYr9). Este important ca adresa de e-mail completată în formular să fie aceeași cu cea utilizată în procesul de înscriere la concurs pe pagina [http://admitere.pub.ro/](http://admitere.pub.ro/).\n2. **Termen limită**: Asigură-te că formularul este completat până cel târziu pe 21 mai 2025, ora 12:00. Toate câmpurile din formular sunt obligatorii, iar candidații care nu respectă acest termen nu vor putea susține testul.\n3. **Obținerea datelor de acces**: După completarea formularului, vei primi un e-mail pe adresa ta de e-mail, care va conține informațiile necesare pentru accesarea testului online, inclusiv linkul de acces, user și parolă. Acest e-mail va fi trimis pe 21 mai 2025, după ora 14:00.\n4. **Susținerea testului**: Accesează platforma de testare folosind datele primite și susține testul la ora programată. Testul pentru limba engleză începe la ora 10:00, pentru limba germană la ora 12:00, iar pentru limba franceză la ora 14:00. Vei avea la dispoziție 100 de minute pentru a răspunde la întrebări, iar testul se va închide automat după 120 de minute de la ora de început programată.\n\nSurse:\n- Detalii despre testul de limbă on-line POLITEHNICA București, URL: https://fils.upb.ro/wp-content/uploads/2025/02/Test-limba-straina-23-05-detalii-S1-2025.pdf, pagina: 1",
        "faithfulness": "1.0"
    },
    {
        "id": "fc5ae6a8590c0b7700d9810f751dbc80c5853a306db52bd838f1400f5a2d82f6",
        "user_input": "Ce tipuri de burse sunt disponibile la Politehnica?",
        "retrieved_contexts": [
            "Toate categoriile de burse se acordă la cererea studenților cu excepția burselor speciale, burselor de performanță II și III. Art. 4. (1) Informațiile privind modalitatea de accesare și acordare a burselor de la bugetul de stat se fac publice prin afișarea pe pagina web şi la facultățile din cadrul POLITEHNICII București, la începutul anului universitar. (2) Anunțurile pentru depunerea cererilor şi documentelor justificative în vederea obținerii unor categorii de burse vor fi publicate pe site-ul și la avizierul POLITEHNICII București/ fiecărei facultăți cu minimum 15 zile lucrătoare înainte de data-limită pentru depunerea acestora. Art. 5. Studentul POLITEHNICII București va depune la Secretariatul facultății, respectând data limită, dosarul în vederea obținerii bursei, ce trebuie să conțină următoarele documente,: a) cererea, însoțită de acordul de prelucrare a datelor cu caracter personal; b) copia cărții de identitate; c) documentele justificative specifice tipului de bursă solicitat. Art. 6. Se constituite, la nivelul Universității Naționale de Știință și Tehnologie POLITEHNICA București comisia centrală de atribuire a burselor, iar la nivelul fiecărei facultăți comisia de atribuire a burselor. Art.7. Comisia centrală de atribuire a burselor, prevăzută la art. 6, este formată din: a) Președinte: Prorectorul responsabil cu gestionarea resurselor; b) Directorul Direcției Generale Administrativ-Economice; c) Directorul Direcției Financiar-Contabile; d) Secretarul șef al universității/ Responsabil Probleme Sociale Studențești; e) Șeful Serviciului Social; Page 3 of 16 f) Un consilier juridic; g) Reprezentantul studenților în Consiliul de Administrație al POLITEHNICII București. Art. 8. Comisia centrală de atribuire a burselor are următoarele responsabilități:",
            "b. burse şi alte forme de sprijin studenților prin proiecte instituționale, fonduri nerambursabile sau din alte surse legal constituite, în conformitate cu metodologiile proprii. c. burse speciale, în baza unei metodologii aprobate de senatul universitar; d. premii, burse şi alte stimulente financiare studenților cu performanțe, respectiv, cu rezultate remarcabile în activitățile extrașcolare sau în activităţi culturale şi sportive, precum şi studenților în situație de risc. (6) POLITEHNICA București poate acorda granturi de studii şi burse românilor de pretutindeni și cetățenilor străini, în conformitate cu metodologiile proprii. Cuantumul bursei este stabilit prin hotărâre a senatului instituției de învățământ superior de stat, la propunerea consiliului de administrație. (7) Studenții pot beneficia și de alte burse, finanțate din bugetul POLITEHNICII București și din alte forme legal constituite, cuantumul acestora fiind stabilit prin hotărârea Senatului Universității, la propunerea Consiliului de Administrație; Page 2 of 16 (8) Studenții români și străini pot beneficia de burse, mobilități și alte drepturi, finanțate din contracte de finanțare externă nerambursabilă, câștigate de către POLITEHNICA București în competiții naționale și internaționale, în cuantumul prevăzut de aceste contracte. Art. 2. Perioada de acordare (1) Bursele, indiferent de categorie, se acordă pe toată durata anului universitar (12 luni), cu excepția burselor sociale ocazionale. Acordarea burselor încetează la data pierderii calității de student sau a neîndeplinirii criteriilor de promovabilitate, după caz. (2) Studenților înmatriculați în ultimul an de studiu al ciclurilor de studii de licență sau de masterat, care beneficiază de orice tip de bursă în ultimul semestru de studii al respectivului ciclu, li se acordă același tip de bursă/burse până la susținerea examenului de finalizare a studiilor în prima sesiune din anul universitar curent. (3) Prin excepție de la prevederile alin. (2), studenții înmatriculați în ultimul an de studiu pot beneficia de orice tip de bursă până la sfârșitul anului universitar curent, în situații temeinic justificate. CAPITOLUL II Atribuirea burselor Art. 3.",
            "(6) În cazul în care fondul pentru acordarea burselor sociale nu este utilizat în întregime, acesta se redistribuie pentru acordarea burselor de performanță. (7) Distribuirea burselor sociale se face în ordine crescătoare a venitului net pe membru de familie. (8) Sumele rămase în sold pentru facilități de transport pentru studenți, subvenții pentru cămine-cantine și sumele pentru bursele studenților neridicate în termen pot fi utilizate în anii următori pentru acordarea de burse pentru studenți, precum și pentru alte cheltuieli de natura investițiilor pentru infrastructura de cămine, cantine și pentru susținerea activităților centrelor pentru consiliere și orientare în carieră. Art. 35. Universitatea Națională de Știință și Tehnologie POLITEHNICA București poate suplimenta fondul pentru burse provenit de la bugetul de stat, pentru fiecare categorie de burse, cu fonduri provenite din venituri proprii. Art. 36. (1) Cuantumul burselor de performanță și al burselor pentru învățământ dual se aprobă prin hotărârea Senatului, la propunerea Consiliului de Administrație, ca urmare a consultării cu reprezentanții studenților, inclusiv a organizațiilor studențești reprezentative din POLITEHNICA București. (2) Universitatea Națională de Știință și Tehnologie POLITEHNICA București poate acorda sprijin financiar studenților cu rezultate deosebite, pentru participarea la conferințe sau publicarea de articole științifice, cu aprobarea Consiliului de Administrație. (3) Universitatea Națională de Știință și Tehnologie POLITEHNICA București poate acorda burse pentru stagii de studii universitare și postuniversitare, în vederea susținerii mobilităților temporare efectuate în universități și instituții din țară și străinătate. Decizia cu privire la acordarea burselor pentru stagii de studii universitare și postuniversitare, precum și stabilirea cuantumului acestora se ia de către Biroul Consiliului de Administrație al POLITEHNICII București. Page 13 of 16 CAPITOLUL IV Dispoziții finale Art. 37. În cazul în care există suspiciuni de falsificare a documentelor depuse pentru obținerea unei burse pentru ajutor social, POLITEHNICA București va sesiza organele de anchetă competente și va proceda la sancționarea studentului, în funcție de gravitatea faptei. Art. 38.",
            "MINISTERUL EDUCAȚIEI Universitatea Naţională de Ştiinţă şi Tehnologie POLITEHNICA Bucureşti (2) Înscrierea la Examenul de Diplomă/Examenul de Licenţăeste condiționată de acumularea ECTS aferente disciplinelor obligatorii şi opționale din planul de învățământ al programului formativ al studentului. (3) Media minimă de promovarea Examenului de Diplomă/Examenul de Licenţăeste 6. (4) Departamentele sunt obligate să stabilească titlurile temelor de Proiect de Diplomă/Lucrare de Licenţă şi conducătorii ştiințifici şi să facă repartizarea acestora conform opţiunilor studenţilor, cel mai tărziu în săptămâna a patra a penultimului semestru, conform criteriilor stabilite la nivelul facultăţii. (5) Modul de desfăşurare a Examenului de Diplomă/Examenul de Licenţă se face în conformitate cu regulamentul de organizare şi desfãşurare a examenelor de finalizare a studiilor, aprobat de către Senatul POLITEHNICA Bucureşti. (6) Absolvenţii care au promovat examenul de Diplomă/Licenţă primesc Diploma de Inginer/Diploma de Licenţă. VII. RECOMPENSE ŞI SANCŢIUNI ART. 30. RECOMPENSE Pentru rezultate deosebite în activitatea profesională, știinţifică și de cercetare şi pentru implicarea în activităţile comunităţii, universitatea poate acorda studentului următoarele recompense: a) burse de performanță; b) burse de voluntariat c) diplome de merit; d) diplome și burse speciale pentru șefii de promoţie; e) diplome de excelență pentru studenţii care au obținut rezultate profesionale științifice remarcabile la nivel național și/sau international; f) burse de mobilităţi în programe internaţionale; g) alte diplome sau premii. ART. 31. SANCȚIUNI Pentru încălcarea normelor de conduită universitară, studentului i se pot aplica următoarele sancţiuni: a) avertisment scris; b) avertisment scris cu atenționare: c) sistarea bursei pe o perioadă de 10-30 zile; d) suspendarea sau retragerea dreptului la unele facilităţi de care beneficiază studentul (cazare în cămin, legitimaţie de student etc); e) exmatricularea. VIII.",
            "• decizii ale Rectorului sau Biroului Executiv al Facultății (BExF) (dacă este cazul); • situaţia şcolară, în caz de transfer; • actele necesare pentru acordarea burselor (pentru fiecare semestru în care a obţinut bursă); • actele prin care i s-au acordat anumite drepturi (întreruperi de studii, prelungiri de şcolaritate, transfer, refaceri de discipline, diferenţe – dacă este cazul); • dovezi de achitare a taxelor stabilite de Senatul POLITEHNICA București; recompense şi sancţiuni primite în facultate; • contractul de studii precum și actele subsecvente acestuia; • cereri în urma cărora studentul a beneficiat de sesiuni prelungite; • certificate medicale (dacă este cazul); • contracte de burse private; • contracte/adeverinţe voluntariat • documente din mobilităţile efectuate pe durata studiilor. 3. După finalizarea studiilor o parte din documente se depun la Serviciul Acte de Studii pentru întocmirea actelor de studii, iar restul documentelor rămân la dosarul personal care este depus la Arhivă. 4. (1) Secretariatul facultăţii eliberează studentului înmatriculat legitimaţia de student şi carnetul de student, în care se înscriu notele de la examene sau de la celelalte forme de verificare a cunoştinţelor, pe toată durata şcolarizării. La începutul fiecărui an universitar, după înscrierea studentului în anul respectiv de studii, acesta este obligat să prezinte, pentru viză, documentele menționate şi să anunţe eventualele modificări care au intervenit faţă de anul precedent. De 24 MINISTERUL EDUCAȚIEI Universitatea Naţională de Ştiinţă şi Tehnologie POLITEHNICA Bucureşti asemenea, tot la începutul anului universitar, se vor stabili studentului eventualele diferenţe sau refaceri de discipline (2) În documentele studentului nu sunt admise corecturi, ştersături sau înscrieri de date nereale, acestea constituind falsuri în acte publice şi se sancţionează penal, conform legii. (3) În cazul în care studentul pierde documentele personale (carnet de student, legitimație de student etc.), se eliberează duplicate, după publicarea în presă a anunțului privind pierderea acestora, pe baza unei cereri de asumare și a dovezii achitării taxelor aferente."
        ],
        "response": "La Universitatea Națională de Știință și Tehnologie POLITEHNICA București sunt disponibile următoarele tipuri de burse:\n\n1. **Burse de performanță** - acordate studenților cu rezultate deosebite în activitatea profesională, științifică și de cercetare.\n2. **Burse sociale** - destinate studenților cu venituri reduse, distribuite în ordine crescătoare a venitului net pe membru de familie.\n3. **Burse de voluntariat** - pentru studenții implicați în activități de voluntariat.\n4. **Burse speciale** - acordate pe baza unei metodologii aprobate de senatul universitar.\n5. **Diplome și burse speciale pentru șefii de promoție** - pentru studenții care au obținut rezultate remarcabile.\n6. **Diplome de excelență** - pentru studenții cu rezultate profesionale științifice remarcabile la nivel național și/sau internațional.\n7. **Burse de mobilități** - pentru studii în programe internaționale.\n8. **Granturi de studii** - pentru românii de pretutindeni și cetățenii străini, conform metodologiilor proprii.\n\nAceste burse sunt acordate pe toată durata anului universitar, cu excepția burselor sociale ocazionale, și sunt reglementate prin hotărâri ale Senatului POLITEHNICA București, la propunerea Consiliului de Administrație.\n\nSurse:\n- Metodologie burse, URL: https://upb.ro/wp-content/uploads/2024/12/Metodologie-burse_rectificata.pdf, pagina: 2\n- Regulament organizare studii universitare de licență, URL: https://upb.ro/wp-content/uploads/2022/11/Regulament-org-studii-univ-licenta_2024.pdf, pagina: 20",
        "faithfulness": "0.9166666666666666"
    },
    {
        "id": "ee706abd2d51f705e0e518dc1f27b21bab84dd9242c8e96e7814e4300b70e65f",
        "user_input": "Cum pot obtine bursa la Politehnica?",
        "retrieved_contexts": [
            "MINISTERUL EDUCAȚIEI Universitatea Naţională de Ştiinţă şi Tehnologie POLITEHNICA Bucureşti (2) Înscrierea la Examenul de Diplomă/Examenul de Licenţăeste condiționată de acumularea ECTS aferente disciplinelor obligatorii şi opționale din planul de învățământ al programului formativ al studentului. (3) Media minimă de promovarea Examenului de Diplomă/Examenul de Licenţăeste 6. (4) Departamentele sunt obligate să stabilească titlurile temelor de Proiect de Diplomă/Lucrare de Licenţă şi conducătorii ştiințifici şi să facă repartizarea acestora conform opţiunilor studenţilor, cel mai tărziu în săptămâna a patra a penultimului semestru, conform criteriilor stabilite la nivelul facultăţii. (5) Modul de desfăşurare a Examenului de Diplomă/Examenul de Licenţă se face în conformitate cu regulamentul de organizare şi desfãşurare a examenelor de finalizare a studiilor, aprobat de către Senatul POLITEHNICA Bucureşti. (6) Absolvenţii care au promovat examenul de Diplomă/Licenţă primesc Diploma de Inginer/Diploma de Licenţă. VII. RECOMPENSE ŞI SANCŢIUNI ART. 30. RECOMPENSE Pentru rezultate deosebite în activitatea profesională, știinţifică și de cercetare şi pentru implicarea în activităţile comunităţii, universitatea poate acorda studentului următoarele recompense: a) burse de performanță; b) burse de voluntariat c) diplome de merit; d) diplome și burse speciale pentru șefii de promoţie; e) diplome de excelență pentru studenţii care au obținut rezultate profesionale științifice remarcabile la nivel național și/sau international; f) burse de mobilităţi în programe internaţionale; g) alte diplome sau premii. ART. 31. SANCȚIUNI Pentru încălcarea normelor de conduită universitară, studentului i se pot aplica următoarele sancţiuni: a) avertisment scris; b) avertisment scris cu atenționare: c) sistarea bursei pe o perioadă de 10-30 zile; d) suspendarea sau retragerea dreptului la unele facilităţi de care beneficiază studentul (cazare în cămin, legitimaţie de student etc); e) exmatricularea. VIII.",
            "Persoanele care dispun de resursele financiare corespunzătoare, fie din surse proprii, fie din burse acordate de persoane fizice sau juridice, pot fi admise ca studenţi-doctoranzi în regim cu taxă, în condiţiile prevăzute în regulamentul studiilor doctorale. Doctoratul ştiinţific este o condiţie pentru cariera profesională în învăţământul superior şi cercetare; b) doctorat profesional, în domeniile artelor, sportului, ale ştiinţelor militare, respectiv pentru învăţământul universitar dual, care are ca finalitate producerea de cunoaştere originală pe baza aplicării metodei ştiinţifice, a reflecţiei sistematice sau a cercetării aplicative asupra unor creaţii artistice, asupra unor performanţe sportive de înalt nivel naţional şi internaţional sau asupra unor teme de importanţă practică şi care constituie o bază pentru cariera profesională în învăţământul superior şi în cercetare, în domeniile vizate. (11) Programele de studii universitare de doctorat profesional se pot organiza, de regulă, la forma de învățământ cu frecvență. (12) Prin excepție de la prevederile aliniatului de mai sus programele de studii universitare de doctorat se pot organiza și la forma de învățământ cu frecvență redusă. (13) Au dreptul să participe la concursul de admitere la studii universitare de doctorat numai absolvenţii cu diplomă de masterat sau echivalentă acesteia, iar numărul cumulat de credite de studii transferabile dobândite, pentru ciclul de studii universitare de licenţă şi de masterat, să fie de cel puţin 300. Potrivit prevederilor Legii învăţământului superior nr. 199/2023, cu modificările şi completările ulterioare, diploma de licenţă a absolvenţilor învăţământului superior de lungă durată din perioada anterioară aplicării celor trei cicluri tip Bologna este echivalentă cu diploma de studii universitare de masterat în specialitate. În consecinţă, titularii diplomelor de studii superioare de lungă durată au dreptul să se înscrie la studii universitare de doctorat fără obligativitatea de a mai parcurge ciclul II de studii universitare de masterat. (14) Înscrierea la concursul de admitere la studii universitare de doctorat, într-un domeniu de doctorat nu este condiționată de domeniul în care a fost dobândită diploma de licență sau masterat.",
            "B14 B15 * Locuri subvenționate de la buget, pentru școlarizarea în beneficiul SRI (Serviciul Român de Informații) *** Locuri cu taxă, dar subvenționate (fără efort bugetar din partea candidaților admiși) Anx. II-2. În anul 2025, disciplinele luate în considerare la concursul de admitere pe baza rezultatelor la activitățile școlare (dosar) în Centrul Universitar București sunt: Pentru proba P1: Matematică, Chimie anorganică • Pentru proba P2: Fizică, Informatică, Chimie anorganică, Chimie organică, Biologie, Economie, Procesarea computerizată a imaginii, Geografie Anx. II-3. În anul 2025, disciplinele luate în considerare la concursul de admitere pe baza rezultatelor la activitățile școlare (dosar) în Centrul Universitar Pitești sunt: Pentru proba P1: Matematică, Chimie anorganică, respectiv Limba și literatura română. • Pentru proba P2: Fizică, Informatică, Chimie organică, Chimie anorganică, Biologie, Matematică, Psihologie, Procesarea computerizată a imaginii, Sociologie, Istorie, Economie, Geografie, Logică argumentare și comunicare, Cultură de specialitate, Religie, Discipline teologice, Limbă modernă 1, Limbă modernă 2, respectiv Latină Anx. II-4. La înscriere, candidatul optează pentru disciplina care va fi utilizată (una dintre variantele permise la facultatea / domeniul la care se înscrie) pentru fiecare dintre cele două probe și furnizează mediile necesare în conformitate cu situația sa școlară. Anx. II-5. Determinarea notelor, pentru disciplinele de concurs pe baza rezultatelor la activitățile școlare, se face pe baza mediilor anuale la discipline corespondente din foaia matricolă/situația școlară a candidatului pentru clasele a IX-a, a X-a și a XI-a. P01 Universitatea Națională de Știință și Tehnologie POLITEHNICA București Anexa II Discipline pentru probele de concurs P1 și P2. Calculul notelor la disciplinele de concurs Matematică M M M cA Chimie anorganică CA Limba și literature română R A Fizică F Informatică I Chimie organică CO",
            "* Locuri subvenționate de la buget, pentru școlarizarea în beneficiul SRI (Serviciul Român de Informații) *** Locuri cu taxă, dar subvenționate (fără efort bugetar din partea candidaților admiși) Anx I - 2 Universitatea Națională de Știință și Tehnologie POLITEHNICA București Anexa I Portofoliul de admitere Facultăți – Domenii – Forme de finanțare CENTRUL UNIVERSITAR PITEȘTI",
            "| | | ('Kinetoterapie', 'Psihologie') | ('Știința Mediului', 'Știința Mediului') |\n|:--|:--|:--|:--|\n| | | | |\n| | | | |\n| | | | |\n| | | | |\n| | | | |\n| | | | |\n| | Sănătate | Ştiința Sportului şi Educației Fizice | |\n| | Știinta Mediului | Ştiința Sportului şi Educației Fizice | |\n| | Inginerie Energetică | | |\n| | Educație Fizică şi Sport | Informatică | |\n| | Informatică | Matematică | |\n| | Matematică | Matematică | |\n| 19.0 | Facultatea de Mecanică şi Tehnologie 8 | Ingineria Autovehiculelor | Ingineria Autovehiculelor |\n| 19.0 | Facultatea de Mecanică şi Tehnologie 8 | Ingineria Transporturilor | Ingineria Transporturilor |\n| 19.0 | Facultatea de Mecanică şi Tehnologie 8 | I , Inginerie Industrială | R - Inginerie Industrială |\n| 19.0 | Facultatea de Mecanică şi Tehnologie 8 | Inginerie şi Management | Inginerie şi Management |\n| 20.0 | Facultatea de Electronică, IIIR Comunicații şi Calculatoare | Calculatoare şi Tehnologia Informației 7 | INIR - Inginerie Electrică |\n| 20.0 | Facultatea de Electronică, IIIR Comunicații şi Calculatoare | Inginerie Electrică | INIR - Inginerie Electrică |\n| 20.0 | Facultatea de Electronică, IIIR Comunicații şi Calculatoare | Inginerie Electronică, EPNE . Telecomunicații şi Tehnologii x Informaționale | RRNR a IRMEFSNE Inginerie Electronică, Telecomunicații şi .. - Tehnologii Informaționale |\n| 21.0 | -. , Facultatea de Științe Economice şi Drept ” P | Administrarea Afacerilor | Administrarea Afacerilor |\n| 21.0 | -. , Facultatea de Științe Economice şi Drept ” P | Contabilitate | Contabilitate |\n| 21.0 | -. , Facultatea de Științe Economice şi Drept ” P | Finanțe : | Finanțe : |\n| 21.0 | -. , Facultatea de Științe Economice şi Drept ” P | Management | Management |\n| 21.0 | -. , Facultatea de Științe Economice şi Drept ” P | Drept | Drept |\n| 21.0 | -. , Facultatea de Științe Economice şi Drept ” P | Ştiințe Administrative | Ştiințe Administrative |"
        ],
        "response": "Pentru a obține o bursă la Universitatea Națională de Știință și Tehnologie POLITEHNICA București, studenții trebuie să îndeplinească anumite criterii de performanță. Universitatea poate acorda burse de performanță pentru rezultate deosebite în activitatea profesională, științifică și de cercetare, precum și pentru implicarea în activitățile comunității. Tipurile de burse includ burse de voluntariat, diplome de merit, diplome și burse speciale pentru șefii de promoție, diplome de excelență pentru studenții cu rezultate remarcabile la nivel național și/sau internațional, burse de mobilități în programe internaționale, și alte diplome sau premii. Este important ca studenții să se informeze despre criteriile specifice și procedurile de aplicare pentru bursele disponibile, care pot varia de la un an la altul.\n\nSurse:\n- Regulament privind raportarea instituțională în vederea obținerii finanțării publice a universității, URL: https://upb.ro/wp-content/uploads/2022/11/Regulament-privind-raportarea-institutionala-in-vederea-obtinerii-finantarii-publice-a-universitatii.pdf, pagina: 28\n- Regulament de organizare și desfășurare a examenelor de finalizare a studiilor, URL: https://upb.ro/wp-content/uploads/2022/11/Regulament-org-studii-univ-licenta_2024.pdf, pagina: 20",
        "faithfulness": "0.8181818181818182"
    },
    {
        "id": "74bd777e8c360c2271e4370eed67ed53b9ccc84e184f2dac568616a588c21b8e",
        "user_input": "Care este media minima necesara pentru a obtine o bursa?",
        "retrieved_contexts": [
            "punct de vedere socio-economic, a căror familie nu a realizat în cele 12 luni dinaintea depunerii cererii pentru acordarea acestui tip de bursă un venit lunar net mediu pe membru de familie mai mare de 50% din salariul minim net la nivel național. Această categorie de bursă se poate acorda aceluiași student de două ori în cursul unui an universitar; b) bursa pentru ajutor social ocazional de maternitate, care se acordă studentei sau studentului a cărui soție nu realizează deloc venituri sau venituri mai mari decât salariul de bază minim net la nivel național, constă într-o bursă pentru naștere și lăuzie și o bursă pentru procurarea îmbrăcămintei copilului nou-născut și care se acordă o singură dată în cursul anului universitar pentru fiecare copil născut; c) bursa pentru ajutor social ocazional în caz de deces se poate acorda pentru decesul unui membru al familiei studentului(ei). Prin membru de familie se înțelege soț, soție, copil. În cazul decesului studentului(ei) necăsătorit(e)/căsătorit(e) cu soție/soț care nu realizează venituri, bursa se acordă rudelor de gradul I/succesorului legal o singură dată în cursul anului universitar. (2) Cuantumul acestor burse este stabilit de Senatul universității, la propunerea Consiliului de administrație, cu condiția ca acesta să fie cel puțin egal cu cuantumul lunar al bursei sociale. (3) POLITEHNICA București poate acorda alte stimulente financiare studenților în situație de risc, stabilite de Biroul Consiliului de Administrație. Art. 28. Calculul venitului lunar mediu net (1) Determinarea venitului lunar mediu net al familiei studentului se realizează până la împlinirea vârstei de 26 de ani. La stabilirea venitului mediu net lunar pe membru de familie se iau în calcul toate veniturile nete cu caracter permanent realizate de membrii familiei, supuse impozitului pe venit. Prin venituri nete se înțelege totalitatea sumelor primite/realizate de persoana singură, respectiv de fiecare membru al familiei, reprezentând valoarea obținută după aplicarea cotei de impozitare asupra venitului impozabil stabilit conform prevederilor legale.",
            "(2) Pentru studenții cu vârsta între 26 și 35 de ani, venitul lunar mediu net se va calcula ținând cont doar de veniturile personale ale acestora și ale persoanelor pe care le au în grijă, precum copii, soție etc., în conformitate cu prevederile legale în vigoare. (3) În situația în care personalul instituției de învățământ are suspiciuni privind îndeplinirea condițiilor de acordare a bursei sociale, rectorul POLITEHNICII București sesizează situația autorităților publice locale, în vederea efectuării unei anchete sociale. Personalul instituției de învățământ nu efectuează anchete sociale în vederea acordării burselor sociale. (4) După caz, bursa socială poate fi acordată sau retrasă, ca urmare a unei solicitări în acest sens din partea serviciilor publice de asistență socială și pe baza unui raport de anchetă socială. Art. 29. Depunerea documentelor în vederea acordării burselor sociale (1) Conform art. 69 alin. (4) din Legea nr. 207/2015 privind Codul de procedură fiscală, cu modificările și completările ulterioare, verificarea veniturilor declarate de solicitanți se face de către reprezentanții instituției de învățământ superior, respectiv, Comisia de atribuire a burselor la nivel de facultate, cu ajutorul platformei PatrimVen sau prin solicitarea organului central fiscal, în a cărui rază teritorială se află situația beneficiarii, de eliberare a unui document care să ateste situația veniturilor declarate de către aceștia. (2) În vederea acordării burselor sociale, studenții trebuie să depună următoarele documente justificative pe baza cărora se realizează încadrarea în unul dintre tipurile de burse oferite: a) cererea solicitantului, însoțită de o declarație pe propria răspundere privind veniturile nete, cu caracter permanent, obținute pe ultimele 12 luni anterioare cererii, realizate de Page 10 of 16 membrii familiei, supuse impozitului pe venit, și acordul privind prelucrarea datelor cu caracter personal pentru verificarea respectării criteriilor de acordare a bursei; b) pentru situațiile în care există suspiciuni rezonabile, comisia de atribuire a burselor poate solicita studentului să prezinte raportul de anchetă socială, realizat cu respectarea prevederilor legale, din care să reiasă situația exactă a familiei acestuia.",
            "(3) Cuantumul minim al bursei sociale se propune anual, până la data de 1 septembrie, de către Comisia Națională pentru Finanțarea Învățământului Superior (CNFIS), se adoptă prin ordin al ministrului educației și trebuie să acopere cheltuielile minime de masă şi cazare. (4) Cuantumul burselor sociale se stabilește prin hotărâre a senatului universității POLITEHNICA București, la propunerea Consiliului de administrație, în limita fondurilor disponibile și în funcție de nevoile identificate la nivelul comunității studențești, prin consultarea reprezentanților studenților, inclusiv cu organizațiile studențești din POLITEHNICA București. (5) Pentru acordarea burselor sociale, singurul criteriu academic ce se ia în considerare este promovabilitatea. (6) Bursele sociale se cumulează cu alte tipuri de burse, dacă studentul îndeplinește criteriile specifice pentru ambele categorii de burse. (7) Bursele sociale se acordă pe durata legală a programului de studii, până la împlinirea vârstei de 35 de ani. (8) Beneficiarii burselor sociale pot fi: a) studenții orfani de unul sau ambii părinți, studenții care provin din familii monoparentale sau studenții proveniți din centre de plasament și care nu realizează venituri peste plafonul pentru acordarea bursei sociale; b) studenții bolnavi de tuberculoză, care se află în evidența unităților medicale, pe perioada tratamentului tuberculostatic, diabet insulinonecesitant, boli maligne, sindroame de malabsorbție severe, boală cronică de rinichi în program de dializă, astm bronșic persistent moderat sau sever, epilepsie grand mal, cardiopatii congenitale, hepatită cronică cu fibroză avansată (stadiul F3 sau F4), glaucom, miopie gravă, boli imunologice autoimune forme severe, boli rare, tulburări din spectrul autist, boli hematologice severe care necesită tratament continuu sau spitalizări frecvente, surditate bilaterală, fibroză chistică, cei infectați cu virusul HIV sau bolnavi de SIDA, cei cu handicap locomotor și încadrați într-un grad de invaliditate, fără a se lua în considerare nivelul venitului mediu pe membru de familie;",
            "Criteriul 4 = NPN - Număr premii obținute la concursuri naționale/internaționale la care candidatul a participat. Fiecare concurs este punctat cu 3 puncte. Se pot aduna din acest criteriu maxim n = 10 pct. Se poate face dovada prin diploma de premiere. Criteriul 5 = NAV - Număr activități de voluntariat la care a participat. Fiecare activitate este punctată cu 0,5 puncte. Se pot aduna din acest criteriu maxim n =2 pct. Se poate face dovada prin poze, link-uri, adeverințe etc. Criteriul 6 = NRP - Număr „recomandări pentru domeniu” în favoarea candidatului, din partea profesorilor titulari la disciplinele luate în considerare de UNSTPB la admitere (matematică, fizică, chimie, economie, informatică), indiferent de materiile selectate de facultate pentru probele P1 și P2. Se va lua în considerare cel mult 1 recomandare / disciplină. Fiecare recomandare este punctată cu 2 puncte. Se pot aduna din acest criteriu maxim n = 4 puncte. Criteriul 7 = NCLS - Număr certificate de competență pentru cunoașterea unor limbi străine (engleză, germană, franceză) la nivel cel puțin B2, eliberate de autorități recunoscute (Cambridge, Toefl, IELTS, DELF, DALF, DL, TestDaF etc.). Fiecare certificat este punctat cu 1 punct. Se pot aduna din acest criteriu maxim n = 3 puncte. Cu ajutorul valorilor NC1 (pentru proba P1), NC2 (pentru proba P2) şi NB (pentru proba P3), se va calcula media generală de admitere cu ajutorul formulei: M = NC1*0.4+NC2*0.4+NB*0.2",
            "(2) Media generală de admitere se constituie ca medie aritmetică dintre nota acordată de comisia/comisiile constituite de Şcoala doctorală privind evaluarea dosarelor electronice ale candidaţilor declaraţi admişi de către conducătorii de doctorat şi media generală a anilor de studii, calculată prin luarea în considerare a anilor de studii de licenţă şi masterat sau de lunga Metodologie admitere la doctorat 2025 durata (Anexa 3). Media generală de admitere trebuie sa fie minim 7,00. (3) Înmatricularea candidaților admiși se face online în termen de 7 2 ore de la data afișării electronice a rezultatelor finale, fiind condiționată de prezentarea dovezii privind absolvirea unui program de masterat (diploma de masterat sau adeverință de absolvire). (4) Candidaţii admişi vor completa şi semna olograf contractul de studii universitare de doctorat până la începutul anului universitar 2025-2026. Contractul se oficializează prin semnaturile olografe ale conducătorului de doctorat și Directorului Şcolii doctorale. Metodologie admitere la doctorat 2025 Anexa 1 Lista domeniilor doctorale organizate de POLITEHNICA București"
        ],
        "response": "Conform documentelor relevante, nu există o mențiune specifică despre o medie minimă necesară pentru a obține o bursă. Totuși, se precizează că pentru admiterea la doctorat, media generală de admitere trebuie să fie minim 7,00. Aceasta poate influența indirect eligibilitatea pentru burse, dar nu este o condiție explicită pentru obținerea burselor sociale sau a altor tipuri de burse. Este important de menționat că bursele sociale se acordă pe baza criteriilor socio-economice și a promovabilității, fără a specifica o medie minimă. \n\nPentru detalii suplimentare, este recomandat să consultați documentele oficiale ale universității.\n\nSurse:\n- Metodologie admitere la doctorat 2025, URL: https://upb.ro/wp-content/uploads/2024/12/Metodologie-admitere-doctorat-2025-2026.pdf, pagina: 6\n- Metodologie burse, URL: https://upb.ro/wp-content/uploads/2024/12/Metodologie-burse_rectificata.pdf, pagina: 8",
        "faithfulness": "0.7142857142857143"
    },
    {
        "id": "188d188135f5a30141ed85ce95edf7f52e2f8daa978c81e8328b5e4a82c00a26",
        "user_input": "Care sunt conditiile de promovare a unui an universitar la Politehnica?",
        "retrieved_contexts": [
            "(7) Bursele, indiferent de categorie, se acordă pe toată durata anului universitar (12 luni), cu excepţia burselor sociale ocazionale. Acordarea burselor încetează la data pierderii calităţii de student sau a neîndeplinirii criteriilor de promovabilitate, după caz, în conformitate cu regulamentele de organizare şi funcţionare ale instituţiilor de învăţământ superior. Capitolul III: OBLIGAȚIILE STUDENȚILOR Art. 15 (1) În mod corelativ, pe durata cât are contract de studii cu POLITEHNICA Bucureşti, studentul, studentul-doctorand sau cursantul, după caz, au următoarele îndatoriri: a) de a învăță în mod sistematic la toate disciplinele din planul de învățământ şi de a-şi însuşi pe deplin cunoştințele predate potrivit programelor universitare sau postuniversitare, după caz, în scopul unei temeinice pregătiri teoretice şi practice; b) de a respecta normele de etică şi de conduită academică în mediul universitar şi de a avea un comportament demn şi conform cu regulile de conviețuire socială în afara acestuia; c) de a respecta Carta, regulamentele și deciziile impuse de POLITEHNICA București; d) de a participa la ședințele structurilor de conducere din cadrul POLITEHNICII București în calitate de reprezentanți aleși ai studenților; e) de a respecta standardele de calitate impuse de către POLITEHNICA București; f) de a respecta drepturile de autor ale altor persoane și de a recunoaște paternitatea informațiilor prezentate în lucrările elaborate g) de a elabora și susține lucrări de evaluare la nivel de disciplină și lucrări de finalizare originale; h) de a sesiza autorităților competente orice nereguli în procesul de învățământ și în cadrul activităților conexe acestuia; i) de a participa la activități academice fără a fi sub influența băuturilor alcoolice sau a altor substanțe interzise; j) de a nu folosi un limbaj și comportament neadecvate mediului universitar; k) de a utiliza în mod corespunzător, conform destinației stabilite, toate facilitățile și subvențiile primite; l) de a semna contractul de studii la începerea fiecărui ciclu de studii. m)",
            "(7) Rezultatele aşteptate ale învăţării sunt corelate cu competenţele solicitate de ocupaţiile corespunzătoare, conform standardelor ocupaţionale şi/sau Clasificării Europene a Ocupaţiilor (ESCO). Art. 4. Structura anului universitar (1) Structura anului universitar este aprobată de către Senatul Universității, în conformitate cu dispozițiile art. 27 din Legea 199/2023. (2) La începutul fiecărui an universitar, facultățile au obligația afișării pe pagina web structura anului universitar și planurile de învățământ, pentru fiecare program de studii. Fișa disciplinei se aduce la cunoștința studentului de către cadrul didactic titular al disciplinei în cadrul primului curs/seminar al semestrului și se publică pe platforma Moodle. MINISTERUL EDUCAȚIEI Universitatea Naţională de Ştiinţă şi Tehnologie POLITEHNICA Bucureşti Art. 5. Calitatea de Student (1) Calitatea de student în cadrul POLITEHNICII Bucureşti se poate dobândi/redobândi prin unul din următoarele moduri: a) prin concurs de admitere; b) prin mobilitate academică definitivă de la o altă instituție de învățământ superior autorizată să funcționeze provizoriu sau acreditată din țară sau străinătate, conform prevederilor legale; c) prin reînmatriculare la aceeași facultate/domeniu/specializare pentru persoanele care au fost exmatriculate din POLITEHNICA București (în maxim 5 ani de la exmatriculare); d) prin reluarea studiilor, la aceeași facultate/domeniu/specializare unde a făcut întreruperea, pentru studenții care au fost în întrerupere de studii (1 sau 2 ani universitari); e) conform procedurilor legale pentru studenții străini. (2) Înscrierea la studii a unui student se face în baza existenţei unui contract de studii semnat de către părți (student și universitate). (3) Calitatea de student al universităţii se pierde: a) la absolvirea ciclului de studii; b) prin retragere de la studii; c) prin exmatriculare; d) pe perioada întreruperii studiilor . Art. 6. Planurile de învățământ Planurile de învățământ conțin discipline care sunt clasificate, în raport de criterii, astfel: a) după tipul disciplinei: obligatorii, opționale și facultative; b) după categoria formativă: disciplină de sinteză, disciplină de aprofundare, disciplină complementară.",
            "MINISTERUL EDUCAȚIEI Universitatea Naţională de Ştiinţă şi Tehnologie POLITEHNICA Bucureşti (2) Înscrierea la Examenul de Diplomă/Examenul de Licenţăeste condiționată de acumularea ECTS aferente disciplinelor obligatorii şi opționale din planul de învățământ al programului formativ al studentului. (3) Media minimă de promovarea Examenului de Diplomă/Examenul de Licenţăeste 6. (4) Departamentele sunt obligate să stabilească titlurile temelor de Proiect de Diplomă/Lucrare de Licenţă şi conducătorii ştiințifici şi să facă repartizarea acestora conform opţiunilor studenţilor, cel mai tărziu în săptămâna a patra a penultimului semestru, conform criteriilor stabilite la nivelul facultăţii. (5) Modul de desfăşurare a Examenului de Diplomă/Examenul de Licenţă se face în conformitate cu regulamentul de organizare şi desfãşurare a examenelor de finalizare a studiilor, aprobat de către Senatul POLITEHNICA Bucureşti. (6) Absolvenţii care au promovat examenul de Diplomă/Licenţă primesc Diploma de Inginer/Diploma de Licenţă. VII. RECOMPENSE ŞI SANCŢIUNI ART. 30. RECOMPENSE Pentru rezultate deosebite în activitatea profesională, știinţifică și de cercetare şi pentru implicarea în activităţile comunităţii, universitatea poate acorda studentului următoarele recompense: a) burse de performanță; b) burse de voluntariat c) diplome de merit; d) diplome și burse speciale pentru șefii de promoţie; e) diplome de excelență pentru studenţii care au obținut rezultate profesionale științifice remarcabile la nivel național și/sau international; f) burse de mobilităţi în programe internaţionale; g) alte diplome sau premii. ART. 31. SANCȚIUNI Pentru încălcarea normelor de conduită universitară, studentului i se pot aplica următoarele sancţiuni: a) avertisment scris; b) avertisment scris cu atenționare: c) sistarea bursei pe o perioadă de 10-30 zile; d) suspendarea sau retragerea dreptului la unele facilităţi de care beneficiază studentul (cazare în cămin, legitimaţie de student etc); e) exmatricularea. VIII.",
            "(1) Studentul poate accede, pe durata studiilor universitare de licenţă (începând cu anul II de studii), la începutul fiecărui an universitar, conform prevederilor legale şi reglementărilor interne, pe loc finanţat de la bugetul de stat, în limita locurilor disponibile pentru fiecare an de studii în parte la nivelul fiecărui centru universitar. (2) La începutul fiecărui an universitar, locurile disponibile finanţate de la bugetul de stat sunt redistribuite în ordinea descrescătoare a mediilor obţinute de studenţi în anul anterior. Studenții care nu au ocupat, în urma redistribuirii locurilor, un loc finanțat de la bugetul de stat vor continua studiile în regim cu taxă. (3) În cazul în care, pentru ultimul loc bugetat ce intră în procedura de redistribuire, sunt eligibili mai mulţi studenţi cu aceeaşi medie se va proceda la redistribuirea acestora pe baza unor criterii subsidiare în următoarea ordine: numărul de ECTS acumulate, media generală a anilor de studii până la momentul realizării repartizării sau media de la admitere (pentru studenţii promovaţi din anul I). În cazul în care egalitatea persistă, BExF va stabili şi alte criterii specifice de departajare. (4) Locul finanţat de la bugetul de stat de pe care titularul, din motive personale, solicită să se retragă după începerea anului universitar, până la finalizarea anului calendaristic, este redistribuit următorului student din clasamentul anului respectiv de studii, începând cu semestrul al II-lea al anului universitar. (5) Repartizarea studenţilor pe locurile finanţate de la bugetul de stat se efectuează la nivelul ramurilor de ştiinţă din fiecare facultate, fiind posibilă redistribuirea internă la nivelul fiecărei facultăţi, fără afectarea negativă a finanţării. În situaţia în care numărul locurilor finanţate de la bugetul de stat depăşeste numărul studenţilor înmatriculaţi la un anumit an de studiu (II, III sau IV) şi nu pot fi redistribuite în cadrul facultăţii respective, atunci Consiliul de Administraţie al Universităţii poate decide redistribuirea locurilor bugetate între facultăţi, la nivelul fiecărui an universitar. VI. FINALIZAREA STUDIILOR ART. 29. FINALIZAREA STUDIILOR (1) Finalizarea studiilor de licenţă în POLITEHNICA Bucureştise face prin Examen de Diplomă/Examen de Licenţă.",
            "7. Disciplinele facultative se organizează în regim „cu taxă”, la cererea studenţilor, cu excepţia disciplinelor prevăzute în programul de pregătire psiho-pedagogică. 8. Nu există o limită superioară a numărului total de ECTS din Contractul anual de studii. 9. Tutorele desemnat de facultate va asista studentul la completarea Contractului anual de studii/Actului Adiţional. Anexa 1 MINISTERUL EDUCAȚIEI Universitatea Naţională de Ştiinţă şi Tehnologie POLITEHNICA Bucureşti Anexa 2 Dosarul personal al studentului 1. Înscrierea studentului în registrul matricol se face pe baza dosarului personal care va cuprinde următoarele documente: • fişa de înscriere de la concursul de admitere; lucrările de la concursul de admitere (dacă este cazul); • diploma de bacalaureat și foaie matricolă, în original; • diploma de absolvire şi anexa acesteia pentru studenţii de la continuare de studii; • diplomă echivalentă (diploma de bacalaureat emisă de un alt stat și atestatul de echivalare emis de CNRED/scrisorii de acceptare la studii) pentru studenții străini; • copie conform cu originalul după certificatul de naştere; • 2 fotografii; • adeverinţă medicală; • copie după diploma obţinută ca premiu la concursurile naţionaleşi/sau internaţionale (pentru olimpici); • copie după cartea de identitate sau paşaport; • acte care atestă schimbarea numelui,în copie legalizată sau în copie conform cu originalul (dacă este cazul). 2. În perioada şcolarizării dosarul personal se completează cu următoarele documente: • decizii ale Rectorului sau Biroului Executiv al Facultății (BExF) (dacă este cazul); • situaţiaşcolară, în caz de transfer; • actele necesare pentru acordarea burselor (pentru fiecare semestru în care a obţinut bursă); • actele prin care i s-au acordat anumite drepturi (întreruperi de studii, prelungiri de şcolaritate, transfer, refaceri de discipline, diferenţe – dacă este cazul); • dovezi de achitare a taxelor stabilite de Senatul POLITEHNICA București; • recompense şisancţiuni primite în facultate; • contractul de studii precum și actele subsecvente acestuia;"
        ],
        "response": "Condițiile de promovare a unui an universitar la Politehnica București includ:\n\n1. **Accesul la locuri bugetate**: Studentul poate accesa un loc finanțat de la bugetul de stat, în limita locurilor disponibile, începând cu anul II de studii. Redistribuirea locurilor se face în funcție de mediile obținute în anul anterior. Cei care nu obțin un loc bugetat vor continua studiile în regim cu taxă (sursa: [Regulament organizare studii universitare de licență 2024](https://upb.ro/wp-content/uploads/2022/11/Regulament-org-studii-univ-licenta_2024.pdf), pagina 19).\n\n2. **Promovarea examenului de diplomă**: Pentru a finaliza studiile de licență, studentul trebuie să acumuleze ECTS aferente disciplinelor obligatorii și opționale și să obțină o medie minimă de 6 la Examenul de Diplomă/Examenul de Licență (sursa: [Regulament organizare studii universitare de licență 2024](https://upb.ro/wp-content/uploads/2022/11/Regulament-org-studii-univ-licenta_2024.pdf), pagina 20).\n\n3. **Îndeplinirea obligațiilor academice**: Studentul trebuie să respecte normele de etică și conduită academică, să participe activ la cursuri și să își îndeplinească sarcinile de învățare (sursa: [Codul drepturilor și obligațiilor studenților](https://upb.ro/wp-content/uploads/2025/03/Codul-drepturilor-si-obligatiilor-studentilor.pdf), pagina 16).\n\nSurse:\n- Regulament organizare studii universitare de licență 2024, URL: https://upb.ro/wp-content/uploads/2022/11/Regulament-org-studii-univ-licenta_2024.pdf, pagina: 19\n- Regulament organizare studii universitare de licență 2024, URL: https://upb.ro/wp-content/uploads/2022/11/Regulament-org-studii-univ-licenta_2024.pdf, pagina: 20\n- Codul drepturilor și obligațiilor studenților, URL: https://upb.ro/wp-content/uploads/2025/03/Codul-drepturilor-si-obligatiilor-studentilor.pdf, pagina: 16",
        "faithfulness": "0.8888888888888888"
    },
    {
        "id": "e84ef517e8fadf9dbaedc8e85bc8d4da742a5ca7fc9c87f1c542c8adc64a16fe",
        "user_input": "Care este cuantumul taxei de scolarizare la ACS?",
        "retrieved_contexts": [
            "Statutul de masterand cu taxă se păstrează, de regulă, pe întreaga durată de școlarizare. Pentru Centrul Universitar Pitești, forma de finanțare pentru studentul masterand se va stabili în fiecare an, conform ierarhizării studenților după medii, fără a fi menținut locul la buget sau taxă, obținut la admitere, toată perioada școlarizării. Cuantumul taxei, pentru fiecare an de studiu, se aprobă de Senatul Universității, în funcție de costurile specifice școlarizării. Art. 35. În organizarea formațiilor de studiu nu se face distincție între cele două categorii de admiși, cu sau fără taxă. Art. 36. Candidații declarați admiși vor completa și semna olograf contractul de studii universitare de masterat, respectiv un contract individual de studii şi pregătire practică la învăţământul dual, după înmatriculare și nu mai târziu de începutul anului universitar 2025-2026. În caz contrar aceștia vor pierde statutul de masterand. Anexa 1 Universitatea Națională de Știință și Tehnologie POLITEHNICA București FIŞA DE ÎNSCRIERE PENTRU ABSOLVENŢII CU DIPLOMĂ DE LICENŢĂ/INGINER CARE DORESC SĂ URMEZE ÎNVĂŢĂMÂNTUL UNIVERSITAR DE MASTERAT ANUL UNIVERSITAR 2025 – 2026 Sesiunea iulie și septembrie 1. Numele, iniţiala prenumelui tatălui şi prenumele candidatului:",
            "CONTINUAREA STUDIILOR IX. DISPOZIŢII FINALE I. PREVEDERI LEGALE Organizarea și desfășurarea concursului de admitere și scolarizare a românilor de pretutindeni la Universitatea Naţională de Ştiinţă şi Tehnologie POLITEHNICA Bucureşti (1) Pe locuri de studii fără plata taxelor de școlarizare, dar cu bursă, respectiv, fără plata taxelor de școlarizare, dar fără bursă, se face în conformitate cu: - Legea învățământului superior nr. 199/2023 cu modificările şi completările ulterioare; - Legea nr. 299/2007 privind sprijinul acordat românilor de pretutindeni, republicată, cu modificările şi completările ulterioare; - Ordinul MEN nr. 3900 din 16 mai 2017 privind aprobarea Metodologiei de școlarizare a românilor de pretutindeni, în învățământul preuniversitar de stat din România, pe locuri de studii fără plata taxelor de școlarizare, dar cu bursă, respectiv, fără plata taxelor de școlarizare, dar fără bursă începând cu anul şcolar 2017-2018 şi a Metodologiei de şcolarizare a românilor de pretutindeni în învăţământul superior de stat în România, pe locuri de studii fără plata taxelor de şcolarizare, dar cu bursă, respectiv fără plata taxelor de şcolarizare, dar fără bursă începând cu anul 2017 – 2018; - Ordinul Ministrului Educaţiei nr. 5552/16.04.2024, publicat în Monitorul Oficial nr. 742/30.07.2024, pentru aprobarea Metodologiei privind condiţiile de şcolarizare a românilor de pretutindeni şi a cetăţenilor străini în cadrul instituţiilor de învăţământ superior de stat, particulare şi confesionale particulare acreditate din România; - Ordinul Ministrului Educaţiei nr. 5553/16.06.2024 privind aprobarea Procedurii de emitere a scrisorilor de acceptare la studii a românilor de pretutindeni pentru învăţământul superior de stat şi particular acreditat, pe locuri cu taxă în lei; - Ordinul Ministrului Educației nr. 4262/2024 pentru aprobarea Metodologiei privind mobilitatea academică a studenților. (2) în categoria românilor de pretutindeni fac parte, în conformitate cu prevederile Legii nr. 299/2007 privind sprijinul acordat românilor de pretutindeni, republicată, cu modificările şi completările ulterioare:",
            "Sistemul de taxe școlarizare În Universitatea Națională de Știință și Tehnologie POLITEHNICA București, pentru anul universitar 2024-2025 2024 Cuantumul Nr. taxei Taxa Crt. [RON]",
            "(2) Studentul care solicită retragerea de la studii are obligaţia de a achita taxele şcolare la zi până la data retragerii. Actele de la dosarul personal se eliberează numai în urma prezentării, la decanat, a notei de lichidare semnate. III. TAXELE DE STUDII PENTRU REFACEREA DISCIPLINELOR Art. 21. Definire taxe (1) Se definesc următoarele tipuri de taxe: a) taxa de refacere a unei discipline TD1, pentru studenţii care au maximum 2 discipline de refăcut; b) taxa de refacere a unei discipline TD2, pentru studenţii care au mai mult de 2 discipline de refăcut, dacă promovează anul de studii; c) taxa de refacere a unei discipline TD3, pentru studenţii care nu promovează anul de studii. (2) Cuantumul acestei taxe se stabileşte şi aprobă anual de către Senatul POLITEHNICA Bucureşti. (3) Taxa de refacere a unei discipline se plăteşte în primele două săptămâni de la începutul semestrului în care se reface disciplina sau în conformitate cu alte decizii ale Consiliului de Administraţie al Universităţii. (4) Studenții care nu plătesc taxa de refacere a unei discipline nu pot susține verificări parţiale sau finale la disciplina respectivă. MINISTERUL EDUCAȚIEI Universitatea Naţională de Ştiinţă şi Tehnologie POLITEHNICA Bucureşti (5) Studenții care reprezintă „cazuri sociale” pot beneficia de scutirea la plată a taxei de refacere a unei discipline, cu aprobarea BExF şi acoperirea cheltuielilor din fondurile facultății. (6) Scutirea de plată a taxelor pentru refacerea disciplinelor este validată numai de Consiliul de Administrație al Universităţii. PARTEA A II-A. ACTIVITATEA PROFESIONALĂ A STUDENŢILOR I. PREVEDERI GENERALE II. ÎNSCRIEREA LA FACULTATE ŞI DOCUMENTE NECESARE Art. 22. Înmatricularea studenților admiși și trecerea în an superior (1) Înmatricularea studenților admiși la concursul de admitere în anul I de studii, a studenților transferați de la alte universități sau facultăți și a studenților cărora li s-a aprobat reluarea studiilor, se face prin decizie a Rectorului POLITEHNICA Bucureşti.",
            "ANS, “se raportează doar datele privind studenții aflați la forma de finanțare cu taxă, inclusiv studenții proveniți din studenți bugetați, care repetă cu taxă un an de studiu sau au depășit durata de studiu subvenționată de stat, stabilită prin lege și plătesc taxe. ” Anual Ministerul Educației alocă, prin HG, cifra de școlarizare – acestea se traduc în locurile finanțate la nivel de universitate de la Bugetul de Stat (BS), pentru ciclurile de învățământ pentru licență, masterat și doctorat. Separat, POLITEHNICA București alocă un număr de locuri pentru studenți în regim de taxă de studii (TS) la învățământul universitar de licență, masterat, respectiv doctorat. Separat, Ministerul Educației alocă locuri finanțate de la bugetul de stat pentru Românii de Pretutindeni (RdP) – acestea sunt locuri fără plata taxelor de școlarizare (i.e. , finanțarea vine de la bugetul de stat), cu bursă suportată sau fără. Cf. Legii nr. 299/2007, “românii de pretutindeni reprezintă: persoanele care își asumă liber identitatea culturală românească; persoanele de origine română și cele care aparțin trăsăturilor lingvistice și culturale românești, care trăiesc în afara granițelor României , indiferent de etnonimul utilizat (armâni, armânji, aromâni, basarabeni, bucovineni, cuțovlahi, daco-români, fărșeroți, herțeni, istro-români, latini dunăreni, macedoromâni, macedo-români, maramureșeni, megleniți, megleno-români, moldoveni, moldovlahi, rrămâni, rumâni, valahi, vlahi, vlasi, volohi, macedo-armânji) precum și toate celelalte forme lexicale semantic legate de cele menționate anterior ; emigranții români, indiferent dacă au păstrat sau nu cetățenia română, precum și descendenții acestora, precum și cetățenii români cu domiciliu sau reședința permanentă în străinătate. ”."
        ],
        "response": "Nu am suficiente informații pentru a răspunde la întrebare.",
        "faithfulness": "1.0"
    },
    {
        "id": "7cf5f98d9735c8552ae759209842debfa81f17d8958d2bc0b603362a7c07b315",
        "user_input": "Cum pot plati taxa de scolarizare?",
        "retrieved_contexts": [
            "(4) Studenţilor români de pretutindeni care finalizează un an de studii în cadrul unei instituţii româneşti de învăţământ superior de stat li se poate modifica regimul financiar de la \"fără plata taxelor de şcolarizare, fără bursă\" la \"fără plata taxelor de şcolarizare, cu bursă\" şi viceversa, în baza regulamentelor proprii ale universităţilor, în limita numărului de locuri alocat pentru anul I. Orice modificare a regimului financiar al bursierilor români de pretutindeni se va comunica Ministerului Educaţiei, în vederea emiterii unei noi scrisori de acceptare la studii. (5) Studenţii români de pretutindeni şcolarizaţi în cadrul instituţiilor de învăţământ superior din România trebuie să respecte prevederile regulamentelor în vigoare la nivelul instituţiilor de învăţământ superior şi legile în vigoare în România. (6) Cuantumul taxelor de şcolarizare este stabilit de instituţiile de învăţământ superior, cu respectarea prevederilor legale în vigoare. (7) Candidaţii nu pot fi repartizaţi fără acordul scris al acestora la programe de studii pentru care nu au optat în prealabil. (8) Scrisoarea de acceptare este valabilă doar pentru instituţia de învăţământ superior pentru care a fost emisă, începând cu anul universitar pentru care a fost emisă şi pentru ciclul universitar respectiv. Orice schimbare în parcursul universitar, care contravine înscrisurilor din scrisoarea de acceptare iniţială (universitate, domeniu, subdomeniu de studiu, prelungire/întrerupere de doctorat, regim financiar la românii de pretutindeni etc.), va fi reglementată, la solicitarea POLITEHNICA Bucureşti, prin emiterea de către Ministerul Educației a unei noi scrisori de acceptare. (9) Înmatricularea la studii, mobilitatea academică, schimbarea domeniului de studii şi reînmatricularea se realizează exclusiv cu aprobarea Ministerul Educației. (10) Prezenta Metodologie a fost aprobată în şedinţa Consiliului de Administrație din data de 12.09.2024 și în ședința Senatului din data de 20.09.2024. (11) Direcția Relații Internaționale prin Serviciul Gestionare Studenți Străini şi Facultăţile din cadrul POLITEHNICA Bucureşti vor duce la îndeplinire prevederile prezentei metodologii. Mihnea COSTOIU Rector Președintele Consiliului de Administrație",
            "CONTINUAREA STUDIILOR IX. DISPOZIŢII FINALE I. PREVEDERI LEGALE Organizarea și desfășurarea concursului de admitere și scolarizare a românilor de pretutindeni la Universitatea Naţională de Ştiinţă şi Tehnologie POLITEHNICA Bucureşti (1) Pe locuri de studii fără plata taxelor de școlarizare, dar cu bursă, respectiv, fără plata taxelor de școlarizare, dar fără bursă, se face în conformitate cu: - Legea învățământului superior nr. 199/2023 cu modificările şi completările ulterioare; - Legea nr. 299/2007 privind sprijinul acordat românilor de pretutindeni, republicată, cu modificările şi completările ulterioare; - Ordinul MEN nr. 3900 din 16 mai 2017 privind aprobarea Metodologiei de școlarizare a românilor de pretutindeni, în învățământul preuniversitar de stat din România, pe locuri de studii fără plata taxelor de școlarizare, dar cu bursă, respectiv, fără plata taxelor de școlarizare, dar fără bursă începând cu anul şcolar 2017-2018 şi a Metodologiei de şcolarizare a românilor de pretutindeni în învăţământul superior de stat în România, pe locuri de studii fără plata taxelor de şcolarizare, dar cu bursă, respectiv fără plata taxelor de şcolarizare, dar fără bursă începând cu anul 2017 – 2018; - Ordinul Ministrului Educaţiei nr. 5552/16.04.2024, publicat în Monitorul Oficial nr. 742/30.07.2024, pentru aprobarea Metodologiei privind condiţiile de şcolarizare a românilor de pretutindeni şi a cetăţenilor străini în cadrul instituţiilor de învăţământ superior de stat, particulare şi confesionale particulare acreditate din România; - Ordinul Ministrului Educaţiei nr. 5553/16.06.2024 privind aprobarea Procedurii de emitere a scrisorilor de acceptare la studii a românilor de pretutindeni pentru învăţământul superior de stat şi particular acreditat, pe locuri cu taxă în lei; - Ordinul Ministrului Educației nr. 4262/2024 pentru aprobarea Metodologiei privind mobilitatea academică a studenților. (2) în categoria românilor de pretutindeni fac parte, în conformitate cu prevederile Legii nr. 299/2007 privind sprijinul acordat românilor de pretutindeni, republicată, cu modificările şi completările ulterioare:",
            "Taxa de înscriere este 125 lei și se poate achita având menționate la explicațiile plății: numele și prenumele complet al candidatului, precum și Facultatea de bază la care acesta se înscrie pentru concursul de admitere, astfel: • direct în platforma on-line https://admitere.pub.ro/, cu card bancar. • prin transfer bancar (realizat într-o aplicate de e-banking sau la ghișeul unei bănci), într-unul dintre următoarele conturi:",
            "ANS, “se raportează doar datele privind studenții aflați la forma de finanțare cu taxă, inclusiv studenții proveniți din studenți bugetați, care repetă cu taxă un an de studiu sau au depășit durata de studiu subvenționată de stat, stabilită prin lege și plătesc taxe. ” Anual Ministerul Educației alocă, prin HG, cifra de școlarizare – acestea se traduc în locurile finanțate la nivel de universitate de la Bugetul de Stat (BS), pentru ciclurile de învățământ pentru licență, masterat și doctorat. Separat, POLITEHNICA București alocă un număr de locuri pentru studenți în regim de taxă de studii (TS) la învățământul universitar de licență, masterat, respectiv doctorat. Separat, Ministerul Educației alocă locuri finanțate de la bugetul de stat pentru Românii de Pretutindeni (RdP) – acestea sunt locuri fără plata taxelor de școlarizare (i.e. , finanțarea vine de la bugetul de stat), cu bursă suportată sau fără. Cf. Legii nr. 299/2007, “românii de pretutindeni reprezintă: persoanele care își asumă liber identitatea culturală românească; persoanele de origine română și cele care aparțin trăsăturilor lingvistice și culturale românești, care trăiesc în afara granițelor României , indiferent de etnonimul utilizat (armâni, armânji, aromâni, basarabeni, bucovineni, cuțovlahi, daco-români, fărșeroți, herțeni, istro-români, latini dunăreni, macedoromâni, macedo-români, maramureșeni, megleniți, megleno-români, moldoveni, moldovlahi, rrămâni, rumâni, valahi, vlahi, vlasi, volohi, macedo-armânji) precum și toate celelalte forme lexicale semantic legate de cele menționate anterior ; emigranții români, indiferent dacă au păstrat sau nu cetățenia română, precum și descendenții acestora, precum și cetățenii români cu domiciliu sau reședința permanentă în străinătate. ”.",
            "Documentele solicitate pentru scutirea plății taxei de înscriere sunt, după caz: - adeverință de angajat în sistemul de învățământ a unuia dintre părinți eliberată de unitatea de învățământ la care acesta este angajat; - adeverințe de la centrele de plasament sau casele de copii, în cazul candidaților care provin de la un centru de plasament sau de la o casă de copii; - certificatul de deces al unui părinte, în cazul candidaților orfani de un părinte; - certificatele de deces ale părinților, în cazul candidaților orfani de ambii părinți; - dovada că este copil al eroilor martiri sau al răniților din timpul Revoluției din decembrie 1989; - dovada că este copil al unui salariat din Universitatea Națională de Știință și Tehnologie POLITEHNICA; - cerere către Decanul facultății la care candidatul se înscrie la concurs, pentru scutirea de plată a taxei de înscriere însoțită de acte doveditoare care să ateste o situație materială precară, în special pentru candidații proveniți din mediul rural (cupoane de pensii din ultima lună ale părinților; adeverințe care să ateste statutul de șomer al părinților; adeverințe de venit eliberate de primăria comunei în care locuiesc părinții etc."
        ],
        "response": "Taxa de înscriere pentru concursul de admitere este de 125 lei și poate fi achitată în următoarele moduri:\n\n1. **Direct în platforma on-line**: Utilizând un card bancar pe site-ul [https://admitere.pub.ro/](https://admitere.pub.ro/).\n2. **Prin transfer bancar**: Acesta poate fi realizat fie într-o aplicație de e-banking, fie la ghișeul unei bănci. Este important ca la explicațiile plății să fie menționate numele și prenumele complet al candidatului, precum și Facultatea de bază la care acesta se înscrie pentru concursul de admitere.\n\nSurse:\n- Taxa de înscriere, URL: https://fils.upb.ro/wp-content/uploads/2025/01/Taxa-de-inscriere-LICENTA-2025-2.pdf, pagina: 1",
        "faithfulness": "1.0"
    },
    {
        "id": "95a8af9a147dd01bc8a1b698d124c41f871461a9d8f83b4e8c7e734e5622f4e6",
        "user_input": "Cum se calculeaza media de bursa la Politehnica?",
        "retrieved_contexts": [
            "(2) Pentru studenții cu vârsta între 26 și 35 de ani, venitul lunar mediu net se va calcula ținând cont doar de veniturile personale ale acestora și ale persoanelor pe care le au în grijă, precum copii, soție etc., în conformitate cu prevederile legale în vigoare. (3) În situația în care personalul instituției de învățământ are suspiciuni privind îndeplinirea condițiilor de acordare a bursei sociale, rectorul POLITEHNICII București sesizează situația autorităților publice locale, în vederea efectuării unei anchete sociale. Personalul instituției de învățământ nu efectuează anchete sociale în vederea acordării burselor sociale. (4) După caz, bursa socială poate fi acordată sau retrasă, ca urmare a unei solicitări în acest sens din partea serviciilor publice de asistență socială și pe baza unui raport de anchetă socială. Art. 29. Depunerea documentelor în vederea acordării burselor sociale (1) Conform art. 69 alin. (4) din Legea nr. 207/2015 privind Codul de procedură fiscală, cu modificările și completările ulterioare, verificarea veniturilor declarate de solicitanți se face de către reprezentanții instituției de învățământ superior, respectiv, Comisia de atribuire a burselor la nivel de facultate, cu ajutorul platformei PatrimVen sau prin solicitarea organului central fiscal, în a cărui rază teritorială se află situația beneficiarii, de eliberare a unui document care să ateste situația veniturilor declarate de către aceștia. (2) În vederea acordării burselor sociale, studenții trebuie să depună următoarele documente justificative pe baza cărora se realizează încadrarea în unul dintre tipurile de burse oferite: a) cererea solicitantului, însoțită de o declarație pe propria răspundere privind veniturile nete, cu caracter permanent, obținute pe ultimele 12 luni anterioare cererii, realizate de Page 10 of 16 membrii familiei, supuse impozitului pe venit, și acordul privind prelucrarea datelor cu caracter personal pentru verificarea respectării criteriilor de acordare a bursei; b) pentru situațiile în care există suspiciuni rezonabile, comisia de atribuire a burselor poate solicita studentului să prezinte raportul de anchetă socială, realizat cu respectarea prevederilor legale, din care să reiasă situația exactă a familiei acestuia.",
            "(3) Cuantumul minim al bursei sociale se propune anual, până la data de 1 septembrie, de către Comisia Națională pentru Finanțarea Învățământului Superior (CNFIS), se adoptă prin ordin al ministrului educației și trebuie să acopere cheltuielile minime de masă şi cazare. (4) Cuantumul burselor sociale se stabilește prin hotărâre a senatului universității POLITEHNICA București, la propunerea Consiliului de administrație, în limita fondurilor disponibile și în funcție de nevoile identificate la nivelul comunității studențești, prin consultarea reprezentanților studenților, inclusiv cu organizațiile studențești din POLITEHNICA București. (5) Pentru acordarea burselor sociale, singurul criteriu academic ce se ia în considerare este promovabilitatea. (6) Bursele sociale se cumulează cu alte tipuri de burse, dacă studentul îndeplinește criteriile specifice pentru ambele categorii de burse. (7) Bursele sociale se acordă pe durata legală a programului de studii, până la împlinirea vârstei de 35 de ani. (8) Beneficiarii burselor sociale pot fi: a) studenții orfani de unul sau ambii părinți, studenții care provin din familii monoparentale sau studenții proveniți din centre de plasament și care nu realizează venituri peste plafonul pentru acordarea bursei sociale; b) studenții bolnavi de tuberculoză, care se află în evidența unităților medicale, pe perioada tratamentului tuberculostatic, diabet insulinonecesitant, boli maligne, sindroame de malabsorbție severe, boală cronică de rinichi în program de dializă, astm bronșic persistent moderat sau sever, epilepsie grand mal, cardiopatii congenitale, hepatită cronică cu fibroză avansată (stadiul F3 sau F4), glaucom, miopie gravă, boli imunologice autoimune forme severe, boli rare, tulburări din spectrul autist, boli hematologice severe care necesită tratament continuu sau spitalizări frecvente, surditate bilaterală, fibroză chistică, cei infectați cu virusul HIV sau bolnavi de SIDA, cei cu handicap locomotor și încadrați într-un grad de invaliditate, fără a se lua în considerare nivelul venitului mediu pe membru de familie;",
            "(2) Media generală de admitere se constituie ca medie aritmetică dintre nota acordată de comisia/comisiile constituite de Şcoala doctorală privind evaluarea dosarelor electronice ale candidaţilor declaraţi admişi de către conducătorii de doctorat şi media generală a anilor de studii, calculată prin luarea în considerare a anilor de studii de licenţă şi masterat sau de lunga Metodologie admitere la doctorat 2025 durata (Anexa 3). Media generală de admitere trebuie sa fie minim 7,00. (3) Înmatricularea candidaților admiși se face online în termen de 7 2 ore de la data afișării electronice a rezultatelor finale, fiind condiționată de prezentarea dovezii privind absolvirea unui program de masterat (diploma de masterat sau adeverință de absolvire). (4) Candidaţii admişi vor completa şi semna olograf contractul de studii universitare de doctorat până la începutul anului universitar 2025-2026. Contractul se oficializează prin semnaturile olografe ale conducătorului de doctorat și Directorului Şcolii doctorale. Metodologie admitere la doctorat 2025 Anexa 1 Lista domeniilor doctorale organizate de POLITEHNICA București",
            "Media generală de admitere, MG, a fiecărui candidat se calculează, cu două zecimale, fără rotunjire, cu formula: MG = (MA +MB) / 2 Facultatea de Ştiinţa şi Ingineria Materialelor oferă în perioada şcolarizării: - Cazare în căminul facultăţii (P21 din Regie); - Burse de performanţă, burse de merit, burse de studiu şi burse sociale; - Burse în străinătate (programe Erasmus); - Participare la contracte de cercetare ştiinţifică şi sesiunile ştiinţifice studenţeşti; - Excursii de studii; - Stagii de practică; - Acces la săli de curs multimedia şi laboratoare IT [acces Internet gratuit]; - Acces la laboratoare de specialitate dotate cu aparatură modernă, la mai multe biblioteci de specialitate şi baze sportive. “Ingineria nu înseamnă numai să ştii şi să fii bine informat, ca o enciclopedie ambulantă; ingineria nu înseamnă numai analiză; ingineria este practicarea artei de a impune în mod organizat schimbarea tehnologică” Intră şi tu în echipa noastră ! facebook:UPB.SIM |",
            "(6) În cazul în care fondul pentru acordarea burselor sociale nu este utilizat în întregime, acesta se redistribuie pentru acordarea burselor de performanță. (7) Distribuirea burselor sociale se face în ordine crescătoare a venitului net pe membru de familie. (8) Sumele rămase în sold pentru facilități de transport pentru studenți, subvenții pentru cămine-cantine și sumele pentru bursele studenților neridicate în termen pot fi utilizate în anii următori pentru acordarea de burse pentru studenți, precum și pentru alte cheltuieli de natura investițiilor pentru infrastructura de cămine, cantine și pentru susținerea activităților centrelor pentru consiliere și orientare în carieră. Art. 35. Universitatea Națională de Știință și Tehnologie POLITEHNICA București poate suplimenta fondul pentru burse provenit de la bugetul de stat, pentru fiecare categorie de burse, cu fonduri provenite din venituri proprii. Art. 36. (1) Cuantumul burselor de performanță și al burselor pentru învățământ dual se aprobă prin hotărârea Senatului, la propunerea Consiliului de Administrație, ca urmare a consultării cu reprezentanții studenților, inclusiv a organizațiilor studențești reprezentative din POLITEHNICA București. (2) Universitatea Națională de Știință și Tehnologie POLITEHNICA București poate acorda sprijin financiar studenților cu rezultate deosebite, pentru participarea la conferințe sau publicarea de articole științifice, cu aprobarea Consiliului de Administrație. (3) Universitatea Națională de Știință și Tehnologie POLITEHNICA București poate acorda burse pentru stagii de studii universitare și postuniversitare, în vederea susținerii mobilităților temporare efectuate în universități și instituții din țară și străinătate. Decizia cu privire la acordarea burselor pentru stagii de studii universitare și postuniversitare, precum și stabilirea cuantumului acestora se ia de către Biroul Consiliului de Administrație al POLITEHNICII București. Page 13 of 16 CAPITOLUL IV Dispoziții finale Art. 37. În cazul în care există suspiciuni de falsificare a documentelor depuse pentru obținerea unei burse pentru ajutor social, POLITEHNICA București va sesiza organele de anchetă competente și va proceda la sancționarea studentului, în funcție de gravitatea faptei. Art. 38."
        ],
        "response": "Media generală de admitere (MG) la Politehnica București se calculează ca medie aritmetică dintre nota acordată de comisia de evaluare a dosarelor și media generală a anilor de studii, luând în considerare anii de studii de licență și masterat. Formula utilizată este: MG = (MA + MB) / 2, unde MA reprezintă nota acordată de comisie, iar MB este media generală a anilor de studii. Este important de menționat că media generală de admitere trebuie să fie minim 7,00 pentru a fi considerată validă. Această informație este relevantă pentru procesul de admitere la doctorat, dar nu se referă direct la burse. Detalii suplimentare despre bursele sociale și criteriile de acordare pot fi găsite în documentele referitoare la burse, dar nu se specifică o formulă de calcul a mediei burselor în mod direct.\n\nSurse:\n- Metodologie admitere doctorat 2025-2026, URL: https://upb.ro/wp-content/uploads/2024/12/Metodologie-admitere-doctorat-2025-2026.pdf, pagina: 6\n- URL: https://upb.ro/wp-content/uploads/2024/12/Metodologie-burse_rectificata.pdf",
        "faithfulness": "1.0"
    },
    {
        "id": "f9c25638ed5543e2100ee2482f3d284e6588ecde2cd408747d958ee348816e98",
        "user_input": "Exista posibilitatea de a plati taxa de scolarizare in rate?",
        "retrieved_contexts": [
            "(4) Studenţilor români de pretutindeni care finalizează un an de studii în cadrul unei instituţii româneşti de învăţământ superior de stat li se poate modifica regimul financiar de la \"fără plata taxelor de şcolarizare, fără bursă\" la \"fără plata taxelor de şcolarizare, cu bursă\" şi viceversa, în baza regulamentelor proprii ale universităţilor, în limita numărului de locuri alocat pentru anul I. Orice modificare a regimului financiar al bursierilor români de pretutindeni se va comunica Ministerului Educaţiei, în vederea emiterii unei noi scrisori de acceptare la studii. (5) Studenţii români de pretutindeni şcolarizaţi în cadrul instituţiilor de învăţământ superior din România trebuie să respecte prevederile regulamentelor în vigoare la nivelul instituţiilor de învăţământ superior şi legile în vigoare în România. (6) Cuantumul taxelor de şcolarizare este stabilit de instituţiile de învăţământ superior, cu respectarea prevederilor legale în vigoare. (7) Candidaţii nu pot fi repartizaţi fără acordul scris al acestora la programe de studii pentru care nu au optat în prealabil. (8) Scrisoarea de acceptare este valabilă doar pentru instituţia de învăţământ superior pentru care a fost emisă, începând cu anul universitar pentru care a fost emisă şi pentru ciclul universitar respectiv. Orice schimbare în parcursul universitar, care contravine înscrisurilor din scrisoarea de acceptare iniţială (universitate, domeniu, subdomeniu de studiu, prelungire/întrerupere de doctorat, regim financiar la românii de pretutindeni etc.), va fi reglementată, la solicitarea POLITEHNICA Bucureşti, prin emiterea de către Ministerul Educației a unei noi scrisori de acceptare. (9) Înmatricularea la studii, mobilitatea academică, schimbarea domeniului de studii şi reînmatricularea se realizează exclusiv cu aprobarea Ministerul Educației. (10) Prezenta Metodologie a fost aprobată în şedinţa Consiliului de Administrație din data de 12.09.2024 și în ședința Senatului din data de 20.09.2024. (11) Direcția Relații Internaționale prin Serviciul Gestionare Studenți Străini şi Facultăţile din cadrul POLITEHNICA Bucureşti vor duce la îndeplinire prevederile prezentei metodologii. Mihnea COSTOIU Rector Președintele Consiliului de Administrație",
            "(7) Persoana care a beneficiat de școlarizare în cadrul unui program de studii universitare pe loc finanțat de la bugetul de stat are, în condițiile legii, dreptul de a urma un alt program de studii universitare în cadrul aceluiași ciclu de studii universitare: (a) în regim cu taxă , dacă instituția de învățământ superior de stat organizează programul și în acest mod; (b) în regim gratuit, cu finanțare de la bugetul de stat, în condițiile în care persoana achită contravaloarea serviciilor de școlarizare de care a beneficiat anterior cu finanțare de la bugetul de stat, integral sau parțial, în cazurile în care programul de studii la care a fost admisă este organizat doar cu finanțare integrală de la buget. Studenții pot achita contravaloarea serviciilor de școlarizare de care au beneficiat anterior Ministerului Educației, conform unei metodologii aprobate prin ordin al ministrului educației; (c) în regim gratuit, doar în cazul programelor universitare de masterat profesional de conducere interarme, care sunt obligatorii pentru evoluția ofițerilor în cariera militară, precum și în cazul programelor universitare de masterat profesional pentru formarea ofițerilor de informații și pentru formarea inițială a ofițerilor/ofițerilor de poliție din Ministerul Afacerilor Interne. (8) În conformitate cu autonomia universitară instituțiile de învățământ superior pot oferi scutiri parțiale sau totale de la plata taxelor de școlarizare, în baza unor criterii sociale, în conformitate cu reglementările proprii. Art. 9 (1) Studenţii au dreptul de a cunoaşte mecanismele prin care se stabilesc taxele de studiu, precum şi alte taxe percepute de instituția de învățământ superior, în conformitate cu Carta Universității. (2) Studenţii au dreptul să fie informaţi cu privire la numărul, tipul şi cuantumul fiecărei taxe practicate de instituțiile de învățământ superior. Cuantumul taxelor este aprobat de Senatul universitar și publicat pe site-ul instituțiilor de învățământ superior cu cel puțin 3 luni înainte de începutul fiecărui an universitar. Taxa de studiu nu se poate modifica în cursul unui ciclu de studii, decât prin indexarea cu rata inflației. (3) Statutul de student cu taxă se modifică în condițiile stabilite de senatul universitar, la începutul fiecărui an universitar.",
            "CONTINUAREA STUDIILOR IX. DISPOZIŢII FINALE I. PREVEDERI LEGALE Organizarea și desfășurarea concursului de admitere și scolarizare a românilor de pretutindeni la Universitatea Naţională de Ştiinţă şi Tehnologie POLITEHNICA Bucureşti (1) Pe locuri de studii fără plata taxelor de școlarizare, dar cu bursă, respectiv, fără plata taxelor de școlarizare, dar fără bursă, se face în conformitate cu: - Legea învățământului superior nr. 199/2023 cu modificările şi completările ulterioare; - Legea nr. 299/2007 privind sprijinul acordat românilor de pretutindeni, republicată, cu modificările şi completările ulterioare; - Ordinul MEN nr. 3900 din 16 mai 2017 privind aprobarea Metodologiei de școlarizare a românilor de pretutindeni, în învățământul preuniversitar de stat din România, pe locuri de studii fără plata taxelor de școlarizare, dar cu bursă, respectiv, fără plata taxelor de școlarizare, dar fără bursă începând cu anul şcolar 2017-2018 şi a Metodologiei de şcolarizare a românilor de pretutindeni în învăţământul superior de stat în România, pe locuri de studii fără plata taxelor de şcolarizare, dar cu bursă, respectiv fără plata taxelor de şcolarizare, dar fără bursă începând cu anul 2017 – 2018; - Ordinul Ministrului Educaţiei nr. 5552/16.04.2024, publicat în Monitorul Oficial nr. 742/30.07.2024, pentru aprobarea Metodologiei privind condiţiile de şcolarizare a românilor de pretutindeni şi a cetăţenilor străini în cadrul instituţiilor de învăţământ superior de stat, particulare şi confesionale particulare acreditate din România; - Ordinul Ministrului Educaţiei nr. 5553/16.06.2024 privind aprobarea Procedurii de emitere a scrisorilor de acceptare la studii a românilor de pretutindeni pentru învăţământul superior de stat şi particular acreditat, pe locuri cu taxă în lei; - Ordinul Ministrului Educației nr. 4262/2024 pentru aprobarea Metodologiei privind mobilitatea academică a studenților. (2) în categoria românilor de pretutindeni fac parte, în conformitate cu prevederile Legii nr. 299/2007 privind sprijinul acordat românilor de pretutindeni, republicată, cu modificările şi completările ulterioare:",
